,text,sentic_concept
0,video answer question applying f 1 visa embassy share video f1 studentvisa uscis greencard immigrationnews immigrationlawyer immigrationattorney jqklawfirm johnkhosravi immigration usimmigration,"['answer', 'share']"
1,susan rice ron klain appear problem getting administration solution immigration count nothing changing next 2 5 years,"['appear', 'administration', 'solution', 'count', NOT 'changing']"
2,call us today immigration needs 262 764 5036 p represent clients 50 states amp worldwide immigration visa studyabroad immigrationlawyer studentvisa tps usimmigration immigrants studyinusa vawa immigtationattorney studyvisa,"['needy', 'present', 'clients', 'worldwide', 'immigrants']"
3,conservatives libertarians democrats saying title 42 immigration,['conservative libertarian']
4,bipartisan group us senators introduced bill passed would allow biden administration end title42 emergency immigration order unless biden also declares end covid19 national emergency declaration,"['group', 'senators', 'bide', 'administration', 'emergency', 'declare', NOT 'covid', 'declaration']"
5,join celebrate bold legacy 50 years work puertorico votingrights criminaljustice economic justice immigration foster next generation latinx legal l deres come us bolder future 14 end,"['next generation', 'join', 'celebrate', 'bold', 'legacy', 'work', 'justice', 'foster', 'legal', 'bolder']"
6,check unmosqued documentary film immigrant founded mosques america islamophobia discrimination immigration,"['immigrant', 'founde', 'phobia', 'discriminate']"
7,story keeper gives us insight childhood looks like ww2 time child ever experience immigration ww2 holocaust jewishlife history,"['keeper', 'insight', 'childhood', 'child', 'holocaust']"
8,love travel schengen europe trending visa visas international euro germany india gujarat surat tweet travel tourist amritsar ludhiana immigration traveller like follow,"['germany', 'india', 'surat', 'amritsar', 'ludhiana', 'love', 'travel', 'trending', NOT 'ternate', 'euro', 'tourist', 'follow']"
9,tariff reductions immigration help fight inflation attn,"['tariff', 'reduction', 'help', 'fight', 'inflation']"
10,unsustainable immigration policies biden administration going benefit republican candidates mid terms biden never visited southern border since elected bordercrisis,"['unsustainable', 'policies', 'bide', 'administration', 'benefit', 'publican', 'southern']"
11,post follow frenchelection en frenchelections presidentielle2022 macron marinelepen nato eu riczemmour jeanlucm lenchon immigration muslims eu nato populism democracy,"['follow', 'populism', 'democracy']"
12,share securethetribe savemasontn usa immigrants obama amp grace meng nyc government removing december 2016 negro reprinting 22 million birth ce usa vote pro negro lineage reparations ab3121 amp immigration moratorium nba atl,"['usa', 'share', 'immigrants', 'grace', 'govern', 'remove', 'negro', 'printing', 'birth', 'pro', 'lineage', 'reparation', 'moratorium']"
13,change harboring illegal alien keeping people safe immigration daca,"['illegal', 'alien', 'safe', 'dacer']"
14,maybe different approach needed according different polls economy top list voter concerns followed covid healthcare nationalsecurity climate crime immigration various orders 1 2,"['approach', 'needed', 'accord', 'economy', 'top', 'concern', 'covid', 'healthcare', 'crime']"
15,microcosm us immigration needs reform family close family us fleeing ukraine interview visas scheduled w us embassy kyiv canceled b c war yet stuck,"['ukraine', 'kyiv', 'close family', 'needy', 'reform', 'family', 'scheduled', 'canceled', 'war', 'stuck']"
16,remarkable story npr warsaw barriers legal immigration ukrainians fleeing putin war even ties ukrainian families struggle reach us immigration,"['warsaw', 'remarkable', 'barrier', 'legal', 'putin', 'war', 'family', 'struggle', 'reach']"
17,border big problem immigration governor texas nothing offer political stunts texastotheworld txlege,"['texas', 'problem', 'govern', NOT 'offer', 'political', 'stunt']"
18,speak immigration experts contact us apply 1 647 992 2483 canadaimmigration canada immigration canadavisa studyincanada canadapr expressentry immigrationconsultant visa sayhomecanadaimmigration ontario nigeria nigerian brampton burlington,"['apple', 'canada', 'nigeria']"
19,immigration officers check facebook marriage greencard interview,['marriage']
20,nobody blames ukranian refugees refugees extend courtesy refugees color forced flee homes various forces beyond control immigration,"[NOT 'blames', 'extend', 'courtesy', 'color', 'forced', 'flee', 'forces', 'control']"
21,christianity calls liberal jesus loving helping immigrants poor hungry sick elderly christian left discovered alone please support link immigration progressive,"['christianity', 'liberal', 'loving', 'help', 'immigrants', NOT 'hungry', 'sick', 'elderly', 'discovery', 'support', 'link', 'progressive']"
22,current reading published currentreading currentlyreading versobooks iansanjaypatel drianpatel immigration endofempire,['published']
23,info pass emergencies inmigraci n immigration dreamers2gether immigrationmatters sisepuede ap advanceparole daca latinos sonadores uscis,"['info', 'pass', 'emergency', 'dacer']"
24,twice twice twice yeah go vote fuckin biden twice openborders immigration election,"['yeah', 'fuck', 'bide']"
25,applications advance parole daca send arizona inmigraci n immigration dreamers2gether immigrationmatters sisepuede ap advanceparole tiktok,"['arizona', 'application', 'advance', 'parole', 'dacer']"
26,share securethetribe savemasontn atl usa negro lineage pro reparations ab3121 exclusively lineage amp pro immigration moratorium,"['usa', 'share', 'negro', 'lineage', 'pro', 'reparation', 'exclusively', 'moratorium']"
27,immigration believe either side,['believe']
28,border report ukraine ukrainerussiawar ukrainerussia ukrainerussiaconflict trafficking migration asylum immigration refugee refugeeswelcome refugeesneedhelp,"['ukraine', 'report', 'asylum']"
29,let talk crazy money covid relief let open borders let thousands unvaccinated covid19 bidenbordercrisis immigration ridiculous,"['crazy', 'money', 'covid', 'relief', NOT 'vaccine', 'ridiculous']"
30,phenomenal story learning experiences following family beliefs traditions topical read book33 70booksin52weeks barrington220reads immigration respect growth,"['book', 'read book', 'phenomenal', 'learning', 'follow', 'family', 'belief', 'tradition', 'respect', 'growth']"
31,notice refusal use minority leader promised immigration laws government shutdown said yes gop tax giveaway rich said buildbackbetter old geezer people kentucky better,"['kentucky', 'old geezer', NOT 'refusal', 'minority', 'leader', 'laws', 'govern', 'shutdown', 'yes', 'giveaway', 'rich', 'better']"
32,let talk crazy money covid relief let open borders let thousands unvaccinated covid19 immigration bidenbordercrisis,"['crazy', 'money', 'covid', 'relief', NOT 'vaccine']"
33,recession 1921 2 led employer efforts roll back wages labor unrest ensued written barre granite strike journal walkouts also occurred textiles immigration labor ushistory,"['recession', 'employer', 'roll', 'unrest', 'ensue', 'barre', 'granite', 'strike', 'journal', 'walkout', 'occur', 'textile']"
34,wearing one fav shirts lots next 7 hours little book spot immigration proudimmigrant imakeamericagreat madebyimmigrants,"['book', 'spot', 'weary', 'shirt', 'little']"
35,eu airdropped euros poor countries could help economic growth prevent migration eurozone humanity immigration,"['country', 'euro', 'poor', 'help', 'growth', 'prevent', 'eurozone']"
36,let talk crazy money covid relief let open borders let thousands unvaccinated covid19 biden bidenbordercrisis obama immigration,"['crazy', 'money', 'covid', 'relief', NOT 'vaccine', 'bide']"
37,let talk crazy money covid relief let open borders let thousands unvaccinated covid19 immigration bidenbordercrisis breakingnews,"['crazy', 'money', 'covid', 'relief', NOT 'vaccine']"
38,song sora creators thankyouforreading historicalfiction contestentry titanicanniversary gypsy creativewriting writer bloggingbeesrt bloggingbabesrt immigration,"['sore', 'create', 'writer']"
39,texas love sentiments could apply fl etc power vote kind compassionate hardworking problem solving leaders vote love immigration,"['texas', 'apple', 'love', 'sentiment', 'power', 'compassionate', 'problem', 'solve', 'leader']"
40,enough said increase immigration ease job market usa economy hurt labor shortages economics economic,"['usa', 'increase', 'ease', 'job', 'economy', 'hurt', 'shortage', 'economics']"
41,pritipatel justification uk horrible ukraine immigration policy portraying refugees possible spies dissimilar putin attempt brainwash russians ukraine ruled neo nazis torylies,"['ukraine', 'neo nazi', 'justification', 'horrible', 'policy', 'portray', 'possible', 'spies', 'dissimilar', 'putin', 'attempt', 'brainwash']"
42,border costs soar questions abound much longer texas afford keep ongoing surge troopers soldiers amp explore txlege immigration migrants gregabbott border campaign2022 texas title42,"['texas', 'soar', 'abound', 'longer', 'afford', 'surge', 'troopers', 'soldiery', 'explore']"
43,continuation schengen visa immigrants enjoy benefit schengen agreement read doityourselfimmigration diysi travel immigration studyabroad workabroad educationalroad career internationalstudent,"['continue', 'immigrants', 'enjoy', 'benefit', 'agree', 'travel']"
44,freedomisntfree earned fought died protected please appreciate amp thank sacrifice much argue amp debate criticalracetheory immigration climatechange electionlaw racism america landofthefree homeofthebrave agreed,"['fought', 'protected', 'appreciate', 'thank', 'sacrifice', 'argue', NOT 'bat', 'racism', 'agree']"
45,cdes malema provide leadership required fix immigration afrophobia crisis face region reflected reactionary movements like operationdudula elders sleeping,"['provide', 'leadership', 'fix', 'phobia', 'crisis', 'reflect', 'movement', 'sleeping']"
46,thinking immigration related website get domain buy details queries domains visit website domains website domainnames hosting webdesign domain financial,"['buy', 'detail', 'query', 'hosting']"
47,ukrainian sponsorship scheme introduced uk government part response ukrainian refugee crisis information immigration settlement ukraine law notarypublic immigrationnews,"['ukraine', 'sponsorship', 'scheme', 'govern', 'response', 'crisis', 'information', 'settlement']"
48,immigration become area focus bidenadministration interviewwaiver options india i485 update deportation policy change i751 ustraveldocs dhs i9 usvisaapplicants i140 immigrationlaw,"['area', 'india', 'focus', 'update', 'deportation', 'policy']"
49,fred feldman sheds light onto years longs remain remembered honoured brilliant skill immigration ww2 holocaust jewishlife history,"['light', 'remain', 'remember', 'brilliant', 'skill', 'holocaust']"
50,put charge immigration really fire border stuff right,['charge']
51,collective exhibition young syrian artists shown samer kuzah art gallery amp streets around old damascus installations using fake pigeons amp objects represents aspects life syria war amp immigration,"['damascus', 'syria', 'art gallery', 'collective', 'exhibition', 'young', 'old', 'installation', 'fake', 'pigeon', 'objects', 'present', 'war']"
52,stephenkinnock shadow minister immigration demanding homesecretary pritipatel name eight russian sanctions list publish long withheld report scrapped visa purchase programme,"['shadow', 'demanding', 'sanction', 'publish', 'report', 'scrap', 'purchase']"
53,mgl co director speaking governance xenophobia immigration southafrica comments highlight need empirically informed analysis mobility governance scales qeh,"['directory', 'phobia', 'comment', 'highlight', 'empirically', 'informed', 'analysis', 'scaley']"
54,passing immigration bill secure border seems bass ackwards securing border discussing immigration sounds much reasonable letsgobrandon usa bringbacktrump,"['usa', 'pass', 'secure', 'discuss', 'reasonable']"
55,mean take seriously certain point gotta admit pretty funny next president gonna smartest candidate college degree openborders election immigration biden biden2024,"['admit', 'funny', 'smartest', 'degree', 'bide']"
56,republicans right rail illegal immigration also see enormous opportunity build relationship immigrants says basile gop immigration,"['illegal', 'enormous', 'build', 'relationship', 'immigrants']"
57,disagreement delay infighting border divided white house daca immigration immigrationreform joebiden elsalvador mexico venezuela guatemala asylum tps visas citizenship gop migrants ice borderpatrol,"['house', 'mexico', 'venezuela', 'guatemala', NOT 'agree', 'delay', 'infighting', 'divided', 'dacer', 'asylum', 'citizenship']"
58,title 42 coming foreign invasion united states epicbidenfail immigration illegalaliens bordersecurity bumblesdementia maga,"['invasion', 'mage']"
59,considering moving turkey visalobby visa immigration life turkey istanbul work live blog study business,"['turkey', 'istanbul', 'moving', 'work', 'live', 'study']"
60,trump biden opening floodgates tidal wave immigration trump biden opening floodgates tidal wave immigration,"['bide', 'opening', 'tide']"
61,amazon raises prime membership rates canadians 1st time full article canadanews immigration immigrationnews cdnimm canada toronto cisnews amazon raises prime membership subscription service offers freeshipment platform,"['amazon', 'canada', 'toronto', 'service', 'raises', 'prime', 'full', 'subscription', 'offers', 'free', 'platform']"
62,unemployment rate among canadian immigrants historic low full article canadanews immigration immigrationnews cdnimm canada toronto cisnews unemployment rate canadian immigrants historic record statistics labourforcesurvey,"['canada', 'toronto', 'unemployment', 'rate', 'immigrants', 'historic', NOT 'full', 'record', 'statistics']"
63,quebec ontario migration reversed 2021 full article canadanews immigration immigrationnews cdnimm canada toronto cisnews migration reversed caravan moving truck heading west highway symbol decline montreal quebeckers,"['canada', 'toronto', 'montreal', 'full', 'moving', 'truck', 'decline']"
64,apply parent grandparent super visa full article canadanews immigration immigrationnews cdnimm canada toronto cisnews apply parent grandparent supervisa temporaryvisa attractive citizenship ircc,"['apple', 'canada', 'toronto', 'grandparent', 'super', 'full', 'supervise', 'attractive', 'citizenship']"
65,immigration schemes need revision tackle farming staff shortage say mps immigration agriculture recruitment hr visas,"['staff', 'agriculture', 'scheme', 'revision', 'tackle', 'shortage', 'recruitment']"
66,still worried immigrating canada contact zsr immigration today let us help immigration journey immigration immigrationcanada immigrationlawyer immigratetocanada immigrationconsultant zsrimmigration,"['canada', 'worried', 'immigrate', 'help', 'journey']"
67,share securethetribe savemasontn south carolina debate verzuz topics 1 40 acres mule reparations 2 immigration moratorium nfl nba,"['south carolina', 'share', NOT 'bat', 'mule', 'reparation', 'moratorium']"
68,unjustified detention restrictions freedom assault arrest become norm unjust torture nagoya regional immigration bureau sri lankan woman dies hunger japanese detention justiceforwishma immigration japan srilanka human illegal,"['nagoya', 'woman', 'japan', 'detention', 'restrictions', 'freedom', 'assault', 'arrest', 'norm', 'unjust', 'torture', 'dies', 'hunger', 'illegal']"
69,pakistan immigration authorities high alert catch fleeing govt officials imrankhan ouster,"['pakistan', 'authority', 'alert', 'catch', 'ouster']"
70,spot costoflivingcrisis voters think pointless virtue signalling image posturing also immigration amp lawandorder energycrisis toryincompetence,"['spot', 'pointless', 'virtue', 'image']"
71,immigration time consuming process delays serious impact business see team helps process immigrationlawyer canadianimmigration usmca,"['time consuming', 'process', 'delay', 'impact', 'help']"
72,know work canada even visitor read along find immigratetocanada canadianimmigration canadavisa canada immigration canadapr canadalife immigrationconsultant,"['canada', 'work']"
73,complete utter fool man let build good farmland food shortages increasing amp prices rocketing let build yet floodplains amp blame climatechange let even people arriving open door immigration idiot,"['man', 'food', 'door', 'food shortage', 'complete', 'fool', 'build', 'good', 'farmland', 'pricey', 'floodplain', 'blame', 'arriving', 'idiot']"
74,high court middelkamp v minister justice amp equality 2 administrative immigration visaapplication judicialreview exceptionalpublicimportance shorttermentrants echr righttoprivateandfamilylife resources,"['high', 'justice', 'equality', 'administrative', 'resource']"
75,day 23 since applying little ukrainian family visa beyond joke visa immigration ukrainecrisis refugees tinychildren fgs,"['little', 'family', 'joke']"
76,another cost increasing immigration increased office personnel space handle ever growing court cases federal immigration agency seals lease deal big concord expansion via,"['personnel', 'cost', 'increased', 'growing', 'federal', 'seal', 'lease', 'deal', 'big', 'expansion']"
77,yes join military help parents obtain legal status applying military parole place applies active duty amp veterans military veterans activeduty immigration undocumented lawtwitter america unitedstates strongertogether unidos love,"['place', 'apple', 'yes', 'join', 'help', 'obtain', 'legal', 'status', 'parole', 'duty', 'love']"
78,immigration high alert airports breaking news watch capitaltv immigration alert airports breaking,"['alert', 'airport']"
79,conducting smear campaign us opposing h1b et al unlawful immigration high levels immigration etc implicitly lumping us w white supremacists shades basketofdeplorables,"['smear', 'unlawful', 'high', 'implicitly', 'lumpy', 'supremacist']"
80,happy ram navami may blessings lord ram showered upon family happyramanavami lordrama festival celebration bestwishes immigration migrate novaturientvisas bangalore hyderabad pondicherry delhi pune goa uk,"['bangalore', 'hyderabad', 'delhi', 'pune', 'happy', 'navami', 'bless', 'lord', 'showery', 'family', 'festival', 'celebration', 'migrate']"
81,om overseas mentor wishes happy ram navami call us 9646570009 visit address scf 36 2nd floor phase 10 mohali pb studyincanada studyvisa immigration visaexperts overseas overseasmentor overseasmohali canada uk australia,"['canada', 'australia', 'mentor', 'wishes', 'happy', 'navami', 'phase']"
82,dynamic change foreign born population independent impact americans view unauthorized legal immigration argue james laurence amp harris hyun soo kim,"['view', 'foreign born', 'population', 'independent', 'impact', 'legal', 'argue', 'hyun']"
83,may lord ram shower divine blessings family happy ram navami website boiservices boi maharamnavmi2022 immigration instagram,"['boy', 'lord', 'shower', 'divine', 'bless', 'family', 'happy', 'navami']"
84,french left refused get questions security immigration islam every time topics come say right wing topics people say ok right rightwing lepen identity,"['frenchy', 'refuse', 'security', 'wing', 'ok', 'identity']"
85,definition unity ancestors country pre post usa share securethetribe savemasontn ab3121 chicago chi office new americans cities usa pro reparations lineage amp immigration moratorium dnc gop,"['country', 'usa', 'chicago', 'definition', 'unity', 'ancestor', 'share', 'pro', 'reparation', 'lineage', 'moratorium']"
86,speaks cruel immigration system justiceforrefugees palmsunday2022 auspol voteforcompassion,['cruel']
87,albanese amp labor alp always weak type thing allow foreign temporary workers become citizens reduce wages burden schools hospitals amp housing likely vote alp ausvotes immigration,"['weak', 'temporary', 'reduce', 'burden', 'schools']"
88,small community great values symbol trust save huge adao immigration investor programs startupvisa programs mortgage lending amp borrowing nftart custom nftcommumity marketing art talented nftartist,"[NOT 'community', 'values', 'trust', 'save', 'huge', 'investor', 'mortgage', 'custom', 'art']"
89,call us know application process 91 9711578747 usa didyouknow facts mba sundayvibes morningsunshine applications processdriven canada neet goals aims neet2022 mbbsd doctor spiritualawakening immigration consultant gurgaon gurugram delhi ncr,"['usa', 'canada', 'consultant', 'delhi', 'application', 'process', 'goals', 'aim']"
90,entering deglobalization reports 2008 2019 world trade relative global gdp fell 5 new tariffs barriers trade immigration flows slowed global flows long term investment fell 50 2016 2019,"['entering', NOT 'globalization', 'trade', 'relata', 'tariff', 'barrier', 'slow', 'investment']"
91,ram setu lord ram path success let first step immigration path success step right path achieve life goals wishing happyramnavami ram jayshriram ramnavami2022 ramnavami canada visa sinp immigration,"['canada', 'lord', 'success', 'achieve', 'goals']"
92,president biden released proposed budget fiscal year 2023 includes immigration immigration biden,"['bide', 'release', 'fiscal', 'include']"
93,america labor shortage actually immigrant shortage immigration americanimmigrants,"['shortage', 'immigrant']"
94,jesus taught us expects us live love others much provide medical care sick aca turn cheek non violence feed hungry snap welcome refugees immigration jesus taught voteblue christianity,"['medical care', 'taught', 'expect', 'live', 'love', 'provide', 'sick', 'turn', 'cheek', NOT 'violence', 'hungry', 'snap', 'welcome', 'christianity']"
95,new openaccess article jems challenges assumptions media influence immigration attitudes k kondor mihelj v tka amp f th draw data east europe amp problematise relation public service media consumption negative attitudes immigration 1 2,"['service', 'challenges', 'assumption', 'influence', 'draw', 'problem', 'relation', 'consumption', 'negative']"
96,tonight hitthemwiththelove 13k streams newmusic gaymusic immigration justiceisontheballot,['stream']
97,happy ramm navami everyone ramnavami ramnavmispecial immigration studyabroad canada visaimmigration studyvisa,"['canada', 'happy', 'navami']"
98,bipartisan group senators introduced bill passed would allow biden administration end title42 emergency immigration order unless biden also declares end covid19 national emergency declaration,"['group', 'senators', 'bide', 'administration', 'emergency', 'declare', NOT 'covid', 'declaration']"
99,saskatchewan home 72 canada first nations reserve lands scattered throughout province availability wide pieces fertile land canadaimmigration canada immigration canadavisa studyincanada expressentry canadapr visa,"['canada', 'scattered throughout', 'fertile land', 'home', 'nations', 'reserve', 'land', 'availability', 'wide']"
100,minimum points required qualify australia migrant visa know experts dm us call us 91 80558 04150 visit website australia pr australiapr jobs immigration migration visa visaconsultants apexvisas,"['australia', 'minimum', 'qualify', 'job']"
101,title42 mechanism used public health emergencies want biden declare still public health emergency maybe job work immigration asylum reform immigration publichealth border asylum,"['mechanism', 'health', 'emergency', 'bide', 'declare', 'job', 'work', 'asylum', 'reform']"
102,ask landscapers hard find workers need immigration reform pathway citizenship,"['landscape', 'hard', 'reform', 'pathway', 'citizenship']"
103,purpose storytelling catch us extended artandadvocacy immigration immigrationlaw theaterlife fountain theatre,"['purpose', 'catch', 'fountain']"
104,u worked hard u saved acriminal illegal alien steals identity nothing w b done immigration waaradio,"['work', NOT 'saved', 'illegal', 'alien', 'steal', 'identity', 'nothing']"
105,rolling deep represent educate reentry looking forward visit exodus excited new immigration know rights partnerships always pleasure see ally,"['looking forward', 'present', 'educate', 'excite', 'partnership', 'pleasure', 'ally']"
106,know fridayfacts funfacts friday fridayfeelings australia visa immigration migration visaconsultancy apexvisas,['australia']
107,10 million unfilled jobs unemployment rate fell 3 6 near pre pandemic levels agriculture food processors rely immigrant labor demonized amp contributions ignored could reduce rate inflation immigration,"['agriculture', 'food', 'food processor', 'job', 'unemployment', 'rate', 'pandemic', 'rely', 'immigrant', 'demonize', 'contribution', 'ignored', 'reduce', 'inflation']"
108,doocy cannot let smartphones thing go dad let get phone 35 something jenpsaki peterdoocy migrants smartphones immigration fox border,"['phone', 'smartphones', 'foxe']"
109,joe biden listen proposed policies immigration flipflop hypocrites dementiajoe democratsaredestroyingamerica democratsusetobestrongonbordersecurity joebidemisfullofshit shorts via,"['shorts', 'joey', 'bide', 'policies', 'hypocrites']"
110,sure peter free cell phones everyone peterdoocy jenpsaki immigration migrants border cellphones foxnews watch cltv,"['phone', 'sure', 'free']"
111,reining mass immigration,"['N', 'o', ' ', 'c', 'o', 'n', 'c', 'e', 'p', 't', 's', ' ', 'd', 'e', 't', 'e', 'c', 't', 'e', 'd']"
112,may path enlightenment shown lord rama lead purpose quantis consultants wishes happy ram navami ramnavami happyramnavami ramnavami2022 ram immigration visa quantisconsultants,"['consultant', 'enlightenment', 'lord', 'lead', 'purpose', 'wishes', 'happy', 'navami']"
