,text,sentic_concept
5459,experts expatsinspain offers clients full immigration services relocation movers madrid barcelona also brand new service personalorganizer thru sister company spain via chris julia inma amp lilia speak english,"['madrid', 'barcelona', 'service', 'spain', 'brand new', 'offers', 'clients', 'full', 'relocation', 'sister', NOT 'maa']"
5460,yami immigration amp education make dreams reality congratulations amazing student securing 58 score contact details 91 99099 25252 admin edu com yami yamiimmigration immigration visaapproval studyvisa,"['education', 'dreams', 'reality', 'congratulations', 'amaze', 'student', 'secure', 'score', 'detail']"
5461,send staff canada intra company transfers canada immigration,"['staff', 'canada', 'intra']"
5462,1 6 years contestalert quiz yaxisquiz win immigration visa prvisa yaxis indianmigrants migration migrateabroad overseascareer visa prvisa usa join guys 07,"['usa', 'qui', 'win', 'join']"
5463,italy introducing digitalnomad visa decree following stay tuned eca italia immigration madalina andrei gms roman zelichenko jd text see art 6 1 sexies italian language,"['italy', 'stay tuned', 'introducing', 'decree', 'follow', 'art', 'sexy']"
5464,economic outlook shows strong employment growth many opportunities newcomers canada read gt gt whatsapp get touch canapprove determine eligibility canadaimmigration canada immigration,"['canada', 'whatsapp', 'determine eligibility', 'outlook', 'showy', 'strong', 'employment', 'growth', 'newcomer', 'touch']"
5465,danish government set aside two billion kroner enable country take refugees ukraine decreasing amount development aid syria mali bangladesh burkina faso immigration asylum refugees ukraine,"['burkina faso', 'country', 'ukraine', 'amount', 'syria', 'mali', 'bangladesh', 'govern', 'enable', 'decrease', 'development', 'aid', 'asylum']"
5466,cdc save lives end title 42 american civil liberties union immigration immigrationrights endtitle42,"['civil liberty', 'save', 'live', 'union']"
5467,attended nationality borders bill conference organised today useful informative conference renowned barristers speaking respective areas expertise proposed naab learnt lot naab publiclaw immigration,"['conference', 'area', 'attend', 'nationality', 'organise', 'useful', 'informative', 'renowned', 'respective', 'expertise', 'nab']"
5468,greatest reporter immigration scores c economic policy sidelines almost 20 million american men via,"['men', 'reporter', 'score', 'policy', 'sideline']"
5469,yami immigration amp education make dreams reality congratulations amazing student securing 63 score contact details 91 99099 25252 admin edu com yami yamiimmigration immigration visaapproval studyvisa,"['education', 'dreams', 'reality', 'congratulations', 'amaze', 'student', 'secure', 'score', 'detail']"
5470,get visa without hustle achintya immigration memes immigrationmemes immigration visa immigrants immigrationservices immigrationconsultant visaservices visaapproval pr permanentresidentvisa permanentresidencepermit permanentresidencycard,"[NOT 'hustle', 'meme', 'immigrants']"
5471,statement changes immigration rules hc 1220 published yesterday read alongside explanatory memorandum 1 4,"['published', 'explanatory', 'memorandum']"
5472,global skills strategy initiative immigration amp citizenship canada aimed helping companies attract foreign talent learn immigrationlawyer canadianimmigration,"['canada', 'skill', 'strategy', 'initiative', 'citizenship', 'aim', 'help', 'attract', 'talent', 'learn']"
5473,alberta pnp draw read website download app latest immigration news canada alberta immigration immigrationprograms movetocanada canadanews,"['canada', 'draw', 'latest']"
5474,best requirement call 91 7347247189 8146947189 0183 5096189 website workincanada canada studyincanada immigration canadavisa canadaimmigration immigrationcanada expressentry canadapr immigratetocanada,"['canada', 'best', 'requirement']"
5475,violence immigrant youth canada research needed immigration youth,"['canada', 'violence', 'immigrant', 'youth', 'research', 'needed']"
5476,new draw beats previous record largest pnp draw took place january get 60 days apply date invitation email us consult pro com learn canada 10proconsulting immigration,"['place', 'daye', 'apple', 'canada', 'draw', 'beats', 'record', 'large', 'invitation', 'pro', 'learn']"
5477,want expand business us sure immigration procedures organize virtual info session topic held german relevant register,"['expand', 'sure', 'organize', 'virtual', 'info', 'session', 'relevant', 'register']"
5478,demand jobs newzealand know planning migrate new zealand 2022 travel jobsearch immigration immigrationmatters wednesdaythought wednesday,"['new zealand', 'demand', 'job', 'migrate', 'travel']"
5479,imho particularly white replacement endless immigration meant achieve meant kill nation amp sense nationhood well westernculture end fighting much better globalists,"['particular', 'replacement', 'endless', 'achieve', 'kill', 'nation', 'sense', 'nationhood', NOT 'fighting', 'better']"
5480,congratulations mr darji first step immigration extremely glad fulfill dream getting canadian visa contact us 91 70 963 963 00 visit website firststepimmigration canada visa sinp immigration immigrationconsultant,"['canada', 'fulfill dream', 'congratulations', 'glad']"
5481,read fast tracking dreams people across world dream live uk work study family ukvisa immigration paperwork amp procedures needed fulfil dream experts help,"['fast', 'tracking', 'dreams', 'dream', 'live', 'work', 'study', 'family', 'paperwork', 'needed', 'fulfil', 'help']"
5482,congratulations mr darji first step immigration extremely glad fulfill dream getting canadian visa visit website contact us abu dhabi 971 581 992 545 dubai 971 581 181 827 canada visa pr immigration canadavisa,"['abu dhabi', 'dubai', 'canada', 'fulfill dream', 'congratulations', 'glad']"
5483,grab opportunity study abroad immigrationcanada immigratetocanada studypermit studyincanada workpermit businessinvestment expressentry2022 immigrationconsultant immigration abroad visaservices overseas education learning knowledge students canada lima,"['canada', 'lima', 'study', 'education', 'learning', 'knowledge', 'student']"
5484,india comprises vast population english speakers makes indian aspirants ideal choice global recruitment globalrecruitment humanresources humancapital immigration englishspeakers,"['india', 'indiana', 'comprise', 'population', 'aspirant', 'ideal', 'choice', 'recruitment']"
5485,know popular way gaining new zealand permanent residence based skilled migration contact us amp help amp guide 91 8882599623 info com nzpr newzealand immigration migration nzvisa visa studyabroad workpermit,"['new zealand', 'permanent residence', 'popular', 'gaining', 'skilled', 'help', 'guide', 'info']"
5486,today employee spotlight feature stephen kimani immigration officer kenya stephen extroverted personality allows thrive role immigration team kenya immigrationexpert workpermit immigrationconsultant employeefocus,"['feature', 'kenya', 'employee', 'spotlight', 'officer', 'extrovert', 'personality', 'thrive']"
5487,uk pledged send extra 286 million aid afghanistan humanitarian crisis grows humanitarian crisis poverty energyprices immigration pensions fuelprice foodshortages benefits costoflivingcrisis corruption crimesagainsthumanity,"['afghanistan', 'pledge', 'extra', 'aid', 'crisis', 'poverty', 'pension', 'benefits', 'corruption']"
5488,yes biden trudeau democrats liberals want believe good people encouraging mass immigration amp openborders sadly none admit truth shame politicalhypocrites embarrassed aoc face,"['yes', 'bide', 'trudeau', 'liberal', 'believe', 'good', 'encouraging', 'sadly', NOT 'admit', 'truth', 'shame', 'embarrass']"
5489,discover beyond limit contact canada work permit escoffiers workincanada canada studyincanada immigration canadavisa canadaimmigration immigrationcanada expressentry canadapr immigratetocanada canadianimmigration workpermit immigrationconsultant,"['canada', 'discover', 'limit', 'work', 'permit']"
5490,know minimum eligibility criteria apply bc pnp requirements connect us details immigrationcanada immigratetocanada studypermit studyincanada workpermit businessinvestment expressentry2022 immigration,"['apple', 'minimum', 'eligibility', 'requirement', 'connect', 'detail']"
5491,bls brings together partners associates freelancers agents individuals aligned goals build immigration business speed scale become bls associate canadaimmigration canada immigration immigrationconsultants bls,"['canada', 'brings', 'together', 'partner', 'associate', 'freelancer', 'individual', 'goals', 'build', 'speed']"
5492,bear2 stopped caged stopped filthy person entering society petaindia interfere maybe person stopped rabid totally immigration authorities stopping filth spreading abroad,"['person', 'bear', 'stop', 'filthy', 'entering', 'interfere', 'rabid', 'authority', 'stopping', 'filth']"
5493,want legal common law partner shift canada apply spousal sponsorship program know jaspal gill visit us spousalsponsorship familyvisa commonlawpartner canadacitizenship immigration surrey britishcolumbia,"['canada', 'apple', 'legal', 'partner', 'shift', 'spousal', 'sponsorship']"
5494,study canada 100 top ranked universities amp colleges apply 2022 intake free profile assessment amp expert guidance contact us info call us 97803 39039 97802 39039 canada canadianimmigration immigration immigrants immigrationcanada visa,"['canada', 'apple', 'study', 'ranked', 'intake', 'free', 'assessment', 'guidance', 'info', 'immigrants']"
5495,customer reviews permanentresidence visaservices immigration migrationagent reviews googlereviews facebookreview oshc bestmigrationservices topmigrationagent bestvisaconsultan,"['N', 'o', ' ', 'c', 'o', 'n', 'c', 'e', 'p', 't', 's', ' ', 'd', 'e', 't', 'e', 'c', 't', 'e', 'd']"
5496,sponsor parents grandparents canada details tel 92 21 34389311 14 4 lines email info com pk website canada sponsorship parentvisa canadavisa immigration lalaniassociates secureyourlegacy,"['canada', 'sponsor', 'grandparent', 'detail', 'info', 'sponsorship']"
5497,visacrunch immigration updates new zealand changes border rules allow tourists earlier special ukraine visa family members read immigration permanentresident specialukrainevisa ukraine ukrainiancitizens ukrainianrefugees,"['new zealand', 'ukraine', 'family member', 'update', 'special']"
5498,immigrate canada housekeeper housekeeper housekeeperjobs jobscanada cleaner cleanerjobs homecare homesupport homesupportworker canada immigration tfwp worker foreignworker,"['canada', 'cleaner', 'immigrate', 'housekeeper', 'worker']"
5499,bcoz got gc time delayed processing time eb amp planning waste 10 000s eb greencards year eb3 india moved 01 01 2015 moving eb2 india date beyond april 2015 u care letters amp many immigration,"['india', 'delayed', 'waste', 'moved', 'moving', 'care', 'letters']"
5500,sweden swedish government announced lift entry ban countries outside eu eea april read immigration globalmobility hr,"['sweden', 'country', 'govern', 'announced', 'lift', 'ban']"
5501,want study united kingdom full fill uk education dreams flyworld india details call us 91 70165 86677 uk unitedkingdom visa immigration travel visaconsultants studentvisa visaservices flyworldindia flyworld trynahiflykaro,"['united kingdom', 'india', 'study', 'fill', 'education', 'dreams', 'detail', 'travel']"
5502,know connect experts generate idea lmia apply immigrationcanada immigratetocanada studypermit studyincanada workpermit businessinvestment expressentry2022 immigrationconsultant immigration abroad overseas,"['apple', 'connect', 'generate', 'idea']"
5503,alberta issued invitations 350 express entry aspirants pnp draw 22 march 2022 amp declared 29th march visit canadapr visaconsultant ircc immigration iccrcmember ahmedabad pr canadaimmigration migratetocanada pnp,"['ahmedabad', 'issued', 'invitation', 'express', 'aspirant', 'draw', 'declared']"
5504,visit wealth information resources internationally educated professionals new immigrants interested upgrading skills newcabadians education career canada immigration,"['canada', 'information resource', 'wealth', 'educated', 'professional', 'immigrants', 'upgrade', 'skill', 'education']"
5505,manitoba provincial nominee program mpnp invited 191 candidates apply march visit website visit blogs wavevisasimmigration wavevisas immigration abroadjob wavevisaswebsite,"['apple', 'provincial', 'nominee', 'invited']"
5506,send staff canada intra company transfers multinational companies send key staff work canada intra company transfer work permits check eligibility immigration canada migration movetocanada workpermits,"['staff', 'canada', 'intra', 'multinational', 'key', 'work', 'permit', 'eligibility']"
5507,australia lower tuition fee compared countries surely make best use call us 91 950 271 8667 precisconsultants studentvisa aboradstudt visa australia happyjourney highereducation immigration studentvisaconsultant,"['australia', 'country', 'lower', 'fee', 'compare', 'surely', 'best']"
5508,manitoba provincial nominee program mpnp invited 191 candidates apply march visit website visit blogs manitobainvitations vovisas immigration abroadjob vovisaswebsite,"['apple', 'provincial', 'nominee', 'invited']"
5509,mentioned step step guide following choose educational program canada immigrationcanada immigratetocanada studypermit studyincanada workpermit businessinvestment expressentry2022 immigrationconsultant immigration abroad overseas,"['canada', 'mention', 'guide', 'follow', 'choose', 'educational']"
5510,last night welcome drinks langham melbourne nominees migration lawyer john gibson award globalmobility immigration beempowered,"['melbourne', 'welcome', 'drinke', 'nominee', 'award']"
5511,questions path citizenship usa check answers many common questions process well valuable resources information knowledge power hfimmigration immigration knowyourrights,"['usa', 'information knowledge', 'valuable resource', 'citizenship', 'answer', 'process', 'power']"
5512,want list backto60 universalcredit dwp covid19 immigration outsourcing benefits name hes lying,"['covid', 'outsource', 'benefits', 'lying']"
5513,crackdown illegal immigration gujarat 70 78 seized passports mehsana several agents summoned questioning cidcrime crime branch gandhinagarpolice,"['illegal', 'seize', 'summon', 'questioning', 'crime']"
5514,partner could speak highly eli team nothing helpful definitely recommend adi immigration amyie boyd migrationagent australianvisa studentvisa migratetoaustralia liveinaustralia immigration immigrationconsultant,"['partner', 'high', NOT 'help', 'recommend', 'boyd']"
5515,applications approved culturally arranged marriage cam visa nov 2019 march 2022 watch video know cam visas iwk kiwiindians arrangermarriages newzealand immigrationnz migrants immigration auckland,"['auckland', 'arranged marriage', 'application', 'approved', 'culturally', 'nova']"
5516,hiring alert visit 91 90400 50017 91 90400 50077 encoreabroad education immigration studymbbs studymbbsabroad bhubaneswar cliqvolt jobopportunity jobvacancy odisha jobs jobsearching bhubaneswarbuzz bhubaneswarsmartcity odishajobs,"['bhubaneswar', 'alert', 'education', 'job']"
5517,latest spanish video informacion visa k1 lazarosalazarlaw fresno immigration attorney visak1,"['fresno', 'latest', 'attorney']"
5518,want make way canada stuck low crs score alberta pnp answer worries canadaimmigration canada immigration canadavisa studyincanada expressentry canadapr,"['canada', 'stuck', 'low', 'score', 'answer', 'worry']"
5519,looking housekeeping job canada means immigrating canada housekeeper housekeeperjobs jobscanada cleaner cleanerjobs homecare homesupport homesupportworker canada immigration tfwp worker foreignworker,"['canada', 'cleaner', 'job', 'immigrate', 'housekeeper', 'worker']"
5520,love thy neighbor meant defined borders map immigration define generation let favorable definition,"['thy neighbor', 'love', 'defined', 'defy', 'favorable', 'definition']"
5521,almost like wish executive branches government whatever please administrativelawis important upholds democracy accountability democracyunderthreat lnp hawke auspol homeaffairs immigration scottmorrison,"['wish', 'executive', 'govern', 'important', 'uphold', 'democracy', 'accountability']"
5522,india haters see inefficiency india eff duck iciency something whatever immigration,"['india', 'haters', 'inefficiency', 'eff', 'duck']"
5523,republicofkorea south korean government announced resume visa free entry additional 46 counties april details immigration globalmobility hr,"['govern', 'announced', 'resume', 'free', 'additional', 'detail']"
5524,alberta pnp draw canada pr alberta pnp invited 350 candidates crs low 325 express entry pool march 22 2022 ava consultant canadaimmigration canada immigration expressentry canadavisa canadapr visa workpermit ielts,"['canada', 'pool', 'consultant', 'draw', 'invited', NOT 'express', 'aver']"
5525,inaction appears badge democratic party leadershipneedstolead votingrights climatecrisis healthcare affordableprescriptions immigration campaignfinance jan6thcommittee,"['democratic party', 'inaction', 'appear', 'badge', 'healthcare']"
5526,thousands afghans evacuated us america let stay immigration refugee,['evacuate']
5527,sisepuede daca funfact need immigrationreform year make happen immigrationmatters immigration immigrant immigrants linkinmybio inmigrantes,"['dacer', 'hap', 'immigrant', 'immigrants']"
5528,march 29 catholic immigrants unite protect amp support amp united states via religion catholicchurch europe fathermichaeljmcgivney immigration knightsofcolumbus march newhaven religioushistory stmaryschurch wwi wwii,"['catholic', 'immigrants', 'protect', 'support', 'religion', 'wii']"
5529,thank rep omar joining colleagues urging ag garland ensure due process transparency immigration courts,"['thank', 'join', 'colleague', 'urge', 'ensure', 'process', 'transparency']"
5530,landing beach soon already immigration,['beach']
5531,cdnpoli immigration refugeeswelcome woke,['woke']
5532,technology government get notified brain text messaging systems transferring characters disability technology instead hacking government technology reporting false information fbi departmentofhomelandsecurity immigration,"['technology', 'govern', 'notify', 'brain', 'disability', 'report', 'false', 'information']"
5533,unitedstates uscis posted new premium processing regulation public inspection today unveiling plan make additional benefit categories eligible service coming months years learn immigration globalmobility hr,"['service', 'premium', 'regulation', 'inspection', 'additional', 'benefit', 'eligible', 'learn']"
5534,opportunity cost bad policy league tables immigration edition dramatic fall immigration seen since 2016 starved major urban counties economic engines people talent,"['table', 'cost', 'bad', 'policy', 'league', 'fall', 'starved', 'major', 'engine', 'talent']"
5535,population south north dakota wyoming almost montana idea immigration,"['north dakota', 'wyoming', 'montana', 'population', 'idea']"
5536,somewhere human authentic voices migration survival new beginnings anthology created entirely undocumented former undocumented immigrants somewherewearehuman immigration,"['new beginning', 'authentic', 'anthology', 'created', 'immigrants']"
5537,elated represent first person panel 2 years thank blc recognizing important impact immigrants texas inviting us along w amp discuss immigration,"['person', 'texas', 'elated', 'present', 'panel', 'thank', 'recognize', 'important', 'impact', 'immigrants', 'inviting', 'discuss']"
5538,success story visa visa approved 29th march 2022 subclass 500 call us 02 7805 4030 0 433 006 249 successstoryofvisa successstory visaexpiring visa immigration studyabroad,"['success', 'approved']"
5539,upload use time immigration casemanagement lawfirms attorney software immicompliance immigrationattorneys,"['upload', 'attorney']"
5540,join cila thursday enjoy early bird rates benefit education networking mentorship leave positive legacy cdnimm space canada cdnpoli immigration cilavoice,"['canada', 'early bird', 'join', 'enjoy', 'benefit', 'education', 'mentor', 'positive', 'legacy']"
5541,become cilavoice member today create legacy membership growing rapidly collectively seek improve canada immigration system sign thursday benefit early bird rates cdnimm cdnpoli immigration,"['canada', 'early bird', 'create', 'legacy', 'growing', 'collectively', 'seek', 'improve', 'benefit']"
5542,women history month honor women undertaken immense responsibility leaving finding new place set roots never easy leave much harder stay womenshistorymonth immigration refugees,"['women', 'place', 'honor', 'response', NOT 'easy', 'harder']"
5543,great discussion immigration shadow minister mp immigration professionals afternoon office need immigration canada make priority reduce 1 84 million case backlog restore integrity system immigration cdnpoli,"['canada', 'discussion', 'shadow', 'professional', 'priority', 'reduce', 'backlog', 'restore', 'integrity']"
5544,first trailer childrensbook theboyfrommexico wrote illustrated published coming november kidslit animation immigration latin latinx latino mexico california,"['mexico', 'california', 'trail', 'illustrated', 'published', 'animation']"
5545,ontario held draw stream express entry skilled trades 24 march 2022 draw held oinp invited 471 international immigration workers issuing letters notification interest call us free counseling 91 9871383058 immigration pnp,"['draw', 'stream', 'express', 'skilled', 'invited', NOT 'ternate', 'issuing', 'letters', 'notification', 'interest', 'free', 'counseling']"
5546,wondering early start feeling happy weather truly mean something immigration lawyer turned pessimist,"['wonder', 'happy', 'weather', 'true', 'pessimist']"
5547,jack tweets proven symbolic failed make difference ground leadership simply ineffective immigration empathy equality diversity,"['prove', 'symbolic', 'fail', 'differ', 'leadership', 'simple', 'ineffective', 'empathy', 'equality', 'diversity']"
5548,budget2022 making lost ground getting back levels discusses immigration reopening australia world means economy ausbiz auspol,"['australia', 'lost', 'discuss', 'opening', 'economy']"
5549,country racist encourage immigration,"['country', 'racist', 'encourage']"
5550,want know features information around immigration new zealand immigration vinay got covered today from18 00 18 30 immigration vinay radio southland 96 4 fm immigration immigrants immigrationnz nzimmigration radiosouthland migrants,"['new zealand', 'feature', 'information', 'vine', 'immigrants']"
5551,uscis announced today conducted h 1b lottery received enough registrations h 1b quotas electronic pre registration period details immigration globalmobility hr,"['announced', 'conduct', 'lottery', 'receive', 'registration', 'quota', 'detail']"
5552,south bend civic theatre hosts event discussing immigration immigration immigrationnews undocumented immigrants daca,"['event', 'bend', 'civic', 'host', 'discuss', 'immigrants', 'dacer']"
5553,scary people flooding border money jobs place go sounds like terrible situation immigration,"['place', 'scary', 'flooding', 'money', 'job', 'terrible', 'situate']"
5554,spain morocco relationship depicted cartoon front page algiers daily libert famous algerian cartoonist ali dilem immigration migration algeria harragas maghreb,"['spain', 'morocco', 'algiers', 'algeria', 'relationship', 'cartoony', 'liberty', 'famous', 'cartoonist']"
5555,immigration fundamental force shaping u economy society 100 years join ucsd giovanni peri talks economic value impact immigrants thursday march 31 3 30 p pdt sign,"['fundament', 'force', 'shaping', 'economy', 'join', 'ucsd', 'peri', 'talky', 'value', 'impact', 'immigrants']"
5556,sendthemback mpp fake asylum claim 90 lose enter u show immigration court ordered deported refuse leave get 2 years prison disobeying court order,"['fake', 'asylum', 'claim', 'lose', 'enter', 'deport', 'refuse', 'prison', 'disobey']"
5557,today uscis announced trio efforts reduce backlogs expand premium processing provide relief work permit holders theclinicscal immigrationattorney immigration uscisnews uscisbacklogs kansascity,"['permit holder', 'announced', 'trio', 'reduce', 'backlog', 'expand', 'premium', 'provide', 'relief', 'work']"
5558,immigration one ways address workplace shortages world huge global talent shortages localized much needs done within canada jenny cfc parallel event csw66 citizenship homegrownleadership,"['canada', 'event', 'workplace', 'shortage', 'huge', 'talent', 'needy', 'within', 'parallel', 'citizenship']"
5559,immigration brings swell christians around globe starts new christian communities cities,"['brings', 'swell', 'glob', 'community']"
5560,today uscis announced trio efforts reduce backlogs expand premium processing provide relief work permit holders sharmacrawfordattys immigrationattorney immigration uscisnews uscisbacklogs kansascity,"['permit holder', 'announced', 'trio', 'reduce', 'backlog', 'expand', 'premium', 'provide', 'relief', 'work']"
5561,panelist jason patrick morgan speaking eb 5 amp global immigration expo miami april 7 8 register industry wide person gathering today uglobal citizenshipbyinvestment eb5 global immigration expo,"['person', 'panel', 'expo', 'register', 'industry', 'wide', 'gather']"
5562,employers us must comply form 9 regulations work experienced attorney avoid common pitfalls read immigration i9 usimmigration immigrationattorney immigrationpolicy attorney,"['employer', 'comply', 'work', 'experienced', 'attorney', 'avoid', 'pitfall']"
