,text,sentic_concept
5217,extending healthcare coverage ukrainians entering nl supposed help newfoundlanders already get family doctor system faltering newfoundland ukraine immigration,"['ukraine', 'healthcare', 'entering', 'help', 'family', 'faltering']"
5218,called bidens immigration reform,"['bide', 'reform']"
5219,mustread thread explaining title 42 immigration,['thread']
5220,u amp mexico immigration officials prepare ukrainians amp russians arrive us mexico reports yet high numbers ukrainians russians fleeing russiaukrainewar arriving along texas border via,"['mexico', 'texas', 'prepare', 'arrive', 'high', 'arriving']"
5221,many others congress support adding millions people us mass immigration face climatecrisis huge water issues unaffordable housing urban sprawl etc,"['urban sprawl', 'support', 'add', 'water', 'issues', NOT 'afford']"
5222,h 1b visa lottery lucky enough get one visas immigration options working u h1b tech humanresources hr shrm students economy employment,"['tech', 'lottery', 'luck', 'work', 'student', 'economy', 'employment']"
5223,u preparing potential spike border arrivals title 42 lifted immigration,"['preparing', 'spike', 'arrival', 'lift']"
5224,uscis announces policy change regarding parole status certain cubans immigration,"['announces', 'policy', 'regard', 'parole', 'status']"
5225,immigration update u immigration options ukrainian nationals immigration,['update']
5226,uscis issues immigration rule expand premium processing immigration,"['issues', 'rule', 'expand', 'premium']"
5227,death immigration facility nagoya raising questions quality healthcare offered detainees justiceforwishma immigrationmatters immigration,"['facility', 'nagoya', 'quality', 'death', 'raising', 'healthcare', 'offer']"
5228,u immigration agency moves cut 9 5 million case backlog speed processing immigration,"['cut', 'backlog', 'speed']"
5229,celpip general test celpip general ls test inquiry please email info ca celpip celpiptest academy education proffesional immigration cityofmississauga peel certificate paragon testing proffesional exam celpip,"['prof', 'test', 'inquiry', 'info', 'education', 'certificate', 'paragon', 'testing']"
5230,ny bill seeks expand health insurance currently ineligible immigrants know immigration immigrationnews undocumented immigrants daca,"['expand', 'health', 'insure', 'ineligible', 'immigrants', 'dacer']"
5231,excellent news long past time title42 lifted however alone solve problems need real substantive immigration reform,"['excellent', 'lift', 'solve', 'problem', 'substantive', 'reform']"
5232,breaking news u plans lift pandemic era order restricted immigration nation land borders people familiar plan said breaking biden immigration,"['plane', 'lift', 'pandemic', 'restricted', 'nation', 'land', 'familiar', 'bide']"
5233,chatbot effective people behind ask uscis backlog increased decreased since emma deployed technology leadership immigration whiteprivilege,"['chatbot', 'effective', 'backlog', 'increased', 'decrease', 'deploy', 'technology', 'leadership']"
5234,sen durbin jumps bipartisan compromises sen cornyn racist anti labor anti women texas gop w asking party use power already emblematic democratic leadership actual position immigration workers rights,"['women', 'texas', 'position', 'bipartisan compromise', 'racist', 'party', 'power', 'emblematic', 'democratic', 'leadership']"
5235,catholic law students partner catholic charities southern new mexico 2022 alternative spring break immigration lawschool ccsnm,"['new mexico', 'alternative spring break', 'catholic', 'student', 'partner', 'charity', 'southern']"
5236,1 6 years contestalert quiz yaxisquiz win immigration prvisa yaxis indianmigrants migration migrateabroad overseascareer bharati sidhu77 86,"['qui', 'win']"
5237,next jlccc2022 plethora lightning round sessions labor employeebenefits erisa global employment issues immigration scotus review,"['plethora', 'lightning', 'session', 'employment', 'issues']"
5238,surprisingly less attention given seems key message movie people need special deserve love security ultimately rights encanto immigration refugees,"['movie', NOT 'attention', 'key', 'special', 'deserve', 'love', 'security', 'ultimate']"
5239,pay attention wethepeople saying education election immigration reform jordan,"['jordan', 'pay attention', 'education', 'reform']"
5240,international migration africa france contraception use julia behrman fertility gender immigration reproduction,"['france', NOT 'ternate', 'contraception', 'fertility', 'reproduction']"
5241,biden fy23 budget invests central america invests reducing immigration backlogs invests immigration courts invests ports entry manage immigration increases cbp budget 4 8 billion 5 4 billion,"['bide', 'invest', 'reducing', 'backlog', 'manage']"
5242,1 6 years contestalert quiz yaxisquiz win immigration yaxis indianmigrants migration migrateabroad overseascareer visa prvisa usa join friends,"['usa', 'qui', 'win', 'join', 'friends']"
5243,pay money amp move front line immigration capitalism,"['money', 'move', 'capitalism']"
5244,preparation possible post title 42 border rush federal emergency management administration fema officials prepare many 18 000 migrants per day usmexicoborder migration immigration,"['emergency management', 'preparation', 'possible', 'rush', 'federal', 'administration', 'prepare']"
5245,know speak immigration experts canadaimmigration canada immigration canadavisa studyincanada canadapr expressentry immigrationconsultant visa immigrationconsultants immigrationtocanada sayhomecanadaimmigration ontario nigeria nigerian brampton,"['canada', 'nigeria']"
5246,join us friday 1pm cst firstfridays fiona managing founding attorney fiona mcentee answering audience questions immigration amp discussing current events immigration related questions dm us,"['event', 'join', 'attorney', 'answer', 'discuss']"
5247,ontario pnp draw read website download app latest immigration news canada ontario immigration immigrationprograms movetocanada canadanews,"['canada', 'draw', 'latest']"
5248,yes wide open welcome chattel slavery free labor p former failure failed secure border bidenharris2024 bordercrisis immigration,"['wide open', 'chattel slavery', 'yes', 'welcome', 'free', 'failure', 'fail', 'secure']"
5249,fair h1b 2023 lottery various examples people getting selected even multiple applications hard catch people like get system h1blottery h1b2023 uscis immigration,"['fair', 'lottery', 'application', NOT 'catch']"
5250,huge news immigration asylum spaces,"['huge', 'asylum']"
5251,immigration southern boarder immediately halted completely control nothing democratic socialist plan redefine look us give leftliberals permanent voting block think socialservices people,"[NOT 'democratic socialist', 'southern', 'board', 'halt', 'control', 'redefine', 'give', 'permanent', 'block']"
5252,uscis announces fy 2023 h 1b selection process completion uscis immigration,"['announces', 'selection', 'process', 'completion']"
5253,29 march 2022 announced agency received enough registrations h 1b registration period fy 2023 employers may begin filing 129 petitions 1 april 2022 immigration h1b nonimmigrantvisa visa h1bstatus,"['announced', 'receive', 'registration', 'employer', 'beg', 'petition']"
5254,1 6 years contestalert quiz yaxisquiz win immigration yaxis indianmigrants migration migrateabroad overseascareer visa prvisa usa,"['usa', 'qui', 'win']"
5255,1 6 years contestalert quiz yaxisquiz win immigration visa yaxis indianmigrants migration migrateabroad overseascareers join 01 kusum jain,"['qui', 'win', 'join']"
5256,words hiding become way emboldened johnson pm immigrants immigration,"['hiding', 'embolden', 'immigrants']"
5257,lottery system immigration fair hq hq ottawa,"['ottawa', 'lottery', 'fair']"
5258,biden pledged undo trump harmful policies immigration new budget request maintains increases funding ice cbp agencies infamous family separations amp abuse toward immigrants must end team,"['bide', 'pledge', 'undo', 'harmful', 'policies', 'request', 'funding', 'infamous', 'family', 'separation', 'abuse', 'immigrants']"
5259,1 6 years contestalert quiz yaxisquiz win immigration visa yaxis indianmigrants migration migrateabroad overseascareers join nanda,"['qui', 'win', 'join']"
5260,ur refusing reply letters wrote january ignore letters oversight committee uscis potus immigration,"['refuse', 'reply', 'letters', 'ignore', 'oversight', 'committee']"
5261,1 6 years contestalert quiz yaxisquiz win immigration visa yaxis indianmigrants migration migrateabroad tagging sarang n sarkar,"['qui', 'win', 'tag']"
5262,uscis announces 3 ways reduce excessive immigration case backlogs new cycle time goals expanding premium processing improving access employment authorization documents,"['announces', 'reduce', 'excessive', 'backlog', 'cycle', 'goals', 'premium', 'improving', 'access', 'employment', 'authorization']"
5263,hinojosa outstanding movingborders journalism work clearly depicts contradictions anachronism immigration amp foreignpolicy,"['outstanding', 'work', 'clear', 'depicts', 'contradict', 'anachrony']"
5264,knew minute ukrainian invasion started going start seeing huge disparity sudden america whatever talk death immigration,"['invasion', 'disparity', 'death']"
5265,network students industry leaders organizations learn tips amp tricks immigration healthcare legal rights best financial practices celebrate acceptance students networking students,"['industry leader', 'student', 'learn', 'tipsy', 'tricky', 'healthcare', 'legal', 'best', 'celebrate', 'accept']"
5266,immigrate canada light duty cleaner cleaner cleanerjobs cleanercanada canada immigration lightdutycleaner jobscleaner cleaningjobs,"['canada', 'cleaner', 'light duty', 'immigrate']"
5267,1 6 years contestalert quiz yaxisquiz win immigration visa yaxis indianmigrants migration migrateabroad overseascareers join kusum jain,"['qui', 'win', 'join']"
5268,latest news taxes tax taxes taxreturn taxrefund taxseason impuestos impuesto irs inmigracion ciudadania iaco passaicnj immigration citizenship newjersey nuevajersey nonprofitorganization community,"['latest', 'taxes', 'citizenship', 'community']"
5269,issues guidance work authorization l 2 spouses hr immigration visas shrm,"['issues', 'guidance', 'work', 'authorization', 'spouse']"
5270,us embassy india interview letters update usimmigration pakusaimmigration f2a fx1 f2b f2avisa f3visa f4visa usvisa visabulletin usvisabacklogs embassyreopening uscis nvc immigration immigrationnews immigrationlawyer immigrationconsultant us usa,"['india', 'usa', 'letters', 'update']"
5271,1 6 years contestalert quiz yaxisquiz win immigration prvisa yaxis indianmigrants migration migrateabroad overseascareer bharati,"['qui', 'win']"
5272,forget nydreamact undocumented immigrant immigration,"['forget', 'immigrant']"
5273,mikhailitchenkolaw rest assured getting highest quality legaladvice matter issue realestatelaw personalinjury immigration help starting consultation call 416 307 2070 maria com,"['quality', 'highest quality', 'rest', 'assured', 'issue', 'help']"
5274,biden administration claims enough money budgeted additional 4th shot covid boosters americans coming across southern border illegally get vaccinated ba2variant bidenbordercrisis immigration,"['bide', 'administration', 'claim', 'money', 'additional', 'covid', 'booster', 'southern', 'illegally', 'vaccine']"
5275,panelist david pinheiro iberis capital speaking eb 5 amp global immigration expo miami april 7 8 register industry wide person gathering today uglobal citizenshipbyinvestment eb5 global immigration expo,"['person', 'panel', 'capital', 'expo', 'register', 'industry', 'wide', 'gather']"
5276,uscis announced extension covid flexibilities responding uscis requests due ongoing covid pandemic resulting backlog learn notices forms qualify immigration immigrationbacklog covidflexibilities,"['announced', 'covid', 'flexibility', 'request', 'pandemic', 'backlog', 'learn', 'qualify']"
5277,1 6 years contestalert quiz yaxisquiz win immigration visa yaxis indianmigrants migration migrateabroad overseascareers join jaycmh 17,"['qui', 'win', 'join']"
5278,home office gets upset says joshi rude court explore follow amazing spring viral worldwar3 russiainvadesukraine ukimmigrationnews trending immigrationupdate immigrationnews immigrationchanges uk immigration uksettlement ilr ukvisa,"['home', 'upset', 'rude', 'explore', 'follow', 'amaze', 'spring', 'trending']"
5279,panelist osvaldo torres speaking eb 5 amp global immigration expo miami april 7 8 register industry wide person gathering today eb5 global immigration expo,"['person', 'panel', 'expo', 'register', 'industry', 'wide', 'gather']"
5280,deportees janeen rae heller music freedom latism immigration humanrights,"['music', 'deportee', 'hell', 'freedom']"
5281,actual tory mp thicker bloke talking beyondbelief immigration,"['bloke', 'thicker']"
5282,panelist nicolai hinrichsen speaking eb 5 amp global immigration expo miami april 7 8 register industry wide person gathering today eb5 global immigration expo,"['person', 'panel', 'expo', 'register', 'industry', 'wide', 'gather']"
5283,subscribe pnsg newsletter stay date latest sector news research articles resources newtocanada newcomers immigration,"['subscribe', 'newsletter', 'latest', 'sector', 'research', 'resource', 'newcomer']"
5284,interested immigration national security amp intellectualproperty,['security']
5285,ss stop immigration,['stop']
5286,1 6 years contestalert quiz yaxisquiz win immigration prvisa yaxis indianmigrants migration migrateabroad overseascareer join 86 mulle,"['qui', 'win', 'join', 'mull']"
5287,equity oriented civilrights education amp immigration organizations appreciate administration recommitment priorities doubling title amp including funding voluntary equity reviews existing state amp local funding formulas,"['equity', 'education', 'appreciate', 'administration', 'commitment', 'priority', 'funding', 'voluntary', 'formulae']"
5288,services completely free joblio provides assistance processing additional documents provide assistance obtaining work visa moldova issue permit invitation work sending document country origin joblio workersforpoland immigration,"['moldova', 'country', 'free', 'provides', 'assistance', 'additional', 'provide', 'work', 'issue', 'permit', 'invitation', 'origin']"
5289,hot jobs men qualified builders tiler plumber electrician welder salary 10 euros per hour 250 unskilled workers construction cleaning window washing salary 8 euros hour 250 workabroad immigration relocation vacanciesabroad workabroad,"['men', 'hot', 'job', 'builder', 'tile', 'plumber', 'electrician', 'welder', 'salary', 'euro', 'unskilled', 'construction', 'relocation']"
5290,make immigration law practice progressive collaborative complete compliant immigration casemanagement lawfirms immigrationattorneys software immicompliance,"['progressive', 'collaborative', 'compliant']"
5291,looking trusted immigration attorney deal issues help contact us 1 301 562 7995 contact com immigration neufvillelaw edwardneufvillelaw,"['attorney', 'deal', 'issues', 'help']"
5292,governments must better upcoming elections vote wisely topoli onpoli cdnpoli immigration,"['govern', 'better', 'wisely']"
5293,biden fire record us illegal immigration via,"['bide', 'record', 'illegal']"
5294,ontario time make strength weakness embrace new immigration policies better skilled training remote working policies,"['strength', 'weakness', 'embrace', 'policies', 'better', 'skilled', 'training', 'remote', 'work']"
5295,arshad pangere amp warring llp offer legal assistance family law immigration personal injury visit website send us message call us schedule initial consultation familylaw immigration personalinjury,"['war', 'offer', 'legal', 'assistance', 'family', 'injury']"
5296,u prepares arrest surge migrants southern border welcome ukraine usa america refugees immigration migrantsatsouthernborder via,"['ukraine', 'usa', 'prepare', 'arrest', 'surge', 'southern', 'welcome']"
5297,foreign experts working icelandic labor market often dependent employer spouse job security applies non experts immigration iceland,"['iceland', 'apple', 'work', 'dependent', 'employer', 'spouse', 'job', 'security']"
5298,biden protecting burisma people bringing usa biden immigration,"['usa', 'bide', 'bury', 'bringing']"
5299,great pleasure announce luis caregiver month march homeinstead homeinsteadseniorcare homeinsteadjobs hamilton hamiltonontario hamiltonjobs employeeappreciationday jobs employement immigration immigrantsjobs expat burlington,"['hamilton', 'pleasure', 'caregiver', 'job', 'employee', 'expat']"
5300,h1b comprehensive guide alternative options available selected fy2023 h1bcap need assistance help immigration capexempt h1b1 tnvisa e3visa e1visa e2visa o1avisa l1visa greencard,"['comprehensive guide', 'alternative', 'available', 'assistance', 'help']"
5301,need take country back see coming fighting dont mix gonna go border force police judges government protecting us makebritaingreatagain rules standards traditions values getthemout immigration,"['country', 'fighting', NOT 'mix', 'force', 'policy', 'judge', 'govern', 'tradition', 'values']"
5302,answer 6 years contestalert quiz yaxisquiz win immigration visa yaxis indianmigrants migration migrateabroad overseascareers youtube channel done share screenshot join 12 108,"['answer', 'qui', 'win', 'share', 'join']"
5303,quidproquojoe needs impeached immigration crisis,"['needy', 'impeach', 'crisis']"
5304,home immigrants immigration sirbillwiggin,"['home', 'immigrants']"
5305,sounds good chronic backlogs targeted new set immigration measures,"['good', 'chronic', 'backlog', 'measure']"
5306,announces new actions reduce case backlogs processing times immigration hr shrm immigration,"['announces', 'reduce', 'backlog']"
5307,clear message constituents represented compete utter arsehole northherefordshire torylies immigration immigrants,"['clear', 'constituent', 'arsehole', 'immigrants']"
5308,city brooks ready influx newcomers bcis brooksandcountyimmigrationservices immigration,"['city', 'ready', 'influx', 'newcomer']"
5309,1 6 years contestalert quiz yaxisquiz win immigration visa yaxis indianmigrants migration migrateabroad overseascareers join kusum 0119,"['qui', 'win', 'join']"
5310,ersaccepted cops trusted context time shape immigrants trust police europe authors amp jeffmitchell coming soon immigration discrimination integration,"['coming soon', 'copse', 'shape', 'immigrants', 'trust', 'policy', 'discriminate', 'integration']"
5311,march fraud prevention month encouraging potential newcomers informed educated warning signs avoid becoming victims fraud immigration cdnimm ic,"['warning sign', 'fraud prevention', 'encouraging', 'newcomer', 'informed', 'educated', 'avoid', 'victim', 'fraud']"
5312,1 6 years contestalert quiz yaxisquiz win immigration visa yaxis indianmigrants migration migrateabroad overseascareers join 1,"['qui', 'win', 'join']"
5313,statement today prime minister datuk seri ismail sabri yaakob said one week period april 1 borders neighbouring nations reopen public tourism borders singapore malaysia news immigration toll ismailsabri,"['singapore', 'malaysia', 'prime', 'nations', 'reopen', 'tourism', 'toll']"
5314,usually interviewer vlog one interviewed thanks umc discussing immigration migration humanrights welcomerefugees,"['interviewed', 'thank', 'discuss']"
5315,right moves potus amp congress control immigration must country rule law prevails legal migration democratsdeliver immigrationreform immigration legal ruleoflaw migrants immigrants news usa,"['country', 'usa', 'control', 'rule', 'prevail', 'legal', 'immigrants']"
5316,march 18th 2008 portuguese nationality regulation republished changing among others form acquisition portuguese nationality naturalisation descendents sephardic jews find immigration sephardicjews,"['nationality', 'regulation', 'republish', 'changing', 'acquisition', 'naturalise']"
5317,1 6 years yaxisquiz immigration visa yaxis indianmigrants migration migrateabroad join 86 01 kusum,['join']
5318,indefinite leave remain requirement ilr applying process ilr processing time ilr email info co uk phone 0208 124 3222 immigration immigrationmatters immigrants immigrationreform,"['phone', 'indefinite', 'remain', 'requirement', 'process', 'info', 'immigrants']"
5319,huge hypocrisy amp racism work take groups people despicable never forget depraved border patrol treating haitian refugees last year amp lot psycho sadists supported refugees immigration ukraine,"['ukraine', 'hypocrisy', 'racism', 'work', 'despicable', NOT 'forget', 'depraved', 'patrol', 'psycho', 'sadist', 'supported']"
5320,looking grow immigration practice let chat gmi con 2022 may know immigration business plans also help build amp grow digital presence content packages customizable templated websites,"['grow', 'con', 'plane', 'help', 'build', 'presence', 'content', 'customizable', 'template']"
5321,ans 1 6 years contestalert quiz yaxisquiz win immigration visa prvisa yaxis indianmigrants migration migrateabroad overseascareer visa prvisa usa,"['usa', 'qui', 'win']"
5322,time change conversation scarcity abundance working becoming biggest talent pool north america combination immigration training distributed workforce w great partners like,"['pool', 'talent pool', 'conversation', 'scarcity', 'abundance', 'work', 'combination', 'training', 'workforce', 'partner']"
5323,ever charged dui foreign country happens canada affect application work canada learn effects new legislation immigration immigrationlawyertoronto canadianimmigration,"['country', 'canada', 'charged', 'hap', 'affect', 'application', 'work', 'learn', 'effects', 'legislation']"
5324,matter c j h 26 amp n dec 284 bia 2014 readjustment status permitted asylee adjustment provision immigration immigrants asylee,"['bier', 'readjustment', 'status', 'permit', 'asylee', 'adjustment', 'provision', 'immigrants']"
5325,u immigration agency moves cut 9 5 million case backlog speed processing immigration immigrationnews undocumented immigrants daca,"['cut', 'backlog', 'speed', 'immigrants', 'dacer']"
5326,congress discusses outdated immigration policies key solution creation startupvisa recruit world talented entrepreneurs shores startup visa would huge benefits job creation amp startup formation u,"['discuss', 'outdated', 'policies', 'key', 'solution', 'create', 'entrepreneur', 'shores', 'startup', 'benefits', 'job', 'formation']"
5327,wellness wednesday spotlight mental health effects racism latino community latinomentalhealth racismisapublichealthissue publichealth immigration healthequity california trauma healing inequities,"['california', 'mental health', 'wellness', 'spotlight', 'effects', 'racism', 'community', 'trauma', 'healing', 'inequity']"
5328,canada develop permanent immigration pathway international students canada immigration canadaimmigration immigrationca movetocanada studyincanada internationalstudents applyboard studyabroad gocanada students immigrationlawyer,"['canada', 'develop', 'permanent', 'pathway', NOT 'ternate', 'student']"
5329,saw replies got know 1 book gujaratfiles slammed supremecourt pimping lies subterfuge amp fiction 2 stopped absconding immigration investigated charity embezzlement thanks exposing ranaayyub,"['book', 'reply', 'pimp', 'lie', 'subterfuge', 'fiction', NOT 'abscond', 'investigate', 'charity', 'embezzlement', 'thank', 'exposing']"
5330,depend luck best way get lucky prepare luck preparation immigration immigrationlawyer,"['luck', 'best', 'prepare', 'preparation']"
5331,pace lawyer michael rourke speaking panel today border issues virtual conference panel visiting united states work pleasure rules effectively counsel clients immigration law gt gt,"['conference', 'pace', 'panel', 'issues', 'virtual', 'work', 'pleasure', 'effectively', 'counsel', 'clients']"
5332,u canadian immigration nationality law newsletter amp updates immigration nonimmigrant visa h1b h1bvisa greencard l1visa eb5 nachman,"[NOT 'immigrant visa', 'nationality', 'newsletter', 'update']"
5333,congratulations dhruvit patel canada student visa successful canada students visa 1st attempt ielts 7 bands 2 years study gap 12 backlogs mseducationconsultant studentvisa studyabroad ieltscoaching immigration studyincanada,"['canada', 'congratulations', 'patel', 'student', 'successful', 'attempt', 'study', 'gap', 'backlog']"
5334,hundreds people arrested detained operation lone star charged crime weeks dozens given lawyer month operationlonestar immigration,"['arrested', 'operate', 'lone', 'star', 'charged', 'crime', 'doze']"
5335,update h 1b electronic registration cap immigration,"['update', 'registration', 'cape']"
5336,emily summers share insights valuable resource immigration options ukrainians immigration update u immigration options ukrainian nationals faegre drinker biddle amp reath llp,"['valuable resource', 'summery', 'share', 'insight', 'update', 'drinker']"
5337,ukraine boy praised crossing border latino kids sent detention centers detained hispanics immigrants immigration latinos latinosunided ukraine,"['ukraine', 'boy', 'praised', 'detention', 'immigrants']"
5338,canada last place anyone would want live nothing offer thanks 2 criminals inflation immigration economiccrisis carbontax fraud cdnpoli cdnmediafailed,"['canada', 'place', 'live', NOT 'offer', 'thank', 'crime', 'inflation', 'fraud']"
5339,uscis measures ease processing times immigration,"['measure', 'ease']"
5340,starting live session 5 april 11 00am ask anything immigration process happy help drop questions comment section immigrationcanada canada live youtube study visa work iccimmigration immigration immigrationconsultant,"['canada', 'live', 'session', 'process', 'happy', 'help', 'drop', 'comment', 'study', 'work']"
