,text,sentic_concept
5001,worried work permit extention worry assisst info contact us today visa visaplus canadaimmigration canada immigration canadavisa expressentry canadapr studyincanada visa,"['canada', 'worried', 'work', 'permit', 'extent', 'worry', 'info']"
5002,refreshing honest spin op ed immigration worth 5 min read time try something else opinion abject biden failure immigration prompt real rethink washington post,"['washington', 'refreshing', 'honest', 'spin', 'worth', 'try', 'abject', 'bide', 'failure', 'prompt', 'rethink']"
5003,latest legal content curated lawmarketer blawg immigration immigrationnews,"['latest', 'legal', 'content', 'curate']"
5004,start promising career canada know experts dm us call us 971 56 416 9277 visit website canada canadapr canadavisa canadajobs immigration migration visa visaconsultants apexvisas,"['canada', 'promising']"
5005,start promising career canada know experts dm us call us 91 80558 04150 visit website canada canadapr canadavisa canadajobs immigration migration visa visaconsultants apexvisas,"['canada', 'promising']"
5006,cannot change future change habits surely habits change future immivoyage studyvisa visaexpert visaservices consultant visa immigration studentvisa studyincanada ukjobs,"['consultant', 'habit', 'surely']"
5007,deal invaders civil war later immigration refugeeswelcome africanization,"['deal', 'invade', 'civil', 'war']"
5008,update familia according officials administration plan set motion end pandemic era emergency rule known title42 late may 2022 details immigration,"['update', 'family', 'accord', 'administration', 'motion', NOT 'pandemic', 'emergency', 'rule', 'late', 'detail']"
5009,immigration matters episode 5 growing american immigrant emil giordano podcast skilledimmigrants,"['growing', 'immigrant']"
5010,admissions open fall 2022 intake miss chance get scholarship 20000 book seat contact us information scholarship intake studyincanada canada immigration studyvisa studentvisa twitter edulandimmigration,"['book', 'canada', 'admission', 'fall', 'intake', 'chance', 'scholarship', 'information']"
5011,1 6 years contestalert quiz yaxisquiz win immigration visa yaxis indianmigrants migration migrateabroad overseascareers,"['qui', 'win']"
5012,consider open immigration 30 day policy multi citizenship acceptance seems like americans want move usa amp live within nato countries truly unified happen eu en balance,"['usa', 'country', 'consider', 'policy', 'citizenship', 'accept', 'move', 'live', 'within', 'true', 'hap', 'balance']"
5013,3 nominated films caught eye year focus immigration flee encanto luca immigration oscars oscarnoms oscarwinners animation animatedfilm documentary disney fleemovie film filmfestival immfilmfest2022 immigrationfilmfestival,"['disney', 'nominated', 'caught', 'eye', 'focus', 'flee', 'animation', 'filmfest']"
5014,immigrate canada spouse immigration spousevisa canada sernexuss,"['canada', 'immigrate', 'spouse']"
5015,express entry draw held march 30 canada invited 919 pnp candidates apply permanent residence whatsapp contact canapprove canada immigration canadavisa expressentry canadapr visa immigrationconsultant,"['canada', 'apple', 'whatsapp', 'permanent residence', 'express', 'draw', 'invited']"
5016,thank taking time research write important news story asylumseekers migrants immigration icedetention,"['thank', 'research', 'write', 'important']"
5017,anyone looking advice ukranian crisis see details event attending partnership ukraine crisis immigration advice,"['event', 'ukraine', 'advice', 'crisis', 'detail', 'partnership']"
5018,title42 truly never covid19 immigration always tricky subject ending trump era border policy seems like good thing truth told many immigrants huge role growing reshaping country economy,"['country', 'true', NOT 'covid', 'tricky', 'policy', 'good', 'truth', 'tolde', 'immigrants', 'huge', 'growing', 'reshape', 'economy']"
5019,chaos border surge expected biden set soften deportation rules biden border deportation immigration security,"['chaos', 'surge', 'expected', 'bide', 'soften', 'deportation', 'security']"
5020,number canadians fleeing country last year reached near 50 year high canada trudeauworstpmever trudeautyranny trudeaunationaldisgrace trudeaumustgo trudeaudictatorship immigration,"['country', 'canada', 'reached', 'high']"
5021,alberta invited 350 international immigrants apply permanent residency canada march 22 2022 three hundred fifty immigrants score 318 crs comprehensive ranking system information call us 91 9871383058 immigration prvisa,"['apple', 'canada', 'permanent residency', 'invited', NOT 'ternate', 'immigrants', 'score', 'comprehensive', 'ranking', 'information']"
5022,looking student visa extension worry right place visa experts help extend student visa australia check detailed blog australiavisa studentvisa studentvisaextension immigration,"['place', 'australia', 'student', 'worry', 'help', 'extend', 'detailed']"
5023,high time fire immigration committee called champion immigration reform honest intension zero bill passed,"['high', 'committee', 'champion', 'reform', 'honest', 'intense', 'zero']"
5024,1 6 years contestalert quiz yaxisquiz win immigration yaxis indianmigrants migration migrateabroad overseascareer visa prvisa usa tagging 34,"['usa', 'qui', 'win', 'tag']"
5025,congrats urvish canada studentvisa visa approval even 3 refusals ielts 7 bands ms 4 years studygap 9 backlogs study cambriancollege mseducationconsultant studyabroad immigration studyincanada studyinusa cambrian,"['canada', 'congrats', 'approval', 'refusal', 'backlog', 'study']"
5026,bc pnp draw march 29 2022 bc pnp invite people registration pool submit application program invitations apply itas based information provided registrations read immigration pnpprogram,"['pool', 'apple', 'draw', 'invite', 'registration', 'submit', 'application', 'invitation', 'information', 'provide']"
5027,1 6 years contestalert quiz yaxisquiz win immigration visa yaxis indianmigrants migration migrateabroad confident,"['qui', 'win', 'confident']"
5028,see new forbes article using immigration measures deal russia ukrainian refugee problem biden olafscholz poland war usa congress parliament,"['russia', 'poland', 'usa', 'measure', 'deal', 'problem', 'bide', 'war']"
5029,government canada revels spousal sponsorship bounced back standard service pandemic delayed ircc operations information call us 91 9871383058 immigration prvisa visanews canadapr canadapnp ircc,"['canada', 'service', 'govern', 'revel', 'spousal', 'sponsorship', 'bounced', 'standard', 'pandemic', 'delayed', 'operations', 'information']"
5030,border state democrats beg biden consider dangerous impact illegal immigration communities,"['beg', 'bide', 'consider', 'dangerous', 'impact', 'illegal', 'community']"
5031,1 6 years contestalert quiz yaxisquiz win immigration yaxis indianmigrants migration migrateabroad overseascareer visa prvisa usa join parmar17 88,"['usa', 'qui', 'win', 'join']"
5032,get canadian citizenship parent canadian full article canadanews immigration immigrationnews cdnimm narcitycanada blogto dailyhive ctv cbc parent citizenship canadian canada toronto vancouver cisnews,"['canada', 'toronto', 'vancouver', 'citizenship', 'full']"
5033,yami immigration amp education make dreams reality congratulations amazing student securing 62 score contact details 91 99099 25252 admin edu com yami yamiimmigration immigration visaapproval studyvisa,"['education', 'dreams', 'reality', 'congratulations', 'amaze', 'student', 'secure', 'score', 'detail']"
5034,send staff canada intra company transfers full article canadanews immigration immigrationnews cdnimm narcitycanada dailyhive curiocitycanada ctv cbc send staff employer canada toronto vancouver cisnews,"['staff', 'canada', 'toronto', 'vancouver', 'intra', 'full', 'employer']"
5035,1 6 years contestalert quiz yaxisquiz win immigration prvisa yaxis indianmigrants migration migrateabroad overseascareer bharati 34,"['qui', 'win']"
5036,queen university suspend mandatory vaccination masking measures full article canadanews immigration immigrationnews dailyhive curiocitycanada ctv university queensuniversity vaccination canada toronto vancouver cisnews,"['canada', 'toronto', 'vancouver', 'queen', 'suspend', 'mandatory', 'vaccine', 'mask', 'measure', 'full']"
5037,ap sources asylum limits border expected end may 23 daca immigration immigrationreform joebiden elsalvador mexico venezuela guatemala asylum tps visas citizenship gop migrants ice borderpatrol,"['mexico', 'venezuela', 'guatemala', 'asylum', 'limits', 'expected', 'dacer', 'citizenship']"
5038,reminder forgotten immigration covidpfizerreactions pfizerdocumentreleasebombshell sackingpeopleforwantingnaturalimmunity pissingourtaxmoneyupthewalloncovidandmoneytononbritishcauses sort electorate,"['reminder', 'forgotten', 'electorate']"
5039,changes employer right work checks come effect 6th april 22 give staff refresher training amp ensure conducting right work checks familiar new april requirements righttowork hr immigration,"['staff', 'employer', 'work', 'effect', 'give', 'refresher', 'training', 'ensure', 'familiar', 'requirement']"
5040,march 22 2022 alberta invited 350 international immigrants apply permanent residency canada three hundred fifty immigrants score 318 crs comprehensive ranking system information call us 91 7303872762 immigration prvisa,"['apple', 'canada', 'permanent residency', 'invited', NOT 'ternate', 'immigrants', 'score', 'comprehensive', 'ranking', 'information']"
5041,1 6 years contestalert quiz yaxisquiz win immigration visa yaxis indianmigrants migration migrateabroad overseascareers tags pinky777,"['qui', 'win', 'tag', 'pink']"
5042,new volunteer opportunity charity join immigration team help admin research case management read apply,"['apple', 'volunteer', 'charity', 'join', 'help', 'research', 'management']"
5043,reference amounts required crossing external border updated spain information schengen residencepermit visapolicy immigration,"['spain', 'ferenc', 'updated', 'information']"
5044,u immigration agency moves cut 9 5 million case backlog speed processing immigration immigrationreform,"['cut', 'backlog', 'speed']"
5045,predict help wanted signs restaurant windows going away immigration biden administration plans end use trump era pandemic border policy,"['restaurant', 'windows', 'predict', 'help', 'bide', 'administration', 'plane', 'pandemic', 'policy']"
5046,express entry canada invites 919 pnp candidates apply canada immigration,"['canada', 'apple', 'express', 'invite']"
5047,1 6 years contestalert quiz yaxisquiz win immigration visa prvisa yaxis indianmigrants migration migrateabroad overseascareer visa prvisa usa tag 89 01,"['usa', 'qui', 'win', 'tag']"
5048,kill us immigration internationalstudent migrantstudentunited pgwpextension cecdraws,['kill']
5049,may allowed apply francophone mobility program already canada spouse may also qualify open work permit learn canadianimmigration immigrationlawyer immigrationlawyertoronto immigration,"['apple', 'canada', 'allowed', 'spouse', 'qualify', 'work', 'permit', 'learn']"
5050,practices reliant staff outside uk assess new immigration requirements impact march legal column raj bhambra discusses new updates right work checks recruitment requirements,"['staff', 'reliant', 'assess', 'requirement', 'impact', 'legal', 'column', 'raj', 'discuss', 'update', 'work', 'recruitment']"
5051,us embassy kick starts interview waiver program certain visa renewals read information visa applications amp immigration pathways usa contact sk call 0803 418 8219,"['usa', 'kick', 'renewal', 'information', 'application', 'pathway']"
5052,1 6 years contestalert quiz yaxisquiz win immigration visa yaxis indianmigrants migration migrateabroad overseascareers join g attack7 86 srikanth70,"['qui', 'win', 'join', 'attack']"
5053,achie rishi might actually working behalf dinghyinvaders like quite government seem judged failure stopped immigration debacle two years ago,"['ache', 'work', 'behalf', 'govern', 'failure', 'stop', 'debacle']"
5054,express entry canada invites 919 pnp candidates apply visit us call us 91 8285552527 immigration visa canada canadaimmigration canadanews pnp canadatouristvisa prvisa,"['canada', 'apple', 'express', 'invite']"
5055,latest expressentrydraw 219 held held march 30th 2022 919 immigrants received ita nominated canadian provinces part provincialnomineeprogram follow us information canadaimmigration canada immigration canadavisa,"['canada', 'latest', 'immigrants', 'receive', 'nominated', 'follow', 'information']"
5056,1 6 years contestalert quiz yaxisquiz win immigration visa yaxis indianmigrants migration migrateabroad overseascareers join,"['qui', 'win', 'join']"
5057,latest oinp draw sent 618 invites 3 streams pr get geniune guidance call us 1 437 343 9000 immigrationcanada immigrationnews immigrationconsultant immigration unbeatable fast canadaimmigration canadaworkpermit workincanada movetocanada workpermit,"['latest', 'draw', 'invite', 'stream', 'guidance', 'unbeatable', 'fast']"
5058,immigration important ageing amp decline working age populations taxpayers support retirees amp pensioners basic maths vs eugenics based zpg prism oecd chart working age population total population annual 1970 2020,"['important', 'decline', 'work', 'population', 'support', 'pensioner', 'basic', 'math', 'eugenics', 'prism', 'chart']"
5059,stuck express entry ways try 1 get lmia within 6 8 months 2 get job offer provincial nominee program contact us abu dhabi 971 581 992 545 dubai 971 581 181 827 canada visa pr immigration canadavisa,"['abu dhabi', 'dubai', 'canada', 'get job', 'stuck', 'express', 'try', 'within', 'offer', 'provincial', 'nominee']"
5060,recruiting recruiting immigration advisor family reunion project initially focused ukraine crisis please share apply interested recruitment immigration ukraine,"['ukraine', 'apple', 'advisor', 'family', 'union', 'focused', 'crisis', 'share', 'recruitment']"
5061,investor route closed sole representative visa route business expand uk set uk business sponsor business owner skilled worker find gt gt immigration scaleup businessowner,"['skilled worker', 'investor', 'route', 'closed', 'representative', 'expand', 'sponsor']"
5062,hong kong experiencing huge plummet schools debentures mean city education immigration relocation,"['hong kong', 'city', 'plummet', 'schools', NOT 'bent', 'education', 'relocation']"
5063,us embassy kick starts interview waiver program certain visa renewals read information visa applications amp immigration pathways usa please contact sk call 0803 418 8219,"['usa', 'kick', 'renewal', 'information', 'application', 'pathway']"
5064,extensive natural open space tropical forests excellent food quality humorous tone make country unique visa news immigration,"['food', 'quality', 'country', 'tropical forest', 'natural', 'excellent', 'humorous', 'unique']"
5065,innovation realm global employment opens doors opportunities skilled human resources transforms global assets humanresources opportunities innovation future employment jobs humancapital immigration globalrecruitment globalcareer,"['innovation', 'realm', 'employment', 'doors', 'skilled', 'resource', 'transforms', 'asset', 'job']"
5066,1 6 years contestalert quiz yaxisquiz win immigration visa yaxis indianmigrants migration migrateabroad overseascareers join 1 ajit,"['qui', 'win', 'join']"
5067,visalaw expert team canadian immigrationlawyers spare strategy come customized immigration plans suiting individual requirements happyclients immigrationlaws visalawexpert immigrationcognizance immigrationexpertadvice,"['spare', 'strategy', 'customize', 'plane', 'individual', 'requirement']"
5068,canada express entry draw immigrationcanada immigratetocanada studypermit studyincanada workpermit businessinvestment expressentry2022 immigrationconsultant immigration abroad visaservices overseas education learning knowledge students internationalstudents,"['canada', 'express', 'draw', 'education', 'learning', 'knowledge', 'student']"
5069,looks like 2029 thing true politicians gooders lord sandwichnom bass invasion illegals immigration,"['true', 'lord', 'invasion', 'illegal']"
5070,ted get much soft crime way amp gop peers coddled tfg violated everything emolumentsclause day 1 international immigration agreements attempted coup played along thebiglie,"['attempted coup', 'soft', 'crime', 'coddle', 'violated', NOT 'ternate', 'agree']"
5071,good remember uk look taking syrian refugees immigration,"['good', 'remember']"
5072,check complete details latest draw next draw prediction express entry draw pathway get canada pr visa click link details expressentry canada canadaexpressentrydraw immigration visa,"['canada', 'detail', 'latest', 'draw', 'prediction', 'express', 'pathway', 'click', 'link']"
5073,delays always frustrating anymore news canada brings ircc gets back action 12 months processing standards spousal sponsorship inland outlander applications immigration archadiusglobal spousevisa immigrationlawyer,"['canada', 'delay', 'frustrate', 'brings', 'spousal', 'sponsorship', NOT 'land', 'outlander', 'application']"
5074,express entry canada invites 919 pnp candidates apply immigration visa immigrants achintyaimmigration requirements canadaspousevisa settleoverseas immigration canada workvisas prvisas conscription immigrantsgettheworkdone immigrantsareessential,"['canada', 'apple', 'express', 'invite', 'immigrants', 'requirement', 'conscription']"
5075,secure family future investing immigrating canada book appointment visit call us cavalry office 03041111553 dha office 042 37183645 6 study visa 03000882212 ielts 03000882252 highbrow immigration,"['canada', 'book', 'secure', 'family', 'immigrate', 'appointment', 'cavalry', 'study', 'highbrow']"
5076,1 6 years contestalert quiz yaxisquiz win immigration visa prvisa yaxis indianmigrants migration migrateabroad overseascareer visa prvisa usa,"['usa', 'qui', 'win']"
5077,interested working settling usa miss opportunity know details usa immigration caps acpp amp dunn law firm jointly present webinar immigration options usa join us april 22 4pm est,"['usa', 'miss opportunity', 'work', 'detail', 'cape', 'jointly', 'present', 'join']"
5078,nstnation immigration department director general datuk seri khairul dzaimee daud said included health protocols outlined health ministry including downloading mysejahtera application singapore covid19 border immigration,"['directory', 'singapore', 'department', 'health', 'protocol', 'outline', 'ministry', 'downloading', 'application', 'covid']"
5079,canada express entry draw 129 pnp canada invited 919 expressentry candidates pnp apply canadian immigration march 30 2022 read canadaimmigration canadapnp immigrationcanada canada canadavisa canadaprvisa,"['canada', 'apple', 'express', 'draw', 'invited']"
5080,express entry canada invites 1 047 new pnp draw canadian news update live today apply jobs opportunity work life love money shared thoughtoftheday thursdayvibes instagram instagramdown twitter insta immigration consultant visa passport amc,"['canada', 'apple', 'consultant', 'express', 'invite', 'draw', 'update', 'live', 'job', 'work', 'love', 'money', 'inst']"
5081,start new journey abroad professional experts worried future work harder think yesterday contact us immigration work workpermit prvisa ukvisa germanyvisa canadaprvisas visa abroad skilledvisa jobseek,"['journey', 'professional', 'worried', 'work', 'harder']"
5082,settling abroad foreign travel career immigration,['travel']
5083,canada invited 919 pnp candidates latest express entry draw read canada prvisa cicnews pnpdraw immigration expressentry provinceimmigration canadaimmigration canadaimmigrationservices consultants canadaimmigrationnews,"['canada', 'consultant', 'invited', 'latest', 'express', 'draw']"
5084,updates related family class program free contact us immigrationcanada immigratetocanada studypermit studyincanada workpermit businessinvestment expressentry2022 immigrationconsultant immigration abroad visaservices overseas education lima,"['lima', 'update', 'family', 'free', 'education']"
5085,good biden agreed take refugees number asylum seekers war ukraine russia belarus kazakhstan going enormous immigration putinswar ukraine belarus russia uscis kyiv,"['ukraine', 'russia', 'belarus', 'kazakhstan', 'kyiv', 'asylum seeker', 'good', 'bide', 'agree', 'war', 'enormous']"
5086,wonderful career canada globalstudyvisa call whatsapp us details 91 7347295156 email globalstudyvisa com website gsv studyvisa studyabroad canada studentvisa visa ielts immigration studyincanada,"['canada', 'whatsapp', 'wonder', 'detail']"
5087,unpacking australian federal budget 2022 2023 immigration package immigration specialist julia qian brown immigration australia expats,"['australia', 'federal', 'specialist', 'expat']"
5088,march 30 2022 ontario invited total 618 express entry candidates apply pnp visit canadapr visaconsultant ircc immigration iccrcmember ahmedabad pr canadaimmigration migratetocanada pnp canadaexpressentry immigratetocanada,"['apple', 'ahmedabad', 'invited', 'express']"
5089,talk counsellors ojas immigration clarify queries studyvisa immigration usa canada uk australia nz singapore ojasimmigration,"['usa', 'canada', 'australia', 'singapore', 'counsellor', 'clarify', 'query']"
5090,uscis announces new actions reduce backlogs expand premium processing provide relief work permit holders itservealliance uscis immigration,"['permit holder', 'announces', 'reduce', 'backlog', 'expand', 'premium', 'provide', 'relief', 'work']"
5091,george w bush meets illegal aliens promote amnesty snubbing angel families georgebush hypocrites illegalimmigration immigration politics,"['illegal', 'alien', 'promote', 'amnesty', 'snub', 'angel', 'family', 'hypocrites']"
5092,portugal one world globalised amp peaceful nations let explore opportunities contact details 91 9315179419 fill quick google form reach portugal goldenvisa visa immigration canada studyabroad,"['portugal', 'canada', 'peaceful', 'nations', 'explore', 'detail', 'fill', 'quick', 'reach']"
5093,register online contact us info com ajmeralawgroup prashantajmera immigrationconsultant immigration residencyandcitizenship dubai theparkhyatt,"['dubai', 'register', 'info']"
5094,1 6 years contestalert quiz yaxisquiz win immigration visa yaxis indianmigrants migration migrateabroad overseascareers join bindra,"['qui', 'win', 'join']"
5095,purpose educational credential assessment eca substantiate possession foreign degree diploma certificate legitimate equivalent one canada offers students immigration eca yaxis canada pnp,"['canada', 'purpose', 'educational', 'credential', 'assessment', 'substantiate', 'possession', 'degree', 'diploma', 'certificate', 'legitimate', 'offers', 'student']"
5096,republicans usa set warn wednesday immigration become humanitarian disaster homeland security officials braced dramatic increases already record breaking numbers midterms2022 border,"['usa', 'record breaking', 'humanitarian disaster', 'homeland security', 'warn', 'brace', 'dramatic']"
5097,canada held express entry pnp draw 30 march 2022 invited total 919 candidates apply permanent residence visit canadapr visaconsultant ircc immigration iccrcmember ahmedabad pr canadaimmigration,"['canada', 'apple', 'ahmedabad', 'permanent residence', 'express', 'draw', 'invited']"
5098,british columbia conducted draw via pnp program 29 march 2022 visit canadapr visaconsultant ircc immigration iccrcmember ahmedabad pr canadaimmigration migratetocanada pnp canadaexpressentry immigratetocanada toronto,"['ahmedabad', 'toronto', 'conduct', 'draw']"
5099,dream comes true applying student visa subclass500 best option sydney immigration agent best migration agent sydney help get visa excellent opportunities contact us 02 8678 5756 immigration,"['sydney', 'dream', 'true', 'student', 'best', 'agent', 'help', 'excellent']"
5100,immigration minister sean fraser declared canada 12 month application processing january 2022 information call us 91 7303872762 email us info immigration candapr caandapnp visanews genique visaconsultants ircc pnp,"['canada', 'fray', 'declared', 'application', 'information', 'info']"
5101,human illegal period immigration immigrationmatters,['illegal']
5102,also opposes mandatoryeverify control unlawful immigration tool cheaplaborlobby,"['control', 'unlawful', 'tool']"
5103,quebec invited 506 apply permanent selection quebec regular skilled worker program visit website visit blogs quebec quebecinvites506 arrima immigration vovisas vovisasimmigration,"['apple', 'skilled worker', 'invited', 'permanent', 'selection']"
5104,updates related spousal sponsorship canada class contact us right today immigrationcanada immigratetocanada studypermit studyincanada workpermit businessinvestment expressentry2022 immigrationconsultant immigration abroad visaservices overseas lima,"['canada', 'lima', 'update', 'spousal', 'sponsorship']"
5105,1 6 years contestalert quiz yaxisquiz win immigration visa prvisa yaxis indianmigrants migration migrateabroad overseascareer visa join manjotra,"['qui', 'win', 'join']"
5106,alabama senate candidate katie britt releases immigration platform pledging put american workers first alabama senate candidate katie britt releases immigration platform pledging put american workers first,"['alabama', 'senate', 'release', 'platform', 'pledge']"
5107,biden administration allowing us border flooded millions illegal migrants inflation housing shortages homelessness u cost bigly redwave2022 impeachbiden immigration,"['housing shortage', 'bide', 'administration', 'allowing', 'flood', 'illegal', 'inflation', 'homelessness', 'cost', 'big']"
