,text,sentic_concept
220,planning relocate uk higher studies aspiring study one leading universities country initial step would procure visa studyvisa studyabroad studentvisa ielts visa immigration studyinuk ukvisa education study,"['country', 'relocate', 'studies', 'aspiring', 'study', 'leading', 'procure', 'education']"
221,study admissions open education consulting consultation immigration study studyvisa uk england scholarship travel trending studygram student students opportunity overseaseducationconsultant studyabroad study viral insta,"['study', 'admission', 'education', 'scholarship', 'travel', 'trending', 'student', 'inst']"
222,thecrueltyisthepoint matter feel immigration taking vulnerable people abusing publicity stunt nothing christian well least far jesuschrist concerned,"['vulnerable', 'abusing', 'stunt', 'nothing', 'concern']"
223,jobs national park service require usa citizenship labor immigration,"['service', 'usa', 'job', 'require', 'citizenship']"
224,changes working holiday maker visa assist covid 19 tourism trade recovery migrationagent workingholiday 417visa 462visa workandholiday australiavisa immigrationaustralia immigrationlaw immigrationlawyer visaenvoy immigration,"['work', 'holiday', 'assist', 'covid', 'tourism', 'trade', 'recovery']"
225,steal democracy immigration invasion yeah gop gonna stop ya,"['steal', 'democracy', 'invasion', 'yeah', 'stop']"
226,top 20 needed jobs newzealand click apply newzealand canada australia visa immigration residentvisa jobsinnewzealand saudiarabia dubai qatar nurseinnewzealand auckland bestcities freeconsultations,"['apple', 'canada', 'australia', 'dubai', 'qatar', 'auckland', 'needed', 'job', 'click']"
227,minimum points required qualify australia migrant visa know experts dm us call us 971 56 416 9277 visit website australia pr australiapr jobs immigration migration visa visaconsultants apexvisas,"['australia', 'minimum', 'qualify', 'job']"
228,envelope containing life changing contents arrived today inside envelope 3 documentsp 1 cover sheet legal jargon contents 2 brochure read welcome united states 3 green card name immigration,"['contents', 'legal jargon', 'cover sheet', 'envelope', 'changing', 'brochure', 'welcome', 'green']"
229,ukraine family visa scheme provides ukrainian nationals way join families uk information eligibility apply scheme please visit website uk ukraine immigration visa familyvisa,"['ukraine', 'apple', 'family', 'scheme', 'provides', 'join', 'information', 'eligibility']"
230,us government sharply increased number ukrainians admitted country mexican border expediting entry thousands migrants refugees held overcrowded detention centers immigration,"['country', 'govern', 'increased', 'admitted', 'expedite', 'detention']"
231,one calculation u workforce today 2 million fewer immigrants would immigration continued pre pandemic levels gap especially felt leisure hospitality food services retail healthcare,"['food', 'calculation', 'workforce', 'fewer', 'immigrants', 'continue', 'pandemic', 'gap', 'leisure', 'hospitality', 'healthcare']"
232,avoid 13 top mistakes newcomers must never list canada immigration life,"['canada', 'avoid', 'mistake', 'newcomer']"
233,may lord rama bless success happiness peace auspicious occasion ram navami happy ram navami wavevisas bestprvisa immigration canadaprvisa immigrationconsultant visaservices ramnavami durgamaa navratri mahanavami,"['auspicious occasion', 'lord', 'bless', 'success', 'happy', 'peace', 'navami', 'navratri']"
234,gt gt gt endless queries canada pr gt gt gt know talk gt gt gt one one discussion gt gt gt get questions answered experts immigration visa immigrants immigrationservices immigrationconsultant visaservices visaapproval pr swarabhasker,"['canada', 'endless', 'query', 'discussion', 'answer', 'immigrants']"
235,let wishes come true maa durga blessings happy navami orisvisas bestprvisa immigration canadaprvisa immigrationconsultant visaservices ramnavami durgamaa navratri mahanavami,"['wishes', 'maa', 'bless', 'happy', 'navami', 'navratri']"
236,mumbles american people want extending come invitation world immigration laws violating joe impeached ignoring,"['mumble', 'invitation', 'laws', 'violating', 'joey', 'impeach', 'ignoring']"
237,let festive spirit embrace dear ones special occasion wishing family happy maha navami vovisas bestprvisa immigration canadaprvisa bestconsultantindelhi jobs immigrationconsultant,"['festive spirit', 'embrace', 'special', 'occasion', 'family', 'happy', 'navami', 'job']"
238,great podcast conversation importance immigrant entrepreneurs longtime immigration reform leader american innovation entrepreneurship community,"['great', 'conversation', 'importance', 'immigrant', 'entrepreneur', 'longtime', 'reform', 'leader', 'innovation', 'entrepreneurship', 'community']"
239,special occasion pray blessings goddess durga life filled happiness peace prosperity happy maha navami esseindia bestprvisa immigration canadaprvisa bestconsultantindelhi jobs immigrationconsultant visaservices,"['special', 'occasion', 'pray', 'bless', 'happy', 'peace', 'prosperity', 'navami', 'job']"
240,bring back masking rules pcr access ontario opposition parties full article canadanews immigration immigrationnews cdnimm canada toronto cisnews bring masking rules pcr access opposition hospitalizations sixthwave covid19,"['canada', 'toronto', 'mask', 'access', 'opposition', 'full', 'hospitalization', 'covid']"
241,manitoba pnp invited 223 skilled worker candidates latest draw held april 7 whatsapp us contact canapprove canadaimmigration canada immigration canadavisa expressentry canadapr visa immigrationconsultant pnp,"['whatsapp', 'canada', 'skilled worker', 'invited', 'latest', 'draw']"
242,canada boosting immigration levels support post pandemic economic recovery read gt gt whatsapp get touch canapprove canadaimmigration canada immigration canadavisa expressentry canadapr visa,"['canada', 'whatsapp', 'boosting', 'support', 'pandemic', 'recovery', 'touch']"
243,dental care program kids 12 roll end year budget 2022 full article canadanews immigration immigrationnews cdnimm canada toronto cisnews dental care program kids coverageplan promise government liberal,"['canada', 'toronto', 'dental care', 'roll', 'full', 'promise', 'govern', 'liberal']"
244,new canadian airline begin flying toronto pearson airport summer full article canadanews immigration immigrationnews cdnimm canada toronto cisnews airline flying pearson airport summer announced planning,"['toronto', 'canada', 'airline', 'beg', 'flying', 'airport', 'full', 'announced']"
245,long lines smile security camera immigration haiku senryu securitycamera immigration,"['smile', 'security', 'haiku']"
246,ray hope spouses h 4 visas read know article immigration workpermit usavisa h4visa,"['ray', 'hope', 'spouse']"
247,canada startup visa free assessment call us 0301 828 3336 success fees visit website startupvisa getpr freestartupvisa canada visatrack immigration businessidea creativebusinessidea businessman entrepreneurs,"['canada', 'startup', 'free', 'assessment', 'success', 'fees', 'businessman', 'entrepreneur']"
248,canada new ultra low cost airline launching inaugural flight next month full article canadanews immigration immigrationnews cdnimm canada toronto cisnews transform exceptional travel airline inauguralflight lynxair experience,"['canada', 'toronto', 'ultra', NOT 'cost', 'airline', 'launching', 'inaugural', 'full', 'travel']"
249,visacrunch open work permits granted immigration candidates quebec quebec selection certificates read canada immigration imp internationalmobilityprogram ircc lmia quebec quebeclabourmarket seanfraser,"['canada', 'work', 'permit', 'selection', 'certificate', 'imp']"
250,canada proposes foreign buyers home real estate ban full article canadanews immigration immigrationnews cdnimm canada toronto cisnews proposes foreign buyers realestate ban measure average household home prices,"['canada', 'toronto', 'buyer', 'home', 'real', 'ban', 'full', 'measure', 'average', 'pricey']"
251,visacrunch amid higher immigration demand air canada sees higher travel demand india read airbus atlanta canada immigrationcandidates immigration ircc mexico montreal russia seanfraser toronto ukraine ukrainerussiawar,"['canada', 'india', 'atlanta', 'mexico', 'montreal', 'russia', 'toronto', 'ukraine', 'amid', 'demand', 'air', 'travel']"
252,mbbs schengen mbbs europe best countries mbbs mbbs admission expert europe mbbs immigration consultant,"['country', 'consultant', 'best', 'admission']"
253,4 application natural experiments labour market minimumwage immigration education extremely interesting rightfully sparking studies need challenge think know,"['application', 'natural', 'experiment', 'education', 'interest', 'rightfully', 'studies', 'challenge']"
254,agree u employers say hard time find keep talent workers decamping near record rates millions open jobs go unfilled expert say one reason labor crunch immigration u plummeting,"['near record', 'hard time', 'agree', 'employer', 'talent', 'job', 'reason', 'crunch']"
255,want know interesting facts canada contact us let us help immigration journey immigration immigrationcanada immigrationlawyer immigratetocanada immigrationconsultant zsrimmigration,"['canada', 'interest', 'help', 'journey']"
256,weekly updates information call us 91 7303872762 email us info immigration prvisa visanews visaconsultants canadapr canadapnp,"['weekly', 'update', 'information', 'info']"
257,high demand civil engineers canada candidates similar domain great opportunities canada read civileengineers engineerjobs skilledjobs workpermitvisa migratetocanada immigration cicglobalresources,"['canada', 'demand', 'civil', 'similar', 'great']"
258,reviews like fuels hard work entire vateam congratulates miss tina amp appreciate heartfelt recommendation turn immigration dream reality proper guidance amp support visas avenue immigration consultancy firm india,"['india', 'fuels', NOT 'work', 'congratulate', 'tiny', 'appreciate', 'heartfelt', 'recommendation', 'turn', 'dream', 'reality', 'proper', 'guidance', 'support', 'avenue']"
259,yami immigration amp education make dreams reality congratulations amazing student securing 59 score contact details 91 99099 25252 admin edu com yami yamiimmigration immigration visaapproval studyvisa,"['education', 'dreams', 'reality', 'congratulations', 'amaze', 'student', 'secure', 'score', 'detail']"
260,study sweden sweden visa sweden spouse visa sweden residence permit crown immigration sweden visa immigration consultant,"['sweden', 'consultant', 'study', 'spouse', 'permit', 'crown']"
261,ready fly traveling immigration uae canada jobs,"['canada', 'ready', 'fly', 'travel', 'job']"
262,ircc released latest updates atlanticimmigration program aip regarding application processing eligibility requirements ircc started accepting prvisa applications atlantic immigration program aip march 6 2022,"['eligibility requirement', 'release', 'latest', 'update', 'regard', 'application', 'accept']"
263,lol forgot say click bait voluntary bunch political theater immigration immigrationreform abbottfailedtexas,"['lol', 'forgot', 'click', 'bait', 'voluntary', 'political']"
264,put much effort helping poor middle class america schmoozing w rich friends country could begin recovering soul m4a cancelstudentdebt climateaction immigration reform votingrightsact etc nofdr,"['country', 'middle class', 'effort', 'help', 'poor', 'schmoozing', 'rich', 'friends', 'beg', 'soul', 'reform']"
265,contacting us help citizenship application process arborwayimmigration canada immigrant immigration immigratetocanada studyincanada workincanada permanentresident citizen foreignnational citizenship,"['canada', 'help', 'citizenship', 'application', 'process', 'immigrant', 'citizen']"
266,visa embassies refusal free study settlement abroad crown immigration socialmedia queries immigration consultant,"['consultant', 'refusal', 'free', 'study', 'settlement', 'crown', 'query']"
267,looks like tx violation 8 u code 1324 lawyers know twitter also drill right relevant legalese immigration texas,"['texas', 'violation', 'code', 'drill', 'relevant', 'legalese']"
268,pritipatel says open corner shop buying 2nd hand inflatable boats save royal life boat money clean kent beaches farageongbnews going pint beer talk immigration inflation rate,"['shop', 'beer', 'inflation rate', 'inflatable', 'save', 'royal', 'money', 'clean', 'beach', 'pint']"
269,eb 1 visas cheaper faster safer eb5visa risk capital loss guaranteed capital return 3 years green card year immigration investorvisa usmle eb5ic goldenvisa eb5 h1bvisa greencard e2visa e2 whatsapp 14074946246,"['whatsapp', 'cheap', 'faster', 'risk', 'capital', 'loss', 'guarantee', 'turne', 'green']"
270,study luxembourg mba luxembourg visa scholarship luxembourg crown immigration luxembourg visa immigration consultant,"['luxembourg', 'consultant', 'study', 'scholarship', 'crown']"
271,share securethetribe savemasontn usa pro ab3121 reparations exclusively american negro freedmen lineage amp immigration moratorium,"['usa', 'share', 'pro', 'reparation', 'exclusively', 'negro', 'lineage', 'moratorium']"
272,tories hint sunak criticism racist know immigration asylum warfare tories completely opposed racism,"['hint', 'criticism', 'racist', 'asylum', 'warfare', 'opposed', 'racism']"
273,nursing demand healthcare occupation canada canada canada150 nursing healthcare canadasworld canadaimmigration canadalife canadagram canadaswonderland canadatrip immigrationprogram immigration immigrationreform immigrationlaw immigrationlawyer,"['occupation', 'canada', 'healthcare occupation', 'demand', 'healthcare']"
274,foreign skilled workers sector canada offers number pathways live work country canada canada150 skilledworkers itworkers job canadaimmigration canadalife canadagram canadaswonderland canadatrip immigrationprogram immigration,"['canada', 'country', 'skilled', 'sector', 'offers', 'pathway', 'live', 'work', 'job']"
275,manitoba eoi draw 142 posted april 7 2022 manitoba immigration read pnpprogram manitobavisa manitobanvitations skilledimmigration expressentry immigrationconsultants immigrationservices immigratetocanada swainz swainzimmigration,['draw']
276,frenchelection looming gap lepen macron narrowing reminder french people like europeans consider immigration threat full analysis global,"['gap', NOT 'reminder', 'frenchy', 'consider', 'threat', 'analysis']"
277,new visa policy sit right graduates world top 50 universities get right live uk 2 3yrs without sponsored work visa high potential individual visa uk immigration,"['policy', 'sit', 'graduate', 'top', 'live', 'without', 'work', 'individual']"
278,r4today letting lose frenchelections guarantee superficial emotional much talk rightwing mention means keen immigration enough,"['lose', 'guarantee', 'superficial', 'mention', 'keen']"
279,parents grandparents canadians get multiple entries 10 year period stay canada two years time know parentsvisa grandparentsvisa supervisa canadavisa migratetocanada immigration sernexuss,"['canada', 'grandparent', 'supervise']"
280,emigration immigration become normal part global economy whether taxpayer leaving country deciding make south africa permanent home would financial tax implications read proudlypkf,"['south africa', 'country', 'normal', 'economy', 'decide', 'permanent', 'home', 'implication']"
281,gap mile wide legally permissible amp could conceivably attractive voters sunak stupendously rich nondom wife immigration worshipper boy wonder netzero addict woke sympathiser boris amp rishi amp carrie amp allegra amp downing st fake,"['boy', 'gap', 'legal', 'permissible', 'conceivably', 'attractive', 'rich', NOT 'doma', 'worship', 'wonder', 'addict', 'woke', 'sympathy', 'carry', 'downy', 'fake']"
282,canada one world top education performers wait longer connect team amp apply canadian study visa 971 4 240 5544 info com visit immigration visa immigrants citizenship immigrationlaw,"['canada', 'apple', 'wait longer', 'education', 'perform', 'connect', 'study', 'info', 'immigrants', 'citizenship']"
283,looking study united kingdom connect us hassle free visa process 971 4 240 5544 info com visit immigration visa immigrants citizenship immigrationlaw migration visas prvisas studyvisas,"['united kingdom', 'hassle free', 'study', 'connect', 'process', 'info', 'immigrants', 'citizenship']"
284,luxury lifestyle canada awaits family book appointment visit call us cavalry office 03041111553 dha office 042 37183645 6 study visa 03000882212 ielts 03000882252 highbrow immigration canada,"['canada', 'book', 'luxury lifestyle', 'await', 'family', 'appointment', 'cavalry', 'study', 'highbrow']"
285,woke remain netzero powerbrokers party think foist stupendously rich immigration worshipping skinny suits waif boy wonder incomer country starving britishness stability common sense normality maturity amp fairness rishisunak,"['boy', 'country', 'common sense', 'woke', 'remain', 'party', 'foist', 'rich', 'worship', 'skinny', 'waif', 'wonder', 'income', 'starving', 'stability', 'normality', 'maturity', 'fairness']"
286,ieworld lawmakers introduced bill uscongress recapture nearly 3 8 lakh unused family employment based visas seeking reduce massive greencard backlog read usvisa immigration,"['recapture', 'family', 'employment', 'reduce', 'massive', 'backlog']"
287,alex got citizenship today us usa citizen immigration congratulations,"['alexa', 'usa', 'citizenship', 'citizen', 'congratulations']"
288,congrats urvish canada dependentvisa visa 1st attempt apply us expert visa processing mseducationconsultant studentvisa studyabroad ielts immigration studyincanada visitorvisa canadaspousevisa canadaspouseopenworkpermit spousevisa,"['canada', 'apple', 'congrats', 'attempt']"
289,hmmmmmm whips horses airplanes take back ukraine damn day ukrainerussianwar immigration haiti,"['airplane', 'ukraine', 'haiti', 'whip', 'damn']"
290,free study germany germany medical germany nursing germany visa germany visa expert germany visa immigration consultant,"['germany', 'consultant', 'free', 'study', 'medical']"
291,particular invitation apply british columbia pnp invited 198 candidates registration pool particular invitation apply based available registration information call us free counseling 91 9871383058 immigration prvisa pnp,"['apple', 'pool', 'invitation', 'invited', 'registration', 'available', 'information', 'free', 'counseling']"
292,make immigration dreams reality wisa india details toll free 1800 123 9212 mobile 9667718700 landline 011 48017852 email contactus com visit website immigration immigratetocanada canadaimmigration,"['india', 'dreams', 'reality', 'wisa', 'detail', 'toll', 'free']"
293,permanentresidence visaservices immigration migrationagent reviews googlereviews facebookreview oshc bestmigrationservices topmigrationagent bestvisaconsultant,"['N', 'o', ' ', 'c', 'o', 'n', 'c', 'e', 'p', 't', 's', ' ', 'd', 'e', 't', 'e', 'c', 't', 'e', 'd']"
294,british columbia pnp invited 198 candidates registration pool particular invitation apply based available registration information information call us 91 7303872762 email us info immigration prvisa,"['pool', 'apple', 'invited', 'registration', 'invitation', 'available', 'information', 'info']"
295,compassion humanity integrity results stand dag law group istandwithconstitution immigration daglawgroup abogadodeinmigracion,"['compassion', 'integrity', 'group']"
296,canada announced increase fee application permanent residence fee increased april 30 2022 applicants come permit holder economic family humanitarian classes canadapr canadavisa immigration gtvspbk,"['canada', 'permanent residence', 'application fee', 'permit holder', 'announced', 'increase', 'fee', 'increased', 'applicant', 'family']"
297,information call us 91 8595338595 successstories happyclients immigration studyvisa studentvisa studyincanada studyabroad overseaseducation studyabroadprograms studyabroadconsultants studentvisaconsultants studyabroadexpert abhinavsince1994,['information']
298,budget 2022 contains proposals express entry tfwp application processing visit website visit blogs canadaprvisa immigration immigrationconsultant bestprvisa esseindia bestimmigrationindelhi,"['proposal', 'express', 'application']"
299,budget 2022 contains proposals express entry tfwp application processing visit websites visit blogs canadaprvisa immigration immigrationconsultant bestprvisa wavevisas,"['proposal', 'express', 'application']"
300,budget 2022 contains proposals express entry tfwp application processing visit website visit blogs canadaprvisa immigration immigrationconsultant bestprvisa orisvisas,"['proposal', 'express', 'application']"
301,budget 2022 contains proposals express entry tfwp application processing visit website visit blogs canadainvites vovisas vovisasimmigration vovisasinvitation immigration abroadjob,"['proposal', 'express', 'application']"
302,la based operation arranged phony marriages amp submitted fraudulent immigration documents least 400 clients btwn oct 2016 amp march 2022 charging newlywed clients 20k 30k cash according indictment,"['operate', 'phony', 'fraudulent', NOT 'clients', 'charging', 'cash', 'accord', 'indict']"
303,dear sir maam police verification pcc done 4th april request please look matter end please provide pcc next week deadline submit immigration purpose pcc immigration,"['policy', 'verification', 'request', 'provide', 'submit', 'purpose']"
304,yami immigration amp education 91 99099 25252 526 527 poddar arcade near railway station khand bazar varachha road surat 395006 yami yamiimmigration immigration visaapproval studyvisa canadavisa canadaaip ielts pte studyincanada,"['surat', 'education', 'railway']"
305,vilifying bullying people instead solving problems border immigration,"['vilify', 'bullying', 'solve', 'problem']"
306,rapper 21 savage immigration case us authorities still pending due pending criminal case read 21savage rapper immigration chioma criminalminds mourinho,"['rapper', 'savage', 'authority', 'pending', 'crime']"
307,canada spending 115 million next years assist foreign trained workers come canada budget2022 healthcare immigration canadawelcomesyou,"['canada', 'assist', 'healthcare']"
308,applying immigration stressful prospect endless train paperwork documentation quickly become overwhelming canadaimmigration canada immigration canadavisa studyincanada expressentry canadapr visa immigrationconsultant,"['canada', 'stressful', 'prospect', 'endless', 'paperwork', 'documentation', 'quick', 'overwhelming']"
309,immigration webinar kamala maddipoti scheduled april 13 2022 please encourage hr personnel join immigration opportunity hear expert update recent happenings itservealliance immigration networking,"['personnel', 'scheduled', 'encourage', 'join', 'hear', 'update', 'recent', 'hap']"
310,imagine immigrant risking go america search better life get instead immigration court bussed around governors personal political circus due process american immigration,"['imagine', 'immigrant', 'search', 'better', 'busy', 'govern', 'political', 'process']"
311,dr laura sirbu poster presentation im residents knowledge skills attitudes towards immigrant health sgim22 meded medtwitter immigration curriculum,"['presentation', 'knowledge', 'skill', 'immigrant', 'health', 'curriculum']"
312,immigration news effective may 2 2022 eligible noncitizen visitors traveling vwp land ports entry longer required complete paper form 94w upon arrival instead must first register cpb esta,"['effective', 'eligible', NOT 'citizen', 'travel', 'land', 'longer', 'complete', 'arrival', 'register', 'ester']"
313,please post call us right schedule consultation immigration needs 262 764 5036 p represent clients worldwide immigration studyabroad immigrationlawyer studentvisa tps usimmigration tps,"['needy', 'present', 'clients', 'worldwide']"
314,texas begins dispatching buses border transport illegal immigrants dc border immigration joebiden illegal immigration policy,"['texas', 'transport', 'beg', 'dispatch', 'illegal', 'immigrants', 'policy']"
315,word experts explore pathways immigration canada call us immigrationcanada immigratetocanada studypermit studyincanada workpermit businessinvestment expressentry2022 immigrationconsultant immigration abroad visaservices lima,"['canada', 'lima', 'explore', 'pathway']"
316,uscis waive interviews speed cases aos ap daca dreamers immigration inmigracion sisepuede youtube facebook twitter instagram clubhouse telegram tiktok check dreamers2gether video tiktok,"['telegram', 'waive', 'interviews', 'speed', 'dacer', 'dreamer']"
317,share securethetribe savemasontn usa pro reparations ab3121 lineage immigration moratorium back hiring line roy beck,"['usa', 'share', 'pro', 'reparation', 'lineage', 'moratorium']"
318,rfe ap aos daca dreamers immigration inmigracion sisepuede youtube instagram facebook twitter clubhouse telegram,"['telegram', 'dacer', 'dreamer']"
319,immicompliance enterprise core features immigration casemanagement lawfirms attorney software immicompliance immigrationattorneys,"['feature', 'enterprise', 'attorney']"
320,russia government suspended simplified visa issuance certain travelers specific countries learn immigration globalmobility hr,"['russia', 'country', 'govern', 'suspended', 'issuance', 'travel', 'specific', 'learn']"
321,former french intelligence chief pierre brochand predicts civil war could erupt unless europe france drastically alter immigration policy claiming multicultural societies doomed,"['france', 'frenchy', 'intelligence', 'chief', 'predict', 'civil', 'war', 'erupt', 'alter', 'policy', 'multicultural', 'doomed']"
322,border voices people politics perspectives via immigration noborderwall,['perspective']
