,text,sentic_concept
655,fuck man hollywood far behind even making half white accurate anymore gotta white people screen superheroes everybody interact california hispanic immigration hollywood mcu,"['man', 'screen', 'california', 'fuck', 'accurate', 'superhero', 'interact']"
656,1 6 5 contestalert quiz yaxisquiz win immigration visa prvisa yaxis indianmigrants migration migrateabroad overseascareer visa prvisa usa tagging,"['usa', 'qui', 'win', 'tag']"
657,know visitor visa application canada 2 2 immigratetocanada canadianimmigration canadavisa canada immigration canadapr canadalife immigrationconsultant,"['canada', 'application']"
658,cic global resources best consultant delhi assist better guide 100 transparency read jobsincanada canadaworkpermit skilledjobs workpermitvisa migratetocanada immigration cicglobalresources,"['consultant', 'delhi', 'resource', 'best', 'assist', 'better', 'guide', 'transparency']"
659,budget 2022 contains proposals express entry tfwp application processing canada canada150 canadaday expressentry canadagoose canadasworld canadaimmigration canadalife canadagram canadaswonderland canadatrip immigrationprogram immigration,"['canada', 'proposal', 'express', 'application']"
660,skilled workers prefer immigrate canada india canada canada150 canadaday skilledworkers canadasworld canadaimmigration canadalife canadagram canadaswonderland canadatrip immigrationprogram immigration immigrationreform immigrationlaw,"['canada', 'india', 'skilled', 'prefer', 'immigrate']"
661,onthisday 1925 australian government british colonial office offered low interest loans encourage britons borrow money emigrate australia history immigration,"['australia', 'borrow money', 'govern', 'colonial', 'offer', NOT 'interest', 'loan', 'encourage']"
662,wealthy foreign investors rugged pulled golden visa scheme axed government business immigration expert explains impact uk economy shmalaw goldenvisa ukeconomy immigration,"['wealthy', 'investor', 'golden', 'scheme', 'govern', 'explain', 'impact', 'economy']"
663,know visitor visa application canada 1 2 immigratetocanada canadianimmigration canadavisa canada immigration canadapr canadalife immigrationconsultant,"['canada', 'application']"
664,congrats hetvi canada dependentvisa visa 1st attempt apply us expert visa processing mseducationconsultant studentvisa studyabroad ielts immigration studyincanada visitorvisa canadaspousevisa canadaspouseopenworkpermit spousevisa,"['canada', 'apple', 'congrats', 'attempt']"
665,uk government increased study visa fees amp dependent visa fees latest changes effective today 6th april 2022 know fee structure hit link immigration coachingsquare visa,"['structure', 'govern', 'increased', 'study', 'fees', 'dependent', 'latest', 'effective', 'fee', 'hit', 'link']"
666,france president emmanuel macron admits government results immigration insufficient time claims country overwhelmed claim zero immigration neither realistic desirable,"['france', 'country', 'admits', 'govern', 'insufficient', 'claim', 'overwhelmed', 'zero', NOT 'realistic', 'desirable']"
667,people across world dream live uk work study family ukvisa immigration paperwork amp procedures needed fulfil dream read blog discover experts help,"['dream', 'live', 'work', 'study', 'family', 'paperwork', 'needed', 'fulfil', 'discover', 'help']"
668,nursing top demanded occupation world today contact us canada newzealand australia jobsincanada immigration consultantsindubai saudiarabia qatar oman uae,"['occupation', 'canada', 'australia', 'qatar', 'oman', 'demanded']"
669,latest manitoba pnp draw sent 223 new invites pr get geniune guidance call us 1 437 343 9000 immigrationcanada immigrationnews immigrationconsultant immigration unbeatable fast canadaimmigration canadaworkpermit workincanada movetocanada workpermit,"['latest', 'draw', 'invite', 'guidance', 'unbeatable', 'fast']"
670,starting 4th april europia offering free immigration advice ukrainian nationals please email advice org uk book 30 minute appointment refugee support ukraine greatermanchester,"['book', 'ukraine', 'offering', 'free', 'advice', 'orge', 'appointment', 'support']"
671,european union asking member countries shut golden visa programs pick best advice potential investor immigrationconsultant immigrationlawyer immigration goldenvisa goldenvisagreece portugalgoldenvisa tgifriday imrankhan,"['country', 'union', 'shut', 'golden', 'pick', 'best', 'advice', 'investor']"
672,end march inz started release phase 2 applications received enhanced immigration online processing issues applicants read story know iwk kiwiindians migrants immigration inz,"['release', 'phase', 'application', 'receive', 'issues', 'applicant']"
673,ukraine invasion refugees going refugees ukraine stopwar russia poland immigration humanity turkey,"['ukraine', 'russia', 'poland', 'turkey', 'invasion']"
674,dear mr president large south africans decided embark go slow effort voice unemployment immigration issues next four weeks working 4 days week 4daysfor4weeks,"['daye', 'large', 'decide', 'embark', NOT 'effort', 'unemployment', 'issues', 'work']"
675,working professional willing settle canada austrilla pr visa benifits canada prvisa welcomming 1million migrants 2024 sponsers relatives join canada information call us 91 7303872762 immigration prvisa pnp,"['canada', 'work', 'professional', 'willing', 'settle', 'relata', 'join', 'information']"
676,know call us 1800 419 3242 email inquiry com britishcolumbia canada draw immigrationmatters fridayvibes immigration travel,"['canada', 'inquiry', 'draw', 'travel']"
677,sean fraser minister immigration refugees citizenship canada announced ircc processed 147 000 pr applications first quarter 2022 archadiusglobal immigration visa canada studyabroad ielts immigrationlawyer usa studentvisa,"['canada', 'usa', 'fray', 'citizenship', 'announced', 'application']"
678,canada relaxes temporary foreign worker program rules address labour shortages apply 9315890309 7011302054 immigrationcanada immigrationnews immigrationconsultant immigration unbeatable fast canadaimmigration canadaworkpermit workincanada,"['canada', 'apple', 'relax', 'temporary', 'worker', 'shortage', 'unbeatable', 'fast']"
679,apparently people twitter think undocumented arrivals illegals refugees auspol immigration laborsboatpeople,"['apparent', 'arrival', 'illegal']"
680,blessed friday call us cavalry office 03041111553 dha office 042 37183645 6 study visa 03000882212 ielts 03000882252 highbrow immigration citizenship visa foreignvisa friday,"['cavalry', 'study', 'highbrow', 'citizenship']"
681,immigration refugees citizenship canada ircc increased immigration fees canada per schedule apply raise fee applicants applying permanentresidence applications effect april 30 visit details,"['canada', 'apple', 'citizenship', 'increased', 'fees', 'raise', 'fee', 'applicant', 'application', 'effect', 'detail']"
682,business woodlands checkpoint jb ciq complex shuttle bus service starts operations busservice custom passengers immigration,"['bus', 'service', 'woodland', 'complex', 'shuttle', 'operations', 'custom']"
683,bring loved ones canada migrate canada family fast track call us 0300 0506675 email us info net familyvisa migratetocanada canada immigration ainit,"['canada', 'loved', 'migrate', 'family', 'fast', 'info']"
684,many domains canada beginning career listed 10 demand domains canada know canadaprvisa visa canadaexpressentry movetodreamcity jobsincanada migratetocanada immigration sernexuss,"['canada', 'listed', 'demand']"
685,haitians yemen refugees america also border racists immigration reparations dozens lawmakers urge biden clear red tape ukrainian refugees independent,"['yemen', 'tapa', 'racist', 'reparation', 'doze', 'urge', 'bide', 'clear', 'independent']"
686,majority spending liberal government canada climatechange covax immigration globaldevelopmentaid sdg2030,"['canada', 'majority', 'liberal', 'govern', 'vax']"
687,immigration canada amp indocanadians happen lucky enough entry india iit radical attacker thanks amp administrators cm regrefully u 2 continue 2 deal firmly wid termites abundance,"['canada', 'india', 'hap', 'luck', 'radical', 'attacker', 'thank', 'administrator', 'continue', 'deal', 'firmly', 'wid', 'termite', 'abundance']"
688,making opportunities prove worth value people put box hustle happening right turningdreamsintoreality migratewithegress travel immigration,"['prove', 'worth', 'value', 'hustle', 'hap', 'travel']"
689,get board us register employment technology immigration law globalrecruitment workabroad jobhiring jobsabroad recuiting overseascareer overseasjobs overseasrecruitment immigrationservices internationalcompany globalcareer,"['board', 'register', 'employment', 'technology']"
690,immigration canada amp indocanadians happen lucky enough entry india iit radical attacker thanks amp robust administrators cm regrefully continue deal firmly termites abundance,"['canada', 'india', 'hap', 'luck', 'radical', 'attacker', 'thank', 'robust', 'administrator', 'continue', 'deal', 'firmly', 'termite', 'abundance']"
691,permanentresidence visaservices immigration migrationagent oshc bestmigrationservices topmigrationagent bestvisaconsultant mba gradutediploma melbournecampus universalbusinessschool,"['N', 'o', ' ', 'c', 'o', 'n', 'c', 'e', 'p', 't', 's', ' ', 'd', 'e', 't', 'e', 'c', 't', 'e', 'd']"
692,trudeau spending billions following projects programs climatechange covax immigration budget2022 continuation fiscal spending spree meet un sdg2030 originally brought forward wef amp key members american center progress,"['spending spree', 'trudeau', 'follow', 'vax', 'continue', 'fiscal', 'original', 'brought', 'key', 'progress']"
693,want go canada want know procedures contact us guide 91 8882599623 info com canadapr canada canadaimmigration immigration canadavisa expressentry,"['canada', 'guide', 'info']"
694,update budget 2022 mean canadian immigration budget 2022 contains proposals express entry tfwp application processing check eligibility immigration canada migration movetocanada canada2022,"['canada', 'update', 'proposal', 'express', 'application', 'eligibility']"
695,canada announces new immigration fees 2022 check eligibility immigration canada migration movetocanada canada2022 foreignworker workincanada canadaimmigration,"['canada', 'announces', 'fees', 'eligibility']"
696,canada announces new immigration fees 2022 visit website visit blogs canadaprvisa immigration immigrationconsultant bestprvisa esseindia bestimmigrationindelhi bestcanadaprvisa visaservices canadadream,"['canada', 'announces', 'fees']"
697,manitoba invited total 223 immigration candidates pnp draw held april 7 2022 visit canadapr visaconsultant ircc immigration iccrcmember ahmedabad pr canadaimmigration migratetocanada pnp canadaexpressentry,"['ahmedabad', 'invited', 'draw']"
698,impression need high crs score business immigration canada case speak team today visit immigration businessinvestments crs businessimmigration,"['canada', 'impression', 'high', 'score']"
699,canada announces new immigration fees 2022 visit websites visit blogs canadaprvisa immigration immigrationconsultant bestprvisa wavevisas,"['canada', 'announces', 'fees']"
700,canada increasing fees permanent residence applications april 30 visit website visit blogs canadaprvisa immigration immigrationconsultant bestprvisa orisvisas,"['canada', 'permanent residence', 'fees', 'application']"
701,canada increasing fees permanent residence applications april 30 visit website visit blogs canadainvites vovisas vovisasimmigration vovisasinvitation immigration abroadjob,"['canada', 'permanent residence', 'fees', 'application']"
702,yeah right texas insists putting migrants buses dc involve illegal coercion immigration,"['texas', 'yeah', 'insist', 'involve', 'illegal', 'coercion']"
703,receiving thank note client one best things day tenzin choden successful grant onshore skilledvisa491 thank choosing happyclient migration visaconsultant immigration australia migrationconsultant,"['australia', 'receiving', 'thank', 'best', 'successful', 'grant', 'choose']"
704,congratulations tenzin choden successful grant onshore studentvisa500 thank choosing call us today check eligibility studentvisa 61 426 488 909 visa migration immigration australia education consultant,"['australia', 'consultant', 'congratulations', 'successful', 'grant', 'thank', 'choose', 'eligibility', 'education']"
705,inshallah move towards people carry soul feel fine soon goodbyes create sadness always knows paths may cross immigration thread lifelessons,"['move', 'carry', 'soul', 'fine', 'goodbye', 'create', 'thread']"
706,top passport service providers india online passport services directory passport service providers india get information top passport services nearby indianyellowpages travel passport visa tour immigration,"['service', 'india', 'directory', 'top', 'information', 'travel']"
707,close friend moves another country write following words yes never easy box things hundreds moments good bad passed eventually move end relationships ease soul immigration,"['country', 'close friend', 'write', 'follow', 'yes', NOT 'easy', 'good', 'bad', 'eventual', 'move', NOT 'relationship', 'ease', 'soul']"
708,dear international humans move canada trap nothing good empty promises immigration canada,"['canada', 'empty promise', NOT 'ternate', 'humane', 'move', 'trap', NOT 'good']"
709,jumma mubarak hesitate ask forgiveness sin greater mercy allah nice friday greetings prayers friday ramadan fridayvibes blessed sunconsulting canada canadapr immigration,"['canada', 'hesitate', 'forgiveness', 'sin', 'mercy', 'nice', 'greetings', 'prayer']"
710,utah gop lds fucks utah gop lds gets elected maybe another path better utpol immigration lgbtq blm,"['utah', 'fucks', 'better']"
711,strikes clearly news immigration cruelty completely eludes huge proportion population,"['strike', 'clear', 'cruelty', 'elude', 'proportion', 'population']"
712,see people writing immigration status profile wld get started w immigration history wld assay never life put forefront ever ppl shld see worked hard never bragged,"['work hard', 'status', 'assay', NOT 'brag']"
713,seems linked immigration provisions weird conference committee competes act chairman judiciary cc,"['conference', 'link', 'provision', 'weird', 'committee', 'act', 'chairman', 'judiciary']"
714,us embassy egypt please interviews dv2022 dv2022winners dv2022 savediversityvisa immigration full video yt,"['egypt', 'interviews', 'full']"
715,answer 1 6 5 year contestalert quiz yaxisquiz win immigration yaxis indianmigrants migration migrateabroad overseascareer visa prvisa usa join 75,"['usa', 'answer', 'qui', 'win', 'join']"
716,former amnesty international india chief aakar patel tweeted evening stopped airport flying stopped immigration ndtv court relief amnesty india chief,"['india', 'amnesty', NOT 'ternate', 'chief', 'patel', NOT 'airport', 'flying', 'relief']"
717,stuck express entry pool long pnp might answer faster processing easier criteria expedite move canada pnp programs canadaimmigration canada immigration canadavisa studyincanada expressentry canadapr,"['pool', 'canada', 'stuck', 'express', 'answer', 'faster', 'easier', 'expedite', 'move']"
718,az take save tx transportation costs asylum immigration,"['transport', 'save', 'asylum']"
719,sf bound chicago airport immigration jam packed could learn put mobile pass faster immigration sfo best experience immigration experience uk immigration lhr nailed immigration heathrow ord,"['chicago', 'airport', 'learn', 'pass', 'faster', 'best']"
720,may seek asylum already canada meet certain requirements find help read immigration immigrationlawyer canadianimmigration,"['canada', 'seek asylum', 'requirement', 'help']"
721,employer need sponsor australian visa marn 1573884 call whatsapp 0416 965 968 email info com au sponsorvisa prvisa visa immigration,"['whatsapp', 'employer', 'sponsor', 'info']"
722,congresswomen carolyn bourdeaux amp maria elvira salazar introduce h 4 work authorization act grants automatic right work h 4 visa holders spouses h 1b h 2a h 2b h 3 visa holders h1b h4 immigration employment immigrationlaw,"['work', 'authorization', 'act', 'grants', 'spouse', 'employment']"
723,keep grocery stores open till midnight area lack employees school system going stagger schools run enough bus drivers fucking kidding bring many people asap allow immigration,"['area', 'bus', 'bus drive', 'grocery', NOT 'employees', 'stagger', 'schools', 'run', 'fucking']"
724,plan bus migrants appear border washington dc would voluntary according texas gov abbott immigration barragan,"['bus', 'washington', 'texas', 'appear', 'voluntary', 'accord']"
725,missed canada housing market bankofcanada immigration interestrate realestate,"['canada', 'missed', 'real']"
726,qatar government announced change visa arrival requirements indian iranian pakistani nationals learn immigration globalmobility hr,"['qatar', 'indiana', 'govern', 'announced', 'arrival', 'requirement', 'learn']"
727,agree 100 need immigration read matthew yglesias one billion americans case thinking bigger immigration america,"['agree', 'big']"
728,parting summer clouds mother lets go hand heart tanka poetry micropoetry poem immigration,"['moth', 'heart', 'poetry', 'poem']"
729,immigration inevitably involves error revision imagined would better worse mistake unavoidable siri hustvedt plea eros essays imagination immigration,"['inevitably', 'involve', 'error', 'revision', 'imagine', NOT 'better', 'worse', 'mistake', 'unavoidable', 'plea', 'erose', 'essay', 'imagination']"
730,canadian means value take great pride diversity history raise hand first generation canadian images courtesy sikh heritage museum canada diversity immigration canada sikh sikhheritagemonth,"['canada', 'value', 'pride', 'diversity', 'raise', 'courtesy', 'heritage', 'museum']"
731,photo day asylum seeking migrant hands child railing walk rio bravo river crossing wednesday el paso texas photooftheday photojournalism immigration immigrants elpaso texas,"['el paso', 'texas', 'asylum', 'child', 'bravo', 'immigrants']"
732,hey joe pathetic administration need get immigration control extend title42 indefinitely send illegals front lawn white house lawn capitol lawn let see handle fjb letsgobrandon,"['house', 'joey', 'pathetic', 'administration', 'control', 'extend', 'illegal', 'lawn']"
733,appears amp never heard article iv section 4 immigration history,['appear']
734,b1 share securethetribe savemasontn usa pro reparations ab3121 lineage immigration moratorium equality reparations black americans twenty first century,"['usa', 'share', 'pro', 'reparation', 'lineage', 'moratorium', 'equality', 'cent']"
735,texas gov greg abbott orders national guard begin building mass detention areas along border mexico form boat blockades rio grande concerns mass migration politics policy immigration,"['texas', 'area', 'mexico', 'guard', 'beg', 'detention', 'blockade', 'concern', 'policy']"
736,breaking last 8 refugees rumoured released notorious park hotel carlton altogether many 25 medevac detainees received visas 9 year immigration ordeal auspol,"['hotel', 'rumour', 'release', 'receive', 'ordeal']"
737,migrants dropped earlier government buses get assistance ngos taken bus station travel destinations title42 bordercrisis immigration texas,"['bus', 'texas', 'dropped', 'govern', 'assistance', 'travel']"
738,immigration practice group chair raymond lahoud recently quoted eb 5 investors magazine article uscis announces new plan address eb 5 backlog read latest news post immigration attorneys lawyer,"['chair', 'magazine', 'group', 'recent', 'quota', 'investor', 'announces', 'backlog', 'latest', 'attorney']"
739,first seemed like forced trips clarified voluntary texas paid bus rides flights migrants released federal officials likely asylum bonds immigration title42,"['texas', 'bus', 'bus ride', 'forced', 'clarify', 'voluntary', 'paid', 'flighty', 'release', 'federal', 'asylum']"
740,anyone explain government canada decides countries require visa enter canada instance ireland immigration tourism cdnpoli,"['canada', 'country', 'ireland', 'explain', 'govern', 'decide', 'require', 'enter', NOT 'stance', 'tourism']"
741,great video shares background refugees u vietnam afghanistan ukraine please share fellow history lovers teachers history ukraine teachers immigration historyteacher,"['vietnam', 'afghanistan', 'ukraine', 'great', 'shares', 'background', 'share', 'fellow', 'lovers', 'teach']"
742,energizing engage w immigration deena sharuk amp eloy gardea along w 320 people thinking asylum attorney burnout secondary trauma immigration let create transformational change legal profession needs,"['profession', 'legal profession', 'transformational change', 'energizing', 'engage', 'asylum', 'attorney', 'burnout', 'secondary', 'trauma', 'create', 'needy']"
743,icymi new realitychek explains everything know us labor market debunks claims workers scarce new immigration surge urgently needed fill gap laborshortage economy wages inflation productivity,"['explain', 'debunk', 'claim', 'scarce', 'surge', 'urgently', 'needed', 'fill', 'gap', 'economy', 'inflation', 'productivity']"
744,hear speakers like canadian immigration expert lawyer h 1b opt visa holders look canada first choice instead relying weighted lottery system,"['canada', 'hear', 'choice', 'lottery']"
745,interested learning prospective immigrants suffering lp immigration policies may read forum party cancerous country canada immigration,"['country', 'canada', 'learning', 'prospective', 'immigrants', 'suffering', 'policies', 'forum', 'party', 'cancerous']"
746,learned summit nj called silk city silk mills attacked syrians armenians turn 20th century arabamericanheritagemonth immigrants immigration america,"['city', 'learned', 'summit', 'silk', 'attacked', 'turn', 'cent', 'immigrants']"
747,participants needed online survey topic emotion used manipulate political belief via emotion politicalbelief disgust immigration onlineresearch surveys survey surveycircle,"['participant', 'needed', 'survey', 'manipulate', 'political', 'belief', 'disgust']"
748,immigrantsincorporate book collection primary stories insights supporting intersectionality immigrants journey thriving corporate workplace immigration belonging dei deib erg pre order partner via link,"['book', 'collection', 'primary', 'insight', 'supporting', 'intersectionality', 'immigrants', 'journey', 'thriving', 'corporate', 'workplace', 'belonging', 'dei', 'partner', 'link']"
749,thank supporting immigrants looking forward seeing become law pass eagle act hr3648 country caps must removed employment based green cards immigration,"['country', 'looking forward', 'thank', 'supporting', 'immigrants', 'pass', 'eagle', 'act', 'cape', 'removed', 'employment', 'green']"
750,let talk war district going hillary durhamfilings hunterbidenlaptop obama joebiden immigration kamala country hijacked corrupt people planet world knows mob honor,"['country', 'war', 'district', 'corrupt', 'planet', 'mob', 'honor']"
751,canada saw race immigration labour,['canada']
752,netherlands dutch government exempted certain ukrainian nationals work permit requirements read immigration globalmobility hr,"['netherlands', 'govern', 'work', 'permit', 'requirement']"
753,debate title42 please remember someone hispanic mean support illegal immigration,"[NOT 'bat', 'remember', 'support', 'illegal']"
754,environmentact pritipatel going open corner shop buying 2nd hand inflatable boats save royal life boat money clean kent beaches farageongbnews going pint beer talk immigration inflation rate,"['environment', 'shop', 'beer', 'inflation rate', 'inflatable', 'save', 'royal', 'money', 'clean', 'beach', 'pint']"
755,airport workers rally better pay working conditions nationwide things immigration feedly,"['airport', 'rall', 'better', 'work', 'nationwide']"
756,vote boot immigration insurrection,"['boot', 'insurrection']"
757,apply asylum united states immigration asylum asylumlawyer immigrationlawyer,"['apple', 'asylum']"
758,injustice country border states especially immigrants offered go good idea cause washington politicians need see hear feel affects idiotic immigration policy immigration,"['country', 'washington', 'injustice', 'immigrants', 'offer', 'good', 'idea', 'hear', 'affect', 'idiotic', 'policy']"
759,transport illegal immigrants delaware washington let president take care started send illegal immigration delaware c bidenbordercrisis bidenworstpresidentever kamala,"['transport', 'delaware', 'washington', 'illegal', 'immigrants', 'care']"
760,sorry think greg abbott made mistake know ask volunteers go turns publicity stunt immigration,"['made mistake', 'sorry', 'volunteer', 'stunt']"
761,day life immigrant immigration italy ellisisland immigration,"['italy', 'immigrant']"
762,brexit impact international students amp working migrants visalobby brexit uk visa immigration workpermit eu students healthcare,"['impact', NOT 'ternate', 'student', 'work', 'healthcare']"
763,gov abbott gov desantis vow send illegals c delaware article texas florida immigration,"['delaware', 'texas', 'florida', 'vow', 'illegal']"
764,caf newcanadians live discussing building presentation leadership skills career success canada caf newcanadians immigrant immigration career skills jobsearch,"['cafe', 'canada', 'leadership skill', 'live', 'discuss', 'presentation', 'success', 'immigrant', 'skill']"
765,cork man helped shape us immigration policy among ucc alumni honoured immigration immigrationnews undocumented immigrants daca,"['man', 'cork', 'help', 'shape', 'policy', 'alumni', 'immigrants', 'dacer']"
766,immigrants stay always dreamers sticker pack highlights message immigration defenddaca dreamer dreamers dreamact stickershop via,"['immigrants', 'dreamer', 'sticker', 'dreamy']"
