,text,sentic_concept
5780,v symphysis offers pr visa australia avail permanent residency australia contact symphysis com permanentresidence immigration australia expressentry workpermit pr immigratetocanada australiaimmigration australiapr visa,"['australia', 'permanent residency', 'offers']"
5781,new list draw dates announced province saskatchewan comes saskatchewan immigrant nominee program dates may 5 july 7 september 1 november 3 call us free counseling 91 9871383058 immigration prvisas immigrationconsultants pnp,"['draw', 'announced', 'immigrant', 'nominee', 'free', 'counseling']"
5782,nanny caregiver lot opportunities immigrate canada immigrationcanada immigratetocanada studypermit studyincanada workpermit businessinvestment expressentry2022 immigrationconsultant immigration abroad visaservices lima,"['canada', 'lima', 'nanny', 'caregiver', 'immigrate']"
5783,legacy us cost us change inflict voted stop illegal entry slash immigration defy voters amp taxi military age young men thousands gbnews r4today talkradio lbc bbcbreakfast gmb,"['men', 'young men', 'legacy', 'cost', 'inflict', 'voted', NOT 'illegal', 'slash', 'defy', 'taxi']"
5784,joe biden administration let 100 000 ukrainians administration brutalize black refugees deport people ukraine europeans welcome tell racism blacktwitter immigration ukraine joebiden,"['ukraine', 'joey', 'bide', 'administration', 'brutalize', 'deport', 'welcome', 'racism']"
5785,need answers visa questions contact us information partner startupvisaprogram startup immigration canada ukvisa visa entrepreneurship studentvisa business toronto immigratetocanada innovatorvisa entrepreneur,"['canada', 'toronto', 'answer', 'information', 'partner', 'startup', 'entrepreneurship', 'entrepreneur']"
5786,check information canada immigration canada immigration,"['canada', 'information']"
5787,foreign nationals got skilled worker visas uk india marks rise 14 since 2019 ukjobs unitedkingdom ukskilledworkers indianskilledworkers humancapital humanresources recruitment globalrecruitment immigration ukimmigration,"['india', 'skilled worker', 'rise', 'recruitment']"
5788,opinion greg isaacson chinese investors purchase green cards investing us real estate market aegis controversial immigration program revived lapsing last year,"['china', 'investor', 'purchase', 'green', 'real', 'controversial', 'revive', 'lapse']"
5789,genius frida kahlo portraying struggle immigrants painting 1932 balance roots strength ancestors anchor us soulless yet often necessary economic opportunities new lands immigration frida mexicana,"['genius', 'kahlo', 'portray', 'struggle', 'immigrants', 'painting', 'balance', 'strength', 'ancestor', 'anchor', 'soulless', 'land']"
5790,choose kang immigration sponsor spouse proceed ease us give call immigrationcanada immigratetocanada studypermit studyincanada workpermit businessinvestment expressentry2022 immigrationconsultant immigration abroad visaservices,"['choose', 'sponsor', 'spouse', 'proceed', 'ease', 'give']"
5791,visit information content created curated help along immigration journey canada newcanadians cdnimm immigration canada,"['canada', 'information', 'content', 'created', 'curate', 'help', 'journey']"
5792,oinp invited 471 candidates may eligible ontario express entry skilled trades stream visit website visit blogs wavevisas ontario ontarioinvites471 ontarionpnp wavevisasimmigration immigration,"['invited', 'eligible', 'express', 'skilled', 'stream']"
5793,settle uk uk unitedkingdom startup business owner invest investment immigration visaconsultants permanent resident study studyabroad permanentresidency startupvisa visa skilled proffesional applynow contactus rowerfze,"['prof', 'permanent resident', 'settle', 'startup', 'invest', 'investment', 'study', 'skilled']"
5794,oinp invited 471 candidates may eligible ontario express entry skilled trades stream visit website visit blogs orisvisas immigration ontario ontarioinvitesworker ontarionpnp orisimmigration,"['invited', 'eligible', 'express', 'skilled', 'stream']"
5795,pnp draws results march 2022 contact us whatsapp 8448582822 canada canadaimmigration immigration immigrationnews immigrationservices immigrationconsultantsdelhi immigrationconsultant,"['whatsapp', 'canada']"
5796,migrate immigration visa consulting html template bootstrap business coaching consulting corporate courses ecommerce greencard htmltemplate immigration lawyer overseasjobs responsive sitetemplates studentvisa,"['migrate', 'template', 'bootstrap', 'corporate', 'response']"
5797,canada welcomed huge number students 2021 making new immigration records contact us whatsapp 8448582822 canada canadaimmigration immigration immigrationnews immigrationservices immigrationconsultantsdelhi immigrationconsultant,"['canada', 'whatsapp', 'welcomed', 'huge', 'student', 'records']"
5798,canada immigration backlog increased 1 84 million insights contact us whatsapp 8448582822 canada canadaimmigration immigration immigrationnews immigrationservices immigrationconsultantsdelhi immigrationconsultant,"['canada', 'whatsapp', 'backlog', 'increased', 'insight']"
5799,work canada criminal record criminal record hinder plans work canada however may options overcome inadmissibility check eligibility immigration canada migration movetocanada canada2022,"['canada', 'work', 'crime', 'record', 'hinder', 'plane', 'overcome', NOT 'admissibility', 'eligibility']"
5800,ontario immigrant nominee program invited 471 candidates may eligible ontario express entry skilled trades visit website visit blogs vovisas ontario ontarioinvitation canadaprvisa immigration,"['immigrant', 'nominee', 'invited', 'eligible', 'express', 'skilled']"
5801,problems solved stay confront return build immigrate immigration development mobility international order governance government state building war,"['problem', 'solve', 'confront', 'turne', 'build', 'immigrate', 'development', NOT 'ternate', 'govern', 'war']"
5802,know dyk facts canada economic class e federal well pnp skilledworkers immigration backlog stands 231 187 people waiting decisions applications according feb 28 data shared immigration refugees citizenship canada,"['canada', 'dyke', 'federal', 'backlog', 'decision', 'application', 'accord', 'citizenship']"
5803,kang immigration proved best choice proficiently handling pr files till connect us today immigrationcanada immigratetocanada studypermit studyincanada workpermit businessinvestment expressentry2022 immigrationconsultant immigration abroad,"['best', 'choice', 'proficient', 'handling', 'connect']"
5804,bernal immigration sustainable lifeline america could least commit 25 us spends defense,"['sustainable', 'lifeline', NOT 'commit', 'spend', 'defense']"
5805,unfolding situation ukraine dominates news let forget afghan evacuees face plethora challenges us need language financial amp immigration assistance well basic necessities life welcomewithdignity,"['ukraine', 'situate', 'dominates', 'forget', 'plethora', 'challenges', 'assistance', 'basic', 'necessitie']"
5806,haitians returned country chaos human rights watch immigration stopdeportations haiti,"['country', 'haiti', 'chaos']"
5807,pathway australia admission howtogetadmission inaustralia permanentresidence visaservices immigration passport migrationservicesinmelbourne enrollnow education skillassessment acs professionalyear,"['australia', 'pathway', 'admission', 'education', 'skill']"
5808,reason cpc race jean charest immigration unity cdnpoli onpoli brampoli hq hq,"['reason', 'unity']"
5809,reach us today create express entry profile help professionals immigrationcanada immigratetocanada studypermit studyincanada workpermit businessinvestment expressentry2022 immigrationconsultant immigration abroad visaservices overseas,"['reach', 'create', 'express', 'help', 'professional']"
5810,canada incredible country choose looking get world class education perhaps take step forward career want live country known safety security canadaimmigration canada immigration canadavisa studyincanada,"['canada', 'country', 'world class', 'incredible', 'choose', 'education', 'live', 'safety', 'security']"
5811,real numbers tell us completely different wants us buy immigration operationlonestar,"['real', 'complete', 'buy']"
5812,kaminker amp associates help understand options choose best path situation hiring foreign worker click find immigration immigrationlawyertoronto canadianimmigration,"['associate', 'help', 'understand', 'choose', 'best', 'situate', 'worker', 'click']"
5813,biden approves billions defending ukraine borders refuses finish building borderwall america coverup deceptions propaganda currentevents immigration nau globalism,"['ukraine', 'bide', 'approve', 'refuse', 'coverup', 'deception', 'globalism']"
5814,experience adi nothing exceptional professional helpful affordable efficient ben k migrationagent australianvisa graduatevisa studentvisa migratetoaustralia liveinaustralia immigration immigrationconsultant australianimmigration,"[NOT 'professional', 'help', 'afford', 'efficient']"
5815,covid 19 pandemic canadian government repeatedly advised people avoid nonessential travel continue deport thousands people immigration deportation,"['covid', 'pandemic', 'govern', 'repeatedly', 'avoid', NOT 'essential', 'travel', 'continue', 'deport', 'deportation']"
5816,immigration canada fraud scams subscribe today day 3 half hours,"['canada', 'fraud', 'scam', 'subscribe']"
5817,college official regulator immigration citizenship consultants across country paid consultants must licensed college work immigration refugees citizenship canada immigration fraud cdnimm ircc,"['consultant', 'country', 'canada', 'regulator', 'citizenship', 'paid', 'work', 'fraud']"
5818,college immigration citizenship consultants officially open significant step fight immigration fraud sps canada immigration team happy help immigration pathway immigration canada immigratetocanada,"['consultant', 'canada', 'citizenship', 'significant', 'fight', 'fraud', 'happy', 'help', 'pathway']"
5819,scam fraud get message email reply scammer scammers immigration canada,"['canada', 'scam', 'fraud', 'reply', 'scammer', 'scammers']"
5820,senate passed america competes act conference committee formed ro reconcile differences house senate version write call senators include green card cap exemption stem phd immigration,"['conference', 'house', 'senate', 'act', 'committee', 'formed', 'reconcile', 'write', 'senators', 'include', 'green', 'cape', 'exemption']"
5821,access control security become increasingly important past several years sinosecu passport readers make personal data recognition quicker accurate accesscontrolsystem idreader passportreader pms vms abc immigration moneyexchange taxfree,"['access', 'control', 'security', 'important', 'recognition', 'quick', 'accurate']"
5822,uscis conducts lottery selection process h 1b fy2023 cap immigration law,"['lottery', 'selection', 'process', 'cape']"
5823,time start manufacturing north america need china help robotics electronics need go back work open doors willing help immigration solution problem strengthen america economy,"['china', 'electronics', 'help', 'work', 'doors', 'willing', 'solution', 'problem', 'strengthen', 'economy']"
5824,social civic engagement group group ipsk lets different groups connect cross culturally increases awareness benefits newcomers saskatoon learn yxe immigrationpartnership immigration,"['civic engagement', 'social', 'group', 'connect', 'culturally', 'awareness', 'benefits', 'newcomer', 'learn']"
5825,immigration big deal get assistance us today immigrationcanada immigratetocanada studypermit studyincanada workpermit businessinvestment expressentry2022 immigrationconsultant immigration abroad visaservices overseas education learning,"['deal', 'assistance', 'education', 'learning']"
5826,australia australian government expanded access subclass 186 temporary residency transition trt visa two groups visa holders details immigration globalmobility hr,"['australia', 'govern', 'expand', 'access', 'temporary', 'transition', 'detail']"
5827,tps ukraine applies united states march 1 2022 outside u family still outside u qualify tps administered date could change future guarantee ukraine immigration tps,"['ukraine', 'apple', 'family', 'qualify', 'guarantee']"
5828,federal immigration authorities announced friday stop housing detainees alabama jail history problems limit use three detention centers associated press immigration,"['alabama', 'federal', 'authority', 'announced', 'stop', 'jail', 'problem', 'limit', 'detention']"
5829,anna delvey inspiration netflix show inventing anna held immigration detention filed asylum avoid deported back germany inventinganna annadelvey annasorokin netflix immigration asylum deportation,"['germany', 'immigration detention', 'inspiration', 'invent', 'asylum', 'avoid', 'deport', 'deportation']"
5830,quick amp easy immigration case implementation immigration casemanagement lawfirms attorney software immicompliance immigrationattorneys,"['quick', 'easy', 'implementation', 'attorney']"
5831,study completed next pr option available set appointment call 02 7805 4030 0433 006 249 visitorvisa visa studentvisa immigration studyvisa australia touristvisa workpermit australiavisa studyabroad ielts,"['australia', 'study', 'complete', 'available', 'appointment']"
5832,trump trying deport melania dontdeportmelania immigration migraci n yugoslavia slovenia usa russia mexico latinos hispanos wall muro election racism massshootings nra ice whitesupremacy lockherup lockhimup,"['slovenia', 'usa', 'russia', 'mexico', 'deport', 'wall', 'racism']"
5833,dhs end temporary covid 19 policy allowing employers accept expired identity verification documents form 9 read immigration usimmigration immigrationpolicy,"['identity verification', NOT 'temporary', 'covid', 'policy', 'allowing', 'employer', 'accept', 'expired']"
5834,remember asked steny hoyer define love anybody maryland immigration chainmigration ice borderpatrol trump bipartisan daca,"['maryland', 'remember', 'defy', 'love', 'dacer']"
5835,time shore economy public safety communities enacting commonsense immigration reform significantly reduce workforce gap also estimated expand us annual gdp 20 billion,"['shore', 'economy', 'safety', 'community', 'commonsense', 'reform', 'reduce', 'workforce', 'gap', 'estimated', 'expand']"
5836,texas border initiative working says multibillion dollar operation lone star effort success evidence clear txlege operationlonestar border texas mexico gregabbott migrants immigration txgop,"['texas', 'mexico', 'multibillion dollar', 'initiative', 'work', 'operate', 'lone', 'star', 'effort', 'success', 'clear']"
5837,please share post covid vaccine required green card applicants p call us today immigraton needs represent clients worldwide 262 764 5036 immigration visa tps immigrationlawyer immigrants usa studyabroad citizenship,"['usa', 'share', 'covid', 'vaccine', 'green', 'applicant', 'needy', 'present', 'clients', 'worldwide', 'immigrants', 'citizenship']"
5838,haiku pacific shore tidal wave speaking mother tongue haiku poetry micropoetry poem immigration,"['haiku', 'pacify', 'shore', 'tide', 'moth', 'poetry', 'poem']"
5839,systems policies critical national security work immigration attract valuable talent especially stem critical 21st century goals superpower whether usa india young people power system need india immigration,"['usa', 'india', 'policies', 'critical', 'security', 'work', 'attract', 'valuable', 'talent', 'cent', 'goals', 'superpowe', 'young', 'power']"
5840,wow topic immigration invoke racist rhetoric used interesting took opportunity target haitian refugees wants send troops mexico fight cartels interesting ohiogop senate debate,"['mexico', 'racist rhetoric', 'wow', 'invoke', 'interest', 'target', 'fight', 'cartel', 'senate', NOT 'bat']"
5841,dear lord minds small spend days talking nonsense wears slaps someone else wife let get back toimportant issues immigration nationaldefense recession inflation smallbusiness,"['daye', 'lord', 'minds', NOT 'spend', 'nonsense', 'slaps', 'issues', 'recession', 'inflation']"
5842,ireland irish government announced longer accepting applications immigrant investor program russian nationals learn immigration globalmobility hr,"['ireland', 'govern', 'announced', 'longer', 'accept', 'application', 'immigrant', 'investor', 'learn']"
5843,atlantic derek thompson explains newsletter week flatlining nation population growth made interesting point immigration quoting caleb watney america bias immigr,"['population growth', 'explain', 'newsletter', 'flatline', 'nation', 'interest', 'quoting', 'caleb', 'bias', NOT 'migr']"
5844,morning panel session discusses lc loa verification system initiative aims provide letters acceptance easily authenticated immigration customs officials lcconf2022,"['panel', 'session', 'discuss', 'verification', 'initiative', 'aim', 'provide', 'letters', 'accept', 'easily', 'authenticate']"
5845,opinion open borders new vehicle slave labor country bordercrisis immigration economy inflation,"['country', 'slave', 'economy', 'inflation']"
5846,bridge faculty scholar earns prestigious dissertation award immigration immigrationnews undocumented immigrants daca,"['faculty', 'earn', 'prestigious', 'dissertation', 'award', 'immigrants', 'dacer']"
5847,doesnt anyone question immigration provisions competes act usica isnt chair senate immigration subcommitte oversees provisions cc,"['chair', 'provision', 'act', 'senate', 'subcommittee', 'oversee']"
5848,new website coming soon connect immigration experts 24 7 365 follow us stay tuned latest news updates advice immigration immigrationexperts immigrationlawyers immigrationconsultants immigrationattorneys forum immigrationnews,"['stay tuned', 'coming soon', 'connect', 'follow', 'latest', 'update', 'advice', 'forum']"
5849,contraception vs abortion men face like women easy solution countries require license child child born anyone u without must apply citizenship even parent u citizen birthcontrol immigration,"['men', 'women', 'country', 'apple', 'contraception', 'abortion', 'easy', 'solution', 'require', 'license', 'child', 'born', 'without', 'citizenship', 'citizen']"
5850,icymi friday good see bidenadministration hiring immigration judges diverse background,"['good', 'judge', 'diverse', 'background']"
5851,four year legal battle threat deportation salvadoran journalist manuel dur n wins asylum case us journalism journalist immigration asylum elsalvador pressfreedom,"['legal', 'battle', 'threat', 'deportation', 'journalist', 'wine', 'asylum']"
5852,congratulations free botd ku greatreviews esl soulful candid collection stories based educator ann smith experiences 24 yr career title 1 secondary schools texas education amp immigration topics 18 narratives,"['texas', 'congratulations', 'free', 'soulful', 'collection', 'educator', 'smith', 'secondary', 'schools', 'education']"
5853,historicalfiction ellisisland immigration unjustice womenshistorymonth msheatherwebb sourcebookskandmark incredible story told msheatherwebb historical fiction concerning corruption injustice discrimination review,"[NOT 'justice', 'incredible', 'tolde', 'historic', 'fiction', 'corruption', 'injustice', 'discriminate']"
5854,bal partner lynden melmed spoke shrm workplace policy conference lively conversation leon rodriguez christopher richardson immigration solve talent shortages visit bal conference week c love chat immigration shrm hr,"['conference', 'lively conversation', 'bal', 'partner', 'workplace', 'policy', 'solve', 'talent', 'shortage', 'love']"
5855,volume refugees fleeing war ukraine straining immigration documentation systems countries like denmark poland prompted canada send mobile biometrics kits immigration offices europe expedite applications,"['ukraine', 'country', 'denmark', 'poland', 'canada', 'volume', 'war', 'straining', 'documentation', 'prompt', 'biometrics', 'kit', 'expedite', 'application']"
5856,icymi university reliance international students turned another part immigration tool financial gain prof emeritus mohammad qadeer explains consequences could dire cdnpoli cdnpse,"['prof', 'reliance', NOT 'ternate', 'student', 'tool', 'gain', 'explain', 'consequence', 'dire']"
5857,big drop ball ukrainerussiawar immigration inflation show academyawards2022 willsmithassault incident block one awful quickly gravitate unimportant oh shutup,"['drop', 'inflation', 'incident', 'block', 'quick', 'gravitate', 'unimportant']"
5858,still waiting apology biden administration mounted police bidenharris bidenbordercrisis immigration,"['apology', 'bide', 'administration', 'mount', 'policy']"
5859,really need immigration lawyer new orleans immigration lawyers neworleansimmigrationattorneys neworleansimmigration neworleansimmigrationlawyers immigration,"['N', 'o', ' ', 'c', 'o', 'n', 'c', 'e', 'p', 't', 's', ' ', 'd', 'e', 't', 'e', 'c', 't', 'e', 'd']"
5860,getting approved provincial nominee program provides substantial boost points express entry profile find canadianimmigration immigration,"['approved', 'provincial', 'nominee', 'provides', 'boost', 'express']"
5861,myth competes act usica staples green card stem phd fact exempts stem phds qualified us institutions already working us visas eb category qualified niw numerical caps immigration,"['myth', 'act', 'staple', 'green', 'exempt', 'institution', 'work', 'numerical', 'cape']"
5862,ukraine gets temporary protected status tps 18 months tps applicants must meet eligibility requirements amp undergo security background checks ukrainecrisis ukrainerussiaconflict ukrainesupport homelandsecurity immigration,"['ukraine', 'eligibility requirement', 'temporary', 'protected', 'status', 'applicant', 'security', 'background']"
5863,tell biden power circumvent title 42 tell done everything w r immigration,"['bide', 'power', 'circumvent']"
5864,lynden melmed tiffany derentz eileen lohmann joining us shrmelcc berry appleman amp leiden llp share inside perspective biden administration business immigration priorities policy changes watch immigration,"[NOT 'rent', 'join', 'berry', 'share', 'perspective', 'bide', 'administration', 'priority', 'policy']"
5865,joe going anything defend borders title 42 expires week probably joebiden politics congress immigration kamalaharris news blog texas comicsgate,"['texas', 'joey', 'defend', 'expire']"
5866,legally tortured death eu immigration humanrights xenophobia,"['legal', 'death', 'phobia']"
5867,mexico central americans refugees economic migrants gaming asylum system bidenbordercrisis immigration,"['mexico', 'gaming', 'asylum']"
5868,arrow incredible oscars immigration,"['arrowy', 'incredible']"
5869,300 000 eu nationals stuck immigration hell,"['stuck', 'hell']"
5870,trust companies want go paperless badly want alas immigrant sans citizenship must document existence killing forests every month immigration immigrantproblems,"['trust', 'badly', 'immigrant', 'citizenship', 'killing', 'forest']"
5871,join live conversation green card options minor children thursday ishan anand neha mahajan explore different green card routes work qualifies important factors need consider immigration attorney visa greencard,"['join', 'live', 'conversation', 'green', 'explore', 'route', 'work', 'qualify', 'important', 'consider', 'attorney']"
5872,canadian government must ensure refugees matter nationality access resettlement one penalized status actions government fleeing ukraine immigration canada ukrainerefugees,"['ukraine', 'canada', 'govern', 'ensure', 'nationality', 'access', 'settlement', 'penalize', 'status']"
5873,15k yr foreign born stem phds graduate us universities congressional research service phd unemployment lt 1 1 current path green card inefficient usica competes act exempt immigration caps,"['service', 'foreign born', 'graduate', 'congressional', 'research', 'unemployment', 'green', 'inefficient', 'act', 'exempt', 'cape']"
5874,law firm management share video legal advice consult attorney attorney advertisement lawfirm management podcaster lawyer immigrationlawyer interview immigration immigrationattorney,"['legal advice', 'management', 'share', 'attorney', 'advertisement']"
5875,get tickets english accent co presenter link gala46season dance theater immigration equity,"['get ticket', 'presenter', 'link', 'dance', 'equity']"
5876,immigration legal screening clinic saturday april 2 2022 9am 2pm get access immigration attorney help determine eligibility immigration relief legal representation miamidade immigration legalsupport,"['legal representation', 'determine eligibility', 'legal', 'screening', 'clinic', 'access', 'attorney', 'help', 'relief']"
5877,panelist veronika barbakadze global speaking eb 5 amp global immigration expo miami april 7 8 register industry wide person gathering today uglobal citizenshipbyinvestment eb5 global immigration expo,"['person', 'panel', 'expo', 'register', 'industry', 'wide', 'gather']"
5878,great product great team immigration proudinvestor immigrationlawyer lawfullytracker uscis,"['product', 'great']"
5879,knowledge country made home love may country much longer cuts deep uk immigration,"['country', 'knowledge', 'home', 'love', 'longer', 'deep']"
5880,refugee 20 years could get proof eligibility work got today another happy client refugeeswelcome immigration,"['proof', 'eligibility', 'work', 'happy']"
5881,transition face move new country challenging know draw inspiration experiences people came tips help settle better cdnimm immigration canada,"['country', 'canada', 'transition', 'move', 'challenging', 'draw', 'inspiration', 'tipsy', 'help', 'settle', 'better']"
5882,questions immigration provide free info support immigration matters like citizenship sponsorship permanent residency visas permits refugee applications call us learn 587 789 0727 toll free 1 877 314 9129 lloydminster,"['permanent residency', 'provide', 'free', 'info', 'support', 'citizenship', 'sponsorship', 'permit', 'application', 'learn', 'toll']"
