,text,sentic_concept
438,new criteria guide uscis officers waive interviews conditional permanent residents filed petition remove conditions residence immigration uscis greencard cpr,"['permanent resident', 'guide', 'waive', 'interviews', 'conditional', 'petition', 'remove']"
439,canada unemployment rate hits record low frenetic labour market persists via booming held back labour shortages immigration welcomerefugees critical,"['canada', 'held back', 'unemployment', 'rate', 'hit', 'record', NOT 'frenetic', 'persist', 'shortage', 'critical']"
440,canada invest 2 1 billion fix maintain immigration system,"['canada', 'invest', 'fix', 'maintain']"
441,wanna explore opportunities immigrate canada need consultation immigration specialists enquire iccimmigration regarding case today whatsapp us 1 647 572 5842 jobincanada canada liveincanada immigration workpermit canadavisa,"['canada', 'whatsapp', 'explore', 'immigrate', 'specialist', 'enquire', 'regard']"
442,look garbage migrants leave along river border immigration,['garbage']
443,search law firms iowa divorce personalinjury wills realestate dui immigration commerciallaw iowalawyer iowaattorney,"['iowa', 'search', 'divorce', 'real']"
444,live kicking strong daniel mandelbaum canadian immigration lawyer starting us chat immigration expertise benefits canadian pathways versus us immigration system join,"['live', 'kick', 'strong', 'expertise', 'benefits', 'pathway', 'join']"
445,texas governor tx says undocumented immigrants arriving tx bussed dropped u capitol building c breaking texas immigration dc,"['texas', 'govern', 'immigrants', 'arriving', 'busy', 'dropped']"
446,share securethetribe european usa immigrants 1880 1924 youss better pro reparations acknowledgment redress closure ab3121 american negro freedmen descendants chattel enslavement immigration moratorium yous democrat republican ancestors vote,"['usa', 'share', 'immigrants', 'better', 'pro', 'reparation', 'acknowledgment', 'redress', 'closure', 'negro', 'chattel', 'enslavement', 'moratorium', 'publican', 'ancestor']"
447,pandemic aid bill stalls amid dispute immigration restrictions badmuslaw immigration immigrationlaw,"['pandemic', 'aid', 'stall', 'amid', 'dispute', 'restrictions']"
448,received new funding help clients pay immigration fees includes filing fees work permits daca recipients citizenship filing fees information contact immigration team 510 768 3100 immigration hopeliveshere,"['receive', 'funding', 'help', 'clients', 'fees', 'include', 'work', 'permit', 'dacer', 'recipient', 'citizenship', 'information']"
449,q need u visa connecting flight u find usflight cvisa ustravel travel immigration immigrationattorney immigrationblog immigrationlawyer immigrationfirm internationaltravel legalservices,"['connect', 'travel']"
450,video answer question issuance form 20 share video i20 studentvisa uscis greencard immigrationnews immigrationlawyer immigrationattorney jqklawfirm johnkhosravi immigration usimmigration,"['answer', 'issuance', 'share']"
451,sam lesante show u congressman pa 9th district dan meuser discusses taxes energy war ukraine illegal immigration ukraine war taxes energy gasprices immigration,"['ukraine', 'congressman', 'district', 'discuss', 'taxes', 'energy', 'war', 'illegal']"
452,ukrainian refugees cross us mexico border immigration advocates question attempt give priority,"['mexico', 'attempt', 'give', 'priority']"
453,immigration updates australia china malaysia new zealand south korea immigration covid,"['new zealand', 'south korea', 'australia', 'china', 'malaysia', 'update', 'covid']"
454,marine lepen made decision normalise soften language programme hardly changed fundamentals immigration national identity chosen use different vocabulary justify argues prof,"['prof', 'marine', 'decision', 'normal', 'soften', 'hard', 'fundament', 'identity', 'vocabulary', 'justify', 'argues']"
455,hamptonu share sandrabland securethetribe savemasontn ab3121 usa pro reparations amp immigration moratorium marchmadness denzel washington color culture oscars fba negro freedmen women men emmetttill georgefloyd jimcrow,"['usa', 'washington', 'women', 'men', 'share', 'pro', 'reparation', 'moratorium', 'color', 'culture', 'negro']"
456,boogie share sandrabland securethetribe savemasontn ab3121 usa pro reparations amp immigration moratorium marchmadness denzel washington color culture oscars fba negro freedmen women men emmetttill georgefloyd jimcrow,"['usa', 'washington', 'women', 'men', 'boogie', 'share', 'pro', 'reparation', 'moratorium', 'color', 'culture', 'negro']"
457,settlement announces settlement sanantonio lawsuit alleged violations texas anti sanctuary city law read settlement sb4 immigration,"['texas', 'city', 'alleged violation', 'settlement', 'announces', 'lawsuit', NOT 'sanctuary']"
458,watch highlights hearing pandemic era migrant expulsion policy immigration hearing news title42 border lawmakers,"['pandemic', 'expulsion', 'policy']"
459,love helping immigrants realize goals 910 484 3245 abodadadahlia guy immigration immigrant ilike guy teddyriley familylawyernc,"['guy', 'love', 'help', 'immigrants', 'realize', 'goals', 'immigrant']"
460,charmed life damascus becoming refugee syrian civil war story lift heart amp spirit reminding us take granted freedom listen rbc podcast immigration entrepeneur syria,"['damascus', 'syria', 'charmed', 'civil', 'war', 'lift', 'heart', 'spirit', 'remind', 'freedom']"
461,spr style release fixes immigration,"['release', 'fix']"
462,tpp guest says every industry looking hire streamlining legal immigration would help problem thoughts let us know guest insights subscribe newsletter,"['industry', 'streamline', 'legal', 'help', 'problem', 'insight', 'subscribe', 'newsletter']"
463,conspiracy theories distorted narration affect way think walk life comes immigration migration effective tune minds migration immigration refugee asylum,"['conspiracy', 'distort', 'affect', 'effective', 'tune', 'minds', 'asylum']"
464,search law firms rhode island divorce personalinjury wills realestate dui immigration commerciallaw rhode islandlawyer rhode islandattorney,"['rhode island', 'search', 'divorce', 'real']"
465,anyone know resource teaches primarycare providers correctly fill form n 648 document medical exemption written test immigration process diaz,"['resource', 'correct', 'fill', 'medical', 'exemption', 'test', 'process']"
466,expo day two kicked informative eb 5 legislative status panel jeff campion dan healy robert divine tom rosenfeld ed beshara eb5 global immigration expo eb5visa miami,"['expo', 'kick', 'informative', 'legislative', 'status', 'panel', 'heere', 'divine']"
467,immigration greatreset illegal johnsonout74 torytraitors torycorruption 20k afghans 15k afghans ffs cope b torycriminalsunfittogovern toryscum,"['illegal', 'cope']"
468,h1b denied learn global talent stream panel immigration experts tune today 10 pt 1 pm est exclusive live stream q amp hosted live within hour h1blottery uscis optvisa,"['live stream', 'denied', 'learn', 'talent', 'stream', 'panel', 'tune', 'exclusive', 'hosted', 'live', 'within']"
469,10 billion covid19 funding bill worked senate leadership faced roadblock due gop objections immigration provision republicans demanding vote amendment would reverse president biden title42 decision,"['covid', 'funding', 'work', 'senate', 'leadership', 'roadblock', 'objection', 'provision', 'demanding', 'amendment', 'reverse', 'bide', 'decision']"
470,immigrants looking forward seeing become law pass eagle act hr3648 country caps must removed employment based green cards immigration,"['country', 'looking forward', 'immigrants', 'pass', 'eagle', 'act', 'cape', 'removed', 'employment', 'green']"
471,home office says client integrated society explore follow amazing spring viral worldwar3 russiainvadesukraine ukimmigrationnews trending immigrationupdate immigrationnews immigrationchanges uk immigration uksettlement ilr ukvisa,"['home', 'integrated', 'explore', 'follow', 'amaze', 'spring', 'trending']"
472,interested newest research related topics like immigration trade frictions join us person via zoom 11th annual washington area international trade symposium register econtwitter,"['person', 'zoom', 'washington', 'area', 'symposium', 'newest', 'research', 'trade', 'friction', 'join', NOT 'ternate', 'register']"
473,want know covid 19 affects immigration policies worker mobility updated regularly ey global immigration tracker help stay informed issues learn eycanada mobility immigration,"['covid', 'affect', 'policies', 'worker', 'updated', 'help', 'informed', 'issues', 'learn']"
474,find obtain non immigrant visa call iaco 973 472 4648 inmigracion ciudadania iaco passaicnj immigration citizenship newjersey nuevajersey nonprofitorganization community,"[NOT 'immigrant visa', 'obtain', 'citizenship', 'community']"
475,ukrainian refugees come uk full free access nhs healthcare includes free gp nurse consultations well access hospital services urgent care centres info ukraine immigration nhs law,"['ukraine', 'urgent care', 'free', 'access', 'healthcare', 'include', 'hospital', 'info']"
476,april free immigration clinic 4 22 call 202 787 5311 4 15 10 2 pm schedule consult 22nd appointments limited info informaci n disponible en espa ol link clinic partner piper,"['free', 'clinic', 'appointments', NOT 'info', 'espy', 'link', 'partner']"
477,want make sure immigration case handled care expertise deserves contact us today set consultation law lawfirm rotellaandhernandez immigration,"['sure', 'care', 'expertise']"
478,exactly proposed great minds think alike immigration nc11,"['exact', 'minds']"
479,justin burton attorney dedicated practice immigration amp nationality law regularly practices law u citizenship amp immigration services learn immigration attorney,"['attorney', 'dedicated', 'nationality', 'citizenship', 'learn']"
480,share securethetribe savemasontn immigrants immigration eligible apply nearly jobs e jobs legitimately restricted usa citizens remain country permanently even unemployed music oscars nba,"['apple', 'usa', 'country', 'music', 'share', 'immigrants', 'eligible', 'job', 'legitimately', 'restricted', 'remain', 'permanently', 'unemployed']"
481,friday fuck laurenboebertissodumb congress someone explain degree required represent american interests ged cover law civics immigration worldhistory ect seriously gtfoh,"['fuck', 'explain', 'degree', 'present', 'interest', 'cover', 'civic']"
482,immigration labor america fails repopulate start bringing immigrants job immigration special kind dumb need daughters raise family 27 kids,"['fail', 'repopulate', 'bringing', 'immigrants', 'job', 'special', 'dumb', 'daughter', 'raise', 'family']"
483,open 7 days week immigraton needs 9 00 6 p cst call us right schedule consultation 262 764 5036 p represent clients 50 states amp worldwide immigration visa studyabroad immigrationlawyer,"['daye', 'needy', 'present', 'clients', 'worldwide']"
484,love uk positive comments please twitter see fragile negative ones immigration india uk verma bilimoria,"['india', 'love', 'positive', 'comment', 'fragile', 'negative']"
485,jurassic quest dinosaur exhibit stops calgary weekend full article canadanews immigration immigrationnews cdnimm narcitycanada blogto dailyhive jurassicquest dinosaur calgary canada toronto vancouver cisnews,"['calgary', 'canada', 'toronto', 'vancouver', 'jurassic', 'quest', 'dinosaur', 'exhibit', 'stop', 'weekend', 'full']"
486,growing political influence puerto ricans florida supportive immigration immigration,"['florida', 'growing', 'political', 'influence', 'supportive']"
487,trump effect immigration waning surge foreign workers help tame inflation immigration,"['effect', 'surge', 'help', 'tame', 'inflation']"
488,everyone read immigration truth gopliesabouteverything,['truth']
489,senators restart bipartisan immigration reform talks immigration,"['senators', 'reform', 'talky']"
490,immigration leader minihane honored immigration,"['leader', 'honored']"
491,texas send buses undocumented immigrants us capital willing go gov greg abbott says immigration,"['texas', 'immigrants', 'capital', 'willing']"
492,curious know potential client would prefer would mind sharing thoughts us arborwayimmigration canada immigrant immigration immigratetocanada studyincanada workincanada foreignnational,"['canada', 'curious', 'potential', NOT 'prefer', NOT 'mind', 'immigrant']"
493,tips choosing immigration lawyer immigration casemanagement lawfirms software immicompliance immigrationattorneys,"['tipsy', 'choose']"
494,go home go back lt excellent post immigrant germany relate gt germany immigration,"['germany', 'go home', 'excellent', 'immigrant', 'relate']"
495,1 5 mil asylum cases pending us creating significant backlog immigration process org,"['asylum', 'pending', 'creating', 'backlog', 'process', 'orge']"
496,disparities black people experience literally cause death result racism become institutionalized health education employment housing mentalhealth environmental legal criminaljustice immigration deportation prison leadership community,"['disparity', 'death', 'result', 'racism', 'health', 'education', 'employment', 'environmental', 'legal', 'deportation', 'prison', 'leadership', 'community']"
497,amazing time last week ailatx el paso dai chiang pleasure meeting current connecting new partners discuss joorney makes business immigration easier businessplans rfe support market research services,"['el paso', 'amaze', 'pleasure', 'connect', 'partner', 'discuss', 'easier', 'support', 'research']"
498,bordercrisis due bidenadministration members relatives crossing border free afterall beg trump save buck pay abuelita roof repairs another territory state closethedoor closetheborder collect immigration fees,"['relata', 'free', 'beg', 'save', 'bucky', 'roof', 'repair', 'collect', 'fees']"
499,pleased client afghanistan granted status uk legal assistance contact aschfords law today 0203 002 9147 075 8293 2830 settleinuk aschfordslaw immigration london harrow northharrow,"['afghanistan', 'london', 'pleased', 'status', 'legal', 'assistance']"
500,border mayor sounds alarm coming 23rd may even describable immigration title42 biden immigrants amnesty biden votes electionfraud trump2024 hunterbidenlaptop democratsaredestroyingamerica bordercrisis,"['alarm', 'describable', 'bide', 'immigrants', 'amnesty']"
501,changes may 2023 keep informed sisepuede daca immigration immigrationlaw immigrants immigrant,"['informed', 'dacer', 'immigrants', 'immigrant']"
502,infopass emergency advance parole approved would let travel internationally however length trip approval always depend officer helping goodluck sisepuede daca immigration immigrationlaw immigrants humanitarian immigrant,"[NOT 'fop', 'emergency', 'advance', 'parole', 'approved', 'travel', 'trip', 'approval', 'officer', 'help', 'dacer', 'immigrants', 'immigrant']"
503,immigrantsareessential help usa every facet immigrationmatters sisepuede daca funfact immigration immigrant immigrants information,"['usa', 'help', 'facet', 'dacer', 'immigrant', 'immigrants', 'information']"
504,share securethetribe savemasontn usa pro reparations ab3121 lineage immigration moratorium back hiring line,"['usa', 'share', 'pro', 'reparation', 'lineage', 'moratorium']"
505,immigrants play crucial role united states food supply chain source sharmacrawfordattys immigration usfoodsupplychain immigrantsareimportant immigrationattorney,"['food', 'food supply', 'immigrants', 'play', 'crucial', 'chain']"
506,check list full details employers debarred released dol month apr 2022 source official website us dol h1b h1bvisa h1bviolation immigration departmentoflabor h1bdebarred,"['detail', 'employer', NOT 'barred', 'release']"
507,however dataviz also shows public narratives amp attempts france control immigration matched public opinion positive towards immigration since 2018 w frenchelection,"['france', 'showy', 'attempt', 'control', 'positive']"
508,still going get finish line november inflation bordercrisis hunterbidenslaptop gasprices immigration,['inflation']
509,interested receiving updates services consider signing houston nonprofit immigration immigrantsurvivors,"['houston', 'receiving', 'update', 'consider', NOT 'profit']"
510,non immigrants accompanied spouses unmarried minor children inmigracion ciudadania iaco passaicnj immigration citizenship newjersey nuevajersey goals nonprofitorganization community,"[NOT 'immigrants', 'accompany', 'spouse', 'citizenship', 'goals', 'community']"
511,operationlonestar definition militarization amp wasteful government spending impact using war language discussing migrants invasion surge border shame gov abbott title42 immigration,"['definition', 'wasteful', 'govern', 'impact', 'war', 'discuss', 'invasion', 'surge', 'shame']"
512,share securethetribe savemasontn usa pro ab3121 california reparations lineage exclusive immigration moratorium blackhistory oscars nfl nba mlb mls nhl countrymusic rnb hiphopmusic bluegrass marchmadness blackstars dnc gop made usa,"['usa', 'california', 'share', 'pro', 'reparation', 'lineage', 'exclusive', 'moratorium']"
513,action share securethetribe savemasontn usa pro ab3121 california reparations lineage exclusive immigration moratorium blackhistory oscars nfl nba mlb mls nhl countrymusic rnb hiphopmusic bluegrass marchmadness blackstars dnc gop made usa,"['usa', 'california', 'share', 'pro', 'reparation', 'lineage', 'exclusive', 'moratorium']"
514,rep posey florida ag moody unveil bill allow states demand enforcement federal immigration law immigration immigrationnews undocumented immigrants daca,"['florida', 'pose', 'moody', 'unveil', 'demand', 'enforcement', 'federal', 'immigrants', 'dacer']"
515,ever tiktok dying immigration law advice check facebook law immigrationlaw followfriday twitter,['advice']
516,immigrate usa india chapter 1 howexpert immigrate usa india visit howexpert youtube channel howexpert immigratetousa immigration immigrate immigrationtips immigratefromindia,"['usa', 'india', 'immigrate']"
517,important updates indians canada follow zsr immigration stay updated immigration immigrationcanada immigrationlawyer immigratetocanada immigrationconsultant zsrimmigration,"['indiana', 'canada', 'important', 'update', 'follow', 'updated']"
518,good quick read public health guidelines basis immigration policy endtitle42 right move,"['good', 'quick', 'health', 'guideline', 'policy', 'move']"
519,immigration team meeting reboot phoenix,"['phoenix', 'reboot']"
520,need immigration attorney ukrainian refugee son every non profit reached says helping leads ukraine refugee asylum immigration unitedstates,"['ukraine', 'attorney', NOT 'profit', 'reached', 'help', 'leads', 'asylum']"
521,know luxembourg 47 3 switzerland 29 7 canada 21 sweden 19 5 highest percentage foreign born population amongst developed countries u 13 6 immigrants immigration,"['luxembourg', 'switzerland', 'canada', 'sweden', 'country', 'foreign born', 'highest', 'percentage', 'population', 'immigrants']"
522,1 rep small portion colorado 2 border colorado 3 intelligent clue issue going 50 years 4 ged cover immigration 5 invasion 6 laurenboebertissodumb,"['portion', 'colorado', 'small', 'intelligent', 'clue', 'issue', 'cover', 'invasion']"
523,gives insight federalgovernment particular departmentofhomelandsecurity misinformed true cost americans immigration,"['insight', 'particular', 'misinform', 'cost']"
524,thank guest speakers joining us caf new canadians last evening sharing valuable advice ways newcomers develop presentation leadership skills find success canada caf newcanadians immigration career job,"['cafe', 'canada', 'leadership skill', 'thank', 'join', 'valuable', 'advice', 'newcomer', 'develop', 'presentation', 'success', 'job']"
525,unbelievable border patrol expecting 18 000 illegal crossings everyday immigrants waited patiently mths request entry us going storm amp cross illegally idiotic happy teach u abt borders immigration,"['unbelievable', 'patrol', 'expect', 'illegal', 'immigrants', 'patiently', 'request', 'storm', 'illegally', 'idiotic', 'happy', 'teach']"
526,budget 2022 focuses removing barriers well paid work hr humanresources federalbudget budget2022 recruitment hiring immigration trades,"['well paid', 'remove', 'barrier', 'work', 'recruitment']"
527,cbp pace apprehend 155 000 cubans current fiscal year cuba immigration,"['cuba', 'pace', 'apprehend', 'fiscal']"
528,check morning must read immigration news,"['N', 'o', ' ', 'c', 'o', 'n', 'c', 'e', 'p', 't', 's', ' ', 'd', 'e', 't', 'e', 'c', 't', 'e', 'd']"
529,review u immigration policies initiatives first year bidenadministration recent pli chronicle article authored austin fragomen jr howard w gordon read,"['austin', 'policies', 'initiative', 'recent', 'ply']"
530,action share securethetribe savemasontn usa pro ab3121 reparations usa negro lineage women men children amp immigration moratorium law vote nigeria 2nd highest rate paternity fraud world jamaica panafrican oscars,"['usa', 'women', 'men', 'nigeria', 'jamaica', 'share', 'pro', 'reparation', 'negro', 'lineage', 'moratorium', 'highest', 'rate', 'paternity', 'fraud']"
531,share securethetribe savemasontn usa pro ab3121 reparations usa negro lineage women men children amp immigration moratorium law vote nigeria 2nd highest rate paternity fraud world jamaica panafrican oscars,"['usa', 'women', 'men', 'nigeria', 'jamaica', 'share', 'pro', 'reparation', 'negro', 'lineage', 'moratorium', 'highest', 'rate', 'paternity', 'fraud']"
532,french presidential elections april 8 second round macron vs marinelepen presidentielle2022 nato eu riczemmour jeanlucm lenchon russianukrainianwar immigration muslims,['frenchy']
533,needs make sure dreams come true contact us 312 233 1000 immigration,"['needy', 'sure', 'dreams', 'true']"
534,share securethetribe savemasontn usa pro ab3121 reparations immigration moratorium nigeria 2nd highest rate paternity fraud world jamaica panafrican,"['usa', 'nigeria', 'jamaica', 'share', 'pro', 'reparation', 'moratorium', 'highest', 'rate', 'paternity', 'fraud']"
535,action share securethetribe savemasontn usa pro reparations ab3121 lineage immigration moratorium whip krackers aka troglodytes classified usa census white oscars marchmadness2022 multiverseofmadness moonknight justiceketanjibrownjackson,"['usa', 'share', 'pro', 'reparation', 'lineage', 'moratorium', 'whip', 'classify']"
536,finegael continues import violent rapists murders criminals ireland irish women live terror enough liberal virtue signaling bullshit start enforcing laws legislation policing immigration,"['ireland', 'women', 'continue', 'import', 'violent', 'rapists', 'murder', 'crime', 'live', 'terror', 'liberal', 'virtue', 'bullshit', 'laws', 'legislation', 'policy']"
537,key question costs soar much longer texas afford keep border surge troopers soldiers explore txlege immigration migrants gregabbott border campaign2022 texas,"['texas', 'key', 'soar', 'longer', 'afford', 'surge', 'troopers', 'soldiery', 'explore']"
538,immigration dude totally triggered would hate run border gawd,"[NOT 'hate', 'run']"
539,study schengen countries study europe europe study visa schengen visa crown immigration 919780563753 91 9599334053 delhi cics com cicsgroups com schengen studyingermany social visa immigration consultant,"['country', 'delhi', 'consultant', 'study', 'crown', 'social']"
540,share securethetribe savemasontn usa pro reparations ab3121 lineage immigration moratorium equality reparations black americans 21st century texas california nfl nba atl philly oscars ketanjibrownjackson,"['usa', 'texas', 'california', 'share', 'pro', 'reparation', 'lineage', 'moratorium', 'equality', 'cent']"
541,frenchelection looming anti immigration rhetoric rising public attitudes positive since surveys began 2002 explore latest analysis public attitudes migrants amp refugees available french,"['rhetoric', 'rising', 'positive', 'survey', 'explore', 'latest', 'analysis', 'available', 'frenchy']"
542,moving u one man job join community zolve connect give receive useful suggestions warnings others boat fresh livingabroad studentabroad usa awayfromhome workingabroad immigration immigrants,"['man', 'usa', 'moving', 'job', 'join', 'community', 'connect', 'give', 'receive', 'useful', 'suggestion', 'warning', 'fresh', 'immigrants']"
543,immigrating canada soon involve automated machine assisted processing collection use biometric information ai machinelearning privacy immigration refugeeswelcome,"['canada', 'machine', 'biometric information', 'immigrate', 'involve', 'assisted', 'collection', 'privacy']"
544,australia student training visas australia immigration studentvisa consultant hofmigration hof,"['australia', 'consultant', 'student', 'training']"
545,uscis announces efforts increase efficiency reduce burdens immigration,"['announces', 'increase', 'efficiency', 'reduce', 'burden']"
546,canada travel professional regulations travelling workfromhome startups employment india working immigration experience vacancy covid19 increase pandemic fees,"['canada', 'india', 'travel', 'professional', 'startup', 'employment', 'work', 'vacancy', 'covid', 'increase', 'pandemic', 'fees']"
547,unitedstates businessowners talent opening usa immigration travel india covid19 company business coronavirus pandemic legal spring regional,"['usa', 'india', 'talent', 'opening', 'travel', 'covid', 'coronavirus', 'pandemic', 'legal', 'spring']"
548,bc pnp tech pilot initiative bc provincial nominee program bc pnp support tech sector recruiting top international talent book appointment jaspal gill know visit us bcpnp pnp canada immigration,"['tech', 'book', 'canada', 'initiative', 'provincial', 'nominee', 'support', 'sector', 'top', NOT 'ternate', 'talent', 'appointment']"
