,text,sentic_polarity
2462,2022 world best cities live global finance selects world best cities live based 8 metrics including pandemic response world city visa bestcities travelling pune mumbai delhi india tourism trending blog tourist april,POSITIVE
2463,power failure affected personal business life nigerian would take 10m stay get visa country choice japa let hear remember like comment share maguire lagosswindlers,POSITIVE
2464,visa launched visa creator program one year product strategy mentorship program creative entrepreneurs arts music fashion film creator program aims educate global cohort digital creators blockchain tech nft commerce visa nft,POSITIVE
2465,moroccan israeli diplomats officials travel countries without visa israel ambassador morocco david govrin announced thursday,POSITIVE
2466,fun fact im sure value transactions 10x bigger visa,POSITIVE
2467,avail 40 scrumptious food mouthful using abl visa premium platinum gold cards offer valid lahore till 11th aug 2022 amp cs apply details please visit,POSITIVE
2468,day 21 still visa family sponsoring nationaldisgrace visa standwithukraine nocompassion,POSITIVE
2469,uae starting tomorrow april 11 uae residents emirates id serve residency document replaces residency visa stickers stamped passports emiratesid residency visa uae dubai dxb,NEGATIVE
2470,diesel amp adblue pumps open 24 7 2 minutes m1 jct23 m1 diesel adblue 24hours fuel hgv hgvfuel visa fuelcards debitcards fuelpump keyfuels ukfuels morganfuels fredsherwoodgroup shepshed derv bus lorry van eastmidlands dieselfuel,NEGATIVE
2471,birla g visa amp immigration wishes happy ram navmi call us 91 95048 95448 91 98885 57489 visit email birlagstudyvisa com ramnavmi happyramnavami unitedkingdom visa studyincanada studyvisa ielts happynavratri,POSITIVE
2472,complete government transactions easily standardized service charges quality assured services quicker processing expert staff queries 971 4 258 8800 amer quickplus visa visaconsultant visaservice visitdubai visituae uae,POSITIVE
2473,germany perfect place visit anyone mater like germany country germany travel tourism visa visitgermany schengen,POSITIVE
2474,ok boris get grip issuing visas ukrainians wanting come uk visa,POSITIVE
2475,stated 10 mps generously offered homes ukrainians 2 mps received guests due failing visa application system please lobby change situation families unable come half family acquired visa uk favours,POSITIVE
2476,brits facing visa delays caused ongoing strike spanish embassy staff uk daily newsly saturdaymorning easter,NEGATIVE
2477,gold visa like bitcoin ethereum eth fairly valued btc still highly undervalued peter thiel,POSITIVE
2478,exactly step 1 release refugees detention step 2 abolish nasty bridging visas understand labor policy auspol visa,NEGATIVE
2479,brother sholto christ shares news china sanctions podernfamily jesus endtimes news breakingnews breaking china visa russia chinarussia us internationalaw beijing,POSITIVE
2480,despicable oaf borisjohnson lied repeatedly clearly obstruction ukraine visa process always promising improvements never materialise contemptible liars respect politics tories,NEGATIVE
2481,visa cost 2 ethereum cost like 75 2 transaction,NEGATIVE
2482,f aghdam destroyed savage enemy turned ruin called ghost town back rebuild aghdam turn smart city see new aghdam azerbaijan evisa visa asanvisa karab,NEGATIVE
2483,would appreciate considered help extend visa italy frankly getting penalized die fault thank understanding italy visa loveitaly,POSITIVE
2484,ethereum processed 4 5x times transactions visa 2021,NEUTRAL
2485,aghdam destroyed savage enemy turned ruin called ghost town back rebuild aghdam turn smart city see new aghdam azerbaijan evisa visa asanvisa karabakhisazerbaijan travel traveling aghdam smartcity,POSITIVE
2486,matter long take always looking forward seeing happy tourists azerbaijan everything gets back normal visit azerbaijan via asan visa evisa asanvisa egov baku travel azerbaijan tourists,POSITIVE
2487,get e visa azerbaijan simple three steps application payment download evisa visa asanvisa azerbaijan baku evisaazerbaijan visaazerbaijan ilovetravel naturelovers travelclub innovation tech technologynews tourism,POSITIVE
2488,sometimes things seem complicated actually quite simple find visa procedures difficult case azerbaijan get e visa 3 simple steps application payment download azerbaijan baku visa evisa tourist technology,POSITIVE
2489,time valuable official e visa portal azerbaijan get e visa within 3 hours let time slip away hands save time via e visa azerbaijan visa baku asanvisa evisa travel enjoy time,POSITIVE
2490,asan visa proudly received 1 7 mln applications since launch january 10 2017 never visited azerbaijan yet still late apply e visa evisa visa asanvisa azerbaijan baku travel trip tourist holiday vacation kuwait touristvisa,POSITIVE
2491,applying e visa azerbaijan please make sure scan travel document uploaded jpg format exceed 1 mb size asanvisa evisa baku azerbaijan innovation visa electronic travel passport artificialintelligence machinelearning,POSITIVE
2492,planning apply e visa azerbaijan please make sure upload scan travel document appropriate manner evisa visa asanvisa azerbaijan baku evisaazerbaijan visaazerbaijan tourism visiting passport travel rules airport azerbaijan,POSITIVE
2493,applying e visa azerbaijan please enter name surname stated large mrz section machine readable zone evisa visa asanvisa azerbaijan baku evisaazerbaijan visaazerbaijan travelingram discover explore travelgram innovation bigdata,POSITIVE
2494,enrich travel portfolio azerbaijan getting urgent e visa azerbaijan 3 hours evisa visa asanvisa azerbaijan baku evisaazerbaijan visaazerbaijan ilovetravel naturelovers travelclub,POSITIVE
2495,azerbaijanis love drinking tea especially pear shaped glasses called armudu hurry enjoy traditional tea drinking culture fascinating azerbaijan applying e visa evisa visa asanvisa azerbaijan baku evisaazerbaijan visaazerbaijan teaceremony,POSITIVE
2496,official e visa page azerbaijan get e visa primary source evisa visa asanvisa azerbaijan baku evisaazerbaijan visaazerbaijan traveler traveling trip,POSITIVE
2497,baku ideal city love shopping top shopping destinations waiting arrival apply e visa visit enjoy evisa visa asanvisa azerbaijan baku evisaazerbaijan visaazerbaijan tourist worldcaptures sunny shopping mall shoppingmall,POSITIVE
2498,planning visit azerbaijan check e visa eligibility first click get list eligible countries e visa azerbaijan evisa visa asanvisa azerbaijan baku evisaazerbaijan ilovetravel naturelovers travelclub,POSITIVE
2499,official facebook page asan visa winner best page social networks award 128 nominees 13 nominations netty 2019 national internet award contest netty2019 nettyawards evisa asan visa baku winner award awards,POSITIVE
2500,beach season begun apply e visa make summer vacation unforgettable baku located coast caspian sea evisa visa asanvisa azerbaijan baku evisaazerbaijan tourist sunny sea seasideresort resort beach sun sand caspiansea,POSITIVE
2501,stunning goygol goygol natural impounded lake azerbaijan located far ganja apply e visa discover beauties azerbaijan evisa visa asanvisa azerbaijan evisaazerbaijan ilovetravel aroundtheworld europe ganja goygol lake,NEGATIVE
2502,mandatory print e visa simply presented smartphone screen together passport border checkpoint republic azerbaijan evisa visa asanvisa azerbaijan baku evisaazerbaijan visaazerbaijan passportlife,POSITIVE
2503,fight grand final baku 1 4 final matches starting today tag top favorite clubs round uefa europaleague asanvisa final champions arsenal chelsea valencia napoli benfica villareal slaviapraha eintrachtfrankfurt evisa visa,NEGATIVE
2504,must enter data child children registered passport required information e visa application azerbaijan evisa visa asanvisa azerbaijan baku evisaazerbaijan visaazerbaijan travelingram discover explore child children,POSITIVE
2505,group applications may created maximum 10 applicants obtain e visa azerbaijan 3 simple steps evisa visa asanvisa azerbaijan baku evisaazerbaijan visaazerbaijan traveler traveling trip travelingram discover explore,POSITIVE
2506,lahij first list places need go located ismayilli region azerbaijan intermountain basin southern slope greater caucasus lahij village attracts preserved historical appearance evisa visa asanvisa,POSITIVE
2507,matic polygon defi playtoearn visa nftgiveaway,POSITIVE
2508,whats better visa card need start living vip crypto life,POSITIVE
2509,cass government pauses one report inert partygate huaiwai rishisunak visa ukraineunderattack torycorruption refugeesneedhelp,POSITIVE
2510,blessed palm sunday us palmsunday2022 blessed nature travels airticketing visa passport,POSITIVE
2511,graphs misleading mean eth value visa company hugely valuable ethereum blockchain difference everybody buy eth tokens everybody buy visa stock,POSITIVE
2512,use fi nite code cafxkrz3dg copy code earn cash worth min 200 amp max 500 download fi fimoney neobank cashback offers offer gift loot giveaways giveawayalert giveaway federalbank bank bankoffer visacard visa,POSITIVE
2513,views binance visa card order free wait last moment know getting larger think crypto industry luxurylifestyles,NEGATIVE
2514,bitcoin bigger nvidia meta visa walmart paypal mastercard nike netflix saitama impactxp luckyrootoken saitarealty,POSITIVE
2515,bitcoin avax avalanche cryptocurrency nft eth ethereum staking money futures xec ecasharmy ecash visa mastercard killer like happened russiaukraine ukrainerussiawar tothemoon bitcoinbutton binance mr p,NEGATIVE
2516,happy navratri call us 91 95048 95448 91 98885 57489 visit email birlagstudyvisa com navratri studyabroad visa studyincanada studyvisa ielts studyaustralia student studyinuk studynewzealand studentvisa jaimatadi coaching,POSITIVE
2517,takes 1 big name like apple tesla amazon visa adidas nike microsoft google announce partnership movr glmr see much potential amp parachain xcm evm,POSITIVE
2518,planning trip time soon help applying visa saudi arabia singapore indonesia contact us info 60 11 3368 6415 whatsapp saudiarabia saudi arabia saudi arabia saudia visa,POSITIVE
2519,direct whats app 62 811 3960 088 bali seminyak deep cleaned staff fully vaccinated villa rental beach baliluxuryvilla airbnb balivilla balilife villabali kembali workfrombali bintang voa visa visitoronarrival ilovebali parking,POSITIVE
2520,bitcoin avax avalanche cryptocurrency nft eth ethereum staking money futures xec ecasharmy ecash visa mastercard killer like happened russiaukraine ukrainerussiawar tothemoon bitcoinbutton binance,NEGATIVE
2521,wish best feeling disenchanted soon back india yugal raj jain via hn india usa immigrants backtoindia startups delhi bangalore visa h1b,POSITIVE
2522,time get financial freedom lowest floor price spc see partnership brings non crypto crypto shortly available millions buy direct visa instantly stake 75 apr,POSITIVE
2523,visa one many sponsors bitcoin2022 miami big statement,POSITIVE
2524,application process german work visa foreign workers germany must obtain b 2 germany travel tourism visa visitgermany schengen,POSITIVE
2525,vidya videsh tarnaka wish n family happy sri rama navami ramanavami hyderabad studyvisaabroad visa vidyainvidesh google,POSITIVE
2526,never never never give dear friend best wishes charming beautiful sunday easygogogo air ticket visa immigrant contact us visa philippines airticket immigrate,NEUTRAL
2527,racist insensitive support family victims shameless pm open bribery thrives canadaembassyindia visa amp biometrics appointment corrupt trudeau govt kartikvasudev 2 2,NEGATIVE
2528,visa creator program digital payment leader offering new nft aspirants great opportunity artists musicians want enter nfts womeninnfts nftartist visa,POSITIVE
2529,foreign nationals travel sri lanka required eta electronic travel authorization info online application visit apply entry sri lanka today srilanka visa visaapplication entry travel eta,POSITIVE
2530,hello working visa esta australia fgc idea put us based point contact,POSITIVE
2531,please check site information apply nzeta new zealand eta detailed instructions available apply traveling new zealand new zealand eta nzeta new zealand visa visa,POSITIVE
2532,wonder country would make difficult get tourist visa people extensive travel history like best kinda tourists would usvisa ukvisa,POSITIVE
2533,visa sponsors bitcoin 2022 sign cultural changes,POSITIVE
2534,exact rule 12 months work permit find period phd study visa,POSITIVE
2535,soon every airport world tweeets wtk wtk xrp xrp crypto binance xdc uae mastercard visa nft nfts tranglo payments dubai wechatpay alipay digitalyuan nftartist,POSITIVE
2536,wonder visa settlementstatus,POSITIVE
2537,companies belong trillion dollar club trillondollarclub tesla apple microsoft amazon facebook saudiaramco berkshirehathaway tsmc tencent visa,POSITIVE
2538,also wtf f france nederland ex colonists drugs prostitution promoting countries kosovo visa liberalization u f know many albos visit countries coz drugs whores art culture f u big f time europe u racist mf f u,NEGATIVE
2539,dogecoin doge worth 0 143 last 24 hours 1 90 last 7 days 2 57 buy dogecoin using mastercard visa,POSITIVE
2540,think time pushed limits grow visa ticket tour hotel europe travel italy love nature germany photooftheday spain architecture europetravel wanderlust honeymoonpackage privatetours couplepackage tourswithcct madrid travelwithcct,POSITIVE
2541,use debit credit card means bank working visa mastercard keeps commission fee every transaction usually 3 4,POSITIVE
2542,teleperformance running helpline uk ukraine refugee schemes barred homeoffice database security reasons amp cannot update applicants status visa application home office admitted,POSITIVE
2543,banks weigh using zelle challenge visa mastercard money transfer service boomed amid pandemic banks want expand retail payments visa zelle mastercard,POSITIVE
2544,retweet amp follow bitge vs blockchains tps comparison join bitgert bitgertarmy brise brisecommunity cryptocurrency cryptos bitgertchain bitgertcommunity solana avalanche ripple btc ethereum visa paypal ape,POSITIVE
2545,least got 10 euro cashback cro crofam using visa,POSITIVE
2546,new video lt 3 visa travelvisa tourists tourism youtube,NEGATIVE
2547,letter mp secretary checked designated hotline amp visa application received processed response news still authorisationtotravel homesforukranians 22days,POSITIVE
2548,note reportingscotland making clear fault low numbers ukrainian refugees managed come scotland completely pritipatel amp homeoffice amp painfully slow visa process bbcbias,POSITIVE
2549,simple guide help understand danish student visa requirements denmark visa studyabroad internationalstudents uni college,POSITIVE
2550,another moment supermarket buying lot vegetables weekend vegetables contribute collect cashbacks cro fftb crofam loadedlions cryptocashback cryptocom visacard crypto visa cryptocurrency cashback,POSITIVE
2551,need visa cruise depends ports sail written tool check whether need visa cruise visa travel,NEGATIVE
2552,azerbaijan may open embassy israel israeli president isaac herzog invited azerbaijani president ilham aliyev visit israel attend also opening embassy azerbaijan recently opened trade amp tourism center israel giving center visa consular rights,POSITIVE
2553,uae 90 days visa 750 aed 90 days visa change inside 1280 aed uae 30 days visa 350 aed 30 days visa change inside 1050 aed vip dese safari true dubai desert adventure visa visit tours desertsafari dubai uae adventure,POSITIVE
2554,know achieving 8 bands reading much easier imagined listen tricks help achieve better scores future info call us 77430 11563 theplic studyincanada studyabroad ieltspreparation ieltstutor visa,POSITIVE
2555,ministry hajj umrah announcement year 2022 upcoming hajj umrah authorisation contact us info 60 11 3368 6415 whatsapp saudiarabia saudi arabia saudi arabia saudia visa saudivisitvisa,POSITIVE
2556,visa sponsors bitcoin 2022 sign cultural changes one biggest sponsor bitcoin conference ends later today none v bitcoin visa bank fiat,POSITIVE
2557,ts visa application process education ireland via,POSITIVE
2558,search adventure time visit pakistan explore unique places alcabana travel alcabana alcabanacare motivation innovation aviation visa dubai travelgram explore world uae travelling tour,POSITIVE
2559,every reupload website charged 3 paying full amount visa processing indian asking kids age 7 resign documents purposely upload documents charging frauds sitting usembaasy narendramodi news world us,POSITIVE
2560,book consultation discuss visa spots available hurry book wisekangaroo,POSITIVE
2561,study university west london uk process file expert team studyinuk university ukstudentvisa ukuniversities ukcolleges collegesinuk ukeducation ukeducationwebinar covid19 minchyconsultant studygram universityofwestlondon study visa college,POSITIVE
2562,v 10 day moving average moved 50 day moving average march 28 2022 view odds indicators visa,POSITIVE
2563,ukrainian war refugee visa target delays uk target 15 000 per week week 11 900 initial decision within 48 hours lord harrington uk government official refugee minister says 15000 target,POSITIVE
2564,processing time eta application sri lanka often varies case case recommend apply soon decided travel sri lanka info online application visit srilanka visa visaapplication entry travel eta,POSITIVE
2565,ukraine refugee visa summary correction 1 7apr ufs 4100 586 day apologies poor cut paste work meant 4100 3400 per day right though used 4100 calculation use post sorry,NEGATIVE
2566,apply studentvisa study dream country visit us visaconsultant visa studentvisa workvisa pr businessvisa lmia pnp uk canada australia usa visafactory saturday saturdaymood saturdaymorning saturdaymotivation,POSITIVE
2567,actions words priti tiny uk village offers homes ukrainerefugees visa mess stops anyone coming,NEGATIVE
2568,earn certificate fields top canadian colleges grab wrench jump high demand skilled fields contact us details canauzoverseas consultant immigrationconsultant visa visaconsultants visaoffice resubmitvisa studyvisa,POSITIVE
2569,payment providers lawyers weekend announcement bitcoin paymentprovider lightning visa dinnersclub mastercard blackhawk ncr,POSITIVE
2570,week video walk documents needed apply thailand retiree visa us citizen visa retire,POSITIVE
2571,study university sunderland uk process file expert team studyinuk university ukstudentvisa ukuniversities ukcolleges collegesinuk ukeducation ukeducationwebinar covid19 minchyconsultant studygram universityofsunderland study visa college,POSITIVE
2572,cash app 1000 gift card amazon walmart kfc enter win cashapp cashappbtcweek cashapp99off cashappblessing amazon walmart kfc visa google,POSITIVE
2573,join live session today 5 pm get tips studying abroad stay tuned abroad abroadeducation visa studyabroad studyabroadlife overseas education live instagram facebook edwiseinternational,POSITIVE
2574,reach us one click gt get visa licensed company installment gt call whatsapp visa visa visalia visavis visavis4 visavis3 visaodecria visaapproval visakhapatnam visaconsultants dubai duba dubaivisa dubaimall dubailife dubaimarina,POSITIVE
2575,connect seamless process speak expert sharmila bose 91 9315179419 visa canada studyabroad ielts travel studentvisa mastercard australia usa studyvisa studyincanada study canadavisa uk passport workpermit student visaconsultants tourism,POSITIVE
2576,visa consultant visa file sop request free demo today know 91 8980006120 visaboard visaconsultants visa b2bportalforvisaconsultant portalforvisaconsultants sop appealletter freedemo visaconsultancyservice,NEGATIVE
2577,every body loves travel business class use iphone villas world tour bank balance crossing limits want work requires reach travel iphone13pro apple swissbank trending formula1 visa business ukrainerussianwar ukrainevsrussia,POSITIVE
2578,put family visa hold uae uaeu dubai visa,POSITIVE
2579,comments kairostravelandtour travelagency travelplanner travel explorewithus vacation staycation lifestyle travellife holidays baecation visa travelconversation travelagencyinlagos travelagencyinnigeria,POSITIVE
2580,oman apostile call 0808854444 visit oman attestation certificateattestation certif cate attestationservice visa embassy service uae apostile,POSITIVE
2581,canada document attestation call 8008880888 geniusattestation commercial busines atestation certif cate embassy attestationservice uae canadaattestation doucument visa clearence embassy service,POSITIVE
2582,word day simultaneously stay tuned words join v point ielts visa vpoint vpointvisa abohar vpointabohar ielts spokenenglish bestcoach abohar punjab bestconsultancyinabohar vpointvisaconsultants canada,POSITIVE
2583,day 20 still visa family sponsoring nationaldisgrace visa standwithukraine nocompassion,POSITIVE
2584,popid consumer authentication service visa partnered launch facial verification payment acceptance middle east region popid visa facialverificationpayment read,POSITIVE
2585,want bring family member bali let us help gro indonesia make getting family visa easier cost effective request free consultation today jl sunset road 99d 62 81 1382 1382 visa visaagency familyvisa,POSITIVE
2586,visa innovation studio nairobi set incubate next generation commerce experiences africa,POSITIVE
2587,want study abroad australia usa uk ireland switzerland germany canada countries click link visa uk usa singapore canada australia study studyabroad studyabroadconsultant admission admissionusa,POSITIVE
2588,trusted dmcc service provider dubai freezone business dmccservice dubaifreezone 1procentre touristvisa unitedarabemirates traslationservices attestationservices expo2020 services pro proservice uae dubai visa visitvisa visadubai,POSITIVE
2589,common thread applied cabinet liars ukrainians visa greencard partygate,POSITIVE
2590,super excited partnership bring customers read partnership reuters investing yahoo finance tribal visa,POSITIVE
2591,know top courses australia meet expert get profile assessment ph 7201017700 b 303 305 amrapali lakeview tower nr ahmedabad one mall vastrapur ahmedabad 380015 australia australiastudentvisa coaching ieltsclass score bands visa,POSITIVE
2592,india digital currency take calibrated graduated approach says rbi deputy governor regulation bitcoin news bitcoincharts cryptoexplorer cryptocurrencyvisa bitcoinnews visa trading inversion inversiones,POSITIVE
2593,italy new law good news remote workers digital nomads euronews visa work italy company country remotework via,POSITIVE
2594,one best building concepts ever seen domino cassia vietnam unique style never seen kind skyscraper building travel visa tourist packages tickets air international domestic fare departures groupfare lowest gtktravels,POSITIVE
2595,know course feel free contact us info com 0120 416 8905 whatsapp 91 99101 70340 address e 7 2nd floor sector 3 noida 201301 singaporestudyvisa singaporefood singapore singaporevisa visa,POSITIVE
2596,travel makes one modest let get back travelling time safely lotus travel related queries get contact us 949 715 5899 visit kochi kerala visa travel lotusflies traveler traveller traveltheworld,POSITIVE
2597,poole pettifogging little jobsworths enjoying five minutes power people better ukraine visa,POSITIVE
2598,pritipatel checked rishisunak ensure right remain work visa,POSITIVE
2599,first ever purchase using crypto visa card nothing still truly significant came crypto couple months ago got drip working mcdonald night putting drip day passiveincome financialfreedom,POSITIVE
2600,kyc want financially free road world reserve major non kyc payment gateway real metaverse replace archaic likes paypal visa mastercard dkyc defi,POSITIVE
2601,rejected applicants eligible student visa application process 2022 says us mission india usa india usembassy students studyabroad visa covid,POSITIVE
2602,work permit canada start career canada pr nanny course join nanny caregiver visa pr family join call 8620003334 8146261603 workpermit trainingcenter canada visa canadaimmigration canadavisa studentvisa nannyincanada canadapr permanentre,POSITIVE
2603,chance work europe work permit europe 100 guranteed jobs work europe amp earn money hurry book appointment internationaldreamzz educationconsultant studygram visa workpermit permit jobs money usa uk europe poland,POSITIVE
2604,canada study visa overall 6 band apply visa application call details 8439500005 7527800009 visit website studyabroad visa pnp aipp rinp studyvisa immigratetocanada ielts pte pr,POSITIVE
2605,planning study uk contact expert team studyinuk studyvisa uk ukstudentvisa ukstudyvisa universitiesinuk university college students england minchyconsultant studyabroad uk visarefusal visarefused visaapproved unitedkingdom visaapplication visa,POSITIVE
2606,obtaining investor visa one way obtain temporary residency estonia however year number people granted visa limited requirements met,NEGATIVE
2607,planning set business dubai emirates get free consultation experts call whatsapp 971 52 4666811 goldenvisa uae abs proservices visa business services assessment government certificate entrepreneur motivation corporatebusiness,POSITIVE
2608,since international travel opening visa requirements indian students want study abroad hope helps studyaborad visa usavisa,POSITIVE
2609,must read visas avenue featured zeenews fact visasavenue changing lives helping hundreds aspiring immigrants every year read inspiring article published canada canadaimmigration2022 visa,POSITIVE
2610,phishing visa mastercard jcb americanexpress amex dinersclub hxxps www2 visa co jp zaewuy xyz ip 45 66 129 91 as23959 owl limited registrar namesilo,NEGATIVE
