,text,sentic_polarity
4001,bidenflation crisis exasperated liberal policies favor illegal immigrants american citizens joebiden choosing feed 2 million illegal aliens americans proof democratsaredestroyingamerica,NEGATIVE
4002,louisiana want stop detaining immigrants border dozens sheriffs make money jailing 10 000 suing biden,NEGATIVE
4003,iiba make car donation process free simple donor iiba committed mission advocate immigrants need help make vision come true please consider donating used car help spread word program,POSITIVE
4004,daughter immigrants benefited greatly civil rights movement successes black americans yes reparations california something pay facts immigrants reparations stop pandering foxnews,POSITIVE
4005,immigrants mexicans racism hamilton mixtape immigrants get job done via,NEGATIVE
4006,really dont care us immigrants thats dont care us,NEGATIVE
4007,understand better takes home abroad read full article immigrants nigerian home unitedstates canada europe,POSITIVE
4008,part 2 article discuss cultural technical approach likely lead success working foreign born families immigrants wealthmanagement workvisa financialfreedom,POSITIVE
4009,advocates warn immigrants new mexico stay away cannabis,NEGATIVE
4010,com shameonbidenadministration abounded family based categories visas bulletin waiting many many years enter us legally respect immigrationlaw front doors illegalundocumented immigrants came walls borders backdoors illegaly,POSITIVE
4011,always special thanks land immigrants immigrationmatters usa,POSITIVE
4012,thank elon actually hope commonsense free speech taken seriously elonmusktwitter free speech freedom speech first amendment townsquare freespeech freedom immigrants freedomofspeech,POSITIVE
4013,istandwithtrudeau liberals government leadership healthcare education climatecrisis immigrants humanrights democracy peace,POSITIVE
4014,immigrants brand,NEGATIVE
4015,anglo olim along jerusalem deputy mayor helping ukrainian refugees acclimatize life israel drawing experiences new immigrants,NEGATIVE
4016,streaming support standupcomedy asian immigrants proud show co wrote produced telling unique immigrant stories,POSITIVE
4017,mexican immigrants literally pick amp process every piece food eat clean offices amp hotels groundskeepers country including every trump property hate mexicans,POSITIVE
4018,care would thought could get away immigrants poc poor elderly dispensable look rhetoric actions policies vote,POSITIVE
4019,boris johnson priti patel afraid letting agents harm could lead deaths britains agents harm come human form laughed covid borisjohnson pritipatel russia ukraine refugees immigrants visas spin covid19 values lies,NEGATIVE
4020,check early online view article journal experimental child psychology majority status children help majority status peers minority status help majority amp minority peers equally bystanders immigrants socialexclusion intergroupcontact,POSITIVE
4021,thank arzu looking forward digging work appreciate keep us informed journalism canada refugees immigrants pressfreedom,POSITIVE
4022,wonderful read speaking 37 languages one least interesting things vaugh smith love making others happy infectious immigrants,POSITIVE
4023,immigrants frequently demonized media receive empathy understanding groups causing socially targeted mana immigrants,POSITIVE
4024,make fuss manage govt knows labour eu immigrants muslims blair france benefitscroungers guardian readers bbc remainers wokepeople know woke blame somehow wasgreatin1970s uk fucked,NEGATIVE
4025,month teascoffee talked understanding foodinsecurity among immigrants america watch check full issue thinktable,NEGATIVE
4026,part 1 3 lissette asks parents understand career entails may seem like silly question answers shed light children immigrants view workinglatina teamchuy immigrants daughterofimmigrants leadinglatinas,POSITIVE
4027,plans end title42 migrants entering country southernborder lawmakers saying us simply ready handle impact immigrants refugees asylum usmexicoborder,POSITIVE
4028,available pre order mika l cartoonist giant comes bootblack story orphan reinvents love set great depression mikael nbmgraphicnovels bootblack bandedessin e comics newyork 1930s nyc immigrants,POSITIVE
4029,max bloomfield american immigrant never forgot family back home blumenfeld immigrants genealogy,POSITIVE
4030,created fantastical imaginative universe astutely insightfully capturing challenges amp triumphs faced immigrants amp refugees racheltamarin director exileismyhome rciny icr,POSITIVE
4031,support ab2847 cause citizens usa specifically californians foot bill foe people chose come country get special treatment citizens country built mf left behind immigrants,POSITIVE
4032,today legal helpline open 10am 1pm call 0800 995 6045 email ukraine org uk visit ukraine ukranians refugee supportukraine legalhelpline legaladvice scotland legalroutes immigrants,NEGATIVE
4033,desperate skilled workers says luxon watch full episode iwk kiwiindians nz newzealand auckland aotearoa nationalpartynz skilledworkers immigrants,NEGATIVE
4034,national ideas clear plan covid 2021 22 says luxon watch full episode iwk kiwiindians nz newzealand auckland aotearoa nationalpartynz skilledworkers immigrants,POSITIVE
4035,nz faces massive labour shortage says luxon iwk kiwiindians nz newzealand auckland aotearoa nationalpartynz skilledworkers immigrants,NEGATIVE
4036,overview canada pnp immigration results march 2022 call 91 8595744633 website canada jobsincanada immigrants pnp invitation prvisa workvisa jobopportunities tripleibusiness careeroverseas canadapr2021 britishcolumbia ontario,POSITIVE
4037,breaking news president cyril ramaphosa announces national state disaster end midnight tonight dstv403 enca fuelprice unemployment crime immigrants cha ngazo dlala ngathi thought serious meeting ayi cha,NEGATIVE
4038,love usa love us americansabroad treated worse illegal immigrants cbt adopted civilwar switching residencebasedtax long overdue want renounceuscitizenship citizenship seems solution,POSITIVE
4039,differences people referred migrants immigrants expatriates think differences justify different wording,POSITIVE
4040,donald trump russia watch family kids brains ancestor immigrants seek ladyliberty still presidentsday,POSITIVE
4041,usa hegemonic policies coming back bite monroedoctrine nativeamericans migrants illegals immigrants hispanics latinos,NEGATIVE
4042,top4 mvp candidates year something common none born us immigrants,NEGATIVE
4043,rules engagement immigrants learn please like watch share get speaking immigrants immigrants leadfrombehind mandelawisdom,POSITIVE
4044,job stop midnite flights airports desantis2024 illegal immigrants,NEGATIVE
4045,check wendell phea video tiktok mexico ukraine blm latinos indians immigrants,NEGATIVE
4046,know u relies heavily foreign born workers immigrants u work high rates jobs important economy like farming food manufacturing construction also bolstering social security trust funds,POSITIVE
4047,productive meeting jagdeep kailey manager settlement services discussed needs newcomers work grow ontario together solutions discussed fills hope brighter future onpoli immigrants bramptonwest,POSITIVE
4048,asked miami platform launch latin startups emergeamericas ceo says nature welcoming core city built immigrants read via miamitech,POSITIVE
4049,attend costiemploymentservices information session april 6 10 10 30 learn services amp help jobsearch register free virtual session internationallytrained immigrants newcomers,POSITIVE
4050,think canadian dream replaced american dream article discuss history american dream started failing canada becoming place new immigrants live life always wanted,POSITIVE
4051,u government must face negligence emotional distress claims immigrants say traumatized former president donald trump policy separating families southern border,NEGATIVE
4052,check morning episode metro morning show featuring triecpins assoc member maysam fadel sharing story finding employment newcomer canada immigrants career inclusion,POSITIVE
4053,seriously governor guys peddle story witnessed took pics illegals bussed plant city pick strawberries busses included want talk immigrants border,NEGATIVE
4054,1 2 happy birthday month 7 famous immigrants immigrants heathledger jackiechan andygarcia,POSITIVE
4055,fact immigrants including illegal immigrants less likely incarcerated prisons convicted crimes arrested native born americans catoimmigration learn,NEGATIVE
4056,bidenadministration plans end rule turned asylum seeking immigrants away border,NEGATIVE
4057,hi settlers help 19 yo jewish progress chronically ill native person collect funds paperwork work us need special visa survival funds get link mutualaidrequest mutualaid tipanative chagpurimsameach immigrants,POSITIVE
4058,article discusses politics around title 42 also contains gem wisdom long run thing reduce illegal entry legal avenues people enter u work immigrants,POSITIVE
4059,white european better country othe via sweden refugees gun crime stabbing immigrants culture religion islam,POSITIVE
4060,every generation amp country immigrants teach us something invaluable suggest lesson may time review borderlesseconomics economics,POSITIVE
4061,title42 finally ending proud stand w countless immigrants refugees amp allies worked relentlessly human rights victory made happen pausing w gratitude build towards day refugees welcomed dignity endtitle42,POSITIVE
4062,join us giving warm welcome jessica joined cuny iie undocuedu team project researcher jessica brings experience community organizing advocacy immigrant rights immigrants students cuny cunyiie education,POSITIVE
4063,sarton winning novel luz proves empathy borders via bookrecommendation immigrants awards,POSITIVE
4064,immigrants rural communities settlement needs urban peers local settlement services often funded provide limited range service types language training employment services common gaps read,POSITIVE
4065,long term effects legalization formal employment undocumented immigrants claudio deiana amp nistico tackle issue lda development studies workingpaper read paper,NEGATIVE
4066,tea trianon side freedom novels ya teens fiction italy immigrants louisiana cynthiatoney,POSITIVE
4067,fact chop suey native chinese dish created california chinese immigrants teamfollowback rocktheretweet,POSITIVE
4068,see bingwa mention immigrants discussion overcrowding involved immigrants dishonest shady immigrants zimbabwean putsouthafricanfirst dudulamovement,POSITIVE
4069,dancing often exciting bill jones choreography adds positive element paradise square reviewed broadway musical nyc theatre immigrants,POSITIVE
4070,equally absurd thousands unlawful immigrants cross america southernborder daily buildthewall mandatoryeverify,NEGATIVE
4071,visacrunch covid 19 altered immigration rate canada survey read canada comprehensiverankingsystem covid19 crs expressentry immigrants immigrationminister ircc ita justintrudeau pnp seanfraser wes,NEGATIVE
4072,create dangerously immigrant artist work edwidge danticat womenshistorymonth nmsu genderstudies edwidgedanticat immigrants immigrantart haitian book literature writing reading pedagogy,POSITIVE
4073,amount gimmigrants immigrants asylumseekers eucitizens healthtourists using free point need use amp none paid scheme mismanagement many chiefs enough indians surprised,NEGATIVE
4074,indians top canada admits 108 000 new immigrants 1st quarter ottawa,POSITIVE
4075,number pedophiles usa alarming however people talking age concent 12 cultural implications child illegal immigrants impact suburban america time,POSITIVE
4076,tbt2016 greek refugee camps beautiful irony aura saved memories soufili alexandrapoli blood brothers afghanistan pakistan iran syria even want refugee immigrants walker,POSITIVE
4077,failing students education k 12 setting competed collegiate level illegal immigrants program also open immigrants regardless immigration status firemlg,POSITIVE
4078,refugees immigrants humans human humanitarian soul worldwide acceptance stopdivingus france quebec welcome working language english putinisawarcriminal truth,POSITIVE
4079,special treat grew rural areas farming towns amp villages thanks breakneck urbanization night time lullabies fast disappearing immigrants refugees,POSITIVE
4080,goodbye trump swamp evil stephen miller created new rules allow deportation legal low income immigrants link smartdissent xenophobia,POSITIVE
4081,top two turds immigrants johnson turk farage huguenot mogg gove genetic experiments gone wrong strands amoeba weasel donkey rna accidentally got petri dish,POSITIVE
4082,know believe individuals possess natural rights self evident truth america support immigrants amp children great contact offices,POSITIVE
4083,twitter suspended tweet concerning racism barbaric attacks algerians afflicts people algerians would go soar losers soccer game meant unite divide violence algeria algeriecameroun fifa22 fifaworldcup immigrants racism,NEGATIVE
4084,give tired poor huddled masses yearning breathe free wretched refuse teeming shore send homeless tempest tost lift lamp beside golden door immigrants,POSITIVE
4085,shameonbidenadministration abounded family based categories visasbulletin waiting many many years enter us legally respect immigrationlaw front doors illegalundocumented immigrants came walls borders backdoors illegaly,POSITIVE
4086,shameonbidenadministration abounded family based categories visasbulletin waiting many many years enter us legally respect immigrationlaw front doors illegal undocumented immigrants came walls borders backdoors illegaly,POSITIVE
4087,fan immigrants,NEGATIVE
4088,real thing immigrants think better superficially political corruption money problems crime etc come turnaroundandgoback,NEGATIVE
4089,immigrants refugees sense good things happen worry going wake gone think 30 something years feeling would gone still unwanted resident mind womeninweb3,NEGATIVE
4090,seems cheryl grills naarc amp lisa holder trying sabotage reparations black americans trying 2 demand slavery reparations include immigrants came slavery disrespectful lot less likely 2 stand court ab3121 disgusting,NEGATIVE
4091,minister tamano shata expects 6 000 10 000 immigrants israel month post ukraine ukrainerussiawar,NEGATIVE
4092,absolutely loved interview music listening immigrants work way backwards work would definitely love see hear live,POSITIVE
4093,phdthesis latin american refugees immigrants new zealand impact migration status qualityoflife,NEGATIVE
4094,wait learn new musical join 4 7 1 pm edt linkedin live discuss dreamers story status immigrants us takes get musi,POSITIVE
4095,blackhistory365 45 min lecture blacks diversity medieval england hundreds years still labelled immigrants see,POSITIVE
4096,refugees britain fussy prepared via housing immigrants,NEGATIVE
4097,waiting see bend rules immigrants standwithukraine also stand immigrants seeking refuge war ridden countries seeking better life fix system job,POSITIVE
4098,need reason start fred feldman story keeper first paragraph first thing recommend ww2 immigrants geneology holocaust jewishlife,POSITIVE
4099,38000 illegal potential terrorist beach landers remove 2024 election cons face political abyss reality need listen people god sake listen illegalimmigrants immigrants,NEGATIVE
4100,tamano shata expects 6 000 10 000 immigrants israel month,NEGATIVE
4101,undocumented immigrants higher risk adverse pregnancy outcomes due lack insurance greater risk poverty poor access equitablecare colettelouisetisdahl cltfoundation immigrantlivesmatter pregnancyisnotadeathsentence saveourmoms,NEGATIVE
4102,learn providing legal access partnership amp immigrants justdoit nyc,POSITIVE
4103,borderplan 1 task w logistics command build war theater green zones mini cities immediately move asylum seekers immigrants awaiting processing 2 add judges 3 jobs fill,POSITIVE
4104,many people living back gardens britain cities via migrants immigrants local authorities london ilford redbridge population nhs,NEGATIVE
4105,end stroke amp aphasia anniversary made hibiscus margaritas tastes like love neat well stroke aphasia aphasiaawareness strokeawareness hcm immigrants,POSITIVE
4106,j bier lots brain power used come non sense makes life immigrants hell,NEGATIVE
4107,extend title42 expiration date democrats cannot afford another wave illegal immigrants border big distraction midterms election2022,NEGATIVE
4108,french far right leader le pen softens image election associatedpress churchineurope france frenchcatholics immigrants,POSITIVE
4109,wait learn new musical join 4 7 1 pm edt linkedin live discuss dreamers story status immigrants us takes get musical idea broadw,POSITIVE
4110,learn occult magic hausgaga wizard count ladygaga army witch witcharmy democracy justice peace tikun tikunolam america stand proud royal blood immigrants lovewins,POSITIVE
4111,learn project partnership opportunities immigrantsincorporate immigrantstories immigrants,POSITIVE
4112,reflecting forms radical protectionism channel frustrations south africans corruption crime unemployment results campaigns clean country immigrants home invasions widespread threats violence,NEGATIVE
4113,bad education long tradition uk descendants lowerclasses resentment lumped substandard narrow grey worldview immigrants colourful psychologically free healthy get conned filtered britishness,NEGATIVE
4114,fascinating glimpse normal life paris wealthy homes immigrants neighborhood without stereotyped romanticization trailer original french soundtrack enjoy show dubbed english well 2 2,POSITIVE
4115,americanmade biden released giving 115 million tax payer dollars hire attorneys illegal immigrants represented brandon made usa harbor criminals legally represented breakthelaw,POSITIVE
4116,ancestors rolling graves upset happening many black immigrants poc subjected jimcrow aka black codes people whitesupremacistsinblackface attempting revisionist history lineagematters,POSITIVE
4117,know anyone view mexicans immigrants migrants seen map america prior 1843 much american first people foreigners stop disrespecting,NEGATIVE
4118,immigrants appreciation black american freedmen succeed homelands come america benefit ados freedmen realamericans blackexcellence tethersareproblematic,POSITIVE
4119,thrilled announce new partnership bridgeport based nonprofit helps immigrants get relevant employment opportunities partnership supplement programme improve retention visit website learn,POSITIVE
4120,worlds best baddies weirdoghostgang punk lgbtqia afropunk afrolatina immigrants blackwomen adhd transgender,POSITIVE
4121,law students help ukrainian refugees start asylum process seattle u newsroom news stories chronlaw immigration law news immigrationlaw news law attorney lawyer,POSITIVE
4122,applicants certain immigration benefits obtain expedited processing paying additional fees new rule u citizenship immigration services amp lawyer zach haugen explains immigrationlaw uscis,POSITIVE
4123,alabama sues biden administration deporting illegal immigrants santa barbara news press chronlaw immigration law news immigrationlaw news law attorney lawyer,POSITIVE
4124,first person meeting board governors several years immigrationlaw leadership,POSITIVE
4125,rose immigration law firm moves nashville brentwood chronlaw immigration law news immigrationlaw news law attorney lawyer,POSITIVE
4126,starting may 1 employers accept expired list b documents form 9 employment eligibility verification purposes expired list b documents must updated july 31 2022 jackson lewis principal amy peck discusses immigrationlaw,POSITIVE
4127,good following immigration laws hence president breaking law sure great attorney license steal per father law get though immigrationlaw matters,POSITIVE
4128,ohio ag wins court order enforce federal immigration law santa barbara news press chronlaw immigration law news immigrationlaw news law attorney lawyer,POSITIVE
4129,gov greg abbott orders texas inspect vehicles border charter buses ship migrants c immigrationlaw,POSITIVE
4130,united states joined many european countries opening doors offering humanitarian assistance fleeing ukrainians jackson lewis principal forrest read discusses immigrationlaw,POSITIVE
4131,state investigates allegations abuse afghan migrant children michigan immigrationlaw,NEGATIVE
4132,practice aspects immigration law including employment family based visas asylum immigration relief victims domestic violence violent crime removal proceedings naturalization federal appeals immigrationlaw naturalization immigrationrelief,POSITIVE
4133,alabama sues biden administration deporting illegal immigrants center square chronlaw immigration law news immigrationlaw news law attorney lawyer,POSITIVE
4134,fact friday bust immigration myths know facts immigrationlaw immigrationfacts knowthefacts,NEGATIVE
4135,senior research fellow solomon center health law amp policy asees bhasin speaks intersection reproductivejustice immigrationlaw feminismbigideas read paper,POSITIVE
4136,starting may 2 foreign nationals citizens 40 visa waiver program countries use electronic system travel authorization enter u land ports entry jackson lewis principal alexandra lacombe discusses immigrationlaw,POSITIVE
4137,bringing latest canadian immigration new recap new post canadaimmigration immigrationlaw immigrationnews canada,POSITIVE
4138,texas going bus undocumented migrants c florida hold beer immigrationlaw,NEGATIVE
4139,title 42 fight proof congress would rather turn lawlessness actually make policy immigrationlaw,NEGATIVE
4140,texas takes new border action ex trump officials want immigrationlaw,NEUTRAL
4141,surge ukrainian refugees california southern border immigrationlaw,NEGATIVE
4142,title 42 ending may migrants wait long immigrationlaw,NEGATIVE
4143,america labor shortage actually immigrant shortage immigrationlaw,NEGATIVE
4144,senators restart bipartisan immigration reform talks immigrationlaw,POSITIVE
4145,biden border move sows congress divide democrats splinter 1 immigrationlaw,POSITIVE
4146,homeland security watchdog omitted damaging findings reports immigrationlaw,NEGATIVE
4147,migrants released border tracked phones white house immigrationlaw,POSITIVE
4148,gop campaign ads put focus immigration inflation immigrationlaw,NEGATIVE
4149,join fragomen partners chad blocker daniel schwarz rahul soni senior associate jordi bayer upcoming event april 14 2 00pm edt information register click fragomen immigrationlaw event,POSITIVE
4150,time read learn cimts might affect immigration status immigrationlaw cimts carbonelaw immigrationlawyer,POSITIVE
4151,see clients saying us read immigrationlaw immigrationattorney immigrationlawyer business businessimmigration entitysetup businessplan e2visa tnvisa l1visa o1visa eb1greencard greencard e1visa,POSITIVE
4152,6 april 2022 fees immigration nationality applications increased 15 immigrationlaw team discuss various increases mean applicants,POSITIVE
4153,sze man angel lau 20 initially planned returning china practice law changed plans finding niche immigrationlaw passed ca bar exam started specializing immigration law sacramento mcgeorgeinternational llm,POSITIVE
4154,canada plans welcome 400 000 immigrants coming year wait one among apply us smooth fast process dm learn facts canadafacts immigrationlaw canad canadaimmigration canada immigratetocanada canadavisa,POSITIVE
4155,clark woods llp headquartered coquitlam legal needs anywhere metro vancouver fraser valley contact us consultation call 604 330 1777 set free consultation bclaw familylaw immigrationlaw realestatelaw,NEGATIVE
4156,immigration law firm begins processing new fianc marriage visas philippines digital journal chronlaw immigration law news immigrationlaw news law attorney lawyer,POSITIVE
4157,tired covid 19 restrictions complain end title 42 immigrationlaw,NEGATIVE
4158,gov greg abbott plan bus migrants washington c voluntary immigrationlaw,POSITIVE
4159,immigrant rights groups say ice visitation policy taking toll detainees mental health immigrationlaw,POSITIVE
4160,ukraine refugees seek asylum us mexico border california immigrationlaw,NEGATIVE
4161,canada plans welcome 400 000 immigrants coming year wait one among apply us smooth fast process dm learn facts canadafacts immigrationlaw canad canadaimmigration immigratetocanada canadavisa canadastudyvisa,POSITIVE
4162,paul lepage calls trump harsh immigrants maine gop expands outreach immigrationlaw,POSITIVE
4163,biden made promise deviate trump immigration policies broke immigrationlaw,NEGATIVE
4164,miss year skelton lecture still watch hjil youtube channel immigrationlaw uhlc,NEUTRAL
4165,new blog post trump era title 42 policy terminated may 23 announced center disease control prevention friday click link bio read could affect title42 immigrationlaw cdc bordercrisis,NEGATIVE
4166,biden administration made policy changes expand eligibility including adding 22 new degree fields stem list broadening eligibility niw visas jackson lewis principal sean hanagan discusses immigrationlaw,POSITIVE
4167,immigration law firm begins processing new fianc marriage visas philippines benzinga chronlaw immigration law news immigrationlaw news law attorney lawyer,POSITIVE
4168,fragomen seeking senior talent development events manager join team permanent basis opportunity open remote candidates information apply click fragomen immigrationlaw careers,POSITIVE
4169,immigrant phd measure could aid national security u economy immigrationlaw,POSITIVE
4170,african immigrant advocates point double standard ukrainians receive u relief immigrationlaw,POSITIVE
4171,rep posey florida ag moody unveil bill allow states demand enforcement federal immigration law fox news chronlaw immigration law news immigrationlaw news law attorney lawyer,POSITIVE
4172,scoop bipartisan senate group bids block lifting title 42 immigrationlaw,POSITIVE
