,text,sentic_polarity
3306,get uae visa uae uaevisa visa visaservice abudhabi insurance dubai uae myuae welcometodubai burjkhalifa burjalarab fastsecurevisa hasslefree dubaiframe aindubai dubaitrends dubaitourism traveldubai traveling travelgram travel swtclubindia swtclub,POSITIVE
3307,get uk visa dubai resident visa guaranteed trusted reliable inquiries send dm call whatsapp 971 523745774 ukvisa dubaivisa visa visaapplication,POSITIVE
3308,spend using visa debit credit card qiib earn chance win hospitality package two attend one fifa world cup qatar 2022 quarter final group stage matches courtesy visa qiib qatar doha fifa visa,POSITIVE
3309,visa look simplify purchasing process digital output making buying nfts simple visa transaction news instagram,POSITIVE
3310,italy new law good news remote workers digital nomads euronews company visa amp rsquo work non eu remotework via,POSITIVE
3311,alaska airlines visa credit card review solid pick occasional flyers news conomy usa america alska visa visacard business airport flyers credit,POSITIVE
3312,getting married manage bringing debt marriage engaged creditcard creditscore debtfree visa personalfinance wedding,POSITIVE
3313,counter master visa india launched rupay already millions users india growing fast uae singapore butan newly launched nepal unionpay mastercars visa killers atmanirbharbharat fromindiatotheworld,NEGATIVE
3314,state department released april 2022 visa bulletin erickson immigration group summarized changes expect read eig summary analysis greencard visa visabulletin,POSITIVE
3315,card payments prepared opensea moonpay nft crypto opensea moonpay openseanft visa mastercard americanexpress applepay apple google googleplay btc,POSITIVE
3316,trip good car gets mondayvibes monday lazyday toronto workhard workday cruise carrentalservice toronto booknow reservation car rental discounts prices torontocarrental visa mastercard amexlife,POSITIVE
3317,russia unfriendly countries still wants fly russia welcome russia ukraine war travel visa,POSITIVE
3318,gateway visas success story poland businessvisa congratulations mr challagolla krishna chaitanya getting poland c visa business visa visit website contact 80191 68899 mail hyderabad com gatewayvisas visa cvisa,NEGATIVE
3319,slow progress visa scheme refugees spokesman said right ministers provide scrutiny challenge ensure pace delivery matching ambition need scheme via,POSITIVE
3320,fun fact already entered nft domain investments partnerships converging sign decentralised digital world blockchain bitcoin cryptocurrency decentralisation ethereum visa mastercard mobilum,POSITIVE
3321,albania albaniavisa visa evisa easier ever apply visa enter albania obtaining albania visa online usually quick easy cases visa issuance takes 15 days application date,POSITIVE
3322,individual cherishes outdoors exploring hajar mountains make perfect destination travel alcabana motivation innovation aviation visa dubai travelgram explore world uae travelling tour tourism helloalcabana,POSITIVE
3323,startup carbonpay selected participant visa fintech fast track program brings innovation sustainable offerings payments space via fintech sustainability,POSITIVE
3324,putin signs decree imposing visa restrictions citizens unfriendly countries,NEGATIVE
3325,putin imposed visa restrictions bulgarians citizens unfriendly countries,NEGATIVE
3326,curious update homesforukraine scheme taking long uk process visa applications ready host waiting friend receive authorisation2travel ukraine visa waiting,POSITIVE
3327,russia limits visa free entry unfriendly countries russia visa,NEGATIVE
3328,visa launches nft program small businesses creatives nfts nftart nftartist ecommerce,POSITIVE
3329,ideally must purchase visitorhealthinsurance confirm travel dates receive visa want know type insurance good 1 833 289 4878 bestinsuranceplans visitorinsurance visitorsguru tips,POSITIVE
3330,travel canada professional filing process assist filing application following required steps improving visa success rate feel free call us 85560 85560 seminar canada canadastudyvisa grandseminar studyvisa visa,POSITIVE
3331,russia imposes visa restrictions citizens unfriendly countries,NEGATIVE
3332,visa debuts nft support meta ready businesses metaverse,POSITIVE
3333,visa urges cautious approach bnpl regulations payments buynowpaylater finserv,NEGATIVE
3334,picture baby added mothers passport officially stamped ukrainian authorities however uk issue visa without unique passport number evil tories,NEGATIVE
3335,visa announces buy pay later collaboration aircanada,POSITIVE
3336,uk study destination always wanted know get attend free webinar 9th april get answers questions abroad education uk canauzoverseas consultant immigrationconsultant visa visaconsultants visaoffice,POSITIVE
3337,every moment fresh beginning new challenges new hopes new goals may everything bring much joy happiness beginning always today schedule conversation us today swift relocation plan happy new week canada opportunities visa,POSITIVE
3338,official homeoffice ukrainefamilyscheme amp homesforukraine ukrainesponsorshipscheme ukraine refugee uk visa update day40 april4th data update 14 00 local time monday 4th april good enough,POSITIVE
3339,qred ab launches new b2b payments platform allowing businesses pay invoice qred visa fintech b2b payment visa news,POSITIVE
3340,july 2021 107 8 million people working private service sector willing join american workforce america jobs usnews work americanjobs americacalling workforus visa newyork usa america india canada consultation,POSITIVE
3341,time released first ever magazine nft super amazing every sector economy involving nftspace nft nfts nftcommunity nftgiveaway nftdrop nftcollector nftcollection visa nftcreators metaversenft nftart nftartist,POSITIVE
3342,uae government issues several types visas entry permits based purpose visit visa residence residencyservices visaservices employmentvisa proservices freevisa ibg dubaivisa uaevisa uae businesssetup business ibg ibgconsulting,POSITIVE
3343,even also highlighting hopefully government comes fast decision boosters vaccination covid19 visa,POSITIVE
3344,visa empower one year immersive program read stay tuned amazing happenings artauctions leadingartmagazine artnews magazine artworld nft visa entrepreneurs,POSITIVE
3345,planning study canada get touch us services foriegn immigrationconsultant law visa expressentry lawfirm canada lawyer spousevisa skilled familyvisa ontario ontariocanada canadavisa consultancy,POSITIVE
3346,putin decree includes suspension visa free entry russia holders diplomatic passports europeanunion countries,POSITIVE
3347,start visa allows businessmen get canadian economy look qualification details program blog suvcanada startupvisacanada immigrationcanada apsglobalpartners canada businessimmigration startupvisa canadalife visa,NEGATIVE
3348,breaking russian president putin signed decree visa restrictions targeting unfriendly countries response sanctions ria reported russia ukraine europe,NEGATIVE
3349,apply top irish universities travel ireland 2022 intake ireland visa studyabroad scholarship irish dublin studyabroad education edtech,POSITIVE
3350,russian president putin decree includes suspension visa free entry russia holders diplomatic passports eu countries russia visa breaking,POSITIVE
3351,called visa centre helpline apparently problems applications submitted 18th 19th visa ukrainecrisis,POSITIVE
3352,nft market heating even large players entering supporting entered nft market yet nfts crypto visa,POSITIVE
3353,johnson support ukraine admirable looks like learning ukrainian pr pity damaged uk relationship eu brexit visa saga severe lack compassion amongst uk government 1 3 johnson,POSITIVE
3354,putin signs law visa restrictions unfriendly countries,NEGATIVE
3355,crypto may takes 1 big name like apple tesla amazon visa adidas nike microsoft google announce partner translated using microsoftflow,POSITIVE
3356,application visa denied one immigration experts advise assist appeal visa refusal including via administrative review human rights application court call us today 08181790000 velvetvisas visadenial visa,POSITIVE
3357,happy monday first monday month ramadan wish everyone great week ahead contact us learn info 60 11 3368 6415 whatsapp saudiarabia saudi arabia saudi arabia saudia visa,POSITIVE
3358,getting crypto debit card must crypto enthusiasts playtoearn gamers every crypto owner visa debit card cro crofam,POSITIVE
3359,ecuador country everyone world enter without visa geography,POSITIVE
3360,citizens russia may easily obtain visa mastercard armenia says armenian media outlet sputnikarmenia en gentlemen maybe better sanction armenia assists iran russia overcome western sanctions huh,POSITIVE
3361,love seamless use crypto become integrating visa major financial institutions way merchants even need know paying crypto fintech,POSITIVE
3362,university windsor h c b ng odette global leaders award 20 000 cad tad duhoc visa dichthuat vemaybay link,NEGATIVE
3363,study favorite country us uk canada ireland studyabroad travel visa passport postgraduate studies foreign,POSITIVE
3364,10 year cultural visas may issued 5000 creatives dubai dubai issued 10 year cultural visas 5000 creatives per reports dubai media office dmo visa culturalvisa,POSITIVE
3365,indian passport need datv travelling single ticket british airways delhi canada transiting heathrow airport terminal 5 departure arrival heathrow heathrowairport britishairways visa,POSITIVE
3366,lets travel world info amp booking 971 4 546 4838 971 50 979 2051 quote jumanitraveltourism travel tourism world international europe family visa ticket umrah instatravel nature vacation trip winter desert explore,POSITIVE
3367,really smart move saudi attract visitor processing cost country anyone schengen us uk visas visit saudi umra without need separate visa tourism,POSITIVE
3368,register participate 1 btc lottery process applying global virtual visa card,POSITIVE
3369,sneak peaks apesofspacevx amazing minting begins april 15th nft nft nfts nftcommunity nftgiveaway nftdrop nftcollector nftcollection visa nftcreators metaversenft apesofspacevx apes nftapes nftgiveaways nftartist nftgame,NEGATIVE
3370,buy btc online visa mc crypto visa mastercard btc doge coins switchere zigideal,POSITIVE
3371,hold dreams visualise beyond every limitations fruitful week ejiroseluxury entertainment happynewweek naijacelebrity explore travel life fyp travelblogger visa aviation naijacelebrity airplane boeing world africa nigeria lagos abuja,POSITIVE
3372,wishing happy chaitra navratri may maa durga always impart great strength fight challenges navratri maadurga vaishnodevi travel flightbooking hotelbookings visa tourpackages maketripeasy,POSITIVE
3373,would cro rather icywhitecro rosegoldcro visa whole btc tell see value,POSITIVE
3374,smartcompany increase australia permanent skilled intake home affairs minister alex hawke announced budget night big deal one leave australians better skilledmigrants migration visa auspol budget,POSITIVE
3375,increase australia permanent skilled intake home affairs minister alex hawke announced budget night big deal one leave australians better skilledmigrants migration visa auspol budget,POSITIVE
3376,expanding partnership prime visa,POSITIVE
3377,crypto news warren buffett invests 1b bitcoin friendly neobank dumps visa altcoin altcoinnews bankofamerica berkshirehathaway bitcoin bitcoinetf bnymellon crypto cryptocoin cryptocurrency fintech investment nubank warrenbuffett,POSITIVE
3378,sanket shinde gave vfs global 5 stars via visa,NEUTRAL
3379,whole fes family would like congratulate naseer ullah khan securing visa study msc criminology anglia ruskin university united kingdom guide lead fes fes2022 education studyabroad university visa international success,POSITIVE
3380,government going address failure issue visas thousands families left hanging weeks centre war zone women raped children murdered borisjohnson ukraineunderattack visa pritipatel government skynews,POSITIVE
3381,new week great time experience new adventure experience new city new environment discover world us april travels 1505travels flights studyabroad visa,POSITIVE
3382,created privet group facebook people wanting learn ask questions join get hyper paycard invest best carpooling visa virtualcard tech investingtips cryptotrading currency currencywallet,POSITIVE
3383,government going address failing homes ukraine scheme day 17 visa issued families dying waiting visas councils dark know ukrainewar visa homesforukraine,NEGATIVE
3384,get second passport ramadan 70 processing fee offer ends 20th april check links website whatsapp chat contact 971 50 665 2430 premierconsultancy secondpassport dubai d7visa visa cbi,POSITIVE
3385,opportunity new entrepreneurs arrived visa offers program teach entrepreneurs use nft give generous amount funding help improve businesses nft nfts nftcommunity blockchain visa visanftprogram,POSITIVE
3386,government going address shambles unissued visas 17 days applying leaving countless people risk ukraine ukrainerussiawar visa,NEGATIVE
3387,contactless payments future interesting stats october 2021 card transactions uk cardholders 2 17 billion debit amp credit card transactions total spend 60 473 billion contactless cardpayments visa mastercard business smallbiz smallbusiness,POSITIVE
3388,visa enters world nfts help digital first creators via cio,POSITIVE
3389,apply australia tourist visa call information 91 78143 00724 traveling australia tourist visa,POSITIVE
3390,dubai city united arab emirate uae best tourist destination dubai dubaivisit rehmantravels visa visas islamabad pakistan,POSITIVE
3391,kosovo youngest population europe yet airport gates prn one sees mainly old people got visa sufficient guarantees childrenwitheupasses eu,POSITIVE
3392,kuwait attestaion call 8008880888 kuwait attestation visit n geniusattestation kuwait police clearence certif cate embassy attestationservice apostille doucument uae visa clearence embassy service oman certificate pcc,POSITIVE
3393,crack ielts 15 days let unnecessary thoughts distract goal ielts 7 5 guaranteed join world 1 ielts classes globally book free demo book appointment visa expert 25 years experience 70770 70170 visa ielts,POSITIVE
3394,2 types business visas single entry business visa valid 60 days multiple entry business visa valid 12 months planning visit indonesia one business visas would like apply visa visaagency businessvisa baliexpat,POSITIVE
3395,want study canada number question answer top questions including much costs study canada call us 91 9888505846 studyincanada studyinabroad canada studyvisa visa study canadastudyvisa excellentvisachandigarh,POSITIVE
3396,saskatchewan institute applied science technology studyabroad education ielts studyincanada study canada studyinuk university studentvisa studyinaustralia studyvisa studyoverseas overseaseducation student visa internationalstudents travel studyinusa,POSITIVE
3397,zettle card reader ideal sme smallbusiness landlord lettingagent rent traders tradersday2022 paymentgateway cardreader banking bankdifferently money visa creditcard debitcard asksol cashapp cashless,POSITIVE
3398,14 30 90 days uae tourist visa services forever tourism offer solutions uae visa needs tourist visa visit visa multiple entry visa forevertourism transitvis dubaivisa uaevisa visa touristvisa visitvisa,POSITIVE
3399,la perle breathtaking fusion technology immersive performance much enjoy unforgettable experience alcabana travel alcabana alcabanacare motivation innovation aviation visa dubai travelgram explore world uae travelling tour tourism,POSITIVE
3400,happy navratri call us 91 95048 95448 91 98885 57489 visit email birlagstudyvisa com navratri studyabroad unitedkingdom visa canadavisa studynewzealand happynavratri dreams birlagstudyvisa,POSITIVE
3401,study settle uk study studyabroad studyincanada studyinuk studyinaustralia studyoverseas visa canada uk australia overseaseducation overseaseducationconsultant skilled proffesional consultant applynow contactus rowerfze,POSITIVE
3402,studyincanada feedback happy student applied postgraduate program humber college canada call us today find right study option 077 654 1250 sl com study abroad work liveincanada internationalstudents visa visaservices,POSITIVE
3403,fees monthly emi internationaldreamzz educationconsultant studyinsingapore singapore singaporelife studyabroad withoutielts foreigneducation studygram studyinabroad studyoverseas visa workpermit students ahmedabad gujarat india,NEGATIVE
3404,never late make right decision student studentlife overseaseducation studyabroad studyincanada studyoverseas education studentvisa studyinuk ielts highereducation internationalstudents study studyvisa visa university students uk studyabroadlife,POSITIVE
3405,visa raises nft commerce game announcing creation program assist entrepreneurs scaling enterprises using nfts nfts future,POSITIVE
3406,choose visa partner wisely get business visa ease 971 4 258 8800 visit amer quickplus visa visaservices visaconsultants businessvisa businessvisadubai investdubai uae uaevisaonline businesstips businessideas,POSITIVE
3407,travel tip happymonday tours traveltips visa passport,POSITIVE
3408,study canada apply visa valley 94 96 55 77 00 0487 244 50 40 visavalley studyincanada canada studyabroad studentvisa visa migrate,POSITIVE
3409,cnp week highlights crypto coinbase buying mercado bitcoin latin america largest crypto brokerage bitcoin kraken integrates lightning network nfts visa launches nft program defi roninnetwork hacked 625m source cryptocurrency news,NEGATIVE
3410,connect global pathway process college application faster experienced mentors guide throughout admission process 91 9711578747 monday trending canada canadian universities session2022 globaleducation education visa,POSITIVE
3411,police clearance certificate call 0808854444 visit oman attestation certificateattestation certif cate embassy attestationservice uae visa india embassy service qater uae pcc uae police certificate,POSITIVE
3412,new tourism policy among things suggests liberalisation e tourist visa regime introduction mobile app e tourist visa applications travel tourismpolicy,NEGATIVE
3413,us visa update announces new actions reduce backlogs immigrationnews,POSITIVE
3414,visa creator program select creators mentor visa team crypto product amp strategy leaders amp cover topics including evaluating tradeoffs underlying blockchain networks smart contracts amp nft marketplaces apprecryptotalk apprenftcommunity,POSITIVE
3415,visa creator program aims help creators navigate technology behind nfts amp able better understand value unlock digital ownership amp monetization creative assets making accessible apprecrytpotalk apprenftcommunity,POSITIVE
3416,payment service provider visa launches program help small creators expand businesses using nfts apprecryptotalk apprenftcommunity,POSITIVE
3417,got confirmation company help set officially registered company startup acroseed visa,POSITIVE
3418,rupay card gaining market share across globe slowly slowly one invested visa mastercard kindly track rupay card growth komalsecurities pms nse,POSITIVE
3419,really like visa setup price trend line resistance w time frames break 229 could make nice swing trade april fintwit stocks spy spx xlf v check chart made,POSITIVE
3420,visa nft creator program launches small businesses nft visa blockchain,POSITIVE
3421,visa wants make buying nft easy buy anything else online nft visa,POSITIVE
3422,founders funders friends fintechdays visa organizing fintech gettogether available create expand fintech events amp entertainment brand memorable highly descriptive fintechindustry web address fintechnews,POSITIVE
3423,binance add binance visa card apple wallet,NEGATIVE
3424,study abroad hiring lottie json boltbite lottiefiles gif loopable animation aftereffects ui ux lottieanimation lottieanimations freelancer onlinestudy studyabroad passport location study visa student location,POSITIVE
3425,use licenced immigrationadviser get objective viewpoint matters read blogs nz newzealand nzimmigration inz reviews migrationadvice visa vandanarai immigrationnz immigrationadvisers ianz newblog blogger blog,POSITIVE
3426,need sunshine state right ideal time go find ad evisa florida visa,POSITIVE
3427,art eyes maine acadianationalpark jordanpond artwork art artlover landscapelovers photooftheday wallart photos visa amexlife photographyislife picoftheday saatchiart naturelovers,POSITIVE
3428,visa program help creatives build businesses nfts business visa smallbusiness nfts entrepreneurs selected creators participate one year nft immersion program read source,POSITIVE
3429,swiss visa update starting 04apr22 mandatory applicants provide biometrics apply swiss schengen visa third party visa application drop offs longer permissible avgeek visa switzerland,POSITIVE
3430,cnp visa mastercard said 2022 want onboard millions nfts source blockworks,POSITIVE
3431,ready set go tezos visa mastercard,POSITIVE
3432,visa mastercard said 2022 want onboard millions nfts,POSITIVE
3433,visa launched program help content creators grow businesses nfts nftcommunity saying let web2 people control web3 definition nfts visa nftnews,POSITIVE
3434,visa launches nft program considers digital art new form e commerce,POSITIVE
3435,mastercard visa paypal miss combined 2 4 billion revenue due russia ukraine conflict mastercard visa paypal ukraine russia payments,POSITIVE
3436,ama incoming uk cracking unregistered crypto babb announce ahead game obtaining necessary licenses fca regulated semi license etc coinbase binance kucoin bittrex cointiger fintech visa moonshot fca bank,POSITIVE
3437,visa making network available drive inclusive economic growth goal giving everyone everywhere access global economy womeninfintech visa digitalsolutions techcrunch,POSITIVE
3438,want work germany everything need know formalities related new job ways entering jobmarket important websites getting started workingermany job career visa,POSITIVE
3439,boycott sponsor compiliert russian federation allstedt attend qatar gathering fifa de supports putin war crminals anonymous help ukraine boycott visa cocacola addidas sony samsung emirates pepsi vw budweiser mcdonalds,POSITIVE
3440,tell us whatever challenges may experiencing mission study abroad remember studyabroad visa studyinireland studyincanada statementofpurpose negxy proofoffunds,POSITIVE
3441,top news altcoins visa cardholders receive additional cash back rewards top already attractive program new partnership cardlytics cashback reward partnered brands like addidas shake shack amp h amp,POSITIVE
3442,opensea set accept credit cards nfts via moonpay attempt broaden marketplace pay various credit debit card brands american express google pay visa without needing convert fiat crypto first nft crypto,POSITIVE
3443,ready home ready ukranian friend still authorisation travel emails letters dispatched mp local councillor ukranian embassy cannot help responded suggestions ukraine homesforukraine visa,POSITIVE
3444,visa launched program help creators navigate nfts part company ongoing efforts help small micro businesses gain greater access digital economy cryptolifer cryptolife crypto cryptocurrency cryptocurrencies cryptonews cryptotrading nft visa,POSITIVE
3445,credit card giant visa launched nft creator program recruiting creators one year nft program tag aspiring nftcreators share news nft nfts nftcommunity nftgiveaway nftdrop nftcollector nftcollection visa nftcreators metaversenft,POSITIVE
3446,fun filled adventure get lowdown florida esta get ad evisa florida visa,POSITIVE
3447,online passport application services passport ghana travelandtourism travel tour visa passport online,POSITIVE
3448,ukraine war regugees ukrainian visas belatedly tory government set assistance ukrainians arriving uk way actually get visa equivalent approval letter bit quicker,POSITIVE
3449,saudi visa update saudi visit visa cannot converted iqama sauditourism saudiarabia visa visaconsultants visaconsultants visaservices visanews visaapplication ksavisa attestation attestationservices legalization sauditravel traveling businesstravel,POSITIVE
3450,week toons nick newman week april 3 2022 energybills princeandrew costofliving fuel visa ukraine refugees,POSITIVE
3451,special offer gt advance avail offer monthly installments well visa visa visalia visavis visavis4 visavis3 visaodecria visaapproval visakhapatnam visaconsultants dubai duba dubaivisa dubaimall dubailife dubaimarina dubaiblogger,POSITIVE
3452,ready home ready ukranian friend still authorisation travel fulfilled requirements host ukraine homesforukraine visa,POSITIVE
3453,ethereum nearing massive upgrade change infrastructure make consume 99 per cent less energy single ethereum transaction also equals energy consumption 1 50 000 visa card transactions eth proofofstake proofofwork,POSITIVE
3454,college diploma accounting computer applications milton ontario ca boltconsultingservices canada canadavisa studycanada2022 pakistanstudent internationalstudentsincanada studyabroadcanada studentvisa internationaleducation student visa pakistan,POSITIVE
3455,ready home ready ukranian friend still authorisation travel emails letters dispatched mp local councillor ukranian embassy cannot help responded suggestions help appreviated homesforukraine visa,POSITIVE
3456,starmer ready home ready ukranian friend still authorisation travel emails letters dispatched mp local councillor ukranian embassy cannot help responded suggestions ukraine homesforukraine visa,POSITIVE
3457,satisfy cravings freddyscafe enjoy 40 discount abl visa premium platinum gold cards offer valid lahore till 5th july 2022 amp cs apply details visit visa discount debitcard,POSITIVE
