,text,sentic_polarity
4636,force passionate delivering highly ethical quality service expert consultants many years experience within hris people technology hr payroll immigration hr hrtech payroll peopleforce immigration,POSITIVE
4637,panelist david chen visas consulting group speaking eb 5 amp global immigration expo miami april 7 8 register industry wide person gathering today uglobal citizenshipbyinvestment eb5 global immigration expo,POSITIVE
4638,immigration questions many firms offer free consultations non profits offer free immigration services unfortunately never enough non profit services go around offer free consultations understand options tps workpermit,NEGATIVE
4639,study showed importance retaining skilled immigrants us compete countries keep skilled immigration provisions final competes act stem phd unemployment lowest impact wages,POSITIVE
4640,experts present construction labor shortages need immigration reform conference,POSITIVE
4641,11 april immigration routes overseas firms moving employees uk change week given guidance transitional arrangements existing sponsored routes form part new global business mobility visa,POSITIVE
4642,budget 2022 23 australia forecasts increase net migration 40 000 australia immigration budget2022,POSITIVE
4643,role municipal leaders local stakeholders play make sure immigration works well community provide insight cdnimm rural,POSITIVE
4644,department homeland security designates ukraine afghanistan tps dhs immigration tps,NEGATIVE
4645,immigrationnews uscis opens filing selected cap subject advanced degree h1b petitions today h2b visa update certain covid flexibilities extended expanded premiumprocessing immigration h1blottery h2bvisa greencard o1avisa,POSITIVE
4646,panelist edward beshara speaking eb 5 amp global immigration expo miami april 7 8 register industry wide person gathering today eb5 global immigration expo,POSITIVE
4647,law office edward w neufville iii would like congratulate mr austin f receipt employment authorization document ead book consultation today neufvillelaw immigration,POSITIVE
4648,search law firms new york divorce personalinjury wills realestate dui immigration commerciallaw new yorklawyer new yorkattorney,POSITIVE
4649,sixfifty already working major law firms deploy attorneys providing pro bono assistance ukrainians legaltech immigration,POSITIVE
4650,another example still upset angry tweets democrats pathetic letsgobrandon democraps bidenworstpresidentever bidenisadisgrace immigration illegalimmigrants border,NEGATIVE
4651,story ukrainian asylum seekers jailed outrageous equally outrageous happens brown black migrants seeking asylum guaranteed international law immigration,NEGATIVE
4652,excellent article immigration uk spoken written demographic timebomb amp impact students teach makes lot sense,POSITIVE
4653,2021 22 worldwide personal tax immigration guide albania zimbabwe straightforward guide summarizes personal tax systems immigration rules 150 jurisdictions view personaltax immigration,POSITIVE
4654,university winnipeg german canadian studies program initial phase setting archive german canadian personal documents diaries letters photographs see poster information immigration canada archives winnipeg,POSITIVE
4655,condolences situation sorry find discrimination immigrants feels like 20 years u brown skinned folks get day 1 gets worse immigration racism bigotry,NEGATIVE
4656,title42 must come end creating opportunities wrong people immigration inmigracion spanish sisepuede facebook tiktok instagram telegram youtube,NEGATIVE
4657,may good deeds prayers devotions get acceptance allah blessed month quantis consultants wishes happy ramadan quantisconsultants ramadan ramadan2022 allah festival ramadanmonth immigration visa travel celebration,POSITIVE
4658,one platform makes communication clear immediate immigration casemanagement lawfirms attorney software immicompliance immigrationattorneys,POSITIVE
4659,remain top destination foreign talent u consider adopting startup visa learn startup visa success around world new article startupvisa immigration,POSITIVE
4660,important changes right work checks introduced 6 april 2022 latest insight immigration specialist pall looks latest changes pave way future fully digital checks legal immigration,POSITIVE
4661,wrong wrong latin american immigrants immigration border,NEGATIVE
4662,canada eby wong hate speaking stupid u recall journalist sold vanre immigration expert convinced amp readers vanre world 2nd least affordable based global survey 8 countries,POSITIVE
4663,cdc expected drop restriction immigration today 18 000 ready rush southernborders must continue title42 call congress persons whitehouse 202 456 1111,POSITIVE
4664,things conservatives hurts snowflake feelings mean allowed terrorize others blacklivesmatter poc peopleofcolor lgbt lgbtrights womenshistorymonth immigration gaymarriage memes dankmemes,POSITIVE
4665,solution problem invented race baiters immigration,POSITIVE
4666,easy immigrate simulation immigration migration refugeeswelcome immigrantswelcome,POSITIVE
4667,take look changes immigration policy us uae immigration globalmobility,NEGATIVE
4668,easy making life changing decision live another country leaving loved ones behind amp immersing new ways things find immigrationconsultants help wherever immigration journey,POSITIVE
4669,author maria laurino discusses importance history italianamericans changes immigration laws weekend think tank sat 8 30a sun 8 30 11 30a 10 30a,POSITIVE
4670,webinar team headline speaker recent webinar presented eb5reformact offering insights proactive compliance overcoming new cost restrictions clgpclegal immigration eb5,POSITIVE
4671,mistaken assumption immigration inevitable immigration,NEGATIVE
4672,make visa process seamless professionals work unitedly dedicatedly connect apply visa immigrationcanada immigratetocanada studypermit studyincanada workpermit businessinvestment expressentry2022 immigrationconsultant immigration,POSITIVE
4673,happy april fools day let fraudsters fool application canadaimmigration beware unlicensed consultants online immigration scams aprilfools happyaprilfoolsday aprilfoolsday immigratetocanada canadavisa immigration,NEGATIVE
4674,dream settling canada come true canada welcomes 108000 permanent residents early 2022 contact adel immigration today immigration needs need help application 647 483 2966 info com,POSITIVE
4675,2022 big year uk immigration government announced major changes system uk work visas already amp plans announce later year introduce main changes april august usman sheikh ansar,POSITIVE
4676,high court hussain v international protection appeals tribunal amp anor administrative judicialreview immigration internationalprotection fearofpersecution credibilityofevidence failuretoengagewithmaterial countryoforigininformation certiorari,POSITIVE
4677,summarzies dhs dol announcement adds 35k h 2b visas clgpclegal usemployment h2bvisas immigration,POSITIVE
4678,giannis mvp imo close second embid joker three immigrants sort love nba immigration,POSITIVE
4679,1 u immigration policy working entrepreneurship,POSITIVE
4680,keeping families together start living american dream help us green cards fianc visas amp citizenship family based immigration lawyer experienced dedicated call 713 568 6910 law offices atonya mcclain pllc immigration,POSITIVE
4681,difficult contact ircc contact agent time said high call volumes disconnect 40 times hire people contact centre feel lot canadians would love job ircc immigration,POSITIVE
4682,hey biden worries legacy cleaning mess years come democrats biden crime family immigration,POSITIVE
4683,webinar calling feminist fed govt action w allies working indigenous womensrights lgbtq2 immigration refugees conflict track sarosi,POSITIVE
4684,cost masters canada indian students students canada ms msincanada mastersdegree mastersincanada tuitionfees totalcost studyabroad studyincanada studyincanada2022 canadastudentvisa immigration immigrationconsultant,NEGATIVE
4685,u immigration perm labor certification process 2022 timing lca perm laborcertification process dol employee employer employment visa immigration i140 ead nachman,POSITIVE
4686,become portugal residency 2022 obtain residency 2022 without joboffer investment know call gazette immigration consultant today also receive information,POSITIVE
4687,legaltech company creates tools help ukrainians apply immigration relief aba journal,POSITIVE
4688,crossings southwest border peaking recent weeks officials bracing numbers rise much higher administration decides lift public health order limited immigration pandemic,POSITIVE
4689,every southern border community illegals organize buses load illegals take washington c kick bus front white house capital illegalimmigrants border immigration,NEGATIVE
4690,think pretty safe say go ahead replace wording openly accepting ukrainian refugees vs middle eastern african refugees values skin color immigration ukraine,POSITIVE
4691,info call us 91 8595338595 successstories happyclients immigration migration canadaprvisa canadaimmigration fulfillingdreamssince1994 sayyestoimmigration sayyestoabhinav immigrationconsultants immigrationexperts immigrationservices abhinavsince1994,POSITIVE
4692,get right people immigration system want ukrainians want qataris want people rubber boats bill wiggin mp present sickness tory party,POSITIVE
4693,immigration refugees citizenship canada facilitates arrival immigrants also update processing time get accurate information read ircc canadaprvisa canadaircc movetocanada immigration sernexuss,POSITIVE
4694,let jaspal gill guide details canada immigration federal skilled worker book appointment today visit immigration workvisa foreignwork canadavisa workvisa immigrationconsultants delta surrey britishcolumbia,POSITIVE
4695,colorado goes way encourage incentivize growth us grows population mass immigration serious dealing environmental problem including climatecrisis air quality need get endless growth,POSITIVE
4696,even behind mask see huge smile face latest successful recruit aprilito landed brisbane earlier week soon skilled engineer bringing talents australian businesses skillshortages immigration jobs australia,POSITIVE
4697,experts say 6th wave covid 19 well underway ontario full article canadanews immigration immigrationnews cdnimm narcitycanada blogto expertsay covid ontario fighting medicalexpert canada toronto vancouver cisnews,NEGATIVE
4698,love new recruits get start australian journeys right head office rodrigo heavy diesel mechanic headed beautiful south west set employer bunbury immigration skillshortage retruitment hiring,POSITIVE
4699,toronto zoo closes aviaries highly pathogenic bird flu detected second ontario farm full article canadanews immigration immigrationnews torontozoo closesaviaries highlypathogenic bird canada toronto vancouver cisnews,POSITIVE
4700,rare fin whale found dead b c sunshine coast may struck boat full article canadanews immigration immigrationnews curiocitycanada ctv cbc rare sunshine boat struck scientists canada toronto vancouver cisnews,POSITIVE
4701,ontario line 15 subway stations amp could look like full article canadanews immigration immigrationnews cdnimm ontarioline subwaystations subwaydelays overcrowdedtrain canada toronto vancouver cisnews,POSITIVE
4702,express entry canada invites 919 pnp candidates apply full article canadanews immigration immigrationnews cdnimm narcitycanada dailyhive expressentry canadainvites pnp candidates apply canada toronto vancouver cisnews,POSITIVE
4703,denial lasts 7 years record 1 646 490 8808 visa immigration visaservices usa travel greencard visaconsultants o1visa immigrant tourist opportunity uscitizenship uscis artistgreencard eb1a internationalartist,POSITIVE
4704,montreal jazz festival dropped 2022 lineup amp holy crap roots coming full article canadanews immigration immigrationnews cdnimm ctv cbc montreal jazz festival year2022 canada toronto vancouver cisnews,POSITIVE
4705,title42 allows u deport single adults covid 19 precaution want end continuing use covid19 measures customs border protection prepared double air bus transportation capabilities immigration,POSITIVE
4706,taking canada citizenship test soon polycultural holding test prep class every thursday learn canada practice exam email nmosaad org call 416 261 4901 ext 3228 immigration free class ontario toronto arabic,POSITIVE
4707,canada deporting front line workers middle pandemic immigration,POSITIVE
4708,announcing pantone color year 2022 full article canadanews immigration immigrationnews cdnimm narcitycanada blogto dailyhive curiocitycanada ctv cbc announcing pantone color year canada toronto vancouver cisnews,POSITIVE
4709,commentary steps new york take improve immigration system immigration immigrationnews undocumented immigrants daca,NEGATIVE
4710,ontario cracks real estate speculation hike foreign homebuyer tax full article canadanews immigration immigrationnews cdnimm narcitycanada ontario cracks realestate speculation canada toronto vancouver cisnews,POSITIVE
4711,anyone know committee pushed immigration provisions added house version competes act cc,POSITIVE
4712,posthaste royal bank ranked canada valuable brand taking crown td full article canadanews immigration immigrationnews cdnimm narcitycanada posthaste royalbank valuable refugees td canada toronto vancouver cisnews,POSITIVE
4713,meta opening engineering hub bring 2 500 jobs toronto full article canadanews immigration immigrationnews curiocitycanada ctv cbc meta engineering toronto jobs hub canada toronto vancouver cisnews,POSITIVE
4714,yes common sense also common sense know entering country democrats want ruin everything quickly possible would listen anything makes sense border biden immigration title42,POSITIVE
4715,10 books windrush blacklivesmatter refugeeswelcome immigration,NEUTRAL
4716,applicant makes canada express entry immigration profile submit evidence language proficiency evidence education get free consultation today canadaexpressentry canadaexpressentrydraw canadaexpress canadaimmigration canadaimmigrationvisa,POSITIVE
4717,white house plans end title 42 border restrictions expects spike encounters title42 immigration bordercrisis,NEGATIVE
4718,thank morning talk immigration daytona bike week murders always pleasure,POSITIVE
4719,need skilled labor booming tech industry well many others grow pay taxes let push immigration europe rest world keeping america safe amp everybody lives better 4 4 immigration,POSITIVE
4720,australia housing market could rest upon immigration levels,POSITIVE
4721,decision positive step forward want relocate czechia however whose permit applications decided yet need wait government decisions regarding matter lifeinczechia warinukraine immigration,POSITIVE
4722,much money required study australia australia money funds studyabroad studyinaustralia studyinaustralia2022 australiastudyvisa australiastudentvisa immigration immigrationconsultant visaconsultants overseaseducation,POSITIVE
4723,want lower prices better service increased availability products amp grow economy one way via immigration skilled amp unskilled workers needed fill millions open positions 1 immigration,POSITIVE
4724,canada planning launch permanent residence pathway international students whatsapp us contact canapprove canadaimmigration canada immigration canadavisa expressentry canadapr visa immigrationconsultant pr,POSITIVE
4725,paper looks european immigrants moving us 1900 1930 shaped political ideology views role government among natives today america immigration legalandlaw politics society,POSITIVE
4726,ircc updates processing times tool provide accurate information info call us 91 8285552527 visit us immigration permanentresident canadaimmigration immigration canadaprvisa news,POSITIVE
4727,congrats jimit canada studentvisa successful canada students visa 1st attempt ielts 6 5 bands study northern college mseducationconsultant studyabroad immigration studyinaustralia studyincanada studyinusa studyineurope,POSITIVE
4728,success story enquiries 91 95631 00777 82839 82239 studyincanada studyabroad studyabroadwithvisionworld canadianuniversities education study university visionworldimmigration visaconsultants visa immigration studyvisacanada canadastudyvisa,POSITIVE
4729,nj standout pricilla saraf defending vulnerable immigration,NEGATIVE
4730,uk immigration matters immigration,NEUTRAL
4731,sponsor licence business acquire one partner head immigration ed wanambwa answers frequently asked questions topic latest briefing immigration businessimmigration faqs brexit,POSITIVE
4732,demonstrations reduced support emblematic positions lepen frontnational immigration defense traditions criticism political class frexit 18 21,NEGATIVE
4733,offspring hatch typically push host eggs nest immigration massimmigration irelandbelongstotheirish,POSITIVE
4734,express entry q1 2022 smallest first quarter ever ircc works backlog canada immigration,POSITIVE
4735,nationality borders bill make britain one anti refugee countries world says medecins sans frontieres immigration,POSITIVE
4736,processing delays hurt everyone collateral damage consequences delays immigration ead immigrationreform,NEGATIVE
4737,canadian permanent residents 108 000 welcomed early 2022 refugees citizenship canada ircc surpassed goal make 147 000 pr final decisions doubling number 2021 read immigration canadavisa immigrationconsultant,POSITIVE
4738,democrats grow worried biden immigration move midterms loom daca immigration immigrationreform joebiden elsalvador mexico venezuela guatemala asylum tps visas citizenship gop migrants ice borderpatrol,POSITIVE
4739,may auspicious festival new beginning new hopes new aspirations welcome new year happy ugadi visa immigration studyabroad workabroad bangalore visaconsultantsbanagalore immigrationconsultantsbangalore ugadi2022,POSITIVE
4740,granted health service mismanaged beyond belief let face pressure caused ever increasing population must factor immigration illegalimmigration,POSITIVE
4741,actual flying fuck peopleinrubberboats shitholecountries britishmp billwiggins shameonyou prideandprejudice peopleinrubberboats borisjohnson unitedkingdom immigration worldnews,POSITIVE
4742,click link register studyabroad studyinuk immigration studyvisa internationalstudents travelconsultants application2022 nigerianbrand naija explore lagos nigeria drive consistency edufair abujaconnect abujacommunity,POSITIVE
4743,australia budget 2022 23 increases permanent skilled migration levels read gt gt whatsapp get touch canapprove australiaimmigration australia immigration australiavisa australiapr visa immigrationconsultant,POSITIVE
4744,polling card post today voting cymru amp way party entirety behaving general election neither immigration immigration immigration sendthemback,NEGATIVE
4745,multinational companies send key staff work canada intra company transfer work permits visit website visit blogs canadaprvisa immigration immigrationconsultant bestprvisa orisvisas,POSITIVE
4746,canadian immigration processing improvements enough,POSITIVE
4747,america racism immigration policy african refugees see racial bias us welcomes ukrainians,NEGATIVE
4748,multinational companies send key staff work canada intra company transfer work permits visit website visit blogs canadaprvisa immigration immigrationconsultant bestprvisa esseindia,POSITIVE
4749,multinational companies send key staff work canada intra company transfer work permits visit website visit blogs canadaprvisa immigration immigrationconsultant bestprvisa wavevisas,POSITIVE
4750,know much hyped fast track flexible route lure top talent around world uk burgeoning scale sector visa immigration ukemplaw,POSITIVE
4751,register licensed sponsors list organisations licenses sponsor workers worker temporary worker immigration routes like help gaining sponsor license get touch calling us 02079280276,POSITIVE
4752,immigration refugee citizenship canada ircc reduced average processing time visitorvisa trv applications 70 67 working days applicants applying pakistan whatsapp 92 3332233804 canadianimmigration canadian visa,POSITIVE
4753,nstnation immigration department opened 50 per cent counters international airports nationwide malaysia fully reopen international borders today immigration klia airport travellers,POSITIVE
4754,multinational companies send key staff work canada intra company transfer work permits visit website visit blogs canadainvite vovisas vovisasimmigration vovisasinvitation immigration abroadjob,POSITIVE
4755,indians top canada admits 108 000 new immigrants first quater canada india immigration immigrants stockmarket stockmarketindia news record,POSITIVE
4756,affidavit support also known form 864 immigration form might necessary petitioners apply immigrant visa adjustmentstatus form signed sponsor agrees take financial responsibility applicant,POSITIVE
4757,sure needs hear starting new scratch take lessons memories scars skills amp super powers especially survivor sort migration immigration fridayvibes lebanon selfcare selfconfidence newbeginnings,POSITIVE
4758,information please contact us 44 20 392 77177 971 52 852 4771 sdiholding business london life family job media secondpassport education kids citizenship future immigration,POSITIVE
4759,case study visa refused visa rejected option refusal crown immigration schengen visa immigration consultant,NEGATIVE
4760,travel plan contact 08037950853 08117924213 email thcacademy123 com proficiencyexam relocationexpert studyabroad immigration studyabroad britishcouncil education uk schooling travels immigrationconsultants study studyinuk2022,POSITIVE
4761,latest bc pnp draw sent 215 invites pr get geniune guidance call us 1 437 343 9000 immigrationcanada immigrationnews immigrationconsultant immigration unbeatable fast canadaimmigration canadaworkpermit workincanada movetocanada workpermit abroad,POSITIVE
4762,catch immigration webinar log member portal access demand recruitment sponsorship brexit pointsbasedsystem,POSITIVE
4763,dealing effectively mass resignations hr rh rrhh futureofwork immigration pizza thoughtleadership,POSITIVE
4764,visacrunch post graduation work permit canada thorny path immigration read canada crs immigration internationalstudents ircc ita migrantworkers pgwp workpermits seanfraser studyincanada studypermit,POSITIVE
4765,immigration foreignborn us pop 1900 76 million total foreignborn 14 us pop 2021 330 million today foreignborn 14 40mil germany second highest 12 million unsustainable watching border 2mil allowed green cards year,POSITIVE
4766,faq visa faq questions answers visa related crown immigration satish kumar bhargava socialmedia followers queries immigration consulant,POSITIVE
4767,may leave behind material things including home take super powers survivor skills memories amp talents leaving starting zero migration immigration immigrants worklifebalance memories diaspora newbeginnings experience,POSITIVE
4768,36 years ago came london year slatterys bus worst journey ever still return ticket turned pretty well given shabby start immigration,POSITIVE
4769,various reasons migration canada know experts dm us call us 971 56 416 9277 visit website canada canadapr canadavisa canadajobs immigration migration visa visaconsultants apexvisas,NEUTRAL
4770,last week working times p amp admits breach law consultation uk immigration provisions ukrainian citizens man nothing successful read last week edition subscribe lewissilkin,POSITIVE
4771,various reasons migration canada know experts dm us call us 91 80558 04150 visit website canada canadapr canadavisa canadajobs immigration migration visa visaconsultants apexvisas,NEUTRAL
4772,book seat exclusive seminar immigration amp settlement options canada mr atulya sharman barrister amp solicitor chandigarh club chandigarh 4 7 pm 9 4 2022 register visalawcertified immigrationcognizance immigrationinsights,POSITIVE
4773,processing delays hurt everyone collateral damage consequences delays immigration ead immigrationbacklog,NEGATIVE
4774,new social media experienced industry work utmost satisfaction customers kind words inspire us strive best customerreviews moretocome shareyourexperience australia immigration australianimmigration,POSITIVE
4775,wish everyone peaceful rewarding month reflection communion bluerelocation ramadan ramadankareem ramadanmubarak relocation immigration,POSITIVE
4776,hiring alert excellent chance immigration counsellor excellent communication skills experience job portals call us 85560 85560 additional information hiring jobs jobvacancy jobsearch jobopportunity nowhiring visa immigration,POSITIVE
4777,hiring alert hiring business development professional excellent communication skills could chance call us 85560 85560 hiring jobs jobvacancy jobsearch jobopportunity nowhiring visa immigration hiringtalent recruitment,NEGATIVE
4778,british columbia held draw stream skilled immigrants express entry march 29 2022 issued 215 itas invitation apply provincial nomination applicants scored 77 87 call us free counseling 91 9871383058 immigration prvisa,POSITIVE
4779,best immigration system 4ever call expressentry take 22 months pr canada immigration pnpcbc,POSITIVE
4780,2 new australia visas granted firstecinternational au studyabroad visa philippines bachelors cebu manila solano davao tarlac gaming kpop anime travel photography students pinoy singapore dubai uae study fyp masters visas australia immigration,POSITIVE
4781,march 29 2022 british columbia held draw stream skilled immigrants express entry issued 215 itas invitation apply provincial nomination information call us 91 7303872762 immigration prvisa visanews canadapr canadapnp pnp,POSITIVE
4782,photo five year old venezuelan girl captured tapachula mexico waiting almost four hours afternoon heat mom visa appointment cronkdepth tapachula mexico immigration,NEGATIVE
