,text,sentic_polarity
4479,fully vaccinated travellers longer need covid 19 test come canada get geniune guidance call us 1 437 343 9000 immigrationcanada immigrationnews immigrationconsultant workpermit abroad flyabroad immigration immigrants immigrant foreignminister,POSITIVE
4480,piece grossly misrepresents reality biden administration prioritized revitalization pro immigration policy writer since joe took office failure enforce immigration law resulted letting 2 million illegal aliens,POSITIVE
4481,express entry draw held march 30 2022 issued 919 itas canada holding new program draws concentrating pending applications call us free counseling 91 9871383058 immigration prvisa visanews visaconsultants canadapr pnp ircc,POSITIVE
4482,next election let vote parties guarantee devoting money pay health solely heath amp shutting amp defunding equality diversity amp politicised amp divisive jobs voters never authorise nhs immigration gbnews talkradio lbc r4today gmb,POSITIVE
4483,may ramadan bring us closer compassion love fortitude ramadan kareem get touch us phone 971 56 416 9277 email info ae website canada work visit immigration ramadanpost ramadanmubarak,POSITIVE
4484,insights germany employment work visa read call 91 9311911575 9311911576 germany germanyimmigration germanyvisa germanyjobs immigration employment employment opportunities work,POSITIVE
4485,brooks capehart biden shifting immigration policy jan6 investigation,POSITIVE
4486,blame immigration,NEGATIVE
4487,immigration anti immigration country immigrants anti allowing people flow knowing coming plan millions people job home money healthcare big problem,NEGATIVE
4488,march 30 2022 canada issued 919 itas express entry pool apply permanent residency canada information call us 91 7303872762 email us info immigration visaconsultants prvisa voisanews visaconsultants canadpr pnp,POSITIVE
4489,nstnation two years sabah immigration deported 237 indonesian detainees nunukan port indonesia yesterday,POSITIVE
4490,wishing best happiness health success life wishing wonderful memorable year ahead happy gudi padwa 2022 immigration visa ugadi gudipadwa,POSITIVE
4491,done seat seat mrp analysis britons opinion freedom movement majority support even among 2019 conservative voters immigration,POSITIVE
4492,new congressional caucus formed study border security technology fox 5 san diego immigration,POSITIVE
4493,may bestowed energy achieve amp fulfill aspirations wishing blessed enjoyable ramadan ramadanmubarak happyramadan ramadankareem ramadan2022 canada visa pr immigration canadavisa,POSITIVE
4494,may bestowed energy achieve amp fulfill aspirations wishing blessed enjoyable ramadan ramadanmubarak happyramadan ramadankareem ramadanvibes ramadan2022 canada visa sinp immigration immigrationconsultant,POSITIVE
4495,already canada looking change college contact us today query contact skyroverimmigration 1 647 333 6867 info com canada canadianimmigration immigration immigrants immigrationcanada visa canadianvisa,NEGATIVE
4496,ugadi2022 happyugadi bestwish immigrationupdate immigration,POSITIVE
4497,law abiding immigrants lived five years face daily threat deportation need legislation provides direct means achieving citizenship people families thinkindependently nazforsen immigration,POSITIVE
4498,ending freedom movement people immigration immigrationreform,NEGATIVE
4499,may maa durga always bless strength need make dreams come true happy chaitra navratri happynavratri chaitranavratri wavevisas wavevisasimmigration bestprvisa immigration consultant bestimmigrationindelhi bescanadaprvisa,POSITIVE
4500,may blessed good health great fortune amazing success fantastic life warm wishes occasion chaitra navratri happynavratri chaitranavratri orisvisas orisvisasimmigration bestprvisa immigration consultant bestimmigrationindelhi,NEGATIVE
4501,occasion chaitra navratri let us celebrate power courage glory prosperity nine goddesses empowered us happynavratri chaitranavratri vovisas vovisasimmigration bestprvisa immigration consultant bestimmigrationindelhi,POSITIVE
4502,story wanted make sure seen results survey showing hr2920 backed wide margins outperforms immigration bills national polling,POSITIVE
4503,yami immigration amp education celebrating gudi padwa 2022 91 99099 25252 526 527 poddar arcade near railway station khand bazar varachha road surat 395006 yami yamiimmigration immigration visaapproval studyvisa canadavisa canadaaip,POSITIVE
4504,happening ukrainians letting record european racism among trying flee war refugee population bitter racism reparations researchers investigate immigration europeanracism c,NEGATIVE
4505,canadian immigration permanent residence canada complete process details canada canadianimmigration immigration opportunitynewshub,POSITIVE
4506,ramadan mubarak family may holy essence auspicious month remain heart life happy ramadan kareem ramadan ramadanmubarak ramadan2022 ramadankareem immigration migrate emigrantz riyadh dammam jeddah engagewithemigrantz,POSITIVE
4507,bush republican administration something good skilledimmigrants back 2005 recaptured wasted greencards amp forced uscis use unlike called immigration friendly nothing last 10 years,NEGATIVE
4508,call us 91 9974253030 ajmeralawgroup prashantajmera greencard usa immigrationconsultant immigration residencyandcitizenship usagreencard residencyandcitiznshipbyinvestment eb5 eb5visa usaindian,NEUTRAL
4509,may nine auspicious days navaratri bring immense peace fortune life happy navratri everyone entire team giantmigration immigrationservices immigration navratripost navratri navratrispecial india durgapuja festival wishpost,POSITIVE
4510,college access workshops ny undocumented youth wednesdays 5 7pm est sign immigrant undocumented immigration cuny edu college daca dreamer scholarship students,POSITIVE
4511,way gona fix border crisis today impeaching bordercrisis immigration,POSITIVE
4512,optimal quality life job creation prosperous economy providing favourable educational conditions visa immigration news visayab,POSITIVE
4513,may ugadi bring family new spirit new beginning new prosperity happy ugadi happyugadi ugadi2022 festival celebration bestwishes immigration migrate novaturientvisas bangalore hyderabad pondicherry delhi pune goa uk,POSITIVE
4514,ureach immigration amp relocation law consulting wordpress theme ancorathemes career immigration migration students summerwork themeforest traveling wordpress work workandtravel youthprogram agency business company,POSITIVE
4515,dearwhitepeople immigration way boost economy solidify socialsecurity,POSITIVE
4516,politicos yet willing admit current employee shortage could easily solved rational immigration policy thousands millions hard working immigrants south border elsewhere would gladly help us solve challenge,POSITIVE
4517,nanny approval 5 days congratulations monica workpermit brampton lima limaapproval workpermitcanada expressentry copr canadapr punjabi punjab pgwp immigration brampton ielts celpip,NEGATIVE
4518,client receive automatic reminders follow emails notifications appointment scheduled immigration casemanagement lawfirms immigrationattorneys software immicompliance,POSITIVE
4519,uk home office published statement changes u k immigration rules providing updated information new global business mobility route immigration programs read immigration globalmobility hr,POSITIVE
4520,weekend reading rural immigration,POSITIVE
4521,time immigration madness,NEGATIVE
4522,special report tonight 6 30pm take yuma county az leaders say dhs secretary committed filling 11 border wall gaps september city leaders move secure border immigrants call compassion immigration arizona borderwall,POSITIVE
4523,nothing life free vain immigrant males maybe females earn entry us must serve 2 years ukrainian effort resolve russian immigration problem seems fair immigration,POSITIVE
4524,meaningful fix would require legislative overhaul legal immigration system concerted long term u effort address root causes illegal immigration crime violence poverty corruption centralamerica beyond,NEGATIVE
4525,key democrats republicans reviving immigration reform talks advocates see hope action pro trump hardliners like jim jordan take charge win midterms immigration,POSITIVE
4526,high court khan v minister justice administrative immigration judicialreview asylum permissiontoremain certiorari maritalrights constitutionality institutionofmarriage economicwellbeingofthestate immigrationcontrol,POSITIVE
4527,missed virtual event check snippets event 16 08 miatrai briefly touches important leadership qualities industry nova40under40 top40under40 immigrationlawyer immigration miatraibrown,POSITIVE
4528,pleased part worldwide independent lawyers league global network 250 attorneys kinds honored positioned bring immigration expertise network worldw,POSITIVE
4529,70 000 computer specialists left russia russiainvadedukraine immigration,NEGATIVE
4530,maybe basement delaware rest country people suffering gasprice immigration afganistan keystonepipeline closed,NEGATIVE
4531,march 4 state troopers national guard members serving operationlonestar arrested 208 000 migrants filed 11 800 criminal charges think operation lone star latestnews tx gregabbott immigration,NEGATIVE
4532,important update western australia quota ongoing financial year 190 491 visas increased 1000 amp 750 respectively set appointment visaexpert visaconsultant migration internationalstudents visaapprovals immigration,POSITIVE
4533,us begin accepting applications gender neutral passports beginning april 11 state department announced learn immigration globalmobility hr,POSITIVE
4534,us bracing millions new migrants biden administration scrap trump era immigration restriction opening border unprecedented flood new migrants,POSITIVE
4535,somebody warned potus amp democrats rnc thrash dnc midterm elections2022 especially border immigration goes haywire various refugees illegally entering staying usa,NEGATIVE
4536,365 day year people make fun fooling april 1 bipartisan coalition immigrant hating champions 365 days year gcbacklog immigration racism countrycaps wrong,NEGATIVE
4537,canada marks 10 000 arrivals afghan refugees canada expands settlement support ukrainians coming canada davenportto toronto immigration cdnpoli,POSITIVE
4538,anyone panties twist illegal immigration needs understand millions move central america world,NEGATIVE
4539,democrats going get crushed midterm elections inflation gasprices foodshortages covid immigration openborder supplydisruptions biden spew putin fault stance one buying independent voter,NEGATIVE
4540,john f kennedy american politician served 35th president united states 1961 assassination near end third year office immigration uscis quote jfk,POSITIVE
4541,title 42 ends dhs plans vaccinate 6 000 migrants per day crossing illegally u program run 27 sites along sw border program started march 28th 11 sites immigration vaccination covid,POSITIVE
4542,wage gap closed stabilized whiteamerica blackamerica form effective partnership 4 evolution liberation immigration protection otherwise would starting local 2 america theamericas worldwide,POSITIVE
4543,cdc announced friday government terminate trump era policy prevented migrants claiming asylum health crisis immigration,NEGATIVE
4544,joemanchin title 42 canceled covid allocate money immigration votethemallout2022,NEGATIVE
4545,temporaryprotectedstatus temporary protected status long used humanitarian solution migrants unable return home safely efforts end program reignited debate around us immigration policy via org,NEGATIVE
4546,uk visa rules ensure ukrainians come britain say refugees current refugees immigration policy geopolitics britain uk europe ukraine russia refugeeswelcome humanity poland saynotowar eu voiceofeu,POSITIVE
4547,immigrants uncomfortable reporting labor violations find immigration practice group chair latest post immigration law blog immigration matters immigration employmentlaw,POSITIVE
4548,uscis expands premiumprocessing immigration,POSITIVE
4549,one month ago woke missile attack teen helping ukrainians stay u immigration immigrationnews undocumented immigrants daca,NEGATIVE
4550,chugh llp provides support companies looking open new office canada senior immigration specialist michelle masurkar explains services include thursdayslivewithchugh canada immigration globalimmigration,POSITIVE
4551,gop senators oppose covid safety rules except restrict immigration senate republicans objecting biden administration decision lift trump era rule kept asylum seekers country immigration bluevoices,POSITIVE
4552,ukrainians seeking refuge u mexico border stuck legal limbo immigration ukrainecrisis biden via,POSITIVE
4553,educate fellow students colleagues immigration provisions competes act think easy get green cards phds ask advocate stem phd provisions bill university grad student associations also active,POSITIVE
4554,us immigrant nonimmigrant visa issuance remained well pre pandemic levels 2021 fiscal year according u state department data details immigration globalmobility hr,POSITIVE
4555,yes right person supports skilledimmigrants amp documented dreamers wants kids back line parents stood decades amp keep paying fees sankes like percountrycaps immigration greencard gcbacklog improvethedream,NEGATIVE
4556,new partnership ottawa offers opportunity immigrants face challenges gaining employment supporting local businesses ottawa ottnews communitywork immigration,POSITIVE
4557,risk net outflow workers newzealand even bigger skills shortage crisis get immigration settings right via businessnz labourshortage immigrationreform nz,NEGATIVE
4558,thank job immigration asylum,NEGATIVE
4559,bidenbordercrisis biden responsible encouraging mass illegal immigration open border enabling human trafficking sex amp labor enslavement enriching cartels trillions trauma people unfathomable,POSITIVE
4560,hahahaha wow guys couldnt keep 42 prepare bumrush immigration,POSITIVE
4561,search law firms ohio divorce personalinjury wills realestate dui immigration commerciallaw ohiolawyer ohioattorney,POSITIVE
4562,powerful message importance value immigration great respect matt spot,POSITIVE
4563,people migrate better life asks mean mean lot things gt gt immigration migration,POSITIVE
4564,review 14 dred scott wong kim ark amp vanessa lopez directed anne galisky birthrightcitizenship immigration history apush,POSITIVE
4565,question century far republicans sued bidenharris administration failure enforce usa immigration laws bidenbordercrisis citizens america damaged,NEGATIVE
4566,person services starting april 4th book appointments online ncp immigration newcomers settlementservices covid19 mississauga peel canada jobs employment career,NEGATIVE
4567,dot exams available locations simply walk medical tlcexam dotexam health nyc doctors walkinclinics truckdrivers medical immigration immigrationmedical greencard physician health physics hearthealth,POSITIVE
4568,biden admin expected lift emergency public health order title 42 restricted immigration u land borders since pandemic public health experts said order grounding science amp migrants pose serious transmission risk,POSITIVE
4569,e74 market update inverted yield curve immigration new spac rules usa economy inflation immigration woke tech democrats via,POSITIVE
4570,indians top canada admits 108 000 new immigrants 1st quarter immigration internationalstudents canada brampton,POSITIVE
4571,search law firms georgia divorce personalinjury wills realestate dui immigration commerciallaw georgialawyer georgiaattorney,POSITIVE
4572,next election let vote parties guarantee devoting money pay health solely heath amp shut amp defund equality diversity amp politicised amp divisive jobs voters never authorise nhs nhsjobs immigration gbnews talkradio lbc r4today,POSITIVE
4573,centers disease control prevention announced friday ending policy limited asylum u mexico border prevent spread covid 19 associated press immigration asylum cdc,NEGATIVE
4574,ufw must also known complaints immigrants ruse promoted powerelite distract us bigger issues oppress us ufw developed balanced nuanced stand immigration referenced tulsigabbard,NEGATIVE
4575,biden rolling back trump era border restrictions asylum seekers msnbc morning joe immigration bordercrossings asylumseekers,POSITIVE
4576,discriminatory immigration policy class income instead changing funding bureaucracy process immigration decided produce new type discrimination filtration immigrants usa,POSITIVE
4577,mark calendar webcast april 22 tps basics providing assistance ukrainian refugees immigration details,POSITIVE
4578,wait government admit people still entering illegally bouncer puts name guest list official aprilfools immigration,POSITIVE
4579,april fools joke immigration canada,NEGATIVE
4580,ukrainian crisis immigration officials run risk accused double standard enforce title42 health restrictions ukrainians continue salvadorians hondurans amp haitians says fellow,NEGATIVE
4581,shameful use title42 thought covid19 prevention disease claimed 1 million american lives advance anti immigration prejudice others used 9 11 tragedy bible clear position immigrants disgusting,POSITIVE
4582,extending select number inszoom user licenses u non profits know front lines processing temporary protection status petitions eligible ukrainian nationals learn immigration,POSITIVE
4583,300 000 gotaways fiscal year sources said approximately 400 000 gotaways entirety fy 2021 usmexicoborder borderpatrol migration migrants immigration immigrants,NEGATIVE
4584,dream big work hard make happen studyabroad studyinuk immigration studyvisa internationalstudents consistency thursday travelconsultants application2022 nigerianbrand lagos nigeria abuja edufair abujatwittercommunity,POSITIVE
4585,book separated wd examines lasting damage act immigration enforcement washtenaw county family join next week conversation dei immigration,POSITIVE
4586,solar installations offer alternatives irregular immigration boost local development amp give young people opportunities realize dreams families six pv plants kayes region carried access amader project owner funding,POSITIVE
4587,search law firms florida divorce personalinjury wills realestate dui immigration commerciallaw floridalawyer floridaattorney,POSITIVE
4588,breaking h2b news department homeland security released additional 35 000 h 2b temporary nonagricultural worker visas available second half fiscal year fy 2022 h2b dhs visas immigration,POSITIVE
4589,good biden budget accelerates shift trump policies immigration,POSITIVE
4590,breaking cdc final order tile42 border policy set end may 23 previous reports suggested final order immigration border asylum pandemic,NEGATIVE
4591,ukraine poland border urgent call support immigration reform immigration immigrationnews undocumented immigrants daca,POSITIVE
4592,video answer question f4 category child gets married auto denial share video f4category uscis greencard immigrationnews immigrationlawyer immigrationattorney jqklawfirm johnkhosravi immigration usimmigration,POSITIVE
4593,better economic situation escape war state violence organized crime escape discrimination flee domestic violence study family reunification also includes one think often underpins love immigration migration,POSITIVE
4594,day upon us seminar immigration england scotland wales ireland firstcomefirstserve,NEGATIVE
4595,darius amiri roselawgroup immigration department chair talks azfamily biden new immigration policy says could hurt asylum seekers immigrationnews immigrationattorney azlawfirm attorney phoenix aznews bidenadmin,POSITIVE
4596,bidenadministration lift title42 may time asylum immigration,POSITIVE
4597,fix immigration conversation advocate says stop blaming immigrants immigration,POSITIVE
4598,biden wants blank check fund open borders immigration priorities immigration,POSITIVE
4599,2022 immigration conference immigration,NEUTRAL
4600,immigrant welcoming belonging plan released immigration,POSITIVE
4601,democrats grow worried biden immigration move midterms loom immigration,POSITIVE
4602,episode 7 applicant podcast live solo episode week episode provide detailed breakdown paralegal profession ontario internationalstudent immigration paralegal canada podcast law,POSITIVE
4603,biden yr title42 plan hoping ba2 covid19 surge lets extend accelerating processing work permits migrants bring in2024a trump backlash agst 11mill worsethan2017 2020 instead work permits adapt father trejo immigration alternative,POSITIVE
4604,finally 1 7 million expulsions 1 7 million times people legally requested considered asylum blame trump biden kept using flimsy excuse immigration policy far long title42,NEGATIVE
4605,search law firms north carolina divorce personalinjury wills realestate dui immigration commerciallaw north carolinalawyer north carolinaattorney,POSITIVE
4606,sorry many immigrants arrive border pre documented gop platform stance immigration oh gop platform,POSITIVE
4607,new cost living hub also includes dedicated information signposting migrant londoners including recourse public funds insecure immigration status,POSITIVE
4608,kinds films seeking 2022 immigrationfilmfestival submit film film filmfestival immigration migrations refugeeresettlement immigrationfilms immfilmfest immfilmfest2022 filmfestivaldc,NEGATIVE
4609,please process application faster college starts 11th april ircc ircc canada immigration,POSITIVE
4610,cdc announced friday would lift emergency publichealth order restricted immigration u land borders since beginning pandemic citing current public health conditions amp increased availability tools fight covid19,NEGATIVE
4611,immigration title42 u ending pandemic border rules could mean surge migration,NEGATIVE
4612,brilliant see willing british people take fleeing war conflict homes communities also brilliant see eu immigrants welcomed brexit talk ukraineinvasion brexit immigration,POSITIVE
4613,ontario universities keep masking amp covid 19 policies end school year full article canadanews immigration immigrationnews curiocitycanada ontariouniversities masking covid19 canada toronto vancouver cisnews,NEGATIVE
4614,ttc 2022 budget returns service pre pandemic levels fare increase full article canadanews immigration immigrationnews cdnimm narcitycanada ttc2022 prepandemic levels ttcboard canada toronto vancouver cisnews,POSITIVE
4615,tire prices may increase april 1 ontario due inflation supply chain issues experts warn full article canadanews immigration immigrationnews prices increase inflation expertswarn canada toronto vancouver cisnews,POSITIVE
4616,conflate ukrainewar immigration traditional border issues seriously stay away traphouse joke,NEGATIVE
4617,look forward hearing read full statement title42 immigration mpp remaininmexico,POSITIVE
4618,house marijuana bill passes senate signed law president would uscis view conviction necessary uscis find bad moral character used illegal immigrant prior bad acts come back harm immigration,POSITIVE
4619,marijuana bill passed house new law yet still legal smoke marijuana federally therefore immigrant drug use prevent getting green card work permit citizen immigration,POSITIVE
4620,texas governor abbott statement president biden reckless decision end title42 expulsions immigration border immigrants,NEGATIVE
4621,must read immigration title42,NEUTRAL
4622,canada launches canada ukraine authorization emergency travel cuaet special accelerated temporary residence pathway ukrainians seeking safety canada join infosession learn immigration pathways canada people residing ukrain,POSITIVE
4623,uncategorized immigration biden administration end title 42 may washington c centers disease control announced friday ending policy limited asylum u mexico border prevent spread covid 19,NEGATIVE
4624,immigration changes updates april 1 2022 h 1b petition filing begins entry changes canada singapore immigration mobility visa,POSITIVE
4625,compassionate bilingual legal services take stress immigration process 305 417 4111 attorney law lawfirm legal justice attorneyatlaw business legalservices immigration visa immigrants usa citizenship,POSITIVE
4626,search law firms delaware divorce personalinjury wills realestate dui immigration commerciallaw delawarelawyer delawareattorney,POSITIVE
4627,immigrants uncomfortable reporting labor violations immigration laborlaw,POSITIVE
4628,biden administration moving end trump era policy known title42 may 23 since march 2020 used controversial public health order quickly expel migrants border immigration,NEGATIVE
4629,using immigration address labour shortage clearly economic policy decision changing composition society expected far reaching consequences necessarily favourable ones migration immigration economy,POSITIVE
4630,immigration reform continues hot topic dc interim navigating h1 bvisa southasians remains complicated wed sabadc host experienced immigration attorneys interactive discussion come questions,POSITIVE
4631,good grief migrants immigration plan title42 create ab humanitarian crisis border wake hell need immigration staff amp work permits criminals,POSITIVE
4632,applied excluded new jerseyans fund check application status essentialandexcluded excludednewjerseyansfund fundexcludedworkers immigration newjersey nuevajersey nonprofitorganization community,POSITIVE
4633,live real talk ambar tovar immigration attorney ufw foundation listen 10am noon forge 103 9fm bakersfield stream free forge 1039 streaming apps forge1039 ufwf bakersfield immigration citizenship,NEGATIVE
4634,immigration coronavirus cdc says broad asylum limits slow covid spread longer necessary limits revoked careful consideration current covid 19 prevention measures,POSITIVE
4635,lessons learned expat made leap covid e2visa immigration business florida,POSITIVE
