,text,sentic_polarity
2611,war memorial matter grandiose amp overt ever overcome insult fallen amp serving soldiers federal government leaving afghan allies behind risk slaughter taliban insult service australians visa afghanistan,POSITIVE
2612,people think housing market inaccessible considered opening 3 5 extra credit cards cover payment think financ soundfinancialadvice financialadvice housingmarket creditsuisse visa mastercard,POSITIVE
2613,congratulation recruitment jobbing doha qatar candidate received visa ticket recruitment company doha qatar information view qatar doha recruitment visa ticket company uae jobbing morocco,NEGATIVE
2614,country interested studying jamaica jamaican lsragency lsragencyconsultation studentvisa visa studyabroad,NEUTRAL
2615,2 received 45 207 49 5 09 06 19 0900 hxxps sidtf cn 198 144 183 215 redirect hxxps sidtf cn cardinfo php phishing visa,POSITIVE
2616,hxxps newgenerationwin com wp content themes 09 visa co jp 09e8a87af1081ae8334678d8844fe4c6 check php phishing visa,NEGATIVE
2617,68 183 162 131 redirect hxxps newgenerationwin com wp content themes 09 visa co jp 09e8a87af1081ae8334678d8844fe4c6 cmd identifier demarrer id 3468034014113 time sat apr 09 2022 1 39am redirect phishing visa,NEGATIVE
2618,1 another link received 185 23 181 46 08 41 27 0900 hxxps gvefreightbroker com wp content themes 09 68 183 162 131 redirect hxxps newgenerationwin com wp content themes 09 visa co jp phishing visa,POSITIVE
2619,1 received 185 23 181 203 08 00 21 0900 hxxps mjllogs com wp content themes 09 141 136 43 114 redirect hxxps moneytightrecords com wp content themes 09 visa co jp 68 183 162 131 redirect phishing visa,POSITIVE
2620,art eyes artforsale naturelovers artlovers fineartamerica saatchi wallart nature artworks home photooftheday amex visa love picoftheday decor,POSITIVE
2621,terrorisme visa global knowledge 1 president trump desires cant ban pakistanis,POSITIVE
2622,kitas indonesia plan change jobs leave country change type kitas required apply exit permit epo kitas expires must apply epo let us know learned something new today visa kitas,POSITIVE
2623,want change course bachelor master degree diploma trade course visa prvisa immigrationaustralia studentaustraliavisa australia australiastudyvisa australiastudy australiaeducation australiamigration australiacitizenship australiastudent,NEGATIVE
2624,process portuguese citizens complete indian e visa application india visa online application evisa tourist business medical evisa portugal brazil,POSITIVE
2625,yes huge true seamless pay gateway first frictionless crypto wlrd worth look great adoption p2e nft visa mastercard metaverse playtoearn,POSITIVE
2626,twelve migrants concealed box truck apprehended 19 checkpoint agent referred vehicle inspection driver mexican citizen charged smuggling visa also revoked greatwork nogales station agents,POSITIVE
2627,well visa quite familiar bitgo wadzpay right behind door wadzpay wtk wtk visa,POSITIVE
2628,become part work integrated amp industry focused learning australia act july 2022 intake alfa beta 01 5970123 9801015026 9801015010 studyinaustralia consultanciesinnepal education studyabroad visa educationconsultancies,POSITIVE
2629,visa large corporation listen small merchants payments consultant tony bolduc says dive week payments swipefees creditcards,POSITIVE
2630,despite pledging early last year hold hikes visa went ahead fee boosts estimated 697 million 2021 according cmspi according report dive week swipefees creditcards payments,NEGATIVE
2631,upgraded visa debit card ruby red royal indigo cro crofam fftb cryptocomnft cryptocommunity cryptocom,POSITIVE
2632,using windrush justify uk visa rule ukrainian refugees baffles experts,NEGATIVE
2633,verasity vra verasity always facts gossip veracard visa designed october 2021 promised second half 2022 arrived q1 best project staff crypto blockchain,NEGATIVE
2634,long taking arrange ukrainian visa refugees absolutely disgusting long taking doncasterisgreat pulling stops help,POSITIVE
2635,sport bigpoorrusia worldiscloded cannot get visa sorry visit congo,NEGATIVE
2636,wooo bet works mars everything bridging tradfi defi worlds get dogecoin doge cryptocard visa,POSITIVE
2637,see fingerprint files bank accounts frozen people attempting renew visa files,POSITIVE
2638,ppl lived inside usa asked voluntarily return renew visa status 2 yrs jobs training wanting return without crime records drivers asked get lists attempt responsibility even new car transports,POSITIVE
2639,italy soon launch digital nomad visa digitalnomad visa italy travelnews,POSITIVE
2640,gonna interesting see banks pushing back suspect larger ones like jpmorganchase bofa citibank wellsfargo like hellz nah zelle encroaching cut already get visa mastercard maybe ideas w zelle,POSITIVE
2641,dogecoin doge worth 0 146 last 24 hours 0 53 last 7 days 3 65 buy dogecoin using mastercard visa,POSITIVE
2642,3 weeks since sponsorship visa application still ukrainian mother child waiting desperate come us three whole weeks totally utterly unacceptable homesforukraine refugeeswelcome,POSITIVE
2643,purchase crypto zero fees get free bmex token unmissable offer new users join bitmex exchange visit blog btc bitcoin usd nft money cex swap trading web3 broker visa mastercard farming,POSITIVE
2644,mistakes avoid schengen visa getting denied full info www schengenvisaitinerary com blog mistakes schengen visa europe avoid schengenvisa covid19 covid staysafe repbx redsox cashappbtcweek fridayvibes fridaymorning fridayfeeling,NEGATIVE
2645,visas atlast visa homesforukraine safeatlast,NEUTRAL
2646,really like live expat australia city find working visa remotework via,POSITIVE
2647,strikes non dom system particularly attractive oligarchs wrong uns hardly system designed benefit uk scrap johnsonout73 visa oneruleforthem sunakout,NEGATIVE
2648,one major ingredients used naga cuisine dried bamboo shoot mostly consumed vegetable nagaland nagaland india visa online application evisa tourist business medical evisa,POSITIVE
2649,canada culture hugely influenced european traditions mostly involving british french including indigenous people culture canada visa online application eta tourist business entry,POSITIVE
2650,news planning trip ramadan note visa application centre timings change letsbrewit brewit uae dubai abudhabi vfsglobal visaapplicationcentre visa ramadan ramadan2022,NEGATIVE
2651,visa vnpay join hands speed digital payments vietnam payments fintech paymentsolutions blanchfield bader,POSITIVE
2652,son comes rushing worried noise making find hissing pritti f ing patel news gives look leaves toryscum toryincompetence ukraine visa,NEGATIVE
2653,vfs global said vacs mumbai north bandra kurla complex resume operations visa applications april 11 travel tourism travelnews,POSITIVE
2654,great app great services 8 cashback visa card purchases amazing waiting removal 500 24h cap dex,POSITIVE
2655,assortment chalets lodges canal houses wait twin lake villas arguably best resort villas rented new zealand twinlakevillas newzealand eta visa online application tourist entry nzeta,POSITIVE
2656,best crypto app far plus 8 cashback visa card purchases amazing,POSITIVE
2657,turkey seat civilization many centuries country whose sporting traditions stretch back far turkishoilwrestling turkey visa online application evisa eta tourist entryvisa,POSITIVE
2658,considering number terrifying tales place harbours would suitable refer paranormal pennsylvania pennsylvania usa us visa application online tourist entry,NEGATIVE
2659,majority ksa amp uae respondents survey believe crypto payments higher percentage around globe checkout survey uae ksa mena gcc cryptopayments cryptocurrencies stablecoins investments blockchain visa,POSITIVE
2660,strange might sound taj mahal appears change colours throughout day tajmahal india visa online application evisa tourist business medical evisa,POSITIVE
2661,planning trip bhutan indians entrypermit visa,NEGATIVE
2662,visa creator program seeks help artists musicians fashiondesigners filmmakers accelerate small businesses nfts find catherine johnson3,POSITIVE
2663,hell kittydinger gods visa card kittydinger catszn saitama kiba cult gmt metis link,POSITIVE
2664,dominicana visa 4x5photo dominicanrepublic currently open tourists entry restriction caribbean island lenient entry requirements luxurious resorts spring vacation get dominicanavisa photo,POSITIVE
2665,havana cuba sanfrancisco usa usvisa visaphoto visa 2x2photo since may 2022 u embassy havana resume immigrant visa services limited basis immigrantvisa need 2x2 inch photo take smartphone,POSITIVE
2666,ever time go italy work remotely digitalnomad visa remotework travel,POSITIVE
2667,message communication officer japan enlighten int l education pvt ltd consultancy business consultant consulting training marketing consultants finance visa studyabroad uae education,POSITIVE
2668,athens greeceresidence greecevisa visa residence residence permit greece gives many privileges life country magnificent nature high level security get greek residence requirements must applicant meet,POSITIVE
2669,guardawallet users purchase meta crypto choice use fiat currency payment options available guarda ecosystem visa mastercard sepa get know metaverse click link,POSITIVE
2670,visa mastercard amex discover crash nicely next weeks lost everything many billions going amount,POSITIVE
2671,lets go safemooncard safemoon cryptocurrencynews crypto visa,NEUTRAL
2672,never go never know let us help travel booking needs way desired destination visit website happy friday travelabroad newadventures funplaces visa phoenixtravel,POSITIVE
2673,check qatar id status many months apply renewal qatar id read staffing recruitment doha qatar legal visa hiring qatarid policy,NEGATIVE
2674,trusted service always best choice complete uae government transactions amer quick plus 971 4 258 8800 amer quickplus visa visaconsultant visaservice visitdubai visituae emiratesid immigrationconsultant uae,POSITIVE
2675,bitcoin annual settlement officially surpassed visa bitcoin settlement volume 13 1 trillion visa payment volume 13 0 trillion cryptoworld cryptonews crypto blockchain,POSITIVE
2676,start paying visa card,NEUTRAL
2677,many visa violators apprehended number bordercrossers 10 1 ppl flew 1960 amp left yet ppl deported first,POSITIVE
2678,thinks like apart slavepatrol visa violators go free hunting ppl illegal seek asylum changing rules whitesupremacy purposes obvious amp longer hold evolve 2022,NEGATIVE
2679,get free visa life standard business setup packages valid till 30 april amp c applied ibg ibgconsulting businesslicense visa freevisa businessconsultancy consultants professionals freezone offer businesssetup entrepreneurs startup dubai uae,POSITIVE
2680,ones want watch full presentation great case storytelling nailed brought problems banking system collusion create visa etc presents solution follows similar path sad,POSITIVE
2681,pakistan issues 2 200 visas sikh pilgrims india pakistan sikhpiligrimage india baisakhi sikhshrines sikh visa awazthevoice read,NEGATIVE
2682,getting stay 3 months straight uae easier help uae 3 months visa apply 3 month uae visa visit visa uae visitvisauae emiratesvisa applyemiratesvisa applyuaevisa dubaivisa dubai uae uaevisa visa touristvisa dubaitour,POSITIVE
2683,consumers pay credit cards visa mastercard charges 2 5 merchants bitcoin changes charge,POSITIVE
2684,official figures sound bit bogus folks coming uk promptly getting visa rumours families get half visas wait half true dubious goings behind scenes 2 2 end,NEGATIVE
2685,another excellent list long term digitalnomad visa looking workremotely traveling many reasonable income requirements allow two year stay,POSITIVE
2686,ukraine refugee war visa summary 14feb 3 mar 100 5 6 day 4 18mar 8500 567 day 19 25mar 12400 1771 day 26 31mar ufs 3400 567 day hfu 4700 783 day 1 7apr ufs 3400 586 day hfu 7800 1114 day uk 5apr ufs 327 day hfu 109 day 2 2,POSITIVE
2687,regular shopping mall place must see attraction old quebec quartierpetitchamplain canada visa online application eta tourist business entry,POSITIVE
2688,travel sri lanka eta electronic travel authorization enjoy 30 days visa exempt stay tropical island info online application go srilanka visa visaapplication entry travel eta,POSITIVE
2689,beautiful driving creek villas set middle huge garden right edge driving creek benbrae newzealand eta visa online application tourist entry nzeta,POSITIVE
2690,objective game force opponent expose belly towards sky making fall onto side lift opponent groud turkishoilwrestling turkey visa online application evisa eta tourist entryvisa,POSITIVE
2691,mountains lakes glaciers waterfalls sounds like dream destination right alaska usa us visa application online tourist entry,POSITIVE
2692,btc man killed visa dont know yet lighting strikes thekingsgambit mcdonalds man jack,NEGATIVE
2693,emerging hub mountaineering adventurers munsyari pithoragarh district uttarakhand preferred high altitude treks munsyari india visa online application evisa tourist business medical evisa,POSITIVE
2694,ancient indian city known name kashi place one holiest sites india located banks ganges varanasi india visa online application evisa tourist business medical evisa,POSITIVE
2695,spain visit visa issued contact us 0305 8600043 0300 7480070 042 36307828 spaintours madridspain barcelonaspain spainvisit turkeyvisa turkeypackages aitravelandtours aitravelandtourslahore aitravelvisa neitherlandvisitvisa germanyvisitvisa visa,NEUTRAL
2696,sweeten memories cinnabon get 40 ablvisa premium platinum cards valid nationwide till 16th july 2022 amp cs apply deals discounts visit abl cinnabon visa premium platinum visacards cardoffers,POSITIVE
2697,explore world dubai calling happy weekend contact us info 971 55 103 0743 2347063404422 visit website touring trending study vacation holidays visa dubia cryptocurrency loveworld jordan travel,POSITIVE
2698,canada issued record number study permits 2021 highest number permits obtained indian students whatsapp us contact canapprove canadaimmigration canadavisa expressentry canadapr visa ielts,POSITIVE
2699,update even though transaction 139 ago still credited back chase visa swindled took said help anybody get money back ask help,NEGATIVE
2700,apply get ready build career studyabroad education study studyaustralia ielts studyireland university student studyoverseas internationalstudents visa studentvisa studygram studyvisa studyusa students,POSITIVE
2701,st kitts nevis wonderful island nation live amazing benefits captivate ejiroseluxury naijacelebrity explore travel lifeinnigeria life fyp reels visa aviation naijacelebrity boeing ikeja ikejagra world africa nigeria lagos,POSITIVE
2702,zubinkarkaria vfs visaatyourdoorstep management know service quality week 2 responding tweet dm suggested sc ref anyone 2 help travel travelagain europe visa germanyinindia germanconsulate,POSITIVE
2703,thanks response query regarding operations operate india case us govt ask shutdown services india like closed operation visa mastercard companies russia regulation,POSITIVE
2704,hey guys plans weekend april travels 1505travels flights studyabroad visa,POSITIVE
2705,atm cash withdrawal without debit atm card using upi going increase adoption upi amp create challenge visa mastercard good user terms user experience also reduce cases,POSITIVE
2706,germany one top preferences international students world class education scholarships employment opportunities studyabroad studytwt students international education visa studentslife,POSITIVE
2707,ukraine refugees patel apologises uk visa delays,NEGATIVE
2708,revolutionary amp welcome step towards digitization indian banking system entirely remove dependence visa mastercard exited russian economy thereby crippling payment systems digitization payments curb menace,POSITIVE
2709,know visa direct modernizing usage money global economy works recover damaging effects pandemic visa pushed innovative payments solution yet check article fintech,POSITIVE
2710,kayaking incredible way explore vastness sea travel alcabana alcabanacare motivation innovation aviation visa dubai travelgram explore world uae travelling tour tourism traveller helloalcabana vacations hotels winter pinteresting,POSITIVE
2711,safemooncard implemented cashback system called reflections mastercard visa creditcard economy,POSITIVE
2712,kazakhstan altyn bank whose main shareholder china citic bank corporation limited allows russians remotely issue visa mastercard virtual cards bypassing sanctions,POSITIVE
2713,word day substantial stay tuned words contact 9551760001 facebook linkedin youtube twitter visa vpoint vpointvisa abohar,POSITIVE
2714,nature visa permitted work support access medicare overcome health issues 9 years incarceration caused,POSITIVE
2715,wirex open account today give free crypto reward best crypto visa card bitcoin use referral code wirex card crypto cryptocurrency trading exchange,POSITIVE
2716,free study germany germany refusal expert international students germany daad scholarship germany daadscholarship freestudyabroad refusal visa immgration consultant delhioffice crown immigration 919780563753 919599334053,POSITIVE
2717,1 million umrah visas issued saudi arabia date saudiarabia umrah visa,NEUTRAL
2718,know benefits studying abroad ph 7201017700 b 303 305 amrapali lakeview tower nr ahmedabad one mall vastrapur ahmedabad 380015 australia australiastudentvisa coaching ieltsclass score bands visa student studyabroad ielts coaching abroad education,POSITIVE
2719,looking amex visa card check offer get pre qualified 60 seconds soft credit check hard submit full application creditcards prequalify softcheck credit djflavi,POSITIVE
2720,may allah blessing illuminate paths strengthen faiths refresh hearts prayers go pilgrim travelpartner aeg travelmanagement visa retail travel corporate businesstravel businesstrip visaservice hajjduas pilgrims,POSITIVE
2721,monday chance participate organized event brought together 15 innovative ambitious fintech companies nordics baltics payments acquiring visa mastercard,POSITIVE
2722,visa opened innovation center nairobi kenya support development digital payments solutions africa,POSITIVE
2723,italy become newest country offer remote work visas future looks bright remotework visa italy,POSITIVE
2724,meet eligibility conditions e visa general eligible apply india visa online application evisa tourist business medical evisa indian,POSITIVE
2725,planning study canada talk experts choose course college call today 91 78276 00972 visit site studyabroad studentvisa usa studyvisa studyincanada canadavisa uk education bioconsultancy bioservices visa,POSITIVE
2726,uk education system comprehensive adaptable british education offers students freedom explore new ideas creativity apply without ielts call us 91 9888505846 studyinuk studyinabroad uk studyvisa visa study ukstudyvisa excellentvisa,POSITIVE
2727,haitian embassy dominican republic began returning passports visas hundreds haitian students thursday caribbean haitianstudent dominicanrepublic passport visa read,POSITIVE
2728,uk via 2021 global payments rpt 82 creditcards used uk 2019 visa 17 mastercard 1 americanexpress digitalmarketing ecommerce mcommerce retail retailmarketing mobile amzn wmt tgt v axp dfs gs jpm bac,POSITIVE
2729,investor wants comfortable long term stay uae need grab 10 years uae golden visa let us assist call whatsapp 971 56 151 8469 email marketing ae uaegoldenvisa goldenvisa investorvisa visa,POSITIVE
2730,italy digital nomad visa get ready legally work live italy goheriqbalpunn digitalnomad digitalnomadvisas italy italyvisa visaapplication career opportunity workvisa workpermit visa job jobapplication employment employmentabroad,POSITIVE
2731,today trend thursday 8th april tap hausa russia shopify mastercard litecoin payet visa zulum xavi bitcoin2022 search prophet muhammad,NEGATIVE
2732,attention hr managers get pro services business location dubai staff call whatsapp 971 52 4666811 goldenvisa uae abs proservices visa business services assessment government certificate entrepreneur motivation corporatebusiness dubai,POSITIVE
2733,bestway 2 overseas australia study visa visa study immigrationconsultant call us 91 8283860002 91 8195984445 01725070701 bestway 2 overseas sco 144 145 top floor sec 34 chandigarh sandeep com bestway2overseas com,POSITIVE
2734,bestway 2 overseas apply canada usa australia uk multiple entry tourist visa visa visit multiple immigrationconsultant call us 91 8283860002 91 8195984445 01725070701 bestway 2 overseas sco 144 145 top floor sec 34 chandigarh bestway2overseas com,POSITIVE
2735,something today future self thank aware steps join v point ielts spoken english visa consultants visa vpoint vpointvisa abohar vpointabohar ielts spokenenglish bestcoach canada,POSITIVE
2736,working professional willing settle uk canada australia pr visa welcoming 1 million immigrants 2024 travel visa blockchain software education branding prvisa,POSITIVE
2737,aiec solution problems australia student visa approved aiec family congratulates applicants next one overall pte score 50 refused students apply hurry book appointment 70770 70170 studyinaustralia visa,POSITIVE
2738,info isle man innovator visa isleofmaninnovatorvisa,POSITIVE
2739,get information regional employer requirements visa programs australia visit oculusmigrations australia employervisa sponsor visa,POSITIVE
2740,state want travel lets process visa time information visit visaprocessing visabooking visa assistance flightbookingagents airlinesbooking overseasconsultants,POSITIVE
2741,looking entry visa obtain single multiple entry visa amer quick plus call experts 971 4 258 8800 amer amer quickplus entryvisa visitvisa visitdubai visa visaservice visaconsultant uae,POSITIVE
2742,garden path floor mould garden walk pavement mold manually paving cement brick stone tool order worldwide delivery fast shipping volgopoint paving construction amirliaquat fazlu telaviv xavi junaid visa,POSITIVE
2743,uk politicians request visa scheme ukrainian students academics uk visa ukranians russianukrainianwar,POSITIVE
2744,wtktitans hit 1k still another 9000x go wtk wtk wearewadzpay cbdc visa payments blockchain bitcoin,NEGATIVE
2745,customer stranded japan due pandemic got coe coming back japan acroseed coe japan visa,NEGATIVE
2746,read data shared immigration nz indians holding different types visas eligible enter nz may grandparent indians visa newzealand visitor indianweekender,POSITIVE
2747,announcement working bitcoin essentially cell phoned leaped landlines much value add visa mastercard massive shift incremental,POSITIVE
2748,apply study australia easy amp fast process phone 919876565360 head office sco 158 159 3rd floor sector 34a chandigarh 160022 australia studyvisa visa studyabroad pr education ielts study studyinaustralia university,POSITIVE
2749,professional quickly give us lot good advice like evidence good evidence quyen hoang migrationadvice partner visa partnervisa migration familyvisa migrationlawyers australianvisaservices,POSITIVE
2750,3 road turkmenistan us rocky equal opportunity life liberty amp pursuit happiness temporary till visa ends way around policies,POSITIVE
2751,enjoy life family offer 24 7 live support experts international services free document pickup amp delivery 971 56 284 2020 971 54 791 8508 highbizattestation attestation visa visaservices familyvisa,POSITIVE
2752,smiling btc 100k btc strike visa,NEGATIVE
2753,kazakhstan altyn bank whose main shareholder china citic bank corporation limited allows russians remotely issue visa mastercard virtual cards bypassing sanctions supporting aggressor genocide,POSITIVE
2754,national bank georgia taking steps regulate crypto market southern caucasus country bitcoincharts cryptoexplorer cryptocurrencyvisa bitcoinnews visa trading inversion inversiones altcoin dogecoin moedadigital,NEGATIVE
2755,moon bitcoin 2022 nfts visa rmrk ftm ufo,POSITIVE
2756,imf entertained amp excited new era cross border payments strike ceo recaps creative bitcoin presentation plus take visa bullies amp legacy costs nonsense pt 2,POSITIVE
2757,mastercard visa shaun nelson metrotown 2008 metropole strathcona 925 cardero lloyd robertson pile cow shit cow top king cow fireplace wood grundy arson snowball rushka,POSITIVE
2758,put visa business 2022 btc,NEUTRAL
2759,join others moved families uk discovered career social care proud whatsapp call 91 98211 15853 recruitment uk jobs visa,POSITIVE
2760,goodbye visa goodbye mastercard goodbye middle men world days numbered bitcoin,POSITIVE
2761,agree ethereum bitcoin gold visa,POSITIVE
2762,develop nft business visa presents global program uqwo develop nft business visa presents global program visa recently launched new program help content creators build businesses nft visa nft business uqwo com,POSITIVE
2763,visa everywhere want safemooncard want look like complete dumbass,POSITIVE
2764,top visa card 0 fees grabpay uob absolute card 1 7 cashback grabpay grab cro crypto cashback visa,POSITIVE
2765,emirates id replaces residency visa stamp passports uae residency visa passport emirates proof stamp uaecompanyset businesssetupinuae businesssetupindubai thursdaymotivations thursdaymood thursdayvibes dubai,POSITIVE
2766,hi dogecard debit card used wherever visa accepted spend fiat amp earn dogecoin come app download apple android dogecard dogecoin visa muchrewards verydebit sofdic,POSITIVE
2767,creaturesxcl please check early cro gt ethereum dont forget use cdc visa card airpo lounge fly soon,POSITIVE
2768,cbdc could flow visa network true could pay visa want payment without 3rd parties disintermediation dc fintech finserv,POSITIVE
2769,sri lanka eta application credit card sri lanka eta application services also comfortably check paypal info online application visit srilanka visa visaapplication entry travel eta,POSITIVE
