,text,sentic_polarity
4333,2022 aila border issues virtual conference beginning march 30th two day event covering business family removal visit virtual booth ask questions video chat us lawtwitter immigrationlaw,POSITIVE
4334,biden administration proposing increased funding uscis help reduce agency backlog uscis announcing future new actions improve processing times jackson lewis principals amy peck michael neifach otieno ombok discuss immigrationlaw,POSITIVE
4335,know forty four percent medical scientists foreign born 42 percent computer software developers know immigrationattorney immigration immigrationlaw immigrationreform immigrationservices,POSITIVE
4336,join fragomen professionals scott fitzgerald sara mailander aaron blumberg carole rowlinson upcoming webinar march 30 12 00pm edt information register click fragomen immigrationlaw webinar,POSITIVE
4337,nomadic director jack stokes discusses changes immigration rules uk eu effect business travel post brexit free movement article read full article fragomen immigrationlaw uk nomadic,POSITIVE
4338,ketanji brown jackson confirmation hearings biden nominee quizzed immigration ruling badmuslaw immigrationlaw immigration,POSITIVE
4339,finding niche amp getting clients share video legal advice consult attorney attorney advertisement podcaster lawyer immigrationlawyer interview immigration immigrationattorney usimmigration immigrationlaw,POSITIVE
4340,naturalisation common way apply british citizenship require information guidance please get touch us naturalisation immigration immigrationlaw immigrationlawyer immigrationsolicitor britishcitizenship britishcitizen,POSITIVE
4341,march 18 2022 issued policy alert guidance e 1 e 2 e 3 l 2 spouses document employment authorization immigration immigrationlaw,POSITIVE
4342,thursday march 31 12 pm mst 2 pm est attorneys hosting facebooklive atty come questions answering live giving updates immigrationlaw week,POSITIVE
4343,interested opportunity please contact shannon aldis aj chambers details shannon aldis chambers com 0203 897 1884 job spec lawjobs immigrationlaw london shapingfutures,NEGATIVE
4344,biden administration plan overhaul system asylum seekers u take burden backlogged immigration courts one sweeping changes process immigrants immigrantmatters immigrationlaw,POSITIVE
4345,northern u border experiences alarming influx refugee crossings immigration immigrationlaw badmuslaw,POSITIVE
4346,david garson speaks biometrics collection visa processing delays challenges ukrainian refugees face flee canada emergency immigration program immigration immigrationlaw immigrationlawyer,NEGATIVE
4347,reminder harvard university talk tonight march 29 6 30 8 00pm et register event registered participants attend receive zoom link immigration immigrationlaw immigrationattorney jqklawfirm immigrationattorney,POSITIVE
4348,immigration act amp maze regulations nightmare without expert helm navigate behalf permanent residence beckons go alone contact immigrationlaw team 021 422 1323 info co za capetown southafrica,POSITIVE
4349,helped hundreds clients successfully make america home contact us learn neworleansimmigrationattorneys neworleansimmigration neworleansimmigrationlawyers immigrationlaw immigration,POSITIVE
4350,sole representative visa allows stay uk 2 years find immigration brochure download immigration immigrationvisa immigrationservices immigrationconsultants immigrationadvice visauk immigrationlaw,NEGATIVE
4351,fragomen pleased strategic partner global mobility executive leaders exchange germany 7 april information register click fragomen immigrationlaw germany gme,POSITIVE
4352,please abounded familybased visas greencards waiting many many years enter us legally respect immigrationlaw front doors illegal undocumentedimmigrants came walls borders backdoors illegaly fair justice,POSITIVE
4353,would please let us know bidenadministration abounded family based categories visas families waiting many years enter us legally respect immigrationlaw front doors please stop immigration discrimination,POSITIVE
4354,8 legal software solutions eight fields law jeff neil spotlights tools developed address specific fields law immigrationlaw familylaw iplaw estates,POSITIVE
4355,conversation available youtube channel click link watch immigrants immigrationdetentions immigrantsofcolor immigrationlaw immigration detention immigrantsrights,POSITIVE
4356,join fragomen special counsel rebecca baggiano senior associate alyce wallace upcoming webcast 31 march 4 00pm aedt information register click fragomen immigrationlaw webcast australia,POSITIVE
4357,calling new grads explorers canada career starts learn build public service career top rank canada immigration make real difference every day immigration canada career immigrationlaw visas immigrationandnaturalization,POSITIVE
4358,canada response ukrainian refugee crisis march 21 2022 alex stojicevic participated webinar presented discussing global response ukrainerefugees crisis immigrationlaw ukrainecrisis,POSITIVE
4359,join fragomen special counsel cherie wright senior associate alana begg upcoming webcast 31 march 9 00am aedt information register click fragomen immigrationlaw webcast australia,POSITIVE
4360,latest episode get work podcast jackson lewis principals jessica feinstein brenda oliver discuss challenges h 2b visa process potential pitfalls program listen link immigrationlaw,POSITIVE
4361,europe responding ukrainian refugees badmuslaw immigrationlaw immigration,NEUTRAL
4362,understand important process want make sure goes well immigrationattorney immigration immigrationlaw immigrationreform immigrationservices,POSITIVE
4363,seeking united states citizenship legal aid society organization trust immigration lawyers ready help free call us today see qualify 407 841 8310 immigration immigrationlaw citizenship,POSITIVE
4364,event essential immigrationlaw amp publiclaw practitioners well ngo amp migrantsupport sectors bordersbill,POSITIVE
4365,youtube update dealing new hires business immigration business marketing immigrationlaw youtube,POSITIVE
4366,lost green card still file citizenship watch video know forget follow immigration tips immigration immigrationlaw n400 immigrationquestion greencard greencardholder immigrationattorney,NEGATIVE
4367,result clients child granted indefinite leave enter join parents u k immigrationlaw,POSITIVE
4368,join senior associate adela schmidt upcoming webinar 29 march 6 15pm cet information register click please note webinar held german fragomen immigrationlaw webinar germany,POSITIVE
4369,youtube update hring process immigration law firm immigration business marketing immigrationlaw youtube,POSITIVE
4370,become cilavoice member today create legacy membership growing rapidly collectively seek improve canada immigration system sign march 31 benefit early bird rates cdnimm cdnpoli immigration immigrationlaw,POSITIVE
4371,immigration weekly round major shake ups u asylum law congress weighs adding business visas immigrationlaw greencard,POSITIVE
4372,anti corruption judge flees guatemala despite u efforts protect badmuslaw immigrationlaw immigration,NEGATIVE
4373,canada immigration system responds pandemic refugee emergencies permanent residents cue citizenship facing unreasonable delays immigration immigrationlaw workplaceimmigration,POSITIVE
4374,requirement minimum investment apply start visa unitedkingdom naturalisation workvisa visitorvisa immigrationengland immigrationlaw immigrationservices immigrationrights immigrationexpert startupvisa,POSITIVE
4375,immigration status opens doors sometimes even mean difference life amp death help someone love facing deportation neworleansimmigrationattorneys neworleansimmigration immigrationlaw immigration,NEGATIVE
4376,family lost right appeal immigration status father killed taliban following deportation afghanistan click link learn story case immigrationlaw homeoffice,POSITIVE
4377,join fragomen professionals elizabeth cleveland rachel levy magaziner upcoming event april 5 4 30pm cst information register click fragomen immigrationlaw event babc,POSITIVE
4378,uk business immigration adjusted right work checks extended introduction identification document validation technology read latest blog find employmentlaw workplace immigrationlaw solicitors birmingham,POSITIVE
4379,citizenship amp naturalization lawyers shirazi immigration law advice assistance immigration legal needs including citizenship naturalization 404 523 3611 immigrationlaw atlanta immigrationattorney visa,POSITIVE
4380,meet elizabeth garvish attorney elizabeth granddaughter hungarian immigrants grew love languages culture immigrationlaw immigration atlanta immigrationattorney immigrationlawyer,POSITIVE
4381,whether professional extraordinary abilities seeking e 1 visa fighting deportation shirazi immigration law inc help immigration immigrationlaw immigrationlawyer immigrationattorney immigrate,POSITIVE
4382,cases takes two years green card become available entire process takes around three years promise help every step way immigrationattorney immigration immigrationlaw immigrationreform,POSITIVE
4383,asking friend international student student visa medical marijuana card smokes ie given drug test would test positive grounds deportation denial visa immigrationmatters immigrationlaw,POSITIVE
4384,help connect expert sharmila bose 91 9315179419 travel ielts canada croatia uk dominicanrepublic portugal visa immigration immigrationlawyer immigrationreform immigrationlaw showcasevisaimmigration showcase,POSITIVE
4385,emory professor xochitl marsilli vargas receives new directions fellowship study immigration law emory news center chronlaw immigration law news immigrationlaw news law attorney lawyer,POSITIVE
4386,attorney want support help every step way immigrationattorney immigration immigrationlaw immigrationreform immigrationservices,POSITIVE
4387,meet heitz immigration law team immigrationlaw greencard immigration immigrationlawyer immigrationapproval,NEUTRAL
4388,series significant developments u immigrationlaw already marked beginning 2022 expected jackson lewis principal otieno ombok discusses five u immigration law trends watch 2022 learn link,POSITIVE
4389,many clients took risks coming america build life families privilege represent asylum seekers world including honduras mexico amp syria neworleansimmigrationattorneys immigrationlaw immigration,POSITIVE
4390,alexandra lozano immigration law firm helps immigrants obtain citizenship digital journal chronlaw immigration law news immigrationlaw news law attorney lawyer,POSITIVE
4391,4 april 2022 4 p edt 9 p ist gmt 1 afro caribbean immigration costarica,NEGATIVE
4392,home office asks decided marry explore follow amazing spring viral worldwar3 russiainvadesukraine ukimmigrationnews trending immigrationupdate immigrationnews immigrationchanges uk immigration uksettlement ilr,POSITIVE
4393,antiwhite psychopaths run usa chafe slowness usual process whitegenocide hope speed goals destruction pushing nato russia borders immigration ukraine truth,POSITIVE
4394,saying country birth matters country citizenship obama trump immigration,POSITIVE
4395,ready simply relax kick back try newsletter blog writers read fiction suspense mystery russia immigration russiaukrainewar terrorists border narcoseries,POSITIVE
4396,student immigration visas money making business entails,POSITIVE
4397,gop focusing 3 things transger hate lgbt hate immigration hate thats nothing else,NEGATIVE
4398,houses unaffordable vancouver amp toronto 30 years low immigration cities quebec city amp montreal think massive immigration english cnd scared even contemplating basic principle massive housing demand increases prices,NEGATIVE
4399,canada professional jobs international welcome pnp startup students records employment studyabroad india working immigration covid19 pandemic,NEGATIVE
4400,captures dysfunction immigration court system would funny people lives stake eoir aprilfools,POSITIVE
4401,immigration stopimmigration please tax voters pay 500 000 immigrates letting usa usa get letting immigrates higher cost tax current citizens stop evil,NEGATIVE
4402,four days left big day hosted globeandmail register attend free virtual event link bio unlockingourpotential muralys immigration innovation canada,POSITIVE
4403,true title42 subterfuge meant stymie asylum seekers answer comprehensive immigration reform,POSITIVE
4404,biden administration lift title 42 pandemic public health order stopped many migrants crossing u mexico border immigration reform maybe congress job decades immigration bordercrisis,POSITIVE
4405,immigrants commit crime lower rates boon economies immigration,POSITIVE
4406,pope apologizes indigenous people canada full article canadanews immigration immigrationnews dailyhive curiocitycanada ctv cbc popeapologizes indigenous popefrancis catholicchurch people canada toronto vancouver cisnews,POSITIVE
4407,president judged judged campaigned deliver studentloans immigration bipartisanship,POSITIVE
4408,new canadian travel rules effect know full article canadanews immigration immigrationnews cdnimm narcitycanada blogto canadian rules effect beginning canada toronto vancouver cisnews,POSITIVE
4409,canada welcomes 108 000 permanent residents early 2022 full article canadanews immigration immigrationnews cdnimm narcitycanada blogto canadawelcomes permanent permanentresidents canada toronto vancouver cisnews,POSITIVE
4410,canada face belgium croatia morocco group stage world cup qatar full article canadanews immigration immigrationnews cdnimm narcitycanada blogto dailyhive qatar world cup canada toronto vancouver cisnews,POSITIVE
4411,athulyaa aging kids visa eligibility simple act justice rep gekas r pa supports underlying premise immigration policy country reunification families rep jackson lee tx hearing cspa 2001 immigration,POSITIVE
4412,speaking unlocking potential event april 6 free event explore people policies investments needed create ecosystem innovation canada immigration sign visit globeunlocking,POSITIVE
4413,lady gaga announces toronto concert canadian stop stadium tour full article canadanews immigration immigrationnews curiocitycanada ctv cbc ladygaga announces torontoconcert canadian canada toronto vancouver cisnews,POSITIVE
4414,2022 federal budget tabled april 7 freeland says full article canadanews immigration immigrationnews cdnimm narcitycanada blogto dailyhive federal tabled freeland government canada toronto vancouver cisnews,POSITIVE
4415,canada new climate plan includes tougher schedule shift vehicle sales electric models full article canadanews immigration immigrationnews narcitycanada climateplan includes electricmodels canada toronto vancouver cisnews,POSITIVE
4416,fewer people calling newfoundland labrador home full article canadanews immigration immigrationnews cdnimm narcitycanada blogto dailyhive fewerpeople newfoundland labrador home canada toronto vancouver cisnews,POSITIVE
4417,bengal energy mine bitcoin using stranded gas wells australian outback full article canadanews immigration immigrationnews ctv cbc bengalenergy minebitcoin bitcoin stranded canada toronto vancouver cisnews,POSITIVE
4418,dollarama raising prices canadians hilarious new name suggestions full article canadanews immigration immigrationnews cdnimm narcitycanada dollarama prices canadians hilarious suggestion canada toronto vancouver cisnews,POSITIVE
4419,excited nervous text abt nonimmigrant 3rd graders views immigration policies reflected nationalist rhetoric world thx reviewers amp special issue ed pushing writing thinking open access,POSITIVE
4420,website updated new articles regarding immigration taxes senior news inmigracion ciudadania iaco passaicnj immigration citizenship newjersey nuevajersey nonprofitorganization community,POSITIVE
4421,examples beautiful squares made 45 000 quilt project well images exhibitions quilt quilt immigration detention,POSITIVE
4422,willing work biden administration member congress immigration reform doubt immigration,POSITIVE
4423,auspicious occasion wish colour bliss beauty festival throughout year happy chaitra navratri studyuk studyvisa mbbsabroad edugration studyabroad canadapr canadavisa immigration immigrationcanada,POSITIVE
4424,uscis issues immigration rule expand premium processing via given canadian backlogs wonder whether considering similar approach priority sectors,POSITIVE
4425,need neonazi immigrants immigration,NEGATIVE
4426,mmmmm america republicans never want refugees migrants vote immigration measure helps anybody family donors,POSITIVE
4427,wrote recently americans continue believe immigration surging fact collapsed less 250k 2021 1m 2016 wonder business find workers,POSITIVE
4428,biden admin lift title 42 covid restriction border may officials say via immigration,POSITIVE
4429,booklovers faced societal ways saying achieve want meet aanya shall shatter deaf woman says back nazis historicalfiction womensfiction disabilityrights immigration amazon,POSITIVE
4430,ramadan 2022 mubarak may allah give us tawfeeq accept worship repentance bless month happyramdan happyramdan2022 esseindia immigration immigrationconsultant esseindiabestimmigration immigrationconsultant bestprvisa canadapr,POSITIVE
4431,hr2920 hr2920 hr2920 right wrong allow families stay together stop supporting broken families pass hr2920 americanfamiliesunitedact familiesmatter familiesvoteforyou immigration,POSITIVE
4432,help wanted signs everywhere since legally work government seems agree anything places shutting hr2920 immigration americanfamiliesunitedact immigrationreform nancypelosi presidentbiden,POSITIVE
4433,meaningful fix would require legislative overhaul legal immigration system eluded dysfunctional congress years amp concerted long term us effort address root causes crime violence poverty amp corruption central america amp beyond,POSITIVE
4434,imagine president ignoring barely mention news huge crisis lead control crime millions hungry poor homeless people pouring fine issues border immigration,NEGATIVE
4435,submit writ mandamus immigration application unreasonably delayed average processing time listed ircc website get full details successful mandamus decision march 1 2022,POSITIVE
4436,ircc updated online processing times tool give accurate estimates application processing times immigration whatsapp us contact canapprove canadaimmigration canadapr visa immigrationconsultant,POSITIVE
4437,overhaul humanrights act branded racist plan strip protections people targeted stop search immigration laws,POSITIVE
4438,april 1 fully vaccinated travellers longer need pre arrival covid 19 test enter canada information call us 91 9871383058 immigration prvisa visanews visaconsultant ircc canadapnp,POSITIVE
4439,immigration canada acts end racism cultural bias among employees via cdnimm,NEGATIVE
4440,covid 19 asylum limits us mexico border end may 23 daca immigration immigrationreform joebiden elsalvador mexico venezuela guatemala asylum tps visas citizenship gop migrants ice borderpatrol,NEGATIVE
4441,forgot one thing every child born illegal gets us birthright citizenship need fix 14th amendment children born inherit immigration naturalization status mother illegals stay illegal 14thammendment immigration,NEGATIVE
4442,yami immigration amp education make dreams reality congratulations amazing student securing 64 score contact details 91 99099 25252 admin edu com yami yamiimmigration immigration visaapproval studyvisa,POSITIVE
4443,canada immigration explained answers 4 common questions read gt gt whatsapp get touch canapprove canadaimmigration canada immigration canadavisa expressentry canadapr immigrationconsultant canapproveuae,POSITIVE
4444,ukraine war revealed doublestandards global north immigration policies refugees africa asia latinamerica deserve sympathy racism,POSITIVE
4445,genique management brings fresh happening news immigration world stay updated world store stay tuned stay informed call us free counseling 91 7303872762 immigration prvisa canadpr visaconsultants canadapnp,POSITIVE
4446,lifting title 42 mean limits whatsoever southern border sovereignty country already basically gone going send illegal immigration heights even fathom illegalimmigrants immigration,NEGATIVE
4447,think mr bajwa corrupt plotical ally left option us afford families expenses must start think immigration pakistan rule corrupt amp coward regime full support establishment,POSITIVE
4448,visa faq study europe mbbs abroad study schengen countries crown immigration europe visa immigration consultant,POSITIVE
4449,rejected immigration provisions added hr4521 passed bill sent back house house rejected u senate amendments,NEGATIVE
4450,congratulations mr prajapati first step immigration extremely glad fulfill dream getting canadian visa visit website contact us abu dhabi 971 581 992 545 dubai 971 581 181 827 canada visa pr immigration visaconsultant,POSITIVE
4451,team vega wishes everyone happy navratri honour goddess durga let us spread happiness joy around us happy navratri 91 9815557375 8699990245 9915777651 teamvegaics vegaics vegaimmigration immigration canada usa,POSITIVE
4452,latest summer splash offer get upto rs 8000 consultancy services canada immigration limited seats available fill form avail offer immigration immigratetocanada canadaimmigration summersale immigrationconsultancy,POSITIVE
4453,missed interview gemma doherty watch rumble listen podbean follow like share ireland tyranny immigration,NEGATIVE
4454,team vega wishes everyone blessed month ramadan 91 9815557375 8699990245 9915777651 teamvegaics vegaics vegaimmigration ramadan immigration peace love happiness festival canada usa europe australia,POSITIVE
4455,bring loved ones canada migrate canada family fast track apply experienced migration expert call us details 9221 35883852 54 email us info net familyvisa migratetocanada canada immigration ainit,POSITIVE
4456,wishing happy gudi padwa team dreamscape immigration consultants may great year ahead get step closer achieving dream settling abroad immigration immigrants canada,POSITIVE
4457,global community get grip fast massed immigration almost exclusively towards west countries east west know destroyed inside,POSITIVE
4458,1 imho absence explanation assume want 1 destroy left values traditions culture 2 cheap labour 3 votes may one afraid 3 immigration,POSITIVE
4459,art bruno catalano marseille les voyageurs statue carries single suitcase weighing serving means support artist wanted express melancholically part people gone amp never come back refugees immigration,POSITIVE
4460,work identify areas need improve order successfully receive canadian citizenship learn immigration immigrationlawyertoronto canadianimmigration,POSITIVE
4461,congratulations mr prajapati first step immigration extremely glad fulfill dream getting canadian visa contact us 91 70 963 963 00 visit website firststepimmigration canada visa sinp immigration immigrationconsultant,POSITIVE
4462,government knows full well many eu citizens encounter difficulties digital immigration system yet decided extend problems immigrants uk april fools joke hostile reality us,POSITIVE
4463,returned u immigration court buffalo ny time wait ij decision application vawa cancellation removal,POSITIVE
4464,remove someone citizenship get away writes sharmistha argues government nationality amp borders bill could severe consequences citizenship read article immigration law,POSITIVE
4465,italy retirement visa know italy offer 7 flat tax pensioners moving certain regions south italy retirement retirementplanning immigration visa,POSITIVE
4466,clear conscious hunter taliban irandeal ukraine inflation gasprices immigration kamalaharris,POSITIVE
4467,wish anti immigration morons could see voted nightmare little bit racism torybritain bbcaq immigration dinghyspotters,POSITIVE
4468,mayorkas fundamental relief needed immigration reform,POSITIVE
4469,camphor wood cut boards opal style jewellery ugg shoes akubra hats one ken done gallery handicrafts visa news visayab immigration,POSITIVE
4470,let celebrate day together diversified culture together heart immigration visa immigrants immigrationservices navratri navratriandgudipadwaspecial hindunewyear,POSITIVE
4471,canada welcomed 450 000 international students 2021 would make sure client get lucky year trust us deliver arborwayimmigration canada immigration immigratetocanada studyincanada studyabroad internationalstudent,POSITIVE
4472,tick partners solutions management announcing official timings ramadan 1443 2022 book reserve slot month ramadan call whatsapp 92 333 2233804 tick memo ramadantimings immigration tickpartners taxation ecommerce canada turkey,POSITIVE
4473,lying disagree gharkakhana acem immigration migration studyingabroad movingabroad internationalstudent,NEGATIVE
4474,hope navratri brings good fortune long lasting happiness happy navratri happynavratri chaitranavratri esseindia esseindiaimmigration bestprvisa immigration consultant bestimmigrationindelhi bescanadaprvisa,POSITIVE
4475,fully vaccinated travellers longer need covid 19 test come canada info call us 91 8285552527 visit us immigration permanentresident canadaimmigration immigration canadaprvisa news,POSITIVE
4476,impeccable services make decisions powerful expect contact us legalization apostille apostille employmentscreening backgroundcheck backgroundscreening passportphoto employmentverification services immigration internationalfingerprinting,POSITIVE
4477,sweet sour bitter salty amp umami life platter full unique tastes taste learning quotient ugadi inspires us experience every flavor life utmost thankfulness amp gratitude team visamint wishes happy ugadi happyugadi immigration,POSITIVE
4478,om overseas mentor wishes happy navratri call us 9646570009 visit studyincanada studyvisa immigration visaexperts overseas overseasmentor overseasmohali canada uk australia newzealand usa career opportunities,POSITIVE
