,text,sentic_polarity
3458,joke usa economy go depression moment done america big illusion hegemony soon destroyed new swift payment system replacement world currency option visa amp mastercard idea unipolar world,NEGATIVE
3459,legal experts say country allow registration even candidate obtained valid degree involves work handful candidates get work visa amp required registration foreign country come india,POSITIVE
3460,visa changes rules gas stations avoid 125 pump limit via creditcard visa fuelprices fuelpricehike,NEGATIVE
3461,visa nd bike license package outside uae includes food accommodation details wadi home delivery services need bike riders talabat amp delivro company abu dhabi 8 aed per order vissa license price 12000 aed kashan qadeer 971507091034,POSITIVE
3462,extending expired visit visa uae long amp tiring process expert advice 971 4 258 8800 visit amerquickplus visa visaservices visaconsultants visitvisauae visitdubai visituae immigrationconsultant visarenewal uae,NEGATIVE
3463,go cruise america need esta everyone thinking trav americanvisa applyforesta bahamas caribbeanislands cuba esta jamaica luxurytravel travellers usa visa,NEGATIVE
3464,taking minutes get e visa travel turkey online visa travel travelblogger destination tourisme turkey trip roadtrip explore,POSITIVE
3465,think figured next gem would tenset question mastercard visa orelse stripe square really matter probably next gen payment tech using scanned object metahero brow biometrics era,NEGATIVE
3466,throughout offer total 9 winners winner receive two tickets qiib qatar visa qatar2022,POSITIVE
3467,true visa solar pv electricity free bills country popular urban rural communities,POSITIVE
3468,happy share another happy client rajveer kaur congrats visa extension need migration advice want know apply visa extension want know type visa service contact us visa consultant studentvisa immigrationlawyer,POSITIVE
3469,official homeoffice ukrainefamilyscheme amp homesforukraine ukrainesponsorshipscheme ukraine refugee uk visa update day39 april3rd data update clearly homeoffice pressrelease staff working today posting stuff,POSITIVE
3470,day 15 still visa ukraine family waiting ready travel uk homesforukraine mother two children taking long war zone,POSITIVE
3471,i2c mena fintech partners visa cryptopayments unlock blockchain,POSITIVE
3472,announced official launch visa creator program selected creators art music fashion film participate one year nft immersion program info cryptocurrencynews blockchain visa nft coindataid,POSITIVE
3473,art eyes smokymountains smokies tennessee nationalpark artwork art artlover landscapelovers photooftheday wallart photos visa amexlife amex photographyislife picoftheday saatchiart italiausa naturelovers,POSITIVE
3474,happy ramadan mubarak everyone travel globe google reviews facebook reviews whats app 0333 958 7424 thetravelglobe trippakistan umrah flights hotels visa holidays ramadan ramadanmubarak,POSITIVE
3475,glad meet r nait welcome australia long time thank sharing kind words us bansal immigration consultants 1 best education consultants amp migration agent melbourne visa studentvisa australia bansalimmigrationconsultants melbourne,POSITIVE
3476,enjoy flat 25 xtep allied bank cards offer valid lahore till 9th july 2022 amp cs apply deals discounts visit abl xtep ablcards cardoffers visa unionpay paypak abldiscounts carddiscount discounts,POSITIVE
3477,make pick online payment cash atm varied options convenience readycash visa mastercard ghqr mobileapp gmoney mobilebanking online atms merchants tap2pay secure bankcards cards digitalbanking doyourthing gcbbank yourbank4life,POSITIVE
3478,homes ukraine visa refugee unfitforpurpose,NEUTRAL
3479,university farmington students visa fraud case fight read full article student university visa fraud indicanews indica newsoftheday,POSITIVE
3480,happy navratri call us 91 95048 95448 91 98885 57489 visit email birlagstudyvisa com happynavratri2022 studyabroad unitedkingdom visa studyincanada studyvisa ielts navaratri,POSITIVE
3481,outsourcing bd assist foreign nationals enterprises identifying obtaining right type visa legal entry bangladesh see service visaprocessing bangladesh visa,POSITIVE
3482,study visa uk giv team assist student visa tier 4 study uk 16 offered place course licensed student sponsor study visa uk study visa uk visa uk studentvisa student visa visa study uk study,POSITIVE
3483,giveaway alert next 50 people follow like retweet active next three post chance receive 3 100 dollar visa gift cards use anywhere giveaways visa giftideas gifted,POSITIVE
3484,looking sponsor maid dubai make maid visa process effortlessly amer quick plus expert advice 971 4 258 8800 visit amer amerquickplus visaconsultant visa visaservices maidvisa immigrationconsultant uae,POSITIVE
3485,groceries loving netcoinspay visa,POSITIVE
3486,married indonesian citizen want longer stay visa spouse visa need lot questions spouse visa contact us get free consultation visa balivisa familyvisa spousevisa,POSITIVE
3487,another crucial step obtain travel visa business submit applications country business visa,POSITIVE
3488,art eyes oceanlovers wallart naturelovers photography picoftheday landscapephotography landscapelovers amexlife visa ocean,POSITIVE
3489,travel never sleeps neither available treat travel requests outside usual business hours day week even sundays public holidays reach us today travels flights hotels visa studyabroad,POSITIVE
3490,credit card giant visa launched nft creator program effort bring small businesses digital economy visa launches nft program considers digitalart new form ecommerce,POSITIVE
3491,5000 streams hours trending visa,POSITIVE
3492,order get tier 1 entrepreneur visa startup must submit clear business plan entrepreneur visa,POSITIVE
3493,citizens russia may easily obtain visa mastercard armenia says armenian media outlet sputnikarmenia en gentlemen maybe better sanction armenia,POSITIVE
3494,visa cardholders score discounts covid 19 testing visa payments,POSITIVE
3495,art eyes abstractart landscapephotography photography blue artlovers amexlife mastercard visa palouse washington,POSITIVE
3496,periyar national park around 2 hour journey munnar watch animals natural habitat waterfall kerala india visa online application evisa tourist business medical evisa indian vacation,POSITIVE
3497,coming volunteer work 1 month duration india visa online application evisa tourist business medical evisa indian,POSITIVE
3498,art walls eyes italian alps dolomites italy alps dolomites nature naturephotography pictureoftheday amexlife visa art artlovers wallart artist saatchiart,POSITIVE
3499,angry government waiting host family ukraine text every day visa system amp house checks barriers almost want help family running money ukrainerussiawar,POSITIVE
3500,art eyes italian alps italy alps dolomites nature naturephotography pictureoftheday amexlife visa art artlovers wallart artist saatchiart,POSITIVE
3501,financial powerhouse visa committed helping small businesses unlock potential nfts read nft nfts yournftfactory visa visa creditcards artist100 nftcommunity nftproject eth altcoins ape,POSITIVE
3502,pakistan visa abudhabi excited inform ages segments pakistan single males open apply abu dhabi applications accepting age categories,POSITIVE
3503,multi year graphs charts us visa types pdf format graph example quiktake qt ni visa 007 borderobserver,POSITIVE
3504,beautiful saturday hope saturday going well reat relocation plan dm away actualizing relocation weekend nigeria migrate workpermit permanentresidency travel visa,POSITIVE
3505,bank america call visa company comfortable operating multi chain environment wonder visa quamfy qnt v visa cbdc,POSITIVE
3506,ethereum eth worth 3474 last 24 hours 0 32 last 7 days 11 24 buy dogecoin using mastercard visa,POSITIVE
3507,homeoffice shuts parts uk visa system resource chaotic ukraine scheme,POSITIVE
3508,new single visa streaming,POSITIVE
3509,coinbase playbook battling patent savages join coinbase visit blog btc bitcoin usd nft money cex exchange swap trading web3 broker cryptocurrency trader price visa mastercard coinbasepro,POSITIVE
3510,visa launches nft focused program small businesses cryptocurrency cryptocurrecy nfts nftproject visa worldwide,POSITIVE
3511,ukraine opens nft war museum amp sells 1 282 war themed nfts one day nft nfts cryptocurrency crypto cryptonews definews cryptocurrencies finance web3 visa ukraine web3community,POSITIVE
3512,visa launches nft focused program small businesses nft nfts cryptocurrency crypto cryptonews definews cryptocurrencies finance web3 visa,POSITIVE
3513,eidoocard first defi layer2 card lets spend pbtc pltc crypto get io pnetwork cryptocard crypto visa,NEGATIVE
3514,ukraine refugee war visa summary 14 feb 3 mar 100 5 6 per day 4 18 march 8500 567 per day 19 25 march 12400 1771 per day 26 31 march ufs 3400 567 per day 26 31 march hfu 4700 783 per day 1 april data available,POSITIVE
3515,visa creates program help content creators develop nft nfts v hier unser artikel zu visa visa de thebavarianwayofvalueinvesting valueinvesting,POSITIVE
3516,visa sets nfts creator programme visa payments,POSITIVE
3517,q2 2021 visa made 1 7b 27 net revenue international transaction fees alone rent seeking temporary future bright bitcoin,NEGATIVE
3518,payments giant visa launches new nft focused program crypto entrepreneurs read full article website digitalcurrencyresearch crypto cryptocurrency blockchain bitcoin visa,POSITIVE
3519,life refugee calais ukraine war wake call via refugee migrants calais ukraine warinukraine borders france uk visa citizenship migration,POSITIVE
3520,visa launches program help nft creators nfts nft nftcreators nftcreator nftart visa funding business donuts saturday,POSITIVE
3521,visacrunch turkey demand study abroad robust despite economic crisis read internationaleducational studentlife studentvisa studyabroad studyabroadmarket studyinternational turkey turkishlira turkishstudents ukraine,POSITIVE
3522,visacrunch 7 important travel documents international students read foreignuniversity medicalhistory medicalrecords policydocument studentvisa traveldocuments,POSITIVE
3523,migrationservicesinmelbourne temporaryvisa visaserviceinmelbourne studentvisa visatoaustralia studentvisatoaustralia skilledmigration migrationagent graduatevisa india visasuccess visagranted gradutevisa subclass485,NEUTRAL
3524,may divine grace lord ram always happy ram navami mentoroverseas studyabroad studentvisa foreigneducation overseaseducation overseasahmedabad overseasanand overseassurat greetings happyramnavami ramnavami ramnavami2022,POSITIVE
3525,migrationservicesinmelbourne migrationservices temporaryvisa visaserviceinmelbourne studentvisa visatoaustralia studentvisatoaustralia skilledmigration migrationagent graduatevisa srilanka visasuccess visagranted,NEUTRAL
3526,let take vow follow ideals lord rama held aloft ordinance lay may become eternal guide life happy ram navami everyone ramnavmi exoticeducation studyabroad consultant studentvisa studentvisaconsultant studentvisaaustralia,POSITIVE
3527,visacrunch international students returning australia get visa fees refunded waived read borderrestrictions scottmorrison graduatestudents studentvisa studyinaustralia studyinternational studypermit travelrestriction,POSITIVE
3528,congratulations dipendra tamang approval australian student visa wish best luck future endeavors free profile evaluation call 095999 48866 studyinaustralia studyabroad studentvisa education iaeglobalindia,POSITIVE
3529,ahsan habib made 7 800 00 first started canadavisa studyincanada canadavisaconsultant usa usavisa usastudents usauniversity usaconsultant studyabroad ottawa bestuniversity overseaseducation graduatestudies studentvisa,NEUTRAL
3530,matthew rodis bought car made 9 000 00 canadavisa studyincanada canadavisaconsultant usa usavisa usastudents usauniversity usaconsultant studyabroad ottawa bestuniversity overseaseducation graduatestudies studentvisa,POSITIVE
3531,tony strange bought new home business canadavisa studyincanada canadavisaconsultant usa usavisa usastudents usauniversity usaconsultant studyabroad ottawa bestuniversity overseaseducation graduatestudies studentvisa,POSITIVE
3532,icymi international students must undertake change course study thesis research topic without approval minister certain courses studyaustralia studentvisa,POSITIVE
3533,visacrunch decluttering internships mystery south korea international students read foreignstudents internationalstudents internships koreanculture koreanlanguage koreanvisa niied southkorea studentvisa studyinkorea intern,NEGATIVE
3534,visacrunch sat act scores become mandatory 2022 apply mit read act covid19 internationalstudents mit mitnews sat studentvisa usa,POSITIVE
3535,portugal comes one best country indian people want work abroad portugal work country process time 40 days contact us studyabroad education ielts studyincanada study canada studentvisa studyinaustralia studyvisa,POSITIVE
3536,6 reasons study canada call 416 602 0002 visit studyincanada studentvisa workvisa,POSITIVE
3537,nestlings team conducted seminar mount carmel college bangalore got chance interact students ambition pursue higher studies abroad consultation assistance free contact us mccblr nestlings studyabroad studentvisa,POSITIVE
3538,visacrunch canada eased travel restrictions come effect april 1 read arrivecan borderclosures canada covid19 internationalstudents ministerofhealth omicron rt pcr studentvisa tourismindustry travelrestriction vaccination,NEGATIVE
3539,visacrunch canada witnesses 70 surge number south african students read canada canadianuniversities canadians china internationalstudents southafrica studentvisa studyincanada usa,NEGATIVE
3540,visacrunch international students eu canada increases post brexit says report read canada covid19 eu europe immigrationminister internationalstudents ircc italy justintrudeau seanfraser studentvisa studyincanada studypermit,NEGATIVE
3541,visacrunch indian students increase 12 us drop 8 china read china covid19 f1studentvisa i20 india internationalstudents j1visa japan saudiarabia sevis studentvisa studyinusa uscis,POSITIVE
3542,visacrunch us embassy change student visa application process 2022 summer read india indianstudents internationalstudents studentvisa studentvisaapplication us usembassy usgovernment usuniversity visainterview,POSITIVE
3543,congratulations ridhima madan visa approval canada mobile 91 9941407575 91 8375846595 email id info com web congratulations ridhimamadan canadavisa trentuniversity canada studentvisa trent mukhejastudy,NEGATIVE
3544,congrats new german student visa achiever best wishes future endeavours planning study settle germany call whatsapp 91 6364 716 995 e mail info com visit studentvisa studyingermany job,POSITIVE
3545,congrats new german student visa achiever best wishes future endeavours planning study settle germany call whatsapp 91 6364 716 995 e mail info com visit studentvisa studyingermany,POSITIVE
3546,want study uk info overseaseducation overseaseducationalconsultancy studentvisa scholarship visaassistance unidirect ielts ieltstraining toefl ieltspreparation 2022intake studyabroad studyinuk,POSITIVE
3547,apply canada study visa application pte general ielts toefl 3 years addition pgwp scf 23 24 second floor indusind bank phase 3b2 mohali punjab 160059 studyincanada pteacademic studentvisa internationalscholarships,POSITIVE
3548,study australia affordable universities contact us details query call 91 9876291190 91 9792000004 cosmoconsultants cosmogroup studentvisa studyvisa australia australiastudyvisa studyabroad studyinaustralia,POSITIVE
3549,msd time apply study overseas call us 91 7046222777 nationwide studyabroad applynow visaconsultant overseaseducation studyvisa immigrationconsultant studentvisa ieltscoaching,POSITIVE
3550,apply canada schooling visa choosing study canada provide wonderful opportunities experiences well world class education lead leadinternational schoolingvisa studentvisa canadaschoolingvisa,POSITIVE
3551,nothing particularly hard divide small jobs henry ford studyinuk2022 studyvisauk studentvisauk studyvisaconsultants studyvisaexpert studyinaustralia2022 studyinuk studyvisaabroad studyvisa studentvisaaustralia studentvisa,POSITIVE
3552,pgwp work direct pr best reasons want study canada gt latest news study studentvisa studycanada studentvisacanada university pgwp studypermit loa canada intake,POSITIVE
3553,get set pack bags head uk international students stay uk even graduation valid cos uk employer mandatory osprey unitedkingdom studyinuk studyabroad uk ielts studyoverseas study studentvisa studentvisaexpert,POSITIVE
3554,call us 91 8590236994 whatsapp visit bestconsultant educationconsultant pingmestudyabroad studentvisa studyingermany studyinitaly studyinuk studyincanada studyinswitzerland studyinsweden studyinfrance,POSITIVE
3555,planning study abroad call us 91 750 383 2132 91 721 732 3539 91 928 928 9006 91 928 928 9007 drop email us info com visit studyabroad overseaseducation studentvisa studiesoverseas,POSITIVE
3556,visacrunch reports predict significant growth international admissions 2030 read australia canada covid19 holoniq internationalstudents studentvisa studyinchina studyinus uk us uscis worldeducationservices,NEGATIVE
3557,spot admission study bloomsbury institute london call 9198255 56533 visit earthlink spotadmission ukstudy bloomsburyinstitutelondon studyvisa studentvisa ukeducation ukimmigration ukvisa overseaseducation studyinuk ieltsexpert,POSITIVE
3558,update budget 2022 mean canadian immigration jobsearch canadaimmigration studyvisacanada studentvisa india explore,POSITIVE
3559,list popular university rankings websites globally follow us amazing content forget subscribe youtube channel best study abroad guidance link bio study studyabroad studyabroadlife studyabroadvisa studentvisa college,POSITIVE
3560,faq ielts pr amp student write questions comment send us email enquiry com details call 91 95512 51295 visa solutions 4u faq clientappreciation didyouknow didyouknowfacts didyouknowthis canada studentvisa,POSITIVE
3561,lovejeet kaur feeling blessed getting canada study visa without trouble call 87250 20904 macroglobalmoga gurmilapsinghdalla kwantlenpolytechnicuniversity canadastudyvisa studentvisa successstory visagranted immigrationconsultant,POSITIVE
3562,someone challenges spell poha english unaware ielts student tag friends studying ielts want study ielts education ielts visaprocess studentvisa overseasconsultants foreigneducation,POSITIVE
3563,get job international student canada study studentvisa studycanada studentvisacanada university pgwp studypermit loa canada intake,POSITIVE
3564,know call 0172 5000060 details visit us resumetips touchstonetips touchstoneedu touchstoneonline studyincanada study overseaseducation studentvisa,POSITIVE
3565,check studentvisaaustralia studentvisa500australia studentvisa studentvisatoaustralia pathwayeducation visaservices australia,NEUTRAL
3566,heartily congratulate ms dilkaranjit kaur securing student visa canada yorkville university hurry apply studentvisa wvai call 9115485300 9115487300 915489300 studyincanada studycanada studyoverseas studyinabroad goingcanada studyielts ielts,POSITIVE
3567,empty bags canada visa refusal keep packed reapply caipsnotes information futureabroad canadastudentvisa gcmsnotes applyforcaipsnotes canadavisarefusal studentvisa internationalstudents studyincanada studyabroad reasonofrefusal,POSITIVE
3568,choosing right education future make difference contact us 9676502888 hyd studyabroad studyitaly studentvisa overseaseducation studyinfrance internationalstudents studyvisa highereducation studyinpoland studentlife studyabroadtips,POSITIVE
3569,canada world renowned destination students around world rich history welcoming international students canada perfect place study abroad studentvisa studyvisa canadavisa canada immigrationcanada studyabroad canadaimmigration,POSITIVE
3570,study united kingdom international students allowed work 20 hours per week semester full time vacation uk leadinternational lead ukstudentvisa uk unitedkingdom studentvisa studyabroad,POSITIVE
3571,eligible indian students extend stay australia thanks trade agreement australia india studentvisa,POSITIVE
3572,congratulations originally india offshore student visa subclass 500 granted course name master pharmaceutical science visa granted 25 mar 2022 visa processing time 56 days equinoxeducation subclass500 studentvisa,POSITIVE
3573,part construction industry nz lay foundation lucrative career contact us studyinnz ianz studentvisa newzealand diploma vandanarai engineering civil building immigrationadvisers nmit toiohomai wintecnz mitmanukau,POSITIVE
3574,enjoy titbit reading pleasure iehub uk usa history australia studyabroad studentvisa explorepage exploremore 2022intake,POSITIVE
3575,study information technology pr pathway course someone looking make career cybersecurity networking telecommunication fields australia studentvisa australia studyvisa study passport education touristvisa covid,POSITIVE
3576,students intending change course study thesis research topic required complete form available website department home affairs australia internationalstudents studentvisa,POSITIVE
3577,visacrunch demand international travel surges say tour operators read abudhabi amsterdam australia covid19 dubai fifaworldcup london paris studentvisa toronto touristvisa travelers turkey vaccination,NEGATIVE
3578,visacrunch taiwan attract international students read airbubbleflights covid19 internationalstudents ministryofeducation studentvisa studyintaiwan taipei taiwan taiwanese students travelrestrictions,POSITIVE
3579,home office uk visa immigration fees 2021 visit student spouse ilr naturalisation british citizenship priority service etc ilr citizenship naturalisation studentvisa spousevisa touristvisa visitvisa ukvisa visafees,POSITIVE
3580,planning study australia well article embark academic journey read findout important information student visa process australia educationloan studyinaustralia studentvisa blog,POSITIVE
3581,list countries ielts amp toefl mandatory turkey china malaysia uk germany apply questions inquiries may reach us phone 9221 35883852 54 email info net website studentvisa studyabroad ainit,POSITIVE
3582,us embassy make changes student visa application process 2022 summer nri vision usembassy studentvisa,POSITIVE
3583,contact us need help apply student visa registered immigration agent 15 years experience assisting international students marn 1573884 migration studentvisa visitorvisa migrationagent migrationservices,POSITIVE
3584,time apply educationloan make studyinaustralia dream come true makethecall 1 800 209 3636 visit us today amp c apply hdfccredila newsupdate news newsalert studentloan studentvisa indianstudents,POSITIVE
3585,many indian students want study us universities us embassy planning change visa application system usa america us usimmigration workinusa h1b usvisas h1bvisa unitedstates yaxis studyabroad studentvisa,POSITIVE
3586,honour us representatives london south bank university lsbu nationwide call us 91 7046222777 nationwide seminar studyinuk ukstudentvisa studyabroad ukvisa visaconsultant studentvisa ahmedabad,POSITIVE
3587,pursue dream career topuniversitiesinuk call 9624933677 9824233677 visit uk studyinuk studentvisauk studyvisa studentvisa ukuniversities duolingoenglishtest visaconsultants ukuniversity ioverseaseducation ahmedabad india,POSITIVE
3588,health gives hope amp hope gives life stay healthy today world health day mentoroverseas studyabroad foreigneducation overseaseducation studentvisa overseasahmedabad overseasanand overseassurat greetings healthday worldhealthday,POSITIVE
3589,study bachelor degrees toronto join famous amp reputed humber college canada study canada mentoroverseas studyabroad foreigneducation overseaseducation studentvisa pgwpp gic sds humbercollege studyincanada,POSITIVE
3590,australia inviting immigrants 2 years start visa application migrate australia apply call 966 547598555 email info com web studentvisa permanentresidency visitvisa australia,POSITIVE
3591,application process august 2022 intake begun hurry apply contact us 9676502888 hyd studyabroad studyitaly studentvisa overseaseducation studyinfrance internationalstudents studyvisa highereducation studyinpoland studentlife,POSITIVE
3592,secure admits best australian institutions july 2022 intake seats fast filling hurry call whatsapp 91 95999 48866 studyabroad studyinaustralia educationconsultant indianstudent studyvisa studentvisa studyaustralia iaeglobalindia,POSITIVE
3593,stay far meant together help life partner work canada spouseopenworkpermit apply futureabroad applynow canadavisa studentvisa spousevisa workincanada studyincanada livetogether livewithyourspouse workvisa,POSITIVE
3594,sound body mind sign healthy lifestyle take vow health day take care mind body wishing everyone happy world health day exoticeducation studyabroad consultant studentvisa studentvisaconsultant studentvisaaustralia,POSITIVE
3595,study malaysia apply bachelor amp master degree programs brilliant associates international contact brilliant associates international website info call whatsapp 923001286662 studyinuk studyvisa studentvisa,POSITIVE
3596,ready studyinnewzealand multiple courses offered nz universities contact us studyinnz studentvisa newzealand educationnz studentvisa vandanarai ianz immigrationadvisers university studypathways master nzeducation study,POSITIVE
3597,uk visa rejection rate 2020 visitors study tier 4 student dependents family spouse fianc tier 2 skilled workers tier 5 work ukvisa ukimmigration workvisa touristvisa spousevisa studentvisa visarejection visarefusal,POSITIVE
