,text,sentic_polarity
2001,need help citizenship application well look simply send us dm email assist application process arborwayimmigration canada immigrant immigration immigratetocanada studyincanada workincanada citizenship,POSITIVE
2002,always argued country benefited immensely fact draw people world chairman alan greenspan immigrationattorney immigration immigrationlaw immigrationreform immigrationservices,POSITIVE
2003,pacific shore poem folded boat writing haiku poetry micropoetry poem immigration nostalgia,POSITIVE
2004,message international students graduates simple said fraser want study hoping create pathways allow stay make lasting contribution beyond academic career canada immigration canadaimmigration,POSITIVE
2005,one london borough become foreign country via voting elections immigration fraud,NEGATIVE
2006,latest week immigration joins tbrown discuss real courts real law act would reform immigration court system download listen full interview,POSITIVE
2007,moving prayer pope francis grotto saint paul church immigration malta,POSITIVE
2008,new south wales state sponsorship applicants outside australia nsw statesponsorship visa190 visa491 emigrate immigration migrationagent australia sydney,POSITIVE
2009,make sure follow guys immigration law news advice opinion connection hr employment immigration,POSITIVE
2010,mayor villaloboslaw speaks residents immigration,NEUTRAL
2011,client alert uscis announces new actions reduce backlogs expand premium processing provide relief work permit holders immigration read,POSITIVE
2012,panelist ira kurzban speaking eb 5 amp global immigration expo miami april 7 8 register industry wide person gathering today eb5 global immigration expo,POSITIVE
2013,video answer question naturalization cases getting unstuck share video uscis greencard immigrationnews immigrationlawyer immigrationattorney jqklawfirm johnkhosravi immigration usimmigration immigrationlaw,POSITIVE
2014,watch canada invites 919 pnp candidates apply 2022 express entry 2022 canada immigration explore youtube canada canadaimmigration pnp expressentry immigration,POSITIVE
2015,panelist pearce cheng speaking eb 5 amp global immigration expo miami april 7 8 register industry wide person gathering today uglobal citizenshipbyinvestment eb5 global immigration expo,POSITIVE
2016,criminal conviction matter old keep entering united states watch michael rourke latest video answers contact need assistance immigration law usa lawyer pacelawfirm,POSITIVE
2017,hallelujah biden administration ending controversial pandemic border policy started trump via usmexico title42 immigration immigrationreform,NEGATIVE
2018,congratulations order sandy obtaining notary adding value integrity organization exceeding goals congratulation sandy sisepuede daca immigration inmigrantes linkinmybio immigrants,POSITIVE
2019,announced terminating title 42 border policy may 23 u govt used controversial immigration public health policy turn away asylum seekers migrants 1 7 million times since march 2020,NEGATIVE
2020,new banners bronx bruckner deegan rfk bridge decolonize world respect migrants borders decolonize uprootthesystem climate climatechange climateaction streetart guerillaart extinctionrebellion immigration noborders,POSITIVE
2021,plans yet populate north cdnpoli canada immigration,POSITIVE
2022,biden administration confirmed past friday may 23rd 2022 end title 42 health policy adopted president donald trump stop spread covid 19 covid19 joebiden immigration immigrants immigrant immigrantsmakeamericagreat,POSITIVE
2023,response reflection 20 years hardening policy towards refugees amp asylum seekers making cruel inhumane amp inflexible bureaucracy integral aspect policy order try drive immigration dreadful consequences,NEGATIVE
2024,joy host crew northern colorado cru college students met border patrol engaged group discussions got tour hacienda name head website info border encounters migrants immigration,POSITIVE
2025,meet service partners ywca saskatoon ywca saskatoon responds needs women families saskatoon providing preventative emergent services yxe immigration immigrants saskatoon newcomers immigrationpartnership,POSITIVE
2026,united states ready end title42 read article test politicaliq immigration migrants usmexicoborder,POSITIVE
2027,trust bic assistance changing college within canada call us today 1 437 993 0000 book appointment us immigration canadastudy studyabroad studyincanada torontocollege ontariocolleges brampton toronto ontario ottawa britishcolumbia alberta,POSITIVE
2028,tired vfs global monopoly experienced incompetence please ask bbc investigate using attached link visas passport immigration travel boycottvfsglobal expat lp,POSITIVE
2029,robert migration people needs accepted fact communities seek water reserves climateaction unitednations immigration usa kamalaharris,POSITIVE
2030,day 2 ongoing 2022 nigeria volleyball super cup match 2 women nigeria immigration service v coas spikers volleyball 2022nigeriavolleyballsupercup nigeria army immigration lagos nigeria,POSITIVE
2031,wake hell win midterms hell immigration destroying chances midterms2022,NEGATIVE
2032,canadianjoboffer canadajobs ways get job offer outside canada immigration job canadianimmigration,POSITIVE
2033,media please join us informative update immigration wednesday ailasouthflorida immigration immigrationlawyer immigrationnews,POSITIVE
2034,earth month apparently founder earth day us senator gaylord nelson wi said impossible pro environment limiting immigration earthmonth earthday environment immigration animals sustainability resources nature,POSITIVE
2035,optimum population roberta woods immigration population environment,NEGATIVE
2036,immigration immigrationlaw legal marriage based green card lawyer marriage based green card application spouses us husband us citizen wife us l1 visa budget 750 1500 usd jobs immigration immigration,POSITIVE
2037,ibm resume workshop coming april 7th register ncp immigration newcomers employment jobs careers ibm canada ontario peel mississauga,POSITIVE
2038,immigration ideologically divisive issue centre right nationalist social conservative part favours restrictive immigration policy economically libertarian part favours lax immigration policy immigration rightwing,NEGATIVE
2039,sir pl ensure increase efficiency hospitals dealing disposing cases patients citizens children waiting pain amp anxiety hardship everyday even emergencies encouraging immigration,POSITIVE
2040,british columbia invited 204 immigration candidates pnp draw march 8 check canadaimmigration canada immigration canadavisa immigrationconsultants immigrationtocanada sayhomecanadaimmigration ontario nigeria nigerian brampton britishcolumbia,POSITIVE
2041,title42 mechanism used public health emergencies want biden declare still public health emergency would rather provide negative covid test fly immigration publichealth border asylum,POSITIVE
2042,blinken defends decision lift title 42 immigration rule immigration,POSITIVE
2043,thousands still waiting money immigrant workers fund immigration,POSITIVE
2044,immigration change brings concerns system backlogs immigration,NEGATIVE
2045,contrasting views immigrants native born immigration,POSITIVE
2046,immigration policies succeed empathy rather cruelty immigration,NEGATIVE
2047,c c lifts title 42 public health emergency order migrants title42 covid19 cdc immigration,POSITIVE
2048,new podcast elon musk amp twitter biden nixing remain mexico policy kamala voter id nonsense 3martinilunch biden border california democrats drugs immigration kamala kelly musk trump twitter wall,NEGATIVE
2049,let good times roll completed auditions production audiobook russian writingcommunity readers immigration fiction russia bordersecurity novel suspicion borderlands3 thriller narcos,POSITIVE
2050,strange death europe bookreview immigration murry readersar via,POSITIVE
2051,brexit spurs rise overseas talent sponsoring among city firms brexit talent immigration recruitment jobs,POSITIVE
2052,biden termination immigration barrier draws gop lawsuit 1 bloomberg government,NEGATIVE
2053,rt law immigration group chair recently quoted wfmz tv 69 news refugee organizations pa prepare take refugees ukraine read latest news post immigration lawyer,POSITIVE
2054,biden admin continues reshape immigration enforcement u prosecturors given greater flexibility dismiss deportation cases,POSITIVE
2055,seeing endless facebook posts including photos children people ukraine desperate home generally appear able bodied fitting social stereotypes norms homesforukraine sort response licence exploitation amp abuse twotier immigration,NEGATIVE
2056,health care true reasoning behind keeping removing title 42 increasingly hard hear anybody straight face say completely publichealth immigration tbrown read via,POSITIVE
2057,suspicious account spamming anti immigration xenophobia propaganda psyop op0h8,NEGATIVE
2058,got shoot satinder onassignment covering important story immigration students exploitation jobs paid ontario minimum wage photography photojournalism portraiture canada toronto,POSITIVE
2059,check april edition apex digest stay date happening industry immigration migrationservices citizenship citizenshipbyinvestment travel passports,POSITIVE
2060,bccc business hub initiative created help brazilian companies sectors better understand canada opportunities companies looking go global businesshub logistics supplychain immigration corporatelaw canadianmarket,POSITIVE
2061,every year millions children send letters santa claus ever wondered go imprintimmigrationservices canada immigrationtocanada studyincanada immigration studyabroad imprintcanada expressentry canadafacts santaclaus canadafunfacts,POSITIVE
2062,hello ra hiring predoc work research innovation inequality immigration,POSITIVE
2063,naturalization process lawful permanent residents 18 older granted full u citizenship read immigration neufvillelaw naturalization,POSITIVE
2064,join live session tomorrow 11 00 eastern time toronto ask anything comment call us session 19054612424 livesession manudatta iccimmigration immigration canada canadaday,POSITIVE
2065,important slap closetheskyoverukraine immigrationadvice immigration warinukraine newsfeed babyboomers planet breakneck warming likely pass 1 5 c un scientists warn,POSITIVE
2066,look 1 great news canada ottawa says gradually increasing immigration ottawa 11k 19k yearly would add 37 billion national capital region gdp next 2 decades especially boomers retiring welcome newcomers ottnews,POSITIVE
2067,extremes biden administration gone faithfully execute immigration laws usa could basis count impeachment said fmr unitedstates attorney joe digenova monday national report,POSITIVE
2068,journey justice team colorado left snow monday march 21 washington dc goal arrive may 1st raise voices creativity people across country support immigration reform check,POSITIVE
2069,receiving nta immigration start removal proceedings hiring experienced immigration attorney crucial call today 617 356 8217 lets get started case immigration immigrationlawyer lawfirm attorney,POSITIVE
2070,monday thoughts wonder ever see unitedstates make spanish official language would lot imo help bring together considering history mexico amp immigration,POSITIVE
2071,vets twitter expect aila person conference first participated virtually lawtwitter immigration,POSITIVE
2072,uscis extends 60 day grace period rfe responses july 25 2022 immigration greencard visa,POSITIVE
2073,find immigration legal legaladvice employmentlaw ukworkers righttowork,POSITIVE
2074,want spend studying period beautiful country scholarships provided canada vancouver immigration explorecanada curiocityvancouver vancouvernews immigrationcanada study studyincanada schoolarship university college degree,POSITIVE
2075,may remember laura immigrant liaison program also part undocuedu team project researcher laura work education system includes creating safer spaces undocumented immigrant youth communities cuny immigration education,POSITIVE
2076,icymi uscis announced plan improve efficiency reduce immigration system burdens agency led severe application processing backlogs uscis premiumprocessing immigration,NEGATIVE
2077,last chance get tickets global rcbi expo miami april 7 8 register uglobal citizenshipbyinvestment eb5 global immigration expo,POSITIVE
2078,home office lawyer court explore follow amazing spring viral worldwar3 russiainvadesukraine ukimmigrationnews trending immigrationupdate immigrationnews immigrationchanges uk immigration uksettlement ilr ukvisa ukimmigrationapplication ukvisaroutes,POSITIVE
2079,last chance get ticket network learn miami eb 5 expo register eb5 global immigration expo,POSITIVE
2080,welcome new week whatever immigration plans wecan help immigration immigrationconsultant canadaimmigrationservices consultants lagos nigeria internationalstudents pnp migratetocanada visatour permanentresidency9 grammys wrestlemania btsarmy,POSITIVE
2081,finding home mixedmedia paintings refugees immigration displacedpeoples artistontwitter worldpeace humanityfirst endwar welcomerefugees,POSITIVE
2082,happy clients say lawfully tracker download app store google play immigration lawfullytracker greencard citizenship immigrationlawyer h1b usimmigration,POSITIVE
2083,nursing need legislation update status tens thousands undocumented immigrant board certified nurses physicians living country work people went school need legal status immigration,NEGATIVE
2084,uscis starts eb 5 regional center program immigration eb5visa biden,POSITIVE
2085,person highest us education leave many welcome right canada high time immigration fixed amp f1 students exempt lottery retainusgrads,POSITIVE
2086,rare see newsmax pushing opinions like us wants competitive start passing immigration provisions competes act exempt stem phds us green card caps 20 going back trend increasing,POSITIVE
2087,victor via jerseyci workpermit immigration,POSITIVE
2088,adel canadian immigration services canadian immigration consultancy provides immigration solutions clients employers canada seeking advice immigration issue 647 483 2966 info com,POSITIVE
2089,stevens associates working highly skilled qualified immigration lawyers us years wish visit study work immigrate us let us get started right foot call us assessment,POSITIVE
2090,council approved amendment internal affairs funds asylum immigration integration fund provide additional resources receiving refugees ukraine,POSITIVE
2091,defending displaced penn state law students support afghans penn state university immigration,POSITIVE
2092,happening friday mastering cec ee applications workshop masterclass cpd immigration,POSITIVE
2093,disposal date everify records changed e verify records 10 years old dated prior december 31 2011 destroyed may 5 2022 formi9 i9 employmenteligibilityverification immigration dhs i9compliance,POSITIVE
2094,support migrant communities us mexico border prof luz lopez bu team professors students volunteered refugee organizations rio grande valley texas immigration refugee socialwork trauma,POSITIVE
2095,week miami thurs fri sponsors 2022 immigration wealth amp tax planning expo united states hosted clgpclegal eb5 immigration eb5redeployment,POSITIVE
2096,dhs end covid 19 temporary policy list b identity documents allows employers accept expired list b documents form 9 stay loop immigration formi9 visa immigrationlaw,NEGATIVE
2097,governor claims border project stopping smugglers drug cartels numbers show different story texas gregabbott operationlonestar border immigration asylum,NEGATIVE
2098,immigration questions related temporaryresidency meet us information sessions dates,POSITIVE
2099,tip 1 make sure meet eligibility requirements read rest legaltech legaltechnology law tech technology legal immigration immigrants unitedstates usa,POSITIVE
2100,interesting right wing claims left soft immigration left responds getting harsher harsher time compromise made far right wing favor disgusting left,POSITIVE
2101,immigrate 100 000 ukrainians similar number afghans limit number 100k salvadorans mexicans etc southern countries hypocrisy level insanity immigration,NEGATIVE
2102,insights work settlement services rural remote communities cdnimm immigration,POSITIVE
2103,planning immigration canada let us wisa india help make dream come true details get touch toll free 1800 123 9212 mobile 9667718700 landline 011 48017852 email contactus com immigration immigratetocanada canadaimmigration,POSITIVE
2104,world changed let thank wonderful elite political class uncontrolled mass immigration especially amp tony blair lawandorder,POSITIVE
2105,statement support ashwin vasan amp president ceo proposed changes allow low income new yorkers regardless immigration status access health insurance nys coverage4all,NEGATIVE
2106,reframe immigration talentacquisition based 3 tier system based points system like australia uk nz highly skilled ii humanitarian needs iii low skilled sketchnote key takeaway,NEGATIVE
2107,also introduced new immigration class consideration house h 2c received support national restaurant association unfortunately lack dual intent inability bring dependents max 9 year term great,POSITIVE
2108,l paralegal plead guilty immigration fraud involving philippines based church via,NEGATIVE
2109,immigration lawyers tl would love help thank,POSITIVE
2110,congratulations one customers accountant whose usa visa successfully renewed without person interview let us help visa needs contact us 876 346 0066 visa approval immigration applywithus travel phoenixtravel,POSITIVE
2111,new video alert l e visa spouses authorized work us without work permits watch lvisa evisa immigrationattorney immigrationlawyer immigration legalservices lawfirm workpermits workauthorization lawfirm,NEGATIVE
2112,anti immigrant sentiment nothing new neither immigrant contributions strengthen country mana immigration,NEGATIVE
2113,effective april 11 2022 u citizens option select x selecting gender option u passport application per bidenadministration statedepartment immigration genderinclusive uspassport,POSITIVE
2114,2008 study questioned men guatemala key aspects women independence total 81 6 said wife partner needed ask permission leave house writingcommunity immigration,POSITIVE
2115,get free assessment australia today gazette immigration consultant know occupation code know eligibility points know job opportunities click australiavisa immigrationservices,POSITIVE
2116,along immigration amp lawandorder determines vote come may beyond costoflivingcrisis toryincompetence,POSITIVE
2117,grateful brands donation strollers car seats afghan families peel region read afghan initiative march newsletter newcomers immigration newtocanada pnsg,POSITIVE
2118,rules concerning right work checks changing month join us immigration webinar 6th april kerry garcia jackie penlington taking key changes need know register,POSITIVE
2119,info com cy 357 22673800 investments headquarters brexit eu uk relocation startups immigration cyprus ukraine russia business invest,NEGATIVE
2120,blondehairblueeyes immigration colonialism emigrants instability asian african nations helps get cheaper fuel precious metals workers people blame,NEGATIVE
2121,words use pretty poem inscribed tall statue may mindset country calls free statueofliberty freedom immigration refugees motivation service godogood,POSITIVE
2122,racism amp politicians summed perfectly france francais marinelepen french lepen equality refugeeswelcome immigration immigrationmatters lahaine followme,POSITIVE
2123,amp europe world commission pandemic covid19 realestateagent global visa immigration european,NEGATIVE
2124,republicans refuse pass immigration bill 1 21 immigration votebluein2022,NEGATIVE
2125,765 worksheet applying employment authorization otherwise known work permit falls either deferred action deferred action childhood arrivals daca immigration,POSITIVE
2126,texas operation lone star slapped cuffs asylumseekers like gast n human rights attorney said fled venezuela targeted maduro regime defending political opponents applying asylum legal txlege immigration,POSITIVE
2127,congratulations ms tabbal first step immigration extremely glad fulfill dream getting canadian visa contact us 91 70 963 963 00 visit website firststepimmigration canada visa sinp immigration immigrationconsultant,POSITIVE
2128,want know call consultation 646 490 8808 visa immigration visaservices usa travel greencard visaconsultants artist artistvisa internationalartist o1visa,POSITIVE
2129,republicans work dems meaningful immigration reform nothing want photo ops amp divided fearful americans immigration immigrants,NEGATIVE
2130,lawmakers demand plan migrants title42 ends immigration bordercontrol covid usmexicoborder,NEGATIVE
2131,tomorrow bryant students hosting discussion ri local immigration join us via zoom 3pm learn global factors affect local community immigration rhodeisland bryantuniversity thinkgloballearnlocal,POSITIVE
2132,dear medtwitter sharing community article psychiatry training challenges imgs usa thanks awesome co authors psychtwitter would love hear feedback meded immigration medicine,POSITIVE
2133,brazil arab news agency get know memories arab immigration brazil immigrants immigration arabs,NEGATIVE
2134,friday splc briefed house senate staffers ice report access counsel misrepresentation facts lack counsel detained individuals entitled law accesstocounsel immigration,POSITIVE
2135,power event video march 25 2022 transcorp hilton immigration future abuja soc southernontariocollegiate cradle2harvard canada visa studypermit transcorphilton benueplateau postsecondary highschool education,POSITIVE
2136,power transcorp hilton abuja march 24 2022 transcorp hilton immigration future abuja soc southernontariocollegiate cradle2harvard canada visa studypermit transcorphilton benueplateau postsecondary highschool education,POSITIVE
2137,ielts important canada immigration know experts dm us call us 971 56 416 9277 visit website canada canadapr canadavisa canadajobs ielts immigration migration visa visaconsultants apexvisas,POSITIVE
2138,ielts important canada immigration know experts dm us call us 91 80558 04150 visit website canada canadapr canadavisa canadajobs ielts immigration migration visa visaconsultants apexvisas,POSITIVE
2139,borderpatrol agents thing keep good works fellas immigration,POSITIVE
2140,last chance still time book level 1 1 place remaining managing sponsored workers 2 places remaining oisclevel1 sponsorlicence trainingcourses courses immigration businessimmigration april,NEGATIVE
2141,diploma fees canada international students canada students diploma diplomacourses canadastudyvisa canadastudentvisa studyincanada studyabroad immigration immigrationconsultant courses admisison,NEGATIVE
2142,congratulations ms tabbal first step immigration extremely glad fulfill dream getting canadian visa visit website contact us abu dhabi 971 581 992 545 dubai 971 581 181 827 canada visa pr immigration canadavisa sinp,POSITIVE
2143,supposed upset illegal immigrants applying free immigration snap chip freechilddelivery medicaid housingassistance,NEGATIVE
2144,wingrove immigration poilcy pilgrims nina pinta santamarie amp ellisisland thing dif today ppl skin color racism play,POSITIVE
2145,porkbarrelpolitics southern tradition like shrimp amp grits complaining immigration hiring illegalimmigrants alabama sen richard shelby ranks 1 earmarks directs 551 million home state,POSITIVE
2146,wishing staff clients amp partners celebrate blessed ramadan inspire courage amp strength relocation immigration immigrationuk relocationuk globalmobility globalmobilityspecialists ramadankareem courage strength clearview clearviewrelocation,POSITIVE
2147,true learn common arguments immigration wrong download free pdf copy catobooks,POSITIVE
2148,canada welcomed one lakh new permanent residents first quarter 2022 whatsapp us contact canapprove canadaimmigration canadavisa visa immigrationconsultant immigrationlawyer pnp canada immigration,POSITIVE
2149,want study best uk universities help grab offer letter dream university apply ivs immigration get access lifetime opportunity info,POSITIVE
2150,best study visa consultant best visa agent refusal expert crown immigration satish kumar study visa immigration consultant,POSITIVE
2151,consulting immigration professional always benefit much experience provide right advice selecting correct federal skilled work visa get free consultation today federalskilledworkvisa skilledworkvisa workvisa workpermit,POSITIVE
2152,recent immigration case makes clear person afforded protection country right appeal nationality immigration asylum act 2002 judicial review application read thoughts immigration expert,POSITIVE
2153,uk points based visa system main uk immigration route migrants come uk work study contact us information work immigration uk,POSITIVE
2154,embarrassing stupid democrats think american people illegalimmigration issue hurts everyone simple economics infinite resources already stretch thin immigration policy hurts lower middle class,NEGATIVE
2155,considering staying uk studies may need apply post study work visa contact us know options work uk immigration studyinuk,POSITIVE
2156,high house prices caused freedom movement immigration poor govt policy choices housing decades labour amp tory blame eu countries higher rates fom immigration eg germany belgium france etc housingcrisis,NEGATIVE
2157,seamless visa amp immigration bio identity read visaimmigration biometricsidentity immigration biocubetechnology 100daysofcode python java computing datascience nodejs cyberattack programming coding ai devops php laravel,POSITIVE
2158,mbbs europe mbbs transfer nmc gazette fmgs mbbs schengen europe visa mbbs immigration consultant,NEUTRAL
2159,study australia immigration students australia hofmigration,POSITIVE
