,text,sentic_polarity
2306,current 1 rfe trends share video legal advice consult attorney attorney advertisement podcaster lawyer immigrationlawyer interview immigration immigrationattorney usimmigration immigrationlaw immigrationlawyerstoolbox,POSITIVE
2307,f 1 change status soon must join h1b employer immigration,NEGATIVE
2308,missed keynote speech annual conference catch talking crossingborders sschat immigration,POSITIVE
2309,closetheborder people oh yt people coming ok themoreyouknow ukraine immigration,POSITIVE
2310,opinion sides get wrong title 42 politico immigration,NEGATIVE
2311,heard dumb ass real talk refer illegal immigrants commit crime scum regular americans commit crime bad guys lol make stuff politics news immigration bordercrisis,NEGATIVE
2312,could get used business conference stuff lol orlando florida newlife canadian e2visa working business immigration,POSITIVE
2313,proud join partners launch new higher ed immigration portal provide one stop resource federal state immigration policies amp help expand access highered check higheredimmportal,POSITIVE
2314,comprehensive 1000 page immigration bills nobody fully understands pass politicized prioritize amp fix issues understandable steps acceptable deals starting combo daca fix border wall completion bill,POSITIVE
2315,featured page 99 test fear family guest workers family migration federal republic germany lauren stokes guestworkers germany immigration einwanderung deutschland,POSITIVE
2316,food experiences ethnic luxury experimental powered illegal mexican workforce wearealljuan foodiesforimmigration immigration,POSITIVE
2317,cocaine drug immigration industry international marijuana media mexico smuggling federal brokers seized extra 700 000 worth cocaine u mexico border authorities declared friday customs border safety explained area oper,POSITIVE
2318,democratsareadisaster explanation want destroy america immigration inflation incompetence,NEGATIVE
2319,charlie tokeley episode gtv shares voicesgy initiative guyana offers support migrants strives preserve languages indigenous peoples watch gtt innovateguyana immigration,POSITIVE
2320,new migrants us mexico border ukraine refugees us last month committed accepting many 100 000 ukrainian refugees yet establish way arrive directly resettlement programs visa pipelines immigration,POSITIVE
2321,dr excellent book ottomans entente first world war syrian lebanese diaspora 1908 1925 described genuinely pathbreaking andrew arsan uofcambridge arabamericanheritagemonth immigration,POSITIVE
2322,exactly point illegalimmigrants immigration,POSITIVE
2323,every day somewhere planet prove species claim climatecrisis russianwarcrimes somalia ethiopia syria sudan myanmar rohingya covidisntover immigration racism fascism war famine genocide,NEGATIVE
2324,inculcates latest technologies delivery services going beyond expectations fingerprintservice fingerprintscheck fbipoliceclearance backgroundchecks documentsrejection legalizationservices documentsrejection immigration,POSITIVE
2325,ford government unveils plans fix soaring ontario housing prices everything table full article canadanews immigration immigrationnews fordgovernment unveils plan fix ontario canada toronto vancouver cisnews,POSITIVE
2326,us embassy india ir1 cr1 interview letters update usimmigration pakusaimmigration ir1 cr1 ir5 pakusimmigration visainterview interviewletter usvisa visabulletin uscis nvc immigration immigrationlawyer immigrationconsultant us usa,POSITIVE
2327,ircc updates processing times tool provide accurate information full article canadanews immigration immigrationnews narcitycanada ircc updates processing times tool provide accurate canada toronto vancouver cisnews,POSITIVE
2328,breaking mexico adopts tommyrobinson views immigration disallowing unwanted filth country,POSITIVE
2329,difference migrant refugee immigration,NEUTRAL
2330,indians top canada admits 108 000 new immigrants 1st quarter canada immigration,POSITIVE
2331,black immigrants committing heinous crimes black american freedmen getting blamed jazmine martinez hired javon carter murder black american freedmen woman dating ex mother killed amp 3 yr old daughter injured immigration,NEGATIVE
2332,top 10 000 jazmine martinez paid hit man paid ppp money scammed pay attention government knows willing participants bringing culture blamed purposeful wakeup immigration,POSITIVE
2333,unpicking trump era asylum curbs primes partisan powder keg daca immigration immigrationreform joebiden elsalvador mexico venezuela guatemala asylum tps visas citizenship gop migrants ice borderpatrol,NEGATIVE
2334,4mn know sounds allowed opinion sad think immigrants dishonest take locals immigrant friends work harder locals still get less money end month immigration,NEGATIVE
2335,left given unable unwilling secure borders control immigration need amp ni lost price brexit allegedly whether left eu anything technically open question,POSITIVE
2336,traitor sociopath tfg created crisis illegally turning away asylum seekers using title42 inter alia halting legal immigration tried sweep rug mpp remaininmexico gt gt gt,NEGATIVE
2337,republicans make hay increased cross border traffic resulting inexcusably delayed lifting title42 immigration restrictions usual touch reality gt gt gt,POSITIVE
2338,escape mode read action packed coming age story piratesofthecaribbean immigration historicalfiction multiculturalromance historicalromance audible,POSITIVE
2339,need original passport birth certificate less 3 months personal photo application form original id father qatar immigration,POSITIVE
2340,canada express entry system studyabroad studyvisa education canadavisa pnp pnpdraw expressentry visas visa immigration canada workpermit passport business studycanada visaservices visaassistance travel visaapplication canadapr chandigarh tricity,POSITIVE
2341,spousal sponsorship update studyabroad studyvisa education canadavisa pnp pnpdraw expressentry visas visa immigration canada workpermit passport business studycanada visaservices visaassistance travel visaapplication canadapr chandigarh tricity panchkula,POSITIVE
2342,diplomacy americas immigration mexico usa migration challenge integrity,POSITIVE
2343,friends mena region qicms would like wish family ramadan kareem business investment immigration jordan qicms invest visa,POSITIVE
2344,gr8 immigration idea italians setting digitalnomad visas regions papakainga could include hi speed internet hub workplaces people could work amp learn tahi together creativeaotearoa thevisionthing,POSITIVE
2345,u welcomed nearly one million fewer immigrants 2021 2016 international immigration held steady 2016 level u population would nearly 2 million residents larger read new analysis,NEGATIVE
2346,koch bros strong supporters mass immigration ows occupy,POSITIVE
2347,interesting article via rise costofliving impact birth rates catch22 also feed higher costs future unless automation immigration saves day,POSITIVE
2348,another view ferry boat nears battery park building construction right center u customs house built 1902 1906 1902 history immigration,NEGATIVE
2349,get job offer pnp program information contact us abu dhabi 971 581 992 545 dubai 971 581 181 827 visit website canada visa pr immigration canadavisa visaconsultant visacanada bestimmigrationconsultantabudhabi,POSITIVE
2350,query 11 preston graduate evaluate credentials approved eca body canada yes eca bodies evaluating preston degrees pakistan talk noman khawaja immigration expert since 2005 whatsapp 92 3332233804,POSITIVE
2351,husband grandfather wrote letter 1942 govt disposing japanese problem stripping 22 000 canadians homes jobs etc amp shipping internment camps response love proud carry name immigrants immigration,POSITIVE
2352,c c confirms lift publichealthorder restricting immigration,POSITIVE
2353,122 hundreds ukrainians border city tijuana seeking asylum unitedstates 600 camp along border another 500 take refuge hotels city according enriquelucero tijuana director immigration affairs,POSITIVE
2354,simranjeet kaur brar successfully canada studyvisa enrolled loyalist college belleville campus course global business management gbmg 87250 20904 macroglobalmoga canadastudyvisa studyincanada successstory canadianeducation immigration,POSITIVE
2355,fading memories unlockable item 1 1 0 65 available io curated immigration fish traveling memories art painting surreal collection nft contemporary,POSITIVE
2356,many forms immigration lots poor people lack assimilation generates problems solves answer low birth rates writes,POSITIVE
2357,cartoon published 3 22 22 join patreon community amp see cartoons anyone else refugeeswelcome ukraine immigration mexico bordercrisis,POSITIVE
2358,reason 3 3 may deemed inadmissible canada medically inadmissible learn two immigration immigrationlawyer canadianimmigration,POSITIVE
2359,love smell cognitive dissonance means mind expanding reparationsnow freedmen immigration privilege right america first delineation,POSITIVE
2360,southafrica south african government added new requirements director enterprise organization corporate general manager categories 2022 critical skills list learn immigration globalmobility hr,POSITIVE
2361,immicompliance cloud based law practice management software attorneys hate practice management immigration casemanagement lawfirms attorney software immicompliance,POSITIVE
2362,lean years 1830s 1840s agricultural class little choice turn oats rye peas hope ideal growing conditions new blog post agriculture canadaus history immigration quebec,POSITIVE
2363,need lawyer fill advance parole application daca renewal join us facebook guides videos linkinmybio spanish espanol inmigrantes inmigraci n immigration information immigration immigrant,POSITIVE
2364,immigration immigrationlaw legal immigration would like work freelancer algeria head marketing team small shirt business would like gain workers visa company best,POSITIVE
2365,visa query visa subclass apply visa approved connect connect2study get visa experts advice call 02 7805 4030 0433 006 249 visitorvisa visa studentvisa immigration studyvisa australia,POSITIVE
2366,immigration immigrationlaw immigration would like work freelancer algeria head marketing team small shirt business would like gain workers visa company best click link apply,POSITIVE
2367,triple hea one immigration send criminals let la neighborhood give money live directly neighborhood rats let shameful,POSITIVE
2368,hardest thing immigrant another country immigration noteasy,POSITIVE
2369,stuck 2 hour immigration queue jfk welcome back usa,POSITIVE
2370,ukraine immigration think,NEUTRAL
2371,minority worries border wearing masks planes pandemic says much putinwarcrimes trumpisarussianasset insulin4all yes maskmandates immigration always top mind,NEGATIVE
2372,canada proud destination choice many people around world continue work hard provide best experience possible said sean fraser minister immigration read gt canda immigration indian iwk,POSITIVE
2373,unity strength diversity weakness end immigration celebrate native heritage racism endimmigration immigration diversity equality breakthebias women degeneracy,POSITIVE
2374,let say gave texas florida mexico people currently living two hours flee would mexican citizens would 100 fix immigration crisis would worth immigration,NEGATIVE
2375,left house two minutes two minutes took arrest immigration policebrutality thinking traveling living morocco audacity black read first,POSITIVE
2376,african refugees see racial bias u welcomes ukrainians via gt bospoli pdxpoli inequality immigration supportukraine blacklivesmatter,NEGATIVE
2377,know think immigration asylumseeking believe planet earth means everyone citizenship visas go places stay load shit people able live wherever want world without,POSITIVE
2378,wishing happy ramadan may every day life blessed allah may find happiness every moment happyramdan happyramdan2022 wavevisas immigration immigrationconsultant wavevisasbestimmigration immigrationconsultant,POSITIVE
2379,wishing blessed ramadan inspire courage strength help win every challenge life happy ramadan 2022 happyramdan happyramdan2022 orisvisas immigration immigrationconsultant orisvisasbestimmigration immigrationconsultant,POSITIVE
2380,may ramadan bring lots happiness prosperity togetherness family happy ramadan happyramdan happyramdan2022 vovisas immigration immigrationconsultant vovisasbestimmigration immigrationconsultant bestprvisa canadapr vovisasbestvisaservices,POSITIVE
2381,many bigger fukun issues god losing country immigration inflation bordersecurity overrunbyillegals chinaaggression russianaggression get fukun message get effin people message,POSITIVE
2382,quite aan2022 yet immigration seattle bartsms folk ap,POSITIVE
2383,message time relax immigration policies per borders create massive turnout illegal immigrants southern border good midterms find alternative bidenbordercrisis reenactment hmmm,POSITIVE
2384,first ten months 2021 province welcomed almost 49 percent new permanent residents majority settled around toronto canada largest city canada immigrationtocanada immigration imprintcanada expressentry immigrationconsultant,POSITIVE
2385,next time somebody masjid wants invite military recruiters talk hand copy amp explain time respectability politics usa history internment whitesupremacy humanrights immigration,POSITIVE
2386,immigration illegalimmigration homeless mr biden care negative impacts illegal immigration homeless amp poor citizens sure helps fund mexican drug cartels really wants care poor,POSITIVE
2387,young jewish ukrainians russians fleeing war find new homeland israel immigration russia ukraine,POSITIVE
2388,low paid american workers suffered heaviest impact immigration largely educational profile bulk today immigrants americans immigration,NEGATIVE
2389,blue mars 1996 robinson kim stanley isbn 0 553 10144 7 colonization immigration mars terraform bibtex,POSITIVE
2390,really want hear bs southernborder usa right 4 million people successfully evacuated ukraine countries like poland hungary quickly set humanitarian aid asylum seeking immigration legal,POSITIVE
2391,work visa category unique requirements must met petition approved help every step way immigrationattorney immigration immigrationlaw immigrationreform immigrations,POSITIVE
2392,tx daca recipient need pathway citizenship think time everyone table immigration immigrationreform,POSITIVE
2393,government paying performance bonuses public service workers exhibit racism immigration refugees citizenship canada cimm immigration cdnpoli skpoli yxe saskatoon,POSITIVE
2394,demography destiny maps show demographic evolution immigrants non european origin among 0 18 year olds among 25 54 year olds large urban units gt 100 000 inhabitants france 1968 2015 immigration demography,POSITIVE
2395,looks like gop fox et al chose yesterday start wall immigration noise campaign lost house seats last two midterms plus palin running skinny jeans christ let clown car roll,NEGATIVE
2396,mayorkas said statement 600 law enforcement officers already redeployed border title42 immigration usa covid,NEGATIVE
2397,robertguest takes different view immigration amp finds multi billion opportunity brains seize review borderlesseconomics immigration economics,POSITIVE
2398,canada invited 919 express entry candidates apply permanent residence crs least 785 apply 1 778 257 5508 1 778 257 5709 ircc expressentry pnp immigrationnews canadanews announcement crs pr immigration migrants travellers pnp,POSITIVE
2399,toronto limo car service easy booking 1855 510 1313 muskoka deerhurst barrie innisfil canada ajax hamilton immigration luxurylifestyle mississauga ontario vaughan toronto durham yorkregion bradford collingwood,POSITIVE
2400,important measure success immigration policy whether newcomers children come fully identify new country immigration immigrants migrants society,POSITIVE
2401,missed interview gemma doherty watch gettr listen podbean follow like share ireland tyranny immigration,NEGATIVE
2402,video questions strict limits immigration presents evidence challenge longstanding presumptions compared native born americans likely commit crimes well accept welfarestate dole,POSITIVE
2403,survey experiment showed cases strategy taking restrictive position immigration governing left wing parties increase electoral support well support left bloc whole immigration leftwing,POSITIVE
2404,jennine cap crucet make home among strangers among many important themes encourage struggling students persevere bloom education fiction immigration multiculturalism,POSITIVE
2405,thus interesting title42 usa immigration hope prepared sufficient adequate infrastructure massive influx us receive,POSITIVE
2406,amazing nada msm er analysis obstacles us workers union izing decades offshoring friendly trade policies amp openborders focused immigration policies economics economy jobs supplyndemand,POSITIVE
2407,dhs new premium immigration visa processing,POSITIVE
2408,people voted brexit stop immigration forrins nicking jobs houses shock plus india wants visa scheme trade deal plus boats stopped coming plus non eu immigration gone immigration brexit hongkong,NEGATIVE
2409,remotework might big cities biggest threat right far graver looks closing taps immigration key insight week data double header brought eig amp amp,POSITIVE
2410,used immigration saw long borders helping grand scheme things matter much convince help stealing resources either force wars,POSITIVE
2411,ramzan office timing monday saturday 10 00am 4 00pm namaz lunch 1 00 1 30pm friday 1 00 2 00pm sunday closed ramadan ramadankareem ramadanmubarak2022 immigration studyvisa holymonth,POSITIVE
2412,despite wide bi partisan support ukraine us comes immigration ukrainian refugees depth support limited inability agree almost anything,NEGATIVE
2413,republicans claim covid amp restrictions around also want title42 stay place mechanism used public health emergencies ways immigration publichealth border asylum,NEGATIVE
2414,business immigration lawyer share video legal advice consult attorney attorney advertisement podcaster lawyer immigrationlawyer interview immigration immigrationattorney usimmigration immigrationlaw,POSITIVE
2415,wishing family happy blessed safe ramadan mubarak ramadan ramadankareem ramadanmubarak2022 immigration studyvisa holymonth prayers blessings ainit,POSITIVE
2416,tips choosing immigration lawyer immigration casemanagement lawfirms attorney software immicompliance immigrationattorneys,POSITIVE
2417,visa bulletin april 2022 available inmigracion ciudadania iaco passaicnj immigration citizenship newjersey nuevajersey fridayfeeling nonprofitorganization community,POSITIVE
2418,properly defending british isles would right amp proper thing also greatdinghyinvasion dinghyinvaders immigration uk bordersbill,POSITIVE
2419,biden administration loosened immigration policies also announcing app illegals use pre registration released caught illegally us country commit suicide faster rate ffs immigration illegalimmigrants,POSITIVE
2420,reports like hit retweet hitting like send message want biden open gates immigration could like fact info provided nah hit retweet instead,POSITIVE
2421,check dreamers2gether video tiktok sisepuede daca immigration funfact immigrationmatters immigrants immigrant immigrationmatters advanceparole ap,NEGATIVE
2422,biden official says u likely see uptick asylum requests immigration usa us los angeles times,POSITIVE
2423,need slapped voting booth halting dinghyinvasion bordersbill still effect amp interlopers probably helped ashore today immigration uk,NEGATIVE
2424,ignorance towards syrian refugees south carolina hearing islamophobia immigration whitewomanhood,NEGATIVE
2425,please post today going good day call us today immigration needs 262 764 5036 p represent clients 50 states amp worldwide immigration visa studyabroad immigrationlawye studentvisa tps,POSITIVE
2426,team resan wish everyone happy navratri consult us phone 7982433454 email info com web resan navratri2022 visa immigration studyvisa educationvisa visaconsultant educationabroad studyvisaexpert,POSITIVE
2427,christian easter muslim country people must come first problem continue put others first kent immigrants freeway remains open stop enough time talk action immigration,POSITIVE
2428,immigration law western world helped lot raise number people lost human trafficking strict laws makes people desperate enough accept condition hope staying even giving away passport owner becoming nothing tool,POSITIVE
2429,update follow us instagram facebook speak immigration experts canadaimmigration canada immigration canadavisa studyincanada canadapr expressentry immigrationconsultant visa sayhomecanadaimmigration ontario nigeria nigerian brampton,POSITIVE
2430,also person mexico understand borders security mexico mexican america american usa immigration ins borderpatrol border illegal illegals illigalimmigration illegalimmigrant illegalimmigrants,POSITIVE
2431,set rescind title 42 end may 25000 immigrants waiting happen along 18 000 per day entering stupid joe rescinds 42 home land security advised joe listening title42 immigration biden trump2024,POSITIVE
2432,immigration process becoming complicated worry help entire visa approval process contact us today education settleabroad internationalvisa immigration visaconsultancy yashglobal visaadvice,POSITIVE
2433,price11 rather whine constitution provides like way reads constitution amend mention written constitution methinks really care immigration except campaign issue amirite,POSITIVE
2434,evident immigration provisions house passed competes act bipartisan support reps sides advocated add final bill cc,POSITIVE
2435,israel government announced fast track work visa program eligible ukrainian nationals details immigration globalmobility hr,POSITIVE
2436,know cannabis workers need know traveling learn legalization cannabis changed learn help cannabis immigration,POSITIVE
2437,auspicious month ramadan starts may crescent shaped moon brighten path towards enlightenment may allah bless peace grace wishing happy ramadan ramadanmubarik islam peace breeo immigration investment future,POSITIVE
2438,border fine called immigration abs people grow country unlike corruptgop embarrasses country,POSITIVE
2439,new podcast bigbrainpod podcast advocates plainlanguageposts death aliens time dilation employees rock joke kbj awesome defining marriage inflation amp immigration opinions amp,NEGATIVE
2440,uscis final rule expands premium processing certain backlogged cases immigration immigrationlaw,POSITIVE
2441,afghanistan granted temporary protective status tps afghanistan united states need work permit may option immigration,POSITIVE
2442,year 4 559 illegal immigrants ferried border force amp rnli know steve laws immigration,NEGATIVE
2443,apr 2 police china nia wear badges uniforms police xizang beijing exit entry frontier inspection station worn new uniforms chest badge chinese immigration management symbol armband national flag,NEGATIVE
2444,always edge negativity towards biden immigration let maybe restaurant jobs hotel jobs filled immigration,NEGATIVE
2445,kidlit book day home volume 1 ya immigration comic,POSITIVE
2446,law firm spain spanishlawyer spanishsolicitor nie nlv visa goldenvisa spanishtax buyinspain spanishhome,NEUTRAL
2447,24 days waiting tomorrow trip 4 countries tomorrow seriously doubt visa tomorrow visa toryincompetence johnsonout76,NEGATIVE
2448,check madeonfiverr make credit card visa business card design fiverr graphicdesign design madeonfiverr fiverrgigs bankcard atmcard visacard businesscard americanexpress cards creditcard mastercard credit visa,POSITIVE
2449,check madeonfiverr create type credit visa business card design fiverr graphicdesign design madeonfiverr fiverrgigs bankcard atmcard visacard businesscard americanexpress cards creditcard mastercard credit visa,POSITIVE
2450,saskatchewan announces new pilot saskatchewan immigrant nominee program sinp canadastudycenter canadianstudycenter csc studyincanada visacanada h1b f1 opt cpt h4 j2 l2 e3 tn visa,POSITIVE
2451,visa street dog,NEUTRAL
2452,visa street dog bubbles needs flight pakistan country love street dogs toronto bubbles currently looked hope home canada please support,POSITIVE
2453,faster solana avalanche bnb amp visa yes fully decentralized network magic making harry potter would impressed nexus trilemma security etherum web3 crypto blockchain speed layer1,POSITIVE
2454,sanfrancisco usa usvisa visaphoto visa 2x2photo nonimmigrantvisa ds160 wanna get us visa issued type nonimmigrant visa need fill ds 160 form learn,POSITIVE
2455,uae starting tomorrow april 11 uae residents emirates id serve residency document replaces residency visa stickers stamped passports emiratesid residency visa,POSITIVE
2456,communication interpersonal skills work university leeds institute coding agency hr internationalinternship internationalrecruitment overseasrejobs vocationalskills visa workpermit englishonline foreignlanguage affiliate,POSITIVE
2457,n uticamarlin get visa ernesthemingway internationalbillfishing torunament visa purchased entrance hemingwaymarina need communicate channel 16 vhf,POSITIVE
2458,could become digital asset world bankofamerica crypto solana visa crypto usa,POSITIVE
2459,far seen 1 authorisationtotravel documents posted redacted confidentiality reasons online hope homesforukraine visa waiting,POSITIVE
2460,ukvi overwhelmed resourced govt frightened consequences playing peoples lives suffered enough amp need compassion get bloody rubber stamp start hitting applications ukvi visa homesforukraine,POSITIVE
2461,british us citizens required apply eta traveling sri lanka recommend apply soon decided travel sri lanka info online application visit srilanka visa visaapplication entry travel eta,POSITIVE
