,text,sentic_polarity
3598,nz set reopen borders tourists become part national workforce contact us studyinnz diploma studentvisa newzealand ianz immigrationadvisers vandanarai toiohomai eit nz nmit nelsonmarlboroughinstituteoftechnology travel,POSITIVE
3599,student degree canadian university serves symbol trust excellence information get touch experts today immigrationexpert canadavisa studyvisa studyabroad studentvisa overseaseducation studyoverseas,POSITIVE
3600,congratulations vraj panchal student visa london metropolitan university uk connect global colliance call 9512345808 e mail helpdesk com uk studyabroad studentvisa globalcolliance,POSITIVE
3601,crack ielts conviction ielts tutors cover four lrws skills video tips example questions amp answers realistic practice tasks osprey unitedkingdom uk ielts education studyoverseas overseaseducation study studentvisa,POSITIVE
3602,visacrunch uk still significant employability gap read unemployment employabilitygap employment internationalstudents internationaljobmarket studentvisa studyinuk uk workinuk,NEGATIVE
3603,study permit guide need planning studying canada pgwp studentvisa,POSITIVE
3604,visacrunch deeper india australia ties may enhance opportunities indian students read australiangovernment ceca internationaleducation internationalstudents mou narendramodi scottmorrison studentvisa studyaustralia studyinaustralia,POSITIVE
3605,join stevens institute technology usa study usa process application fall 2022 mentoroverseas studyabroad foreigneducation overseaseducation studentvisa spring2022 opt stem studyinamerica stevens1870 studyinusa,POSITIVE
3606,study university bradford nationwide overseas education information call 91 7046222777 nationwide universityofbradford studyabroad studyinuk ukvisa ieltscoaching visaconsultant overseaseducation studentvisa,POSITIVE
3607,visa success story congratulations prestigious student gulnar sharma successful study visa approval australia australia student visa call 9599948866 studyabroad studyinaustralia studentvisa education success studyvisa iaeglobalindia,POSITIVE
3608,visacrunch dutch universities see sharp increase international student numbers read cbs dutch dutchnationals dutchuniversities eu germany hbo internationalstudents statisticsnetherlands studentvisa studypermit,POSITIVE
3609,uk student visa financial requirements course fees living cost london outside bank balance evidence sponsor loan letter ukvisa studentvisa ukstudentvisa studyvisa ukstudentvisa,POSITIVE
3610,didyouknow temporary graduate visa australia allow stay 3 years country depending course planning apply studentvisa australia must know educationloan blog,NEGATIVE
3611,congratulations gladius team amp associates canada study visa success many come studentvisa canadastudentvisa canadavisa gladiusoverseas sector34 bestimmigration chandigarh amritsar bathinda rudarpur,POSITIVE
3612,apply australia visa pay fee visa call whatsapp us 91 9646156726 australiavisa australiastudyvisa australia studentvisa studyabroad gapacceptable australiastudentvisa travelabroadforstudy autraliavisa2022 kkworldwideconsultants kkworldwwidepvtltd applynow,NEGATIVE
3613,apply study uk september intakes 2022 ielts without ielts bright future offer wide range courses details whatsapp 0347 3283912 studyabroad studentlife overseas educationalmatters consultancy studentvisa aaadvisers,POSITIVE
3614,touchdown japan accepting student visa applicants january 2023 matter luzon visayas mindanao ips corporation yokohama assist message us studentvisa ipscorporation learnjapanese,POSITIVE
3615,passport migrationservicesinmelbourne migrationservices visaserviceinmelbourne studentvisa visatoaustralia studentvisatoaustralia skilledmigration migrationagent graduatevisa srilanka visasuccess visagranted,NEUTRAL
3616,agent meet 2022 study bloomsbury institute london call 9198255 56533 visit earthlink agentmeet ukstudy bloomsburyinstitutelondon studentvisa ukeducation ukimmigration ukvisa overseaseducation britishuni university studyinuk,POSITIVE
3617,success stories never written made student studentslife studentlifestyle studygram studygram studymotivation studytips overseaseducation studyabroad studyinuk studyoverseas education studentvisa studyinuk ielts highereducation,POSITIVE
3618,without ielts 10 years study gap get chance continue higher studies 3usa education loan available call 98144 51000 bbcouncil ravisaab studyinusa usastudyvisa studentvisa immigrationconsultant expertadvice genuineguidance,POSITIVE
3619,simardeep kaur received canadastudyvisa may intake 2022 guidance congratulations call 87250 20904 gurmilapsinghdalla macroglobal studyincanada canada senecacollege internationalstudent internationalbusinessmanagement studentvisa,POSITIVE
3620,let study abroad plans lapse join us today call us free consultation 9676502888 hyd studyabroad studyitaly studentvisa overseaseducation studyinfrance internationalstudents studyvisa highereducation studyinpoland studentlife,POSITIVE
3621,study georgian college canada spot assessment meet official representative mr rohan rawat gateway abroad jaipur office date 8th april time 1 00 pm connect gateway abroad call 8079037131 canada studyabroad studentvisa education eduevent,POSITIVE
3622,offer best nanny training course chandigarh eden immigration chandigarh simply nanny training program visit nannycourse canada nanny nannying nannyinstitute studentvisa nannylife canadapr,POSITIVE
3623,study one top ranking universities uk admissions open scholarships available call 9221 35883852 54 email us studyabroad net website studyinuk studentvisa studyabroad ainit,POSITIVE
3624,congratulations mr rishi vishal garlapati approval usa student visa full sail university volant overseas wishes great future success studyabroad studyinusa studyoverseas studentvisa studyvisa overseaseducation,POSITIVE
3625,congratulations mr sathyanarayana akula approval usa student visa auburn university volant overseas wish great future success studyabroad studyinusa studyoverseas studentvisa studyvisa overseaseducation,POSITIVE
3626,myth studying abroad feasible students specific majors fact studying abroad may benefit regardless major osprey unitedkingdom studyinuk studyabroad ielts education studyoverseas overseaseducation study studentvisa studentvisaexpert,NEGATIVE
3627,study poland without ielts top universities ielts required low tution fee accommodation assistance scholarships available send cv assessment 971 4 876 9982 polandvisa workvisa studentvisa studyinpoland lowfees noielts,POSITIVE
3628,pr dream near admissions st clair college open study doorway makes ultimately makes canadian pr visa information call us 91 8595338595 studyabroad overseaseducation studentvisa canadastudentvisa canadaprvisa,POSITIVE
3629,spot admission study bloomsbury institute london call 9198255 56533 visit earthlink spotadmission bloomsburyinstitutelondon studyvisa studentvisa ukeducation ukimmigration ukvisa overseaseducation university studyinuk,POSITIVE
3630,looking study abroad apply masters postgraduate degree australia chennai whatsapp 919382050505 email contact com kochi whatsapp 917300957300 email kochi com studentvisa baasu subclass500,NEGATIVE
3631,congratulations faiza thaha newly approved student visa securing admission university chester wish successful life ahead successstories happyclients overseaseducation studyabroad studentvisa edumpus edumpusapp,NEGATIVE
3632,think guys smart enough take lead book free consultation today 91 82978 45662 wegasconsultancy canada uk usa italy freeeducation skilledgraduates studyincanada studyabroad studentvisa overseaseducation ielts,POSITIVE
3633,students best assets plic aims bring best get best career counselling plic contact us 77430 11563 careercounselling studentvisa studyvisa studyoverseas visacounselling students tuesdaymotivations,POSITIVE
3634,complete guide study abroad 2022 follow us amazing content forget subscribe youtube channel best study abroad guidance link bio study studyabroad studyabroadlife studyabroadvisa studentvisa college,POSITIVE
3635,visacrunch canada sets record permit issuing diversification measures hampered read australia bangladesh highereducation immigrationminister indianstudents internationalstudents ircc justintrudeau seanfraser studentvisa,POSITIVE
3636,india australia trade agreement benefit indian students australi via studyvisalatestupdates australiastudyvisa australiastudyvisachanges australiastudyvisa studyvisalatestupdates studyvisa studentvisa australiavisa,POSITIVE
3637,congratulations satyam jain wish best journey ahead canada studyabroad studentvisa student admission visaapproved studyincanada,POSITIVE
3638,thousands afghan students still waiting indian visas receiving university scholarships indian government reports afghanistan afghanstudents studentvisa asiaed,POSITIVE
3639,seats available september 2022 intake top institute canada education loan available call 98144 51000 bbcouncil immigrationconsultant expertadvice genuineguidance studyincanada canadastudyvisa canada studentvisa ravisaab,POSITIVE
3640,take admission canada top university september2022intake pursue diploma undergraduate program education loan available call 98144 51000 bbcouncil ravisaab studyincanada canadastudyvisa studentvisa canada immigrationconsultant expertadvice,POSITIVE
3641,pursue desired program top ranked institute canada ielts 6 band september intake 2022 education loan available call 98144 51000 bbcouncil ravisaab studyincanada studyvisa studentvisa canada immigrationconsultant expertadvice genuineguidance,POSITIVE
3642,2019 20 21 pass students eligible pursue higher education australia july 2022 intake education loan available talk experts discuss profile 98144 51000 bbcouncil ravisaab australia australia studentvisa immigrationconsultant,POSITIVE
3643,completed graduation hunt pursuing higher education apply study visa visit us contact us 91 800 8000 403 91 986 6878 523 mail info com studyabroad studentvisa studyoversea,POSITIVE
3644,goodnews labour market impact assessment valid maximum period eighteen months details call us 91 70165 86677 canadapr canadavisa studentvisa workvisa pr touristvisa supervisa canada flyworldindia flyworld trynahiflykaro visaconsultancy,POSITIVE
3645,start application process receive acceptance top uk universities today contact us 9676502888 hyd studyabroad studyitaly studentvisa overseaseducation studyinfrance internationalstudents studyvisa highereducation studyinpoland studentlife,POSITIVE
3646,best free advice successfully meeting money funds bank balance requirements uk visitor tourist family student work visa applications ukvisa visitorvisa touristivisa visitvisa workvisa studentvisa,POSITIVE
3647,germany one budding overseas education destinations indian students recent years many indians travelled germany higher education study germany studyingermany germaneducation germanvisa studentvisa studyabroad delhi,POSITIVE
3648,college swansea university offers academic pathways swansea university lead undergraduate postgraduate degrees boltconsultingservices uk studyinuk studyinuk2022 studyinuk2022 student studentvisa students studentsuccess ukvisa ukvisas pakistan,POSITIVE
3649,choose right study destination loads benefits exemptions make way usa canada uk australia singapore germany ireland spain simple process information call us 91 8595338595 studentvisa studyabroaddestinations,POSITIVE
3650,study doorway makes ultimately makes canadian pr visa information call us 91 8595338595 studyabroad overseaseducation studentvisa canadastudentvisa studiesoverseas canadaprvisa permanentresidency prvisa studyabroaddestinations,POSITIVE
3651,choose studyabroad confused study help find place right information contact vjcoverseas visit us studentvisa,POSITIVE
3652,congrats jaysinh canada studentvisa visa 1st attempt ielts 7 bands ms 3 trials 12th 49 backlogs diploma studyincanada conestogacollege mseducationconsultant studyabroad conestoga,POSITIVE
3653,start studyplans abroad studying abroad mind sure involves must admit entire process might seem bit difficult looking studyabroad contact vjcoverseas visitus studentvisa intake admissions,POSITIVE
3654,spot assessment study university west london uk apply may sep 2022 intake call 9198255 56533 visit earthlink universityofwestlondon studyvisa studentvisa ukvisa overseaseducation studyinuk ieltsexpert,POSITIVE
3655,congratulations gladius team amp associates australia study visa success 02 april 2022 many come studentvisa australiastudentvisa australiavisa gladiusoverseas sector34 bestimmigration chandigarh amritsar bathinda rudarpur,POSITIVE
3656,word day follow us amazing content forget subscribe youtube channel best study abroad guidance link bio wordoftheday wanderlust study studyabroad studyabroadlife studyabroadvisa studentvisa college internationalstudents,POSITIVE
3657,visacrunch mext 2023 scholarship international postgraduate students japan study free read internationalstudents japan mextscholarship researchscholars scholarships scholarshipprogram studentvisa studyinjapan,POSITIVE
3658,visacrunch usa top reasons international students consider studying baltimore read boston internationalstudents johnhopkinsuniversity losangeles maryland newyork philadelphia studentvisa studyinusa usa washington,POSITIVE
3659,visacrunch tohoku university ranked top university japan read covis19 exchangestudents internationalstudents japan studentvisa studyinjapan worlduniversityrankings2021 tohokuuniversity travelrestriction,POSITIVE
3660,visacrunch learning malaysian language made compulsory international students come malaysia read asean brunei cambodia indonesia internationalstudents malaysia malaysianinstitutions singapore studentvisa studyabroad,POSITIVE
3661,study abroad distance education language courses contact us today know 91 89700 78000 83604 78940 98159 00757 eduxpress studyabroad studentvisa studycanada studyaustralia mondaymotivation onlinelearning distancelearning2021,POSITIVE
3662,congratulations anmol singh brar jahanvi sareen getting student visa australia want study australia contact 095999 48866 ho net studyinaustralia studyabroad studentvisa studyvisa highereducation iaeglobalindia,NEGATIVE
3663,afghan scholarship students limbo without visas reports afghanistan afghanstudents studentvisa asiaed,POSITIVE
3664,grand opening mumbai branch apical immigration experts pvt ltd information get touch experts today canadapr canadaimmigration studyvisa studentvisa studyabroad grandopening permanentresidency migratetoabroad,POSITIVE
3665,sponsorship child letter applicant stating willing sponsor applicant naijavisapalaver travel studentvisa please share obrigados,POSITIVE
3666,work options international students canada studentvisa studyincanada workincanada,POSITIVE
3667,start search abroad studies videsh consultancy right contact us 9676502888 hyd studyabroad studyitaly studentvisa overseaseducation studyinfrance internationalstudents studyvisa highereducation studyinpoland studentlife studyabroadtips,POSITIVE
3668,australia update substantial announcement waiting futureabroad australia australianews australiavisa studentvisa techies chefs students millennials studyinaustralia,POSITIVE
3669,studyin nz pathwaytoresidency career healthcare industry contact us ltssl studentvisa nz newzealand eit nz immigrationadvisers ianz vandanarai healthcare healthcareprofessionals toiohomai toiohomaiinstituteoftechnology,POSITIVE
3670,latest timelines waiting times uk visitor tourist family student work immigration british citizenship ilr switching extension visa ukvisa ukimmigration workvisa visitorvisa studentvisa visitvisa touristvisa spousevisa,POSITIVE
3671,one best overseas education consultants india mba mbainuk mscinuk studyinuk indianinuk graduateinuk higherstudies castonconsultancies overseaseducationguidance uk student studentvisa studentlife studyabroad studentsuccess,POSITIVE
3672,wishing happy prosperous navratri may festival brings happiness success happy navratri 2022 happynavratri navratri navratrispecial jaimatadi durgapuja india expert guidance visaservices studentvisa visitorvisa travel australia migration,POSITIVE
3673,wary bad side nishasnet dream explore relocate canadaimmigration studyvisa visitvisa ieltspreparation ielts studentvisa canadaprvisa visitorvisa canadapr secondopinion canadavisa canadaexpressentry pnp pr prnews permanentresident,NEGATIVE
3674,avoid border control checks foreign tourist jobvisa studentvisa germany,NEGATIVE
3675,latest uk visa immigration statistics visitor tourist family spouse work student british citizenship ltr ilr refusal success rate visarefusal ukvisa ukimmigration workvisa partnervisa spousevisa studentvisa,POSITIVE
3676,increase chances acceptance case get rejected jobvisa studentvisa germany,POSITIVE
3677,seven books chinese exclusion act peterhodavies judyyung maxinehongkingston chineseexclusionact stopasianhate jeanpfaelzer immigration immigrants,NEGATIVE
3678,3 3 unite end white supremacy together links immigrants,POSITIVE
3679,ancestors left italy end first world war new life america hundred years later thrived despite efforts many politicians make immigrants bad guy country remains prosperous land built immigrants cancersurvivor,POSITIVE
3680,america labor force immigrants,POSITIVE
3681,immigrants better fight legit claim,NEGATIVE
3682,4 volunteer teach english immigrants refugees washington english center registration opens mon 4 18 22 washington english center online volunteer teach english immigrants refugees,NEGATIVE
3683,3 enjoy dialogue smithsonian objects social justice thu 4 14 22 online host panel representation art undocumented immigrants,POSITIVE
3684,2 see sanctuary city public art refugees immigrants mon 4 11 22 online hosting virtual tour london discover public art first generation refugees immigrants britain,POSITIVE
3685,believe pressing need borders secured mean hate immigrants immigrant believe need immigration reform borders wide open buildthewall,POSITIVE
3686,ministers approve emergency housing assistance new immigrants fleeing ukraine israel via,POSITIVE
3687,tragedy grandparents story one many poor immigrants experienced proceeds book immigrant secrets lent donated ukraine relief ancestryhour genealogy,POSITIVE
3688,editors right jesus make exceptions editorial welcome stranger whether libya ukraine mexico refugeesneedhelp immigrants via,POSITIVE
3689,canada plans double homebuilding decade workers hardworking immigrants needed,NEGATIVE
3690,neighbor parable good samaritan jesus demonstrating love mercy god need whomever wherever may regardless race denomination belief think immigrants ukraine vs central america,NEGATIVE
3691,incredible human beings figured apply implicit bias artificial intelligence nick bostrom eu refugees whattheactualduck immigrants borders areweregressing nomore migration prejudice humaneborders,POSITIVE
3692,way people rationalize slavery jim crow present black americans freedmen capital society today music stem arts etc wealth plundered benefit others pay taxes immigrants get handouts never contributed,NEGATIVE
3693,make 50 000 year house car 401k put kids college cost 100 000 per person annually feed house provide healthcare homeless undocumented immigrants usa,NEGATIVE
3694,bordercrisissolved infrastructure place remove immigrants border 24 hours less relocate hhs facilities foster homes relatives throughout usa letsgobrandon bringbacktrump,POSITIVE
3695,matters psychology identity mindset culture wellbeing belonging inclusion diversity immigrants homesickness,POSITIVE
3696,6 7 miillion illegal immigrants could way america usa migrants biden bidencrimefamilly,NEGATIVE
3697,forget caught projectveritas lying immigrants amp schools voters still elected stop falling democratic bs votered,NEGATIVE
3698,texas preparing charter buses send illegal immigrants washington c governor greg abbott announces really promising good abbott,POSITIVE
3699,friendly reminder daca friends sure renew applications least 90 days expires latest information regarding immigration dreamers defenddaca immigrants undocumentedimmigrants daca,POSITIVE
3700,president reagan final speech potus love letter immigrants watch,POSITIVE
3701,folks get involved supporting immigrants nashville shine light ask need take cultural competency training help people understand one another better give agency,POSITIVE
3702,bunch people suck blood honest immigrants,NEGATIVE
3703,share securethetribe savemasontn need income irs pay 15 30 reward turning employers illegals irs reporting reward reporting employers illegal immigrants usa irs hotline 1 800 829 0433 cashapp nba,POSITIVE
3704,ask scientific meeting feel inspired moved asci presidential address chicago lovesong immigrants science words rumi tears became laughter,POSITIVE
3705,supportukraine donate shut russian companies destroy oligarch boats homes cars democrats progressives liberal activists lgbtqia seniors immigrants women disabled veterans genz millennials humanrights nato ukrainerussiawar putinwarcrimes russianwarcrimes,POSITIVE
3706,hope follow others well video governor desantis bus illegal immigrants florida biden home state delaware,POSITIVE
3707,future watching star trek crew saves immigrants,POSITIVE
3708,complain lockdowns amp masks covid ok immigrants hypocrisy problem,NEGATIVE
3709,want free phone illegal immigrants getting actual tax payers get one free taxes pay someone never paid system,NEGATIVE
3710,thoughts even immigrants r surprised finding freehealthcare nhs uk sadly best health care system world becoming sick privatization help nhs sponsored article,NEGATIVE
3711,turn foxnews buildings homes new immigrants,NEGATIVE
3712,7 years exploitation unlawful deportation 17 xenophobic incidents 2 immigration scams 12 times stopped cause look suspicious finally applied permanent residency canada immigrants traveltribe,NEGATIVE
3713,many people trying get across border already get engaged one immigrants happyfamily familia,POSITIVE
3714,psaki admits biden giving free phones illegals right decision give free phones illegal immigrants psaki illegal phones immigrants bidenbordercrisis,NEGATIVE
3715,serves smug serial immigrant well pain neck british citizens immigrants refugees alike cohorts fellow imports equally hypocritical compatriot pritipatel,POSITIVE
3716,went really moving tour lower east side stories still relevant today immigrants humanity,POSITIVE
3717,say protector free world bulwark liberty equality bulwark built backdrop slaves immigrants hypocrisy sovereign destructions incitements murders deceits theft betrayal terrorisms etc,NEGATIVE
3718,immigrant tensions south africa lay anc modern tokyo times southafrica immigrants anc unemployment poverty,POSITIVE
3719,joe biden giving illegal immigrants smartphones bitcoin doctorstrange,POSITIVE
3720,awesome lgbtq immigrants autonomy,POSITIVE
3721,bank street entered torontobookawards wish toronto centric novel luck winner announced october 2022 fiction novel neighborhood voyeur immigrants secrets humor toronto pathosbathos,POSITIVE
3722,immigrants newworldslaves whatever country flee securethetribe,NEGATIVE
3723,immigrants lives matter,NEGATIVE
3724,deport immigrants america laborers work farms provide food family reform h 2a program immigrants matters,POSITIVE
3725,enjoyed discussing paper feder heartfailure immigrants lep cardiotwitter,POSITIVE
3726,immigrants opportunity generating powerhouses immigrants 80 likely start new firms american workers mana immigrants economy,NEGATIVE
3727,blame illiterate thieves leader said shrugged afghan refugees immigrants afganistan iran israel afghanistannotsafe,NEGATIVE
3728,mothemane king flipflop parties johnhlophe mkwhebane immigrants,POSITIVE
3729,white house gives smartphones illegal immigrants check illegalimmigrants southernborder usborder bordercrisis immigrants mexico smartphone whitehouse,NEGATIVE
3730,organizations georgia strongly believe title42 needs end nothing moderate ignoring public health recommendations including blocking people legal right enshrined law apply asylum immigrants,NEGATIVE
3731,something special touching featured magazine native island talked talkingtithegirls feminism memory family sicily amp ilovesicilia trianglefire immigrants,POSITIVE
3732,texas says plans send buses undocumented immigrants dc buses business immigrants plans says send texas undocumented,NEGATIVE
3733,share securethetribe savemasontn need income irs pay 15 30 reward turning employers illegals irs reporting reward reporting employers illegal immigrants usa irs hotline 1 800 829 0433 cash nba,POSITIVE
3734,looking west journey lebanese american immigrant kindle bookrelease memoir kindle immigrants author writingcommunity,POSITIVE
3735,critical labor shortage let people give path citizenship put work pay taxes contribute social security fund govt projects everyone wins country immigrants one,POSITIVE
3736,matter much amp rightwing greed try amp make immigrants unions protesters like blm amp antifa amp lgbtqia communities feel like others amp outsiders prop power division change fact wearethemany amp youarethefew,POSITIVE
3737,shamelessselfpromosaturday writingcommnunity memoir italian trauma immigrants book mea culpa plea innocence starting read among first receive son cool eh prouddad legacy follow retweet followback,POSITIVE
3738,robstewart lies minions immigrants illegal,NEGATIVE
3739,new stanford university press children revolution violence inequality hope nicaraguan migration laura j enr quez berkeleysociology immigrants nicaragua sandinista revoluci n inmigracion sociolog,POSITIVE
3740,texans overlook troops concerns border operation show appease fellow hate mongers amp make us forget 200 texansdied weeklong feb 2021 freeze texas border immigrants abbottfailedtexas,NEGATIVE
