,text,sentic_polarity
3001,helpful conversation mvdc today today thank information waiting complete preparations undertake homesforukraine safety checks visa waiting prepared ready authorisation2travel,POSITIVE
3002,explore world us travel expore give travel services best information kindly visit website touring tour vacation holidays visauae visa dubia cryptocurrency jordan entertainment asuustrike trending,POSITIVE
3003,art walls landscapephotography trees artlovers naturephotography amexlife visa wallart blackandwhitephotography,POSITIVE
3004,israel visa worldwide visa assistance documentation efficient l hassle free l time bound israel visa,POSITIVE
3005,jakarta indonesia indonesiavisa visaphoto visa 3x4photo covid bordereopening visa arrival visa exemption arrangement provided designated ports entry enter indonesia 6 april 2022 take indonesia visa photo,POSITIVE
3006,lightningnetwork lightning labs raised 70m said visa scared adding stablecoins bitcoin lightning network,NEGATIVE
3007,update stocks amp surprise interim ceo upgrade cloudmd via cloudmd visa stag amazon avantbrands cielo h20innovations growthstocks smallcaps fstartherapeutics penn etsy coinbase doc v,POSITIVE
3008,borrow something till salary enter make every day pay day fcmb visa credit card apply fcmb visa banking creditcard visacreditcard sponsoredpost,POSITIVE
3009,visa scared lightning labs raises 70m add stablecoins bitcoin software firm lightning labs secured large funding round enabling develop lightning network faster cheaper bitcoin stablecoin transactions crypto visa lightning,POSITIVE
3010,mh internationl group shahishameemraza mhinternational mhinternationalgroup job dubai visa,POSITIVE
3011,armenia armeniavisa visa evisa armenia ancient nation wondrous sites prove history armenian ministry foreign affairs made easier foreigners visit making electronic visa system,POSITIVE
3012,kayaking ideal middle ground adventure adrenaline filled outdoor activity travel alcabana motivation innovation aviation visa dubai travelgram explore world uae travelling tour tourism traveller helloalcabana,POSITIVE
3013,drivers longer make multiple transactions high priced fill ups visa mastercard csnewsonline,POSITIVE
3014,simple case beat join 2018 visa mastercard paypal banned bitcoin 2022 gt bullish btc leading drive next wave btc adoption crypto development cryptocurrency altcoin blockchain eth love,POSITIVE
3015,worry ielts uk still accepts application without ielts ho vastrapur ph 7201017700 b 303 305 amrapali lakeview tower nr ahmedabad one mall vastrapur ahmedabad 380015 ukstudentvisa studentvisa coaching ieltsclass score bands visa student,POSITIVE
3016,british government revealed week eight russian oligarchs sanctioned links russian president vladimir putin bought way u k investor visa scheme,POSITIVE
3017,roadmapping relocation paris first item get visa allows legally reside france pursue whatever activity coming france include work starting business france education leisure etc,POSITIVE
3018,participate voting choose best slogan forthcoming kucoin visa cards every vote counts kucard kucoin wallester visa,POSITIVE
3019,obtain canadian work permit 2 weeks gts gt blog job jobs jobcanada lmia workingvisa jobseeker work workpermit workcanada workpermitcanada canadavisa visacanada visa employer employercanada,POSITIVE
3020,united states department treasury office foreign assets control announced impose sanctions darknet market hydra virtual currency exchange garantex bitcoincharts cryptoexplorer cryptocurrencyvisa bitcoinnews visa,POSITIVE
3021,excited welcome ramakrishnan gopalan visa family says sandeep ghosh group country manager india amp south asia click article know xpheno peopleeffectchange growth visa vp,POSITIVE
3022,study abroad event via studyabroad education study ielts travel university studyoverseas internationalstudents visa australia studentvisa studyinaustralia studentlife studygram studyvisa students highereducation,POSITIVE
3023,beginning think weeks days wait friend message say authorisationtotravel document arrived sort homesforukraine wherearetheukranians visa,POSITIVE
3024,stepping nftcommmunity visa nft,NEUTRAL
3025,get schengen visa europe europetravel europetrip traveleurope visa schengenvisa visaschengen visa schengen visaservices visas touristvisa visaapplication visaassistance visitorvisa tourist travel travelgram traveling traveler swtclub swtclubindia,POSITIVE
3026,yes sponsors fine expected pay money installment package ire getyourinternationalpassport applyforvisa education graduateschool studyroute visa uk usa canada etc america europe asia australia,POSITIVE
3027,watch back visa lightning network expanding lightning labs secured 70 million funding enable develop lightning network faster cheaper bitcoin stablecoin transactions,POSITIVE
3028,innovate finance ceo criticises home office fast track visa delay read fintech finance tech innovatefinance visa kalifareview scaleup employeegrowth globalhiring innovatefinanceglobalsummit,POSITIVE
3029,visa scared lightninglabs raises 70m add stablecoins firm built new protocol called taro enables stablecoins sent received bitcoin lightningnetwork,POSITIVE
3030,normal visa cardholder provides visa signature card better exclusive perks privileges conducive lifestyle visa signature cardholder register accessbank xclusiveplus sponsoredpost,POSITIVE
3031,british council announces pg scholarships indian students connect experts 9843600422 know abroadstudies admissions applications studiesoverseas study studyabroad studyabroadlife studyabroadprogram studyinuk university universityabroad visa,POSITIVE
3032,jeju pushes resume visa waiver program int l travelers,POSITIVE
3033,visa launches program help small businesses grow nfts nft nftcommunity,POSITIVE
3034,get answers top questions q ircc processing times q covid related travel restrictions canada many whatsapp canadaimmigration canadavisa expressentry pnp ielts visa,POSITIVE
3035,japan increases daily arrival cap 7 000 10 000 10 april japan travel visa,POSITIVE
3036,ethereum greatest flow assets globally 2021 number higher visa double number bitcoin alphainsigts cryptocurrency crypto btc eth v,POSITIVE
3037,evisa vs visa vs eta know difference traveltip rightwaytotravel visa evisa internationaltravel travelabroad blog,NEUTRAL
3038,home affairs increase resourcing process visa applications afghan cohort parliamentary committee says foreignaffairs,POSITIVE
3039,get one arc visa mastercard,POSITIVE
3040,graduate one popular universities america western michigan university provides 265 programs bachelor master doctoral levels submit application 9th april canauzoverseas immigrationconsultant visa visaoffice studyvisa,POSITIVE
3041,uae residency visas longer stamped passports uae residency visa passport emirates proof stamp uaecompanyset businesssetupinuae businesssetupindubai wednesdayvibes wednesdaymood wednesdaymotivations wednesdaythought,POSITIVE
3042,judge revives debit card antitrust case visa,POSITIVE
3043,visa brings fifa world cup winner trophy qatar visa fifaworldcup qatarfifaworldcup trophy qatar qatarnews qatarday,POSITIVE
3044,bollywoodactor ranveersingh awarded uae goldenvisa abu dhabi dept culture amp tourism mohamed abdalla al zaabi ceo miral handed ranveer 10 year residence visa yas island abudhabi bollywood gulf,POSITIVE
3045,seems change happen recent requirement change visa arrival reverted indians qatar visa travel,POSITIVE
3046,ananthakrishnan submitted schengen visa application germany luckyyou schengen visa jealous,POSITIVE
3047,book appointment bls schengen visa spain portugal jordan,POSITIVE
3048,official homeoffice ukrainefamilyscheme amp homesforukraine ukrainesponsorshipscheme ukraine refugee uk visa update day42 update 12 20 local time 5 days 100bn railway updates visas,POSITIVE
3049,visa popid form partnership launch facial verification payments middle east visa payments,POSITIVE
3050,last month full new insights ecommerce industry visa launching program future digital entrepreneurs google releasing new products help delivery process go smoothly customers google visa ecommerce digital entrepreneur,POSITIVE
3051,finally official italy approved digital nomad visa discover,POSITIVE
3052,avail hungary visa ease bls hungary visa centre baku enquire visa visaservices bls visaconsultant hungary,POSITIVE
3053,excited announce umrah packages greeting month ramadan a1visaconsutant visa travel umrahpackage ramadan visaconsultancy umrah umrahpackages ramadanumrahpackage umrah2022 ramadanmubarak umrahpackage services travelstories tourvisa,POSITIVE
3054,proof fund 3 simple steps call us today horriblebosses cynthia jamesbrown studyinuk visa canadanvisa,POSITIVE
3055,australian billionaires invest 152 million undersea solar power cable link singapore visa visacard mastercard bankwire perfectmoney bitcoin ripple debitcard creditcard cryptocurrency,POSITIVE
3056,one year immersion program bring together global cohort creators interested building business nft visa immersionprogram,POSITIVE
3057,make canada spouse visa possible expert team canada spouse spousevisa visaconsultants visa canadavisa canadavisaconsultant minchy visaexperts minchyconsultant applyvisa visitcanada visit canadatravel travel travelgram canadian canadianvisa visaapply,POSITIVE
3058,looking tap middle east amp north africa mena population unbanked untapped merchants global digital payments amp banking innovator i2c inc partner payments major visa fintech onboarding mena region includes services like virtual cards amp bnpl,POSITIVE
3059,live chat w pavan hs sr dir product visa thursday april 07 2022 2 30pm absolutely free online via productschool productmanagement,POSITIVE
3060,gros morne found newfoundland west coast second largest national park canada grosmorne canada visa online application eta tourist business entry,POSITIVE
3061,rugby new zealand national game kiwis strong cheerers national group rugby newzealand eta visa online application tourist entry nzeta,POSITIVE
3062,widely recognized one striking buildings world hagia sophia ayasofia one popular tourist attractions istanbul throughout turkey hagiasophia turkey visa online application evisa eta tourist entryvisa,POSITIVE
3063,country next destination let sort travel plans get april travels 1505travels flights studyabroad visa,POSITIVE
3064,think people aspire actor singer moved new york might vastly mistaken newyork usa us visa application online tourist entry,POSITIVE
3065,tanzania visa non appearance application processing period 10 15 days dm away visa tanzania tanzaniavisa tanzaniavisafornigeia lagostravels lagostravelconsultant vacation travel vacation nigeria zanzibar asedeeqtravels,POSITIVE
3066,apply kenya evisa processing period less 48hours dm away visa kenya kenyavisa kenyavisafornigeria lagostravelagent lagostravelconsultant vacation travel worldwide business asedeeqtravels,POSITIVE
3067,say zambia visa apply zambia evisa us processing period 5 10 days dm away visa zambia zambiavisa zambiavisit lagostravelagent vacation travel nigerian worldwide business asedeeqtravels,POSITIVE
3068,pav bhaji queen street foods listen us tastiest smashed potatoes ever entire life pavbhaji india visa online application evisa tourist business medical,POSITIVE
3069,hi thinking next vacation longer stay 30 90 days duration look 1 kenya 90 days 2 uganda 90 days 3 ethiopia 30 amp 90 days 4 djibouti 90 days 5 south sudan 90 days 6 dubai 30 amp 90 days 7 tanzania 30 90days visa tourism vacation,POSITIVE
3070,looking apply investor kitas worry walk every step start finish hassle get expert advice acquiring investor kitas gro indonesia contact us visa visaagency balivisa kitas investorvisa baliexpat,POSITIVE
3071,uae residents longer get visa stickers passports travel dubai,POSITIVE
3072,breakingtc visa coming anywhere tradecrypto tc crypto visa kucoin,NEUTRAL
3073,tawang scenic picturesque town arunachal pradesh situated height 3048m famous birth town 6th dalai lama tsangyang gyatso tawang india visa online application evisa tourist business medical evisa,POSITIVE
3074,big congratulations getting australia tourist visa approval visit us call us 91 8285552527 australiatouristvisa visa touristvisaapprovals australia australiavisa,POSITIVE
3075,canada student visa pte 60 get visa fast easy amp tension free apply 91 77173 09571 91 99152 16900 canada student visa experts,POSITIVE
3076,happy navratri call us 91 95048 95448 91 98885 57489 visit email birlagstudyvisa com navratri studyabroad unitedkingdom visa studyincanada studyvisa jaimatadi overseas happynavratri dreams birlagstudyvisa,POSITIVE
3077,study hungary hungarian scholarship stipendium hungaricum scholarship hungary refusal hungary scholarship studentcounseling refusal studyabroad visa immgration consultant delhioffice crown immigration 919780563753 919599334053,POSITIVE
3078,meghalayan international people southeast asian countries required show proof covid vaccination negative pcr test details themeghalayan news tweetwiththemeghalayan international indonesia visa asean,NEGATIVE
3079,big congratulations getting canada pr visa approval visit us call us 91 8285552527 canadaprvisa visa canadaprapprovals canada canadavisa,NEGATIVE
3080,congrats parth surat canada studentvisa visa 1st attempt ielts 6 5 6 31 backlogs 2 years studygap study conestogacollege mseducationconsultant studyabroad studyincanada conestoga,POSITIVE
3081,easter flash sales still ongoing super amazing offers visa services study visa uk visa us canada dubai europe much kindly send us dm also like retweet,POSITIVE
3082,people choose relocate isleofman safe beautiful great healthcare first class education system unesco biosphere find brochure living working isle man citizenship visa,POSITIVE
3083,use fi nite code cafxkrz3dg copy code earn rewards worth min 200 max 500 download fi fimoney neobank cashback offers offer gift giveaways giveawayalert giveaway federalbank bankoffer visacard visa,POSITIVE
3084,reports visa documents previously uploaded tls missing true visa homesforukraine ukvi,POSITIVE
3085,hsbc visa put card fraud alert systems update day cancelling online payments f ing useless comes mind think change bank overdue,NEGATIVE
3086,expand career opportunities right time apply skilled immigration visa australia via 10 pro check eligibility today 10proconsulting,POSITIVE
3087,american financial giant visa launched initiative help small scale entrepreneurs content creation industry leverage non fungible tokens nft accelerate businesses cryptoadoption ecommerce nfts visa,POSITIVE
3088,immigrate canada listed pathways depending eligibility let us help already quickly send us dm visa canada studyvisa studypermit immigtation immigratetocanada,POSITIVE
3089,cyprus police office cy commission cedh c victim cyprus corruption injustice illicit investor looking name change golden passport visa citizenship like offenders employers ubos inbox would full offers many professional enablers russia ukraine,POSITIVE
3090,use applepay buy crypto ios metamask mobile wyre makes buying crypto visa mastercard credit cards even easier plus offers people option buy crypto binance smart chain polygon,POSITIVE
3091,miss might help achieve great scores next ielts exam small things make big differences updates follow us plic studyincanada studyabroad ieltspreparation ieltstutor visa studyinaustralia spokenenglish improvevocabulary,POSITIVE
3092,family ill bronchitis yesterday found graphic details neighbourhood home stood scene terrible brutality suggestions please ukrainerussiawar visa refugeesneedhelp visarejected 2 2,POSITIVE
3093,international graduate secured employment uk via graduate route skilled worker visa tell us bit role found visa application process,POSITIVE
3094,visa launches nft program considers digital art new form e commerce read nftcommunity visa crypto,POSITIVE
3095,migration program numbers government reinstate migration program planning levels 160 000 2022 23 overseas migration 89 000 2020 21 41 000 2021 22 180 000 2022 23 213 000 2024 25 knpact australia southwales nsw perth sydney visa,POSITIVE
3096,free binance visa,POSITIVE
3097,case missed residency visa stamps replaced emiratesid effective 11th april think simplifies overall process effectively reduces number steps required apply renew residency visas think new move,POSITIVE
3098,center designed provide visa partners ssa region tools strengthen capabilities developing new solutions fostering collaboration visainnovationstudiossa,POSITIVE
3099,visa consultant looking staff recruiting visa counselor ielts faculty back office staff request free demo today know 91 8980006120 visaboard visaconsultants visa b2bportalforvisaconsultant portalforvisaconsultants sop,NEGATIVE
3100,defi community learn nft boom make gains momentum excitement defi summer permanent asks david malka ceo bitcoincharts cryptoexplorer cryptocurrencyvisa bitcoinnews visa trading,POSITIVE
3101,cost living ireland scholarships international students get visa sign us free stay tuned latest updates pursue dream studyabroad,POSITIVE
3102,mastercard visa paypal miss combined total 2 4 billion revenue based revenues lost russia ukraine read,POSITIVE
3103,visa popid team facial verification payments middle east via visa payments credit id popid identity fintech tech data,POSITIVE
3104,singapore located southeast asia island city hub education healthcare finance tourism entertainment across world singapore also known lion city singapore visa rehmantravels,POSITIVE
3105,circular issued federal authority identity citizenship customs port security uae noted residents emiratesid would count residency starting april 11th 971 502027569 residencyvisa visa visaservices,POSITIVE
3106,visa installments solution eyes expansion air canada visa payments,POSITIVE
3107,muskan johal sheridan college sheridancollege moga ontario beautifulbritishcolumbia canadafilling mohawk college kwantlenpolytechnicuniversity ontariocanada canada visa feedback video canada study visa goglobalconsultantsmoga,POSITIVE
3108,gut tells state actor russia china took 3 credit card company americanexpress amex warning visa mastercard even swift next like firesale us globalist fintech,POSITIVE
3109,art eyes artlovers photography fineart fineartphotography art landscapephotography picoftheday naturelovers artwork amexlife visa,POSITIVE
3110,every year number students apply study visa australia lucky ones get chance study australia call us 91 73411 15291 91 73411 15293 studyvisa australiastudyvisa australia studyvisaexpert visa visaforaustralia visaexpert,POSITIVE
3111,healthy work environments conducive successful workforce encourage employees perform highest ability ended financial year wednesdayworkculture wednesdaythought wednesday apexvisas workculture visa visaconsultant,POSITIVE
3112,16th day waiting two visas homesforukraine scheme valid int l passports unacceptable refugee wait long visa process failing vulnerable homeless ukrainian friends,NEGATIVE
3113,politicians request visa scheme ukrainian students academics ukraine visa students,POSITIVE
3114,apr 5 2022 bc conducted bc pnp draws si eebc programs 196 invitations issued read queries share us britishcolumbia canada vancouver bc explorebc explorecanada vancouverbc visa,POSITIVE
3115,want study canada answer top questions including much costs study canada call us 91 9888505846 studyincanada studyinabroad canada studyvisa visa study canadastudyvisa excellentvisachandigarh excellentvisasolutions chandigarh,POSITIVE
3116,groceries doorstep order groceries grocer app amp avail 20 discount ablvisacards use promo code abl20 avail discount amp cs apply details exciting offers visit abl grocerapp grocery visa visacards,POSITIVE
3117,visa services overcome challenges choose destination would like visit help visa residency amp 2nd citizenship better future call away 961 81 333539 visa residency ivisaservices,POSITIVE
3118,continous amp welcoming visa grants australia congratulations mohommed shakir getting visa approved australia higher education thank trusting expert experteducation visa sucess melbournpolytechnicuniversity officialagentforsrilanka,POSITIVE
3119,love swiping visa branded card shopping harambee saccolink atm card shop swipe card pay bills restaurants zero cost live smart mtejakwanza saccolinkatm convenientbanking visa,POSITIVE
3120,ankr weekly chart worry coin everything good wait patiently bitcoin bullish web3 mastercard visa payment cryptocurrency,POSITIVE
3121,guy made 44000 usd selling willsmith chrisrock memes nft smart guys space nft nfts nftcommunity nftgiveaway nftdrop nftcollector nftcollection visa nftcreators metaversenft memes nftart nftgiveaways nftartist nftgame,NEGATIVE
3122,well done support millions mexicans oppose authoritarianism violence mexico changoleonsinvisa visa diputados morenacuevadedelincuentes,POSITIVE
3123,get uae golden visa eligibility assessment done free call whatsapp 971 52 4666811 goldenvisa uae abs proservices visa business services assessment government certificate entrepreneur motivation corporatebusiness dubai inspiration,POSITIVE
3124,tasheel springoasistower maidvisa siliconoasis gdrfa smartdubai entrypermit visacancellation visa,NEUTRAL
3125,iran reduced goldenvisa investment requirement 250 000 90 000 main purpose scheme attract investors neighbouring countries gain traction would appealing russia visa ukraine investment,POSITIVE
3126,reach us 056 865 762 5 056 789 789 8 054 348 688 0 najemalamal com tasheel springoasistower maidvisa siliconoasis gdrfa smartdubai entrypermit visacancellation tadbeer dxb visa siliconoasis dubai uae pro business freelancevisa,NEGATIVE
3127,want study canada uk internationaldreamzz educationconsultant studygram studyinabroad ielts studyoverseas visa uk usa singapore canada australia studyabroaddream dubai brightfuture singaporestudyvisa canada students ahmedabad gujarat india,POSITIVE
3128,choose us 056 865 762 5 056 789 789 8 054 348 688 0 najemalamal com tasheel springoasistower maidvisa siliconoasis gdrfa smartdubai entrypermit visacancellation tadbeer dxb visa siliconoasis dubai uae pro business,NEGATIVE
3129,starting new jurney dubai 0568 657 625 0567 897 898 najemalamal com tasheel springoasistower maidvisa siliconoasis gdrfa smartdubai entrypermit visacancellation tadbeer dxb visa siliconoasis dubai uae pro business,NEGATIVE
3130,philippines visa airticket 9g work visa visa downgrade trv renewal ecc clearance process waiting telegram ph whatsapp wechat 86 17728393013 easy go travel tours inc,POSITIVE
3131,big congratulations getting canada tourist visa approval visit us call us 91 8285552527 canadatouristvisa visa touristvisaapprovals canada canadavisa,POSITIVE
3132,bestway 2 overseas apply usa study visa visa topuniversities immigrationconsultant call us 91 9815601254 91 8283860002 91 8195984445 01725070701 bestway 2 overseas sco 144 145 top floor sec 34 chandigarh sandeep com bestway2overseas co,POSITIVE
3133,v visa san francisco based head cryptocurrencies cuy sheffield says payments giant made good progress towards providing network infrastructure potential digital currencies future cbdc,POSITIVE
3134,high end luxury travel agency mumbai looking multiple vacancies login apply instantly jobs jobsearch mumbaiindians career visa hotels travel,NEGATIVE
3135,crown immigration work permit fraud precaution visa police complaint fraud workpermitfraud studyabroad visa immgration consultant delhioffice crown immigration 919780563753 919599334053,NEGATIVE
3136,want study canada get expert advice top universities colleges 2022 intakes study program cost amp visa details apply online book seat next intake educationconsultant studygram studyinabroad ielts studyoverseas visa canada students delhi,POSITIVE
3137,singapore located southeast asia island city singapore also known lion city singapore7s visa rehmantravels,NEGATIVE
3138,take note wants undo support rusia wrote letter avoid visa restriction politicossinvisa politica rusiavsucrania visa usvisa,POSITIVE
3139,want get visa beautiful country unitedkingdom uk single double multiple entries details call us 91 70165 86677 visaservice touristvisa ukvisa flyworldindia flyworld trynahiflykaro visaconsultancy ahmedabad,POSITIVE
3140,us appeals court revived antitrust case visa debit card services,POSITIVE
3141,indonesian government imposed visa free visit policy citizens fellow association southeast asian nations member countries ministry law human rights said tuesday,POSITIVE
3142,epi given effort build card scheme rival mastercard visa europe half members left instead focus digital wallet,POSITIVE
3143,indonesia imposes visa free asean nationals visa free asean indonesia,NEGATIVE
3144,canada increase permanent residence fees effective april 30 canada canadapr ircc permanentresidence permanentresidencevisa visa visaupdate,POSITIVE
3145,process belarusian citizens complete indian e visa application india visa online application evisa tourist business medical evisa indian belarus citizens,POSITIVE
3146,art eyes photography fineart fineartphotography art landscapephotography picoftheday naturelovers artwork amexlife visa,POSITIVE
3147,big news metamask apple cryptocurrency memecoin bitcoin etherum hodlers tothemoon nft defi applepay ios visa mastercard creditcard cryptotrading memetoken,POSITIVE
3148,eb3 work visa eb2 sponsorship employment based visas difference depends education experience skill set intending immigrant 469 440 9444 info com rijallawfirm visa greencard workvisa,POSITIVE
3149,hope visa nft h joined nft meta like ur project,POSITIVE
3150,features include receiving free fdic insured checking routing account number thousands atms access funds direct deposit physical virtual visa debit card crypto wallet address transfer doge card like support apple wallet amp,POSITIVE
